SETTLEMENTDATE,DUID,SCADAVALUE,Participant,Station Name,Fuel Source - Primary,MAX_CAP,utilisation_pct,Plant,Latitude,Longitude,timestamp_utc
2026/03/25 05:20:00,CAPTL_WF,0.0,Iberdrola Australia Holdings Pty Limited,Capital Wind Farm,Wind,140.0,0.0,Capital Wind Farm,-35.1,149.31,2026-03-24T19:18:48.007098
2026/03/25 05:20:00,CHALLHWF,16.8,Pacific Hydro Challicum Hills Pty Ltd,Challicum Hills Wind Farm,Wind,52.0,32.31,Challicum Hills Wind Farm,-37.38,143.11,2026-03-24T19:18:48.007098
2026/03/25 05:20:00,CULLRGWF,-0.04,Cullerin Range Wind Farm Pty Ltd,Cullerin Range Wind Farm,Wind,30.0,-0.13,Cullerin Range Wind Farm,-34.81,149.4,2026-03-24T19:18:48.007098
2026/03/25 05:20:00,DIAPURWF1,7.6,Y.E.S. Energy (SA) Pty Ltd,Diapur Wind Farm,Wind,7.0,108.57,Diapur Wind Farm,-36.3425,141.43,2026-03-24T19:18:48.007098
2026/03/25 05:20:00,MLWF1,5.36,Mortons Lane Windfarm Pty Limited,Mortons Lane Wind Farm,Wind,20.0,26.8,Mortons Lane Wind Farm,-37.84,142.45,2026-03-24T19:18:48.007098
2026/03/25 05:20:00,WAUBRAWF,34.6,Pyrenees Wind Energy Developments Pty Ltd,Waubra Wind Farm,Wind,192.0,18.02,Waubra Wind Farm,-37.394498,143.638982,2026-03-24T19:18:48.007098
2026/03/25 05:20:00,WOOLNTH1,21.58,Hydro-Electric Corporation,Woolnorth Studland Bay / Bluff Point Wind Farm,Wind,140.0,15.41,Woolnorth Studland Bay / Bluff Point Wind Farm,-40.69,144.72,2026-03-24T19:18:48.007098
2026/03/25 05:20:00,YAMBUKWF,0.1,Energy Pacific (Vic) Pty Ltd,Yambuk Wind Farm,Wind,30.0,0.33,Yambuk Wind Farm,-38.299083,142.027577,2026-03-24T19:18:48.007098
2026/03/25 05:20:00,YSWF1,11.0,Pacific Hydro Yaloak South Pty Ltd,Yaloak South Wind Farm,Wind,28.0,39.29,Yaloak South Wind Farm,-37.7163,144.242853,2026-03-24T19:18:48.007098
2026/03/25 05:20:00,ARWF1,18.2,Ararat Wind Farm Pty Ltd,Ararat Wind Farm,Wind,241.0,7.55,Ararat Wind Farm,-37.232778,143.031389,2026-03-24T19:18:48.007098
2026/03/25 05:20:00,BALDHWF1,4.61,Alinta Energy Retail Sales Pty Ltd,Bald Hills Wind Farm,Wind,106.0,4.35,Bald Hills Wind Farm,-38.79,145.93,2026-03-24T19:18:48.007098
2026/03/25 05:20:00,BANGOWF1,1.0,BWF Nominees Pty Ltd as The Trustee for BWF Trust,Bango 973 Wind Farm,Wind,155.0,0.65,Bango 973 Wind Farm,-34.551582,148.732808,2026-03-24T19:18:48.007098
2026/03/25 05:20:00,BANGOWF2,0.0,BWF Nominees Pty Ltd as The Trustee for BWF Trust,Bango 999 Wind Farm,Wind,82.0,0.0,Bango 999 Wind Farm,-34.551582,148.732808,2026-03-24T19:18:48.007098
2026/03/25 05:20:00,BLUFF1,0.0,AGL SA Generation Pty Limited,The Bluff Wind Farm,Wind,53.0,0.0,The Bluff Wind Farm,-33.367778,138.728611,2026-03-24T19:18:48.007098
2026/03/25 05:20:00,BOCORWF1,22.18,Boco Rock Wind Farm Pty Ltd,Boco Rock Wind Farm,Wind,111.0,19.98,Boco Rock Wind Farm,-36.578611,149.103333,2026-03-24T19:18:48.007098
2026/03/25 05:20:00,BRYB1WF1,62.52,Berrybank Development Pty Ltd,Berrybank Wind Farm,Wind,175.9,35.54,Berrybank Wind Farm,-37.94,143.52,2026-03-24T19:18:48.007098
2026/03/25 05:20:00,BRYB2WF2,41.2,Berrybank 2 Asset Pty Ltd as trustee for Berrybank 2 Asset Trust,Berrybank 2 Wind Farm,Wind,105.0,39.24,Berrybank 2 Wind Farm,-37.94,143.52,2026-03-24T19:18:48.007098
2026/03/25 05:20:00,BULGANA1,20.88,Bulgana Wind Farm Pty Ltd,Bulgana Green Power Hub,Wind,204.0,10.24,Bulgana Green Power Hub,-37.0975,142.973611,2026-03-24T19:18:48.007098
2026/03/25 05:20:00,CATHROCK,13.9,Cathedral Rocks Wind Farm Pty Ltd,Cathedral Rocks,Wind,66.0,21.06,Cathedral Rocks,-34.51,135.35,2026-03-24T19:18:48.007098
2026/03/25 05:20:00,CHYTWF1,5.47,Cherry Tree Wind Farm Pty Ltd as trustee for The Cherry Tree Project trust ,Cherry Tree Wind Farm,Wind,57.0,9.6,Cherry Tree Wind Farm,-37.1,145.26,2026-03-24T19:18:48.007098
2026/03/25 05:20:00,CLEMGPWF,0.0,Pacific Hydro Clements Gap Pty Ltd,Clements Gap Wind Farm,Wind,57.0,0.0,Clements Gap Wind Farm,-33.48,138.1,2026-03-24T19:18:48.007098
2026/03/25 05:20:00,CLRKCWF1,173.08,Stanwell Corporation Limited ,Clarke Creek Wind Farm,Wind,338.0,51.21,Clarke Creek Wind Farm,-22.85,149.45,2026-03-24T19:18:48.007098
2026/03/25 05:20:00,CLRKCWF2,41.86,Stanwell Corporation Limited ,Clarke Creek Wind Farm,Wind,101.0,41.45,Clarke Creek Wind Farm,-22.85,149.45,2026-03-24T19:18:48.007098
2026/03/25 05:20:00,CNUNDAWF,0.0,Canunda Power Pty Ltd,Canunda Wind Farm,Wind,46.0,0.0,Canunda Wind Farm,-37.73,140.39,2026-03-24T19:18:48.007098
2026/03/25 05:20:00,COLWF01,0.0,Collector Wind Farm Pty Ltd,Collector Wind Farm 1,Wind,219.0,0.0,Collector Wind Farm 1,-34.8719,149.3967,2026-03-24T19:18:48.007098
2026/03/25 05:20:00,COOPGWF1,198.91,PARF Company 10 Pty Limited as The Trustee for Coopers Gap Project Trust,Coopers Gap Wind Farm,Wind,440.0,45.21,Coopers Gap Wind Farm,-26.74,151.45,2026-03-24T19:18:48.007098
2026/03/25 05:20:00,CROOKWF2,0.83,Crookwell Development Pty Ltd ,Crookwell 2 Wind Farm,Wind,91.0,0.91,Crookwell 2 Wind Farm,-34.52,149.54,2026-03-24T19:18:48.007098
2026/03/25 05:20:00,CROOKWF3,0.0,Crookwell 3 Development Pty Ltd,Crookwell 3 Wind Farm,Wind,56.0,0.0,Crookwell 3 Wind Farm,-34.52,149.54,2026-03-24T19:18:48.007098
2026/03/25 05:20:00,CROWLWF1,12.81,Pacific Hydro Crowlands Pty Ltd ,Crowlands Wind Farm,Wind,79.0,16.22,Crowlands Wind Farm,-37.13,143.16,2026-03-24T19:18:48.007098
2026/03/25 05:20:00,CRURWF1,18.2,CRWF Nominees Pty Ltd As Trustee For The CRWF Trust,Crudine Ridge Wind Farm,Wind,138.0,13.19,Crudine Ridge Wind Farm,-32.97,149.64,2026-03-24T19:18:48.007098
2026/03/25 05:20:00,CTHLWF1,37.85,Wild Cattle Hill Pty Ltd,Cattle Hill Wind Farm,Wind,144.0,26.28,Cattle Hill Wind Farm,-42.15,146.69,2026-03-24T19:18:48.007098
2026/03/25 05:20:00,DULAWF1,58.1,Dulacca Energy Project Co Pty Ltd,Dulacca Wind Farm,Wind,173.0,33.58,Dulacca Wind Farm,-26.63,149.87,2026-03-24T19:18:48.007098
2026/03/25 05:20:00,DUNDWF1,64.92,Dundonnell Wind Farm Pty Ltd,Dundonnell Wind Farm,Wind,168.0,38.64,Dundonnell Wind Farm,-37.52,142.58,2026-03-24T19:18:48.007098
2026/03/25 05:20:00,DUNDWF2,13.78,Dundonnell Wind Farm Pty Ltd,Dundonnell Wind Farm,Wind,46.0,29.96,Dundonnell Wind Farm,-37.52,142.58,2026-03-24T19:18:48.007098
2026/03/25 05:20:00,DUNDWF3,45.65,Dundonnell Wind Farm Pty Ltd,Dundonnell Wind Farm,Wind,122.0,37.42,Dundonnell Wind Farm,-37.52,142.58,2026-03-24T19:18:48.007098
2026/03/25 05:20:00,ELAINWF1,26.76,Lal Lal Wind Farms Nom Co Pty Ltd,Elaine Wind Farm,Wind,82.0,32.63,Elaine Wind Farm,-37.36,144.0,2026-03-24T19:18:48.007098
2026/03/25 05:20:00,FLYCRKWF,13.82,Iberdrola Australia Energy Markets Pty Limited,Flyers Creek Wind Farm,Wind,140.0,9.87,Flyers Creek Wind Farm,-33.365556,148.981944,2026-03-24T19:18:48.007098
2026/03/25 05:20:00,GPWFEST1,52.67,Golden Plains WF1 Pty Ltd as Trustee for the Golden Plains WF1 Unit Trust,Golden Plains Wind Farm East,Wind,240.0,21.95,Golden Plains Wind Farm East,-37.945091,143.752614,2026-03-24T19:18:48.007098
2026/03/25 05:20:00,GPWFEST2,38.26,Golden Plains WF1 Pty Ltd as Trustee for the Golden Plains WF1 Unit Trust,Golden Plains Wind Farm East,Wind,253.0,15.12,Golden Plains Wind Farm East,-37.945091,143.752614,2026-03-24T19:18:48.007098
2026/03/25 05:20:00,GPWFEST3,82.07,Golden Plains WF1 Pty Ltd as Trustee for the Golden Plains WF1 Unit Trust,Golden Plains Wind Farm East,Wind,240.0,34.2,Golden Plains Wind Farm East,-37.945091,143.752614,2026-03-24T19:18:48.007098
2026/03/25 05:20:00,GRANWF1,64.85,Granville Harbour Operations Pty Ltd as The Trustee for Granville Harbour Operations Trust,Granville Harbour Wind Farm,Wind,111.0,58.42,Granville Harbour Wind Farm,-41.8,145.06,2026-03-24T19:18:48.007098
2026/03/25 05:20:00,GSWF1A,0.0,Goyder Wind Farm 1 Pty Ltd as the Trustee for Goyder Wind Farm 1 Trust,Goyder South Wind Farm 1A,Wind,201.0,0.0,Goyder South Wind Farm 1A,-33.679758,138.937597,2026-03-24T19:18:48.007098
2026/03/25 05:20:00,GSWF1B1,0.18,Goyder Wind Farm 1B Pty Ltd as the Trustee for the Goyder Wind Farm 1B Trust,Goyder South Wind Farm 1B,Wind,196.0,0.09,Goyder South Wind Farm 1B,-33.679758,138.937597,2026-03-24T19:18:48.007098
2026/03/25 05:20:00,GULLRWF1,0.0,New Gullen Range Wind Farm Pty Ltd,Gullen Range Wind Farm,Wind,161.0,0.0,Gullen Range Wind Farm,-34.34,149.27,2026-03-24T19:18:48.007098
2026/03/25 05:20:00,GULLRWF2,0.0,New Gullen Range Wind Farm Pty Ltd,Gullen Range Wind Farm,Wind,107.0,0.0,Gullen Range Wind Farm,-34.34,149.27,2026-03-24T19:18:48.007098
2026/03/25 05:20:00,GUNNING1,0.0,Gunning Wind Energy Developments Pty Ltd,Gunning Wind Farm,Wind,47.0,0.0,Gunning Wind Farm,-34.813333,149.4,2026-03-24T19:18:48.007098
2026/03/25 05:20:00,HALLWF1,0.0,AGL SA Generation Pty Limited,Hallett 1 Wind Farm,Wind,95.0,0.0,Hallett 1 Wind Farm,-33.367778,138.728611,2026-03-24T19:18:48.007098
2026/03/25 05:20:00,HALLWF2,0.0,AGL SA Generation Pty Limited,Hallett 2 Wind Farm,Wind,71.0,0.0,Hallett 2 Wind Farm,-33.367778,138.728611,2026-03-24T19:18:48.007098
2026/03/25 05:20:00,HD1WF1,14.72,Hawkesdale Asset Pty Ltd as trustee for Hawkesdale Asset Trust,Hawkesdale Wind Farm,Wind,89.0,16.54,Hawkesdale Wind Farm,-38.147894,142.361381,2026-03-24T19:18:48.007098
2026/03/25 05:20:00,HDWF1,0.4,HWF1 Pty Ltd,Hornsdale Wind Farm,Wind,102.0,0.39,Hornsdale Wind Farm,-33.050556,138.543611,2026-03-24T19:18:48.007098
2026/03/25 05:20:00,HDWF2,0.3,HWF 2 Pty Ltd,Hornsdale Wind Farm 2,Wind,102.0,0.29,Hornsdale Wind Farm 2,-33.06,138.54,2026-03-24T19:18:48.007098
2026/03/25 05:20:00,HDWF3,0.5,HWF3 Pty Ltd,Hornsdale Wind Farm 3,Wind,109.0,0.46,Hornsdale Wind Farm 3,-33.06,138.54,2026-03-24T19:18:48.007098
2026/03/25 05:20:00,KABANWF1,59.68,Kaban Wind Farm Pty Ltd as trustee for Kaban Wind Farm Trust,Kaban Wind Farm,Wind,152.0,39.26,Kaban Wind Farm,-17.56,145.41,2026-03-24T19:18:48.007098
2026/03/25 05:20:00,KEPWF1,27.2,Kennedy Energy Park Pty Ltd,Kennedy Energy Park,Wind,43.0,63.26,Kennedy Energy Park,-20.88,144.42,2026-03-24T19:18:48.007098
2026/03/25 05:20:00,KIATAWF1,21.2,Kiata ProjectCo Pty Ltd Atf Kiata Project Trust,Kiata Wind Farm,Wind,31.0,68.39,Kiata Wind Farm,-36.4,141.75,2026-03-24T19:18:48.007098
2026/03/25 05:20:00,LGAPWF1,9.75,Lincoln Gap Wind Farm (Operations) Pty Ltd,Lincoln Gap Wind Farm,Wind,123.0,7.93,Lincoln Gap Wind Farm,-32.564279,137.557328,2026-03-24T19:18:48.007098
2026/03/25 05:20:00,LGAPWF1,9.75,Lincoln Gap Wind Farm (Operations) Pty Ltd,Lincoln Gap Wind Farm,Wind,123.0,7.93,Lincoln Gap Wind Farm,-32.564279,137.557328,2026-03-24T19:18:48.007098
2026/03/25 05:20:00,LGAPWF2,16.26,Lincoln Gap Wind Farm (Operations) Pty Ltd,Lincoln Gap Wind Farm,Wind,85.0,19.13,Lincoln Gap Wind Farm,-32.564279,137.557328,2026-03-24T19:18:48.007098
2026/03/25 05:20:00,LGAPWF2,16.26,Lincoln Gap Wind Farm (Operations) Pty Ltd,Lincoln Gap Wind Farm,Wind,85.0,19.13,Lincoln Gap Wind Farm,-32.564279,137.557328,2026-03-24T19:18:48.007098
2026/03/25 05:20:00,LKBONNY1,0.0,Lake Bonney Wind Power Pty Ltd,Lake Bonney Wind Farm Stage 1,Wind,81.0,0.0,Lake Bonney Wind Farm Stage 1,-37.76,140.4,2026-03-24T19:18:48.007098
2026/03/25 05:20:00,LKBONNY2,0.0,Lake Bonney Wind Power Pty Ltd,Lake Bonney Stage 2 Windfarm,Wind,159.0,0.0,Lake Bonney Stage 2 Windfarm,-37.76,140.4,2026-03-24T19:18:48.007098
2026/03/25 05:20:00,LKBONNY3,0.0,Lake Bonney Wind Power Pty Ltd,Lake Bonney Stage 3 Wind Farm,Wind,39.0,0.0,Lake Bonney Stage 3 Wind Farm,-37.737781,140.388137,2026-03-24T19:18:48.007098
2026/03/25 05:20:00,MACARTH1,47.5,AGL Hydro Partnership,Macarthur Wind Farm,Wind,420.0,11.31,Macarthur Wind Farm,-38.048957,142.192112,2026-03-24T19:18:48.007098
2026/03/25 05:20:00,MCINTYR1,217.26,MacIntyre UJV Operator Pty Ltd,MacIntyre Wind Farm,Wind,890.0,24.41,MacIntyre Wind Farm,-28.32,151.54,2026-03-24T19:18:48.007098
2026/03/25 05:20:00,MERCER01,90.2,Mt Mercer Windfarm Pty Ltd,Mt Mercer Wind Farm,Wind,131.0,68.85,Mt Mercer Wind Farm,-37.841111,143.871111,2026-03-24T19:18:48.007098
2026/03/25 05:20:00,MEWF1,98.75,Ergon Energy Queensland Pty Ltd ,Mount Emerald Wind Farm,Wind,178.0,55.48,Mount Emerald Wind Farm,-17.133007,145.380644,2026-03-24T19:18:48.007098
2026/03/25 05:20:00,MRTLSWF1,5.32,Mortlake South Wind Farm Pty Ltd,Mortlake South Wind Farm,Wind,153.0,3.48,Mortlake South Wind Farm,-38.127337,142.857801,2026-03-24T19:18:48.007098
2026/03/25 05:20:00,MTGELWF1,0.72,Mt. Gellibrand Wind Farm Pty Ltd,Mt Gellibrand Wind Farm,Wind,132.0,0.55,Mt Gellibrand Wind Farm,-38.23,143.77,2026-03-24T19:18:48.007098
2026/03/25 05:20:00,MTMILLAR,0.0,Mt Millar Wind Farm Pty Ltd,Mt Millar Wind Farm,Wind,70.0,0.0,Mt Millar Wind Farm,-33.624444,136.703611,2026-03-24T19:18:48.007098
2026/03/25 05:20:00,MUSSELR1,0.0,Hydro-Electric Corporation,Musselroe Wind Farm,Wind,168.0,0.0,Musselroe Wind Farm,-40.780225,148.010799,2026-03-24T19:18:48.007098
2026/03/25 05:20:00,MUWAWF1,29.15,Telstra Energy (Generation) Pty Ltd,Murra Warra Wind Farm,Wind,225.7,12.92,Murra Warra Wind Farm,-36.432404,142.317853,2026-03-24T19:18:48.007098
2026/03/25 05:20:00,MUWAWF2,36.7,Murra Warra II Project Co Pty Ltd ATF The Murra Warra II Project Trust,Murra Warra Wind Farm Stage 2,Wind,203.0,18.08,Murra Warra Wind Farm Stage 2,-36.43,142.32,2026-03-24T19:18:48.007098
2026/03/25 05:20:00,NBHWF1,0.0,AGL SA Generation Pty Limited,North Brown Hill Wind Farm,Wind,132.0,0.0,North Brown Hill Wind Farm,-33.367778,138.728611,2026-03-24T19:18:48.007098
2026/03/25 05:20:00,OAKLAND1,15.3,AGL Hydro Partnership,Oaklands Hill Wind Farm,Wind,63.0,24.29,Oaklands Hill Wind Farm,-37.683078,142.551678,2026-03-24T19:18:48.007098
2026/03/25 05:20:00,PAREPW1,3.75,Iberdrola Australia Energy Markets Pty Limited,Port Augusta Renewable Energy Park,Wind,201.0,1.87,Port Augusta Renewable Energy Park,-32.566944,137.856111,2026-03-24T19:18:48.007098
2026/03/25 05:20:00,RYANCWF1,2.6,Ryan Corner Development Pty Ltd,Ryan Corner Wind Farm,Wind,205.0,1.27,Ryan Corner Wind Farm,-38.271017,142.140647,2026-03-24T19:18:48.007098
2026/03/25 05:20:00,RYEPARK1,3.38,Rye Park Renewable Energy Pty Ltd as trustee for Rye Park Wind Farm Trust,Rye Park Renewable Energy,Wind,384.0,0.88,Rye Park Renewable Energy,-32.138333,148.972778,2026-03-24T19:18:48.007098
2026/03/25 05:20:00,SALTCRK1,17.34,Salt Creek Wind Farm Pty Ltd,Salt Creek Wind Farm,Wind,54.0,32.11,Salt Creek Wind Farm,-37.95,142.63,2026-03-24T19:18:48.007098
2026/03/25 05:20:00,SAPHWF1,4.98,The Trustee For The SWF1 Operations Trust,Sapphire Wind Farm,Wind,270.0,1.84,Sapphire Wind Farm,-29.7,151.41,2026-03-24T19:18:48.007098
2026/03/25 05:20:00,SNOWNTH1,7.6,Snowtown Wind Farm Stage 2 Pty Ltd,Snowtown Wind Farm Stage 2 North,Wind,144.0,5.28,Snowtown Wind Farm Stage 2 North,-33.83,138.118611,2026-03-24T19:18:48.007098
2026/03/25 05:20:00,SNOWSTH1,43.0,Snowtown Wind Farm Stage 2 Pty Ltd,Snowtown South Wind Farm,Wind,126.0,34.13,Snowtown South Wind Farm,-33.83,138.118611,2026-03-24T19:18:48.007098
2026/03/25 05:20:00,SNOWTWN1,18.08,Snowtown Wind Farm Pty Ltd,Snowtown Wind Farm Units 1 And 47,Wind,99.0,18.26,Snowtown Wind Farm Units 1 And 47,-33.83,138.118611,2026-03-24T19:18:48.007098
2026/03/25 05:20:00,STARHLWF,0.01,Starfish Hill Wind Farm Pty Ltd,Starfish Hill Wind Farm,Wind,35.0,0.03,Starfish Hill Wind Farm,-35.58,138.14,2026-03-24T19:18:48.007098
2026/03/25 05:20:00,STOCKYD1,121.84,Stockyard Hill Wind Farm Pty Ltd,Stockyard Hill Wind Farm,Wind,511.0,23.84,Stockyard Hill Wind Farm,-37.535833,143.251389,2026-03-24T19:18:48.007098
2026/03/25 05:20:00,STWF1,0.0,PARF Company 8 Pty Ltd as The Trustee for Silverton Project Trust,Silverton Wind Farm,Wind,198.0,0.0,Silverton Wind Farm,-37.683168,142.551678,2026-03-24T19:18:48.007098
2026/03/25 05:20:00,TARALGA1,0.0,Taralga Wind Farm Nominees No 2 Pty Ltd (ATF Taralga Wind Farm Operating Trust),Taralga Wind Farm,Wind,106.0,0.0,Taralga Wind Farm,-34.42352,149.826267,2026-03-24T19:18:48.007098
2026/03/25 05:20:00,WAMBOWF1,118.24,Stanwell Corporation Limited,Wambo Wind Farm 1,Wind,245.0,48.26,Wambo Wind Farm 1,-35.187301,149.524945,2026-03-24T19:18:48.007098
2026/03/25 05:20:00,WATERLWF,5.5,Waterloo Wind Farm Pty Ltd,Waterloo Wind Farm,Wind,130.0,4.23,Waterloo Wind Farm,-34.00094,138.911567,2026-03-24T19:18:48.007098
2026/03/25 05:20:00,WGWF1,0.8,Willogoleche Power Pty Ltd As The Trustee For The Willogoleche Operating Trust,Willogoleche Wind Farm,Wind,119.0,0.67,Willogoleche Wind Farm,-33.39,138.85,2026-03-24T19:18:48.007098
2026/03/25 05:20:00,WOODLWN1,0.0,Woodlawn Wind Pty Ltd,Woodlawn Wind Farm,Wind,48.0,0.0,Woodlawn Wind Farm,-35.08,149.62,2026-03-24T19:18:48.007098
2026/03/25 05:20:00,WPWF,10.25,AGL SA Generation Pty Limited,Wattle Point Wind Farm,Wind,91.0,11.26,Wattle Point Wind Farm,-35.111624,137.7219,2026-03-24T19:18:48.007098
2026/03/25 05:20:00,WRWF1,2.16,White Rock Wind Farm Pty Ltd,White Rock Wind Farm,Wind,172.0,1.26,White Rock Wind Farm,-29.79,151.54,2026-03-24T19:18:48.007098
2026/03/25 05:20:00,YENDWF1,54.87,Lal Lal Wind Farms Nom Co Pty Ltd,Yendon Wind Farm,Wind,142.0,38.64,Yendon Wind Farm,-37.629987,144.022717,2026-03-24T19:18:48.007098
