SETTLEMENTDATE,DUID,SCADAVALUE,Participant,Station Name,Fuel Source - Primary,MAX_CAP,utilisation_pct,Plant,Latitude,Longitude,timestamp_utc
2026/02/02 07:00:00,CAPTL_WF,1.83,Iberdrola Australia Holdings Pty Limited,Capital Wind Farm,Wind,140.0,1.31,Capital Wind Farm,-35.1,149.31,2026-02-01T20:58:32.440778
2026/02/02 07:00:00,CHALLHWF,7.9,Pacific Hydro Challicum Hills Pty Ltd,Challicum Hills Wind Farm,Wind,52.0,15.19,Challicum Hills Wind Farm,-37.38,143.11,2026-02-01T20:58:32.440778
2026/02/02 07:00:00,CULLRGWF,2.53,Cullerin Range Wind Farm Pty Ltd,Cullerin Range Wind Farm,Wind,30.0,8.43,Cullerin Range Wind Farm,-34.81,149.4,2026-02-01T20:58:32.440778
2026/02/02 07:00:00,DIAPURWF1,8.3,Y.E.S. Energy (SA) Pty Ltd,Diapur Wind Farm,Wind,7.0,118.57,Diapur Wind Farm,-36.3425,141.43,2026-02-01T20:58:32.440778
2026/02/02 07:00:00,MLWF1,1.16,Mortons Lane Windfarm Pty Limited,Mortons Lane Wind Farm,Wind,20.0,5.8,Mortons Lane Wind Farm,-37.84,142.45,2026-02-01T20:58:32.440778
2026/02/02 07:00:00,WAUBRAWF,45.33,Pyrenees Wind Energy Developments Pty Ltd,Waubra Wind Farm,Wind,192.0,23.61,Waubra Wind Farm,-37.394498,143.638982,2026-02-01T20:58:32.440778
2026/02/02 07:00:00,WOOLNTH1,20.39,Hydro-Electric Corporation,Woolnorth Studland Bay / Bluff Point Wind Farm,Wind,140.0,14.56,Woolnorth Studland Bay / Bluff Point Wind Farm,-40.69,144.72,2026-02-01T20:58:32.440778
2026/02/02 07:00:00,YAMBUKWF,3.5,Energy Pacific (Vic) Pty Ltd,Yambuk Wind Farm,Wind,30.0,11.67,Yambuk Wind Farm,-38.299083,142.027577,2026-02-01T20:58:32.440778
2026/02/02 07:00:00,YSWF1,2.6,Pacific Hydro Yaloak South Pty Ltd,Yaloak South Wind Farm,Wind,28.0,9.29,Yaloak South Wind Farm,-37.7163,144.242853,2026-02-01T20:58:32.440778
2026/02/02 07:00:00,ARWF1,64.0,Ararat Wind Farm Pty Ltd,Ararat Wind Farm,Wind,241.0,26.56,Ararat Wind Farm,-37.232778,143.031389,2026-02-01T20:58:32.440778
2026/02/02 07:00:00,BALDHWF1,6.9,Alinta Energy Retail Sales Pty Ltd,Bald Hills Wind Farm,Wind,106.0,6.51,Bald Hills Wind Farm,-38.79,145.93,2026-02-01T20:58:32.440778
2026/02/02 07:00:00,BANGOWF1,134.3,BWF Nominees Pty Ltd as The Trustee for BWF Trust,Bango 973 Wind Farm,Wind,155.0,86.65,Bango 973 Wind Farm,-34.551582,148.732808,2026-02-01T20:58:32.440778
2026/02/02 07:00:00,BANGOWF2,56.0,BWF Nominees Pty Ltd as The Trustee for BWF Trust,Bango 999 Wind Farm,Wind,82.0,68.29,Bango 999 Wind Farm,-34.551582,148.732808,2026-02-01T20:58:32.440778
2026/02/02 07:00:00,BLUFF1,28.8,AGL SA Generation Pty Limited,The Bluff Wind Farm,Wind,53.0,54.34,The Bluff Wind Farm,-33.367778,138.728611,2026-02-01T20:58:32.440778
2026/02/02 07:00:00,BOCORWF1,20.71,Boco Rock Wind Farm Pty Ltd,Boco Rock Wind Farm,Wind,111.0,18.66,Boco Rock Wind Farm,-36.578611,149.103333,2026-02-01T20:58:32.440778
2026/02/02 07:00:00,BRYB1WF1,8.51,Berrybank Development Pty Ltd,Berrybank Wind Farm,Wind,175.9,4.84,Berrybank Wind Farm,-37.94,143.52,2026-02-01T20:58:32.440778
2026/02/02 07:00:00,BRYB2WF2,5.67,Berrybank 2 Asset Pty Ltd as trustee for Berrybank 2 Asset Trust,Berrybank 2 Wind Farm,Wind,105.0,5.4,Berrybank 2 Wind Farm,-37.94,143.52,2026-02-01T20:58:32.440778
2026/02/02 07:00:00,BULGANA1,0.0,Bulgana Wind Farm Pty Ltd,Bulgana Green Power Hub,Wind,204.0,0.0,Bulgana Green Power Hub,-37.0975,142.973611,2026-02-01T20:58:32.440778
2026/02/02 07:00:00,CATHROCK,21.6,Cathedral Rocks Wind Farm Pty Ltd,Cathedral Rocks,Wind,66.0,32.73,Cathedral Rocks,-34.51,135.35,2026-02-01T20:58:32.440778
2026/02/02 07:00:00,CHYTWF1,53.77,Cherry Tree Wind Farm Pty Ltd as trustee for The Cherry Tree Project trust ,Cherry Tree Wind Farm,Wind,57.0,94.33,Cherry Tree Wind Farm,-37.1,145.26,2026-02-01T20:58:32.440778
2026/02/02 07:00:00,CLEMGPWF,51.0,Pacific Hydro Clements Gap Pty Ltd,Clements Gap Wind Farm,Wind,57.0,89.47,Clements Gap Wind Farm,-33.48,138.1,2026-02-01T20:58:32.440778
2026/02/02 07:00:00,CLRKCWF1,0.0,Stanwell Corporation Limited ,Clarke Creek Wind Farm,Wind,338.0,0.0,Clarke Creek Wind Farm,-22.85,149.45,2026-02-01T20:58:32.440778
2026/02/02 07:00:00,CLRKCWF2,0.0,Stanwell Corporation Limited ,Clarke Creek Wind Farm,Wind,101.0,0.0,Clarke Creek Wind Farm,-22.85,149.45,2026-02-01T20:58:32.440778
2026/02/02 07:00:00,CNUNDAWF,1.4,Canunda Power Pty Ltd,Canunda Wind Farm,Wind,46.0,3.04,Canunda Wind Farm,-37.73,140.39,2026-02-01T20:58:32.440778
2026/02/02 07:00:00,COLWF01,31.7,Collector Wind Farm Pty Ltd,Collector Wind Farm 1,Wind,219.0,14.47,Collector Wind Farm 1,-34.8719,149.3967,2026-02-01T20:58:32.440778
2026/02/02 07:00:00,COOPGWF1,95.4,PARF Company 10 Pty Limited as The Trustee for Coopers Gap Project Trust,Coopers Gap Wind Farm,Wind,440.0,21.68,Coopers Gap Wind Farm,-26.74,151.45,2026-02-01T20:58:32.440778
2026/02/02 07:00:00,CROOKWF2,70.88,Crookwell Development Pty Ltd ,Crookwell 2 Wind Farm,Wind,91.0,77.89,Crookwell 2 Wind Farm,-34.52,149.54,2026-02-01T20:58:32.440778
2026/02/02 07:00:00,CROOKWF3,14.77,Crookwell 3 Development Pty Ltd,Crookwell 3 Wind Farm,Wind,56.0,26.38,Crookwell 3 Wind Farm,-34.52,149.54,2026-02-01T20:58:32.440778
2026/02/02 07:00:00,CROWLWF1,40.46,Pacific Hydro Crowlands Pty Ltd ,Crowlands Wind Farm,Wind,79.0,51.22,Crowlands Wind Farm,-37.13,143.16,2026-02-01T20:58:32.440778
2026/02/02 07:00:00,CRURWF1,62.9,CRWF Nominees Pty Ltd As Trustee For The CRWF Trust,Crudine Ridge Wind Farm,Wind,138.0,45.58,Crudine Ridge Wind Farm,-32.97,149.64,2026-02-01T20:58:32.440778
2026/02/02 07:00:00,CTHLWF1,35.92,Wild Cattle Hill Pty Ltd,Cattle Hill Wind Farm,Wind,144.0,24.94,Cattle Hill Wind Farm,-42.15,146.69,2026-02-01T20:58:32.440778
2026/02/02 07:00:00,DULAWF1,30.6,Dulacca Energy Project Co Pty Ltd,Dulacca Wind Farm,Wind,173.0,17.69,Dulacca Wind Farm,-26.63,149.87,2026-02-01T20:58:32.440778
2026/02/02 07:00:00,DUNDWF1,13.82,Dundonnell Wind Farm Pty Ltd,Dundonnell Wind Farm,Wind,168.0,8.23,Dundonnell Wind Farm,-37.52,142.58,2026-02-01T20:58:32.440778
2026/02/02 07:00:00,DUNDWF2,4.52,Dundonnell Wind Farm Pty Ltd,Dundonnell Wind Farm,Wind,46.0,9.83,Dundonnell Wind Farm,-37.52,142.58,2026-02-01T20:58:32.440778
2026/02/02 07:00:00,DUNDWF3,4.18,Dundonnell Wind Farm Pty Ltd,Dundonnell Wind Farm,Wind,122.0,3.43,Dundonnell Wind Farm,-37.52,142.58,2026-02-01T20:58:32.440778
2026/02/02 07:00:00,ELAINWF1,18.59,Lal Lal Wind Farms Nom Co Pty Ltd,Elaine Wind Farm,Wind,82.0,22.67,Elaine Wind Farm,-37.36,144.0,2026-02-01T20:58:32.440778
2026/02/02 07:00:00,FLYCRKWF,19.77,Iberdrola Australia Energy Markets Pty Limited,Flyers Creek Wind Farm,Wind,140.0,14.12,Flyers Creek Wind Farm,-33.365556,148.981944,2026-02-01T20:58:32.440778
2026/02/02 07:00:00,GPWFEST1,14.47,Golden Plains WF1 Pty Ltd as Trustee for the Golden Plains WF1 Unit Trust,Golden Plains Wind Farm East,Wind,240.0,6.03,Golden Plains Wind Farm East,-37.945091,143.752614,2026-02-01T20:58:32.440778
2026/02/02 07:00:00,GPWFEST2,9.73,Golden Plains WF1 Pty Ltd as Trustee for the Golden Plains WF1 Unit Trust,Golden Plains Wind Farm East,Wind,253.0,3.85,Golden Plains Wind Farm East,-37.945091,143.752614,2026-02-01T20:58:32.440778
2026/02/02 07:00:00,GPWFEST3,7.08,Golden Plains WF1 Pty Ltd as Trustee for the Golden Plains WF1 Unit Trust,Golden Plains Wind Farm East,Wind,240.0,2.95,Golden Plains Wind Farm East,-37.945091,143.752614,2026-02-01T20:58:32.440778
2026/02/02 07:00:00,GRANWF1,28.62,Granville Harbour Operations Pty Ltd as The Trustee for Granville Harbour Operations Trust,Granville Harbour Wind Farm,Wind,111.0,25.78,Granville Harbour Wind Farm,-41.8,145.06,2026-02-01T20:58:32.440778
2026/02/02 07:00:00,GSWF1A,1.57,Goyder Wind Farm 1 Pty Ltd as the Trustee for Goyder Wind Farm 1 Trust,Goyder South Wind Farm 1A,Wind,201.0,0.78,Goyder South Wind Farm 1A,-33.679758,138.937597,2026-02-01T20:58:32.440778
2026/02/02 07:00:00,GSWF1B1,0.74,Goyder Wind Farm 1B Pty Ltd as the Trustee for the Goyder Wind Farm 1B Trust,Goyder South Wind Farm 1B,Wind,196.0,0.38,Goyder South Wind Farm 1B,-33.679758,138.937597,2026-02-01T20:58:32.440778
2026/02/02 07:00:00,GULLRWF1,97.64,New Gullen Range Wind Farm Pty Ltd,Gullen Range Wind Farm,Wind,161.0,60.65,Gullen Range Wind Farm,-34.34,149.27,2026-02-01T20:58:32.440778
2026/02/02 07:00:00,GULLRWF2,103.94,New Gullen Range Wind Farm Pty Ltd,Gullen Range Wind Farm,Wind,107.0,97.14,Gullen Range Wind Farm,-34.34,149.27,2026-02-01T20:58:32.440778
2026/02/02 07:00:00,GUNNING1,16.78,Gunning Wind Energy Developments Pty Ltd,Gunning Wind Farm,Wind,47.0,35.7,Gunning Wind Farm,-34.813333,149.4,2026-02-01T20:58:32.440778
2026/02/02 07:00:00,HALLWF1,68.81,AGL SA Generation Pty Limited,Hallett 1 Wind Farm,Wind,95.0,72.43,Hallett 1 Wind Farm,-33.367778,138.728611,2026-02-01T20:58:32.440778
2026/02/02 07:00:00,HALLWF2,62.21,AGL SA Generation Pty Limited,Hallett 2 Wind Farm,Wind,71.0,87.62,Hallett 2 Wind Farm,-33.367778,138.728611,2026-02-01T20:58:32.440778
2026/02/02 07:00:00,HD1WF1,3.31,Hawkesdale Asset Pty Ltd as trustee for Hawkesdale Asset Trust,Hawkesdale Wind Farm,Wind,89.0,3.72,Hawkesdale Wind Farm,-38.147894,142.361381,2026-02-01T20:58:32.440778
2026/02/02 07:00:00,HDWF1,92.1,HWF1 Pty Ltd,Hornsdale Wind Farm,Wind,102.0,90.29,Hornsdale Wind Farm,-33.050556,138.543611,2026-02-01T20:58:32.440778
2026/02/02 07:00:00,HDWF2,87.6,HWF 2 Pty Ltd,Hornsdale Wind Farm 2,Wind,102.0,85.88,Hornsdale Wind Farm 2,-33.06,138.54,2026-02-01T20:58:32.440778
2026/02/02 07:00:00,HDWF3,107.7,HWF3 Pty Ltd,Hornsdale Wind Farm 3,Wind,109.0,98.81,Hornsdale Wind Farm 3,-33.06,138.54,2026-02-01T20:58:32.440778
2026/02/02 07:00:00,KABANWF1,0.0,Kaban Wind Farm Pty Ltd as trustee for Kaban Wind Farm Trust,Kaban Wind Farm,Wind,152.0,0.0,Kaban Wind Farm,-17.56,145.41,2026-02-01T20:58:32.440778
2026/02/02 07:00:00,KEPWF1,0.0,Kennedy Energy Park Pty Ltd,Kennedy Energy Park,Wind,43.0,0.0,Kennedy Energy Park,-20.88,144.42,2026-02-01T20:58:32.440778
2026/02/02 07:00:00,KIATAWF1,12.0,Kiata ProjectCo Pty Ltd Atf Kiata Project Trust,Kiata Wind Farm,Wind,31.0,38.71,Kiata Wind Farm,-36.4,141.75,2026-02-01T20:58:32.440778
2026/02/02 07:00:00,LGAPWF1,49.65,Lincoln Gap Wind Farm (Operations) Pty Ltd,Lincoln Gap Wind Farm,Wind,123.0,40.37,Lincoln Gap Wind Farm,-32.564279,137.557328,2026-02-01T20:58:32.440778
2026/02/02 07:00:00,LGAPWF1,49.65,Lincoln Gap Wind Farm (Operations) Pty Ltd,Lincoln Gap Wind Farm,Wind,123.0,40.37,Lincoln Gap Wind Farm,-32.564279,137.557328,2026-02-01T20:58:32.440778
2026/02/02 07:00:00,LGAPWF2,54.61,Lincoln Gap Wind Farm (Operations) Pty Ltd,Lincoln Gap Wind Farm,Wind,85.0,64.25,Lincoln Gap Wind Farm,-32.564279,137.557328,2026-02-01T20:58:32.440778
2026/02/02 07:00:00,LGAPWF2,54.61,Lincoln Gap Wind Farm (Operations) Pty Ltd,Lincoln Gap Wind Farm,Wind,85.0,64.25,Lincoln Gap Wind Farm,-32.564279,137.557328,2026-02-01T20:58:32.440778
2026/02/02 07:00:00,LKBONNY1,1.16,Lake Bonney Wind Power Pty Ltd,Lake Bonney Wind Farm Stage 1,Wind,81.0,1.43,Lake Bonney Wind Farm Stage 1,-37.76,140.4,2026-02-01T20:58:32.440778
2026/02/02 07:00:00,LKBONNY2,5.87,Lake Bonney Wind Power Pty Ltd,Lake Bonney Stage 2 Windfarm,Wind,159.0,3.69,Lake Bonney Stage 2 Windfarm,-37.76,140.4,2026-02-01T20:58:32.440778
2026/02/02 07:00:00,LKBONNY3,1.28,Lake Bonney Wind Power Pty Ltd,Lake Bonney Stage 3 Wind Farm,Wind,39.0,3.28,Lake Bonney Stage 3 Wind Farm,-37.737781,140.388137,2026-02-01T20:58:32.440778
2026/02/02 07:00:00,MACARTH1,0.0,AGL Hydro Partnership,Macarthur Wind Farm,Wind,420.0,0.0,Macarthur Wind Farm,-38.048957,142.192112,2026-02-01T20:58:32.440778
2026/02/02 07:00:00,MCINTYR1,161.96,MacIntyre UJV Operator Pty Ltd,MacIntyre Wind Farm,Wind,890.0,18.2,MacIntyre Wind Farm,-28.32,151.54,2026-02-01T20:58:32.440778
2026/02/02 07:00:00,MERCER01,4.5,Mt Mercer Windfarm Pty Ltd,Mt Mercer Wind Farm,Wind,131.0,3.44,Mt Mercer Wind Farm,-37.841111,143.871111,2026-02-01T20:58:32.440778
2026/02/02 07:00:00,MEWF1,25.4,Ergon Energy Queensland Pty Ltd ,Mount Emerald Wind Farm,Wind,178.0,14.27,Mount Emerald Wind Farm,-17.133007,145.380644,2026-02-01T20:58:32.440778
2026/02/02 07:00:00,MRTLSWF1,6.29,Mortlake South Wind Farm Pty Ltd,Mortlake South Wind Farm,Wind,153.0,4.11,Mortlake South Wind Farm,-38.127337,142.857801,2026-02-01T20:58:32.440778
2026/02/02 07:00:00,MTGELWF1,0.6,Mt. Gellibrand Wind Farm Pty Ltd,Mt Gellibrand Wind Farm,Wind,132.0,0.45,Mt Gellibrand Wind Farm,-38.23,143.77,2026-02-01T20:58:32.440778
2026/02/02 07:00:00,MTMILLAR,36.0,Mt Millar Wind Farm Pty Ltd,Mt Millar Wind Farm,Wind,70.0,51.43,Mt Millar Wind Farm,-33.624444,136.703611,2026-02-01T20:58:32.440778
2026/02/02 07:00:00,MUSSELR1,13.5,Hydro-Electric Corporation,Musselroe Wind Farm,Wind,168.0,8.04,Musselroe Wind Farm,-40.780225,148.010799,2026-02-01T20:58:32.440778
2026/02/02 07:00:00,MUWAWF1,52.38,Telstra Energy (Generation) Pty Ltd,Murra Warra Wind Farm,Wind,225.7,23.21,Murra Warra Wind Farm,-36.432404,142.317853,2026-02-01T20:58:32.440778
2026/02/02 07:00:00,MUWAWF2,47.7,Murra Warra II Project Co Pty Ltd ATF The Murra Warra II Project Trust,Murra Warra Wind Farm Stage 2,Wind,203.0,23.5,Murra Warra Wind Farm Stage 2,-36.43,142.32,2026-02-01T20:58:32.440778
2026/02/02 07:00:00,NBHWF1,109.2,AGL SA Generation Pty Limited,North Brown Hill Wind Farm,Wind,132.0,82.73,North Brown Hill Wind Farm,-33.367778,138.728611,2026-02-01T20:58:32.440778
2026/02/02 07:00:00,OAKLAND1,4.5,AGL Hydro Partnership,Oaklands Hill Wind Farm,Wind,63.0,7.14,Oaklands Hill Wind Farm,-37.683078,142.551678,2026-02-01T20:58:32.440778
2026/02/02 07:00:00,PAREPW1,116.51,Iberdrola Australia Energy Markets Pty Limited,Port Augusta Renewable Energy Park,Wind,201.0,57.97,Port Augusta Renewable Energy Park,-32.566944,137.856111,2026-02-01T20:58:32.440778
2026/02/02 07:00:00,RYANCWF1,26.04,Ryan Corner Development Pty Ltd,Ryan Corner Wind Farm,Wind,205.0,12.7,Ryan Corner Wind Farm,-38.271017,142.140647,2026-02-01T20:58:32.440778
2026/02/02 07:00:00,RYEPARK1,290.6,Rye Park Renewable Energy Pty Ltd as trustee for Rye Park Wind Farm Trust,Rye Park Renewable Energy,Wind,384.0,75.68,Rye Park Renewable Energy,-32.138333,148.972778,2026-02-01T20:58:32.440778
2026/02/02 07:00:00,SALTCRK1,0.7,Salt Creek Wind Farm Pty Ltd,Salt Creek Wind Farm,Wind,54.0,1.3,Salt Creek Wind Farm,-37.95,142.63,2026-02-01T20:58:32.440778
2026/02/02 07:00:00,SAPHWF1,203.03,The Trustee For The SWF1 Operations Trust,Sapphire Wind Farm,Wind,270.0,75.2,Sapphire Wind Farm,-29.7,151.41,2026-02-01T20:58:32.440778
2026/02/02 07:00:00,SNOWNTH1,119.5,Snowtown Wind Farm Stage 2 Pty Ltd,Snowtown Wind Farm Stage 2 North,Wind,144.0,82.99,Snowtown Wind Farm Stage 2 North,-33.83,138.118611,2026-02-01T20:58:32.440778
2026/02/02 07:00:00,SNOWSTH1,108.0,Snowtown Wind Farm Stage 2 Pty Ltd,Snowtown South Wind Farm,Wind,126.0,85.71,Snowtown South Wind Farm,-33.83,138.118611,2026-02-01T20:58:32.440778
2026/02/02 07:00:00,SNOWTWN1,79.6,Snowtown Wind Farm Pty Ltd,Snowtown Wind Farm Units 1 And 47,Wind,99.0,80.4,Snowtown Wind Farm Units 1 And 47,-33.83,138.118611,2026-02-01T20:58:32.440778
2026/02/02 07:00:00,STARHLWF,13.2,Starfish Hill Wind Farm Pty Ltd,Starfish Hill Wind Farm,Wind,35.0,37.71,Starfish Hill Wind Farm,-35.58,138.14,2026-02-01T20:58:32.440778
2026/02/02 07:00:00,STOCKYD1,89.69,Stockyard Hill Wind Farm Pty Ltd,Stockyard Hill Wind Farm,Wind,511.0,17.55,Stockyard Hill Wind Farm,-37.535833,143.251389,2026-02-01T20:58:32.440778
2026/02/02 07:00:00,STWF1,0.0,PARF Company 8 Pty Ltd as The Trustee for Silverton Project Trust,Silverton Wind Farm,Wind,198.0,0.0,Silverton Wind Farm,-37.683168,142.551678,2026-02-01T20:58:32.440778
2026/02/02 07:00:00,TARALGA1,34.04,Taralga Wind Farm Nominees No 2 Pty Ltd (ATF Taralga Wind Farm Operating Trust),Taralga Wind Farm,Wind,106.0,32.11,Taralga Wind Farm,-34.42352,149.826267,2026-02-01T20:58:32.440778
2026/02/02 07:00:00,WAMBOWF1,26.6,Stanwell Corporation Limited,Wambo Wind Farm 1,Wind,245.0,10.86,Wambo Wind Farm 1,-35.187301,149.524945,2026-02-01T20:58:32.440778
2026/02/02 07:00:00,WATERLWF,98.1,Waterloo Wind Farm Pty Ltd,Waterloo Wind Farm,Wind,130.0,75.46,Waterloo Wind Farm,-34.00094,138.911567,2026-02-01T20:58:32.440778
2026/02/02 07:00:00,WGWF1,62.0,Willogoleche Power Pty Ltd As The Trustee For The Willogoleche Operating Trust,Willogoleche Wind Farm,Wind,119.0,52.1,Willogoleche Wind Farm,-33.39,138.85,2026-02-01T20:58:32.440778
2026/02/02 07:00:00,WOODLWN1,6.96,Woodlawn Wind Pty Ltd,Woodlawn Wind Farm,Wind,48.0,14.5,Woodlawn Wind Farm,-35.08,149.62,2026-02-01T20:58:32.440778
2026/02/02 07:00:00,WPWF,64.29,AGL SA Generation Pty Limited,Wattle Point Wind Farm,Wind,91.0,70.65,Wattle Point Wind Farm,-35.111624,137.7219,2026-02-01T20:58:32.440778
2026/02/02 07:00:00,WRWF1,73.08,White Rock Wind Farm Pty Ltd,White Rock Wind Farm,Wind,172.0,42.49,White Rock Wind Farm,-29.79,151.54,2026-02-01T20:58:32.440778
2026/02/02 07:00:00,YENDWF1,27.08,Lal Lal Wind Farms Nom Co Pty Ltd,Yendon Wind Farm,Wind,142.0,19.07,Yendon Wind Farm,-37.629987,144.022717,2026-02-01T20:58:32.440778
