SETTLEMENTDATE,DUID,SCADAVALUE,Participant,Station Name,Fuel Source - Primary,MAX_CAP,utilisation_pct,Plant,Latitude,Longitude,timestamp_utc
2026/03/15 00:40:00,CAPTL_WF,0.0,Iberdrola Australia Holdings Pty Limited,Capital Wind Farm,Wind,140.0,0.0,Capital Wind Farm,-35.1,149.31,2026-03-14T14:39:41.968198
2026/03/15 00:40:00,CHALLHWF,0.0,Pacific Hydro Challicum Hills Pty Ltd,Challicum Hills Wind Farm,Wind,52.0,0.0,Challicum Hills Wind Farm,-37.38,143.11,2026-03-14T14:39:41.968198
2026/03/15 00:40:00,CULLRGWF,5.97,Cullerin Range Wind Farm Pty Ltd,Cullerin Range Wind Farm,Wind,30.0,19.9,Cullerin Range Wind Farm,-34.81,149.4,2026-03-14T14:39:41.968198
2026/03/15 00:40:00,DIAPURWF1,6.9,Y.E.S. Energy (SA) Pty Ltd,Diapur Wind Farm,Wind,7.0,98.57,Diapur Wind Farm,-36.3425,141.43,2026-03-14T14:39:41.968198
2026/03/15 00:40:00,MLWF1,3.2,Mortons Lane Windfarm Pty Limited,Mortons Lane Wind Farm,Wind,20.0,16.0,Mortons Lane Wind Farm,-37.84,142.45,2026-03-14T14:39:41.968198
2026/03/15 00:40:00,WAUBRAWF,26.56,Pyrenees Wind Energy Developments Pty Ltd,Waubra Wind Farm,Wind,192.0,13.83,Waubra Wind Farm,-37.394498,143.638982,2026-03-14T14:39:41.968198
2026/03/15 00:40:00,WOOLNTH1,37.01,Hydro-Electric Corporation,Woolnorth Studland Bay / Bluff Point Wind Farm,Wind,140.0,26.44,Woolnorth Studland Bay / Bluff Point Wind Farm,-40.69,144.72,2026-03-14T14:39:41.968198
2026/03/15 00:40:00,YAMBUKWF,3.5,Energy Pacific (Vic) Pty Ltd,Yambuk Wind Farm,Wind,30.0,11.67,Yambuk Wind Farm,-38.299083,142.027577,2026-03-14T14:39:41.968198
2026/03/15 00:40:00,YSWF1,0.9,Pacific Hydro Yaloak South Pty Ltd,Yaloak South Wind Farm,Wind,28.0,3.21,Yaloak South Wind Farm,-37.7163,144.242853,2026-03-14T14:39:41.968198
2026/03/15 00:40:00,ARWF1,17.3,Ararat Wind Farm Pty Ltd,Ararat Wind Farm,Wind,241.0,7.18,Ararat Wind Farm,-37.232778,143.031389,2026-03-14T14:39:41.968198
2026/03/15 00:40:00,BALDHWF1,1.06,Alinta Energy Retail Sales Pty Ltd,Bald Hills Wind Farm,Wind,106.0,1.0,Bald Hills Wind Farm,-38.79,145.93,2026-03-14T14:39:41.968198
2026/03/15 00:40:00,BANGOWF1,18.9,BWF Nominees Pty Ltd as The Trustee for BWF Trust,Bango 973 Wind Farm,Wind,155.0,12.19,Bango 973 Wind Farm,-34.551582,148.732808,2026-03-14T14:39:41.968198
2026/03/15 00:40:00,BANGOWF2,10.9,BWF Nominees Pty Ltd as The Trustee for BWF Trust,Bango 999 Wind Farm,Wind,82.0,13.29,Bango 999 Wind Farm,-34.551582,148.732808,2026-03-14T14:39:41.968198
2026/03/15 00:40:00,BLUFF1,21.8,AGL SA Generation Pty Limited,The Bluff Wind Farm,Wind,53.0,41.13,The Bluff Wind Farm,-33.367778,138.728611,2026-03-14T14:39:41.968198
2026/03/15 00:40:00,BOCORWF1,4.96,Boco Rock Wind Farm Pty Ltd,Boco Rock Wind Farm,Wind,111.0,4.47,Boco Rock Wind Farm,-36.578611,149.103333,2026-03-14T14:39:41.968198
2026/03/15 00:40:00,BRYB1WF1,39.29,Berrybank Development Pty Ltd,Berrybank Wind Farm,Wind,175.9,22.34,Berrybank Wind Farm,-37.94,143.52,2026-03-14T14:39:41.968198
2026/03/15 00:40:00,BRYB2WF2,43.08,Berrybank 2 Asset Pty Ltd as trustee for Berrybank 2 Asset Trust,Berrybank 2 Wind Farm,Wind,105.0,41.03,Berrybank 2 Wind Farm,-37.94,143.52,2026-03-14T14:39:41.968198
2026/03/15 00:40:00,BULGANA1,20.49,Bulgana Wind Farm Pty Ltd,Bulgana Green Power Hub,Wind,204.0,10.04,Bulgana Green Power Hub,-37.0975,142.973611,2026-03-14T14:39:41.968198
2026/03/15 00:40:00,CATHROCK,19.3,Cathedral Rocks Wind Farm Pty Ltd,Cathedral Rocks,Wind,66.0,29.24,Cathedral Rocks,-34.51,135.35,2026-03-14T14:39:41.968198
2026/03/15 00:40:00,CHYTWF1,0.0,Cherry Tree Wind Farm Pty Ltd as trustee for The Cherry Tree Project trust ,Cherry Tree Wind Farm,Wind,57.0,0.0,Cherry Tree Wind Farm,-37.1,145.26,2026-03-14T14:39:41.968198
2026/03/15 00:40:00,CLEMGPWF,43.51,Pacific Hydro Clements Gap Pty Ltd,Clements Gap Wind Farm,Wind,57.0,76.33,Clements Gap Wind Farm,-33.48,138.1,2026-03-14T14:39:41.968198
2026/03/15 00:40:00,CLRKCWF1,325.67,Stanwell Corporation Limited ,Clarke Creek Wind Farm,Wind,338.0,96.35,Clarke Creek Wind Farm,-22.85,149.45,2026-03-14T14:39:41.968198
2026/03/15 00:40:00,CLRKCWF2,99.83,Stanwell Corporation Limited ,Clarke Creek Wind Farm,Wind,101.0,98.84,Clarke Creek Wind Farm,-22.85,149.45,2026-03-14T14:39:41.968198
2026/03/15 00:40:00,CNUNDAWF,17.82,Canunda Power Pty Ltd,Canunda Wind Farm,Wind,46.0,38.74,Canunda Wind Farm,-37.73,140.39,2026-03-14T14:39:41.968198
2026/03/15 00:40:00,COLWF01,35.06,Collector Wind Farm Pty Ltd,Collector Wind Farm 1,Wind,219.0,16.01,Collector Wind Farm 1,-34.8719,149.3967,2026-03-14T14:39:41.968198
2026/03/15 00:40:00,COOPGWF1,307.83,PARF Company 10 Pty Limited as The Trustee for Coopers Gap Project Trust,Coopers Gap Wind Farm,Wind,440.0,69.96,Coopers Gap Wind Farm,-26.74,151.45,2026-03-14T14:39:41.968198
2026/03/15 00:40:00,CROOKWF2,4.38,Crookwell Development Pty Ltd ,Crookwell 2 Wind Farm,Wind,91.0,4.81,Crookwell 2 Wind Farm,-34.52,149.54,2026-03-14T14:39:41.968198
2026/03/15 00:40:00,CROOKWF3,4.93,Crookwell 3 Development Pty Ltd,Crookwell 3 Wind Farm,Wind,56.0,8.8,Crookwell 3 Wind Farm,-34.52,149.54,2026-03-14T14:39:41.968198
2026/03/15 00:40:00,CROWLWF1,18.8,Pacific Hydro Crowlands Pty Ltd ,Crowlands Wind Farm,Wind,79.0,23.8,Crowlands Wind Farm,-37.13,143.16,2026-03-14T14:39:41.968198
2026/03/15 00:40:00,CRURWF1,32.1,CRWF Nominees Pty Ltd As Trustee For The CRWF Trust,Crudine Ridge Wind Farm,Wind,138.0,23.26,Crudine Ridge Wind Farm,-32.97,149.64,2026-03-14T14:39:41.968198
2026/03/15 00:40:00,CTHLWF1,0.0,Wild Cattle Hill Pty Ltd,Cattle Hill Wind Farm,Wind,144.0,0.0,Cattle Hill Wind Farm,-42.15,146.69,2026-03-14T14:39:41.968198
2026/03/15 00:40:00,DULAWF1,140.8,Dulacca Energy Project Co Pty Ltd,Dulacca Wind Farm,Wind,173.0,81.39,Dulacca Wind Farm,-26.63,149.87,2026-03-14T14:39:41.968198
2026/03/15 00:40:00,DUNDWF1,28.56,Dundonnell Wind Farm Pty Ltd,Dundonnell Wind Farm,Wind,168.0,17.0,Dundonnell Wind Farm,-37.52,142.58,2026-03-14T14:39:41.968198
2026/03/15 00:40:00,DUNDWF2,6.77,Dundonnell Wind Farm Pty Ltd,Dundonnell Wind Farm,Wind,46.0,14.72,Dundonnell Wind Farm,-37.52,142.58,2026-03-14T14:39:41.968198
2026/03/15 00:40:00,DUNDWF3,15.99,Dundonnell Wind Farm Pty Ltd,Dundonnell Wind Farm,Wind,122.0,13.11,Dundonnell Wind Farm,-37.52,142.58,2026-03-14T14:39:41.968198
2026/03/15 00:40:00,ELAINWF1,6.95,Lal Lal Wind Farms Nom Co Pty Ltd,Elaine Wind Farm,Wind,82.0,8.48,Elaine Wind Farm,-37.36,144.0,2026-03-14T14:39:41.968198
2026/03/15 00:40:00,FLYCRKWF,79.9,Iberdrola Australia Energy Markets Pty Limited,Flyers Creek Wind Farm,Wind,140.0,57.07,Flyers Creek Wind Farm,-33.365556,148.981944,2026-03-14T14:39:41.968198
2026/03/15 00:40:00,GPWFEST1,54.08,Golden Plains WF1 Pty Ltd as Trustee for the Golden Plains WF1 Unit Trust,Golden Plains Wind Farm East,Wind,240.0,22.53,Golden Plains Wind Farm East,-37.945091,143.752614,2026-03-14T14:39:41.968198
2026/03/15 00:40:00,GPWFEST2,65.34,Golden Plains WF1 Pty Ltd as Trustee for the Golden Plains WF1 Unit Trust,Golden Plains Wind Farm East,Wind,253.0,25.83,Golden Plains Wind Farm East,-37.945091,143.752614,2026-03-14T14:39:41.968198
2026/03/15 00:40:00,GPWFEST3,74.51,Golden Plains WF1 Pty Ltd as Trustee for the Golden Plains WF1 Unit Trust,Golden Plains Wind Farm East,Wind,240.0,31.05,Golden Plains Wind Farm East,-37.945091,143.752614,2026-03-14T14:39:41.968198
2026/03/15 00:40:00,GRANWF1,0.0,Granville Harbour Operations Pty Ltd as The Trustee for Granville Harbour Operations Trust,Granville Harbour Wind Farm,Wind,111.0,0.0,Granville Harbour Wind Farm,-41.8,145.06,2026-03-14T14:39:41.968198
2026/03/15 00:40:00,GSWF1A,90.67,Goyder Wind Farm 1 Pty Ltd as the Trustee for Goyder Wind Farm 1 Trust,Goyder South Wind Farm 1A,Wind,201.0,45.11,Goyder South Wind Farm 1A,-33.679758,138.937597,2026-03-14T14:39:41.968198
2026/03/15 00:40:00,GSWF1B1,48.34,Goyder Wind Farm 1B Pty Ltd as the Trustee for the Goyder Wind Farm 1B Trust,Goyder South Wind Farm 1B,Wind,196.0,24.66,Goyder South Wind Farm 1B,-33.679758,138.937597,2026-03-14T14:39:41.968198
2026/03/15 00:40:00,GULLRWF1,5.37,New Gullen Range Wind Farm Pty Ltd,Gullen Range Wind Farm,Wind,161.0,3.34,Gullen Range Wind Farm,-34.34,149.27,2026-03-14T14:39:41.968198
2026/03/15 00:40:00,GULLRWF2,4.45,New Gullen Range Wind Farm Pty Ltd,Gullen Range Wind Farm,Wind,107.0,4.16,Gullen Range Wind Farm,-34.34,149.27,2026-03-14T14:39:41.968198
2026/03/15 00:40:00,GUNNING1,8.8,Gunning Wind Energy Developments Pty Ltd,Gunning Wind Farm,Wind,47.0,18.72,Gunning Wind Farm,-34.813333,149.4,2026-03-14T14:39:41.968198
2026/03/15 00:40:00,HALLWF1,37.56,AGL SA Generation Pty Limited,Hallett 1 Wind Farm,Wind,95.0,39.54,Hallett 1 Wind Farm,-33.367778,138.728611,2026-03-14T14:39:41.968198
2026/03/15 00:40:00,HALLWF2,35.05,AGL SA Generation Pty Limited,Hallett 2 Wind Farm,Wind,71.0,49.37,Hallett 2 Wind Farm,-33.367778,138.728611,2026-03-14T14:39:41.968198
2026/03/15 00:40:00,HD1WF1,51.05,Hawkesdale Asset Pty Ltd as trustee for Hawkesdale Asset Trust,Hawkesdale Wind Farm,Wind,89.0,57.36,Hawkesdale Wind Farm,-38.147894,142.361381,2026-03-14T14:39:41.968198
2026/03/15 00:40:00,HDWF1,56.1,HWF1 Pty Ltd,Hornsdale Wind Farm,Wind,102.0,55.0,Hornsdale Wind Farm,-33.050556,138.543611,2026-03-14T14:39:41.968198
2026/03/15 00:40:00,HDWF2,83.2,HWF 2 Pty Ltd,Hornsdale Wind Farm 2,Wind,102.0,81.57,Hornsdale Wind Farm 2,-33.06,138.54,2026-03-14T14:39:41.968198
2026/03/15 00:40:00,HDWF3,75.9,HWF3 Pty Ltd,Hornsdale Wind Farm 3,Wind,109.0,69.63,Hornsdale Wind Farm 3,-33.06,138.54,2026-03-14T14:39:41.968198
2026/03/15 00:40:00,KABANWF1,31.95,Kaban Wind Farm Pty Ltd as trustee for Kaban Wind Farm Trust,Kaban Wind Farm,Wind,152.0,21.02,Kaban Wind Farm,-17.56,145.41,2026-03-14T14:39:41.968198
2026/03/15 00:40:00,KEPWF1,27.2,Kennedy Energy Park Pty Ltd,Kennedy Energy Park,Wind,43.0,63.26,Kennedy Energy Park,-20.88,144.42,2026-03-14T14:39:41.968198
2026/03/15 00:40:00,KIATAWF1,24.8,Kiata ProjectCo Pty Ltd Atf Kiata Project Trust,Kiata Wind Farm,Wind,31.0,80.0,Kiata Wind Farm,-36.4,141.75,2026-03-14T14:39:41.968198
2026/03/15 00:40:00,LGAPWF1,27.87,Lincoln Gap Wind Farm (Operations) Pty Ltd,Lincoln Gap Wind Farm,Wind,123.0,22.66,Lincoln Gap Wind Farm,-32.564279,137.557328,2026-03-14T14:39:41.968198
2026/03/15 00:40:00,LGAPWF1,27.87,Lincoln Gap Wind Farm (Operations) Pty Ltd,Lincoln Gap Wind Farm,Wind,123.0,22.66,Lincoln Gap Wind Farm,-32.564279,137.557328,2026-03-14T14:39:41.968198
2026/03/15 00:40:00,LGAPWF2,38.29,Lincoln Gap Wind Farm (Operations) Pty Ltd,Lincoln Gap Wind Farm,Wind,85.0,45.05,Lincoln Gap Wind Farm,-32.564279,137.557328,2026-03-14T14:39:41.968198
2026/03/15 00:40:00,LGAPWF2,38.29,Lincoln Gap Wind Farm (Operations) Pty Ltd,Lincoln Gap Wind Farm,Wind,85.0,45.05,Lincoln Gap Wind Farm,-32.564279,137.557328,2026-03-14T14:39:41.968198
2026/03/15 00:40:00,LKBONNY1,27.42,Lake Bonney Wind Power Pty Ltd,Lake Bonney Wind Farm Stage 1,Wind,81.0,33.85,Lake Bonney Wind Farm Stage 1,-37.76,140.4,2026-03-14T14:39:41.968198
2026/03/15 00:40:00,LKBONNY2,53.97,Lake Bonney Wind Power Pty Ltd,Lake Bonney Stage 2 Windfarm,Wind,159.0,33.94,Lake Bonney Stage 2 Windfarm,-37.76,140.4,2026-03-14T14:39:41.968198
2026/03/15 00:40:00,LKBONNY3,9.55,Lake Bonney Wind Power Pty Ltd,Lake Bonney Stage 3 Wind Farm,Wind,39.0,24.49,Lake Bonney Stage 3 Wind Farm,-37.737781,140.388137,2026-03-14T14:39:41.968198
2026/03/15 00:40:00,MACARTH1,47.1,AGL Hydro Partnership,Macarthur Wind Farm,Wind,420.0,11.21,Macarthur Wind Farm,-38.048957,142.192112,2026-03-14T14:39:41.968198
2026/03/15 00:40:00,MCINTYR1,406.09,MacIntyre UJV Operator Pty Ltd,MacIntyre Wind Farm,Wind,890.0,45.63,MacIntyre Wind Farm,-28.32,151.54,2026-03-14T14:39:41.968198
2026/03/15 00:40:00,MERCER01,33.1,Mt Mercer Windfarm Pty Ltd,Mt Mercer Wind Farm,Wind,131.0,25.27,Mt Mercer Wind Farm,-37.841111,143.871111,2026-03-14T14:39:41.968198
2026/03/15 00:40:00,MEWF1,128.0,Ergon Energy Queensland Pty Ltd ,Mount Emerald Wind Farm,Wind,178.0,71.91,Mount Emerald Wind Farm,-17.133007,145.380644,2026-03-14T14:39:41.968198
2026/03/15 00:40:00,MRTLSWF1,107.17,Mortlake South Wind Farm Pty Ltd,Mortlake South Wind Farm,Wind,153.0,70.05,Mortlake South Wind Farm,-38.127337,142.857801,2026-03-14T14:39:41.968198
2026/03/15 00:40:00,MTGELWF1,60.2,Mt. Gellibrand Wind Farm Pty Ltd,Mt Gellibrand Wind Farm,Wind,132.0,45.61,Mt Gellibrand Wind Farm,-38.23,143.77,2026-03-14T14:39:41.968198
2026/03/15 00:40:00,MTMILLAR,4.8,Mt Millar Wind Farm Pty Ltd,Mt Millar Wind Farm,Wind,70.0,6.86,Mt Millar Wind Farm,-33.624444,136.703611,2026-03-14T14:39:41.968198
2026/03/15 00:40:00,MUSSELR1,35.2,Hydro-Electric Corporation,Musselroe Wind Farm,Wind,168.0,20.95,Musselroe Wind Farm,-40.780225,148.010799,2026-03-14T14:39:41.968198
2026/03/15 00:40:00,MUWAWF1,41.32,Telstra Energy (Generation) Pty Ltd,Murra Warra Wind Farm,Wind,225.7,18.31,Murra Warra Wind Farm,-36.432404,142.317853,2026-03-14T14:39:41.968198
2026/03/15 00:40:00,MUWAWF2,94.5,Murra Warra II Project Co Pty Ltd ATF The Murra Warra II Project Trust,Murra Warra Wind Farm Stage 2,Wind,203.0,46.55,Murra Warra Wind Farm Stage 2,-36.43,142.32,2026-03-14T14:39:41.968198
2026/03/15 00:40:00,NBHWF1,85.5,AGL SA Generation Pty Limited,North Brown Hill Wind Farm,Wind,132.0,64.77,North Brown Hill Wind Farm,-33.367778,138.728611,2026-03-14T14:39:41.968198
2026/03/15 00:40:00,OAKLAND1,0.0,AGL Hydro Partnership,Oaklands Hill Wind Farm,Wind,63.0,0.0,Oaklands Hill Wind Farm,-37.683078,142.551678,2026-03-14T14:39:41.968198
2026/03/15 00:40:00,PAREPW1,30.0,Iberdrola Australia Energy Markets Pty Limited,Port Augusta Renewable Energy Park,Wind,201.0,14.93,Port Augusta Renewable Energy Park,-32.566944,137.856111,2026-03-14T14:39:41.968198
2026/03/15 00:40:00,RYANCWF1,17.58,Ryan Corner Development Pty Ltd,Ryan Corner Wind Farm,Wind,205.0,8.58,Ryan Corner Wind Farm,-38.271017,142.140647,2026-03-14T14:39:41.968198
2026/03/15 00:40:00,RYEPARK1,42.79,Rye Park Renewable Energy Pty Ltd as trustee for Rye Park Wind Farm Trust,Rye Park Renewable Energy,Wind,384.0,11.14,Rye Park Renewable Energy,-32.138333,148.972778,2026-03-14T14:39:41.968198
2026/03/15 00:40:00,SALTCRK1,14.51,Salt Creek Wind Farm Pty Ltd,Salt Creek Wind Farm,Wind,54.0,26.87,Salt Creek Wind Farm,-37.95,142.63,2026-03-14T14:39:41.968198
2026/03/15 00:40:00,SAPHWF1,259.48,The Trustee For The SWF1 Operations Trust,Sapphire Wind Farm,Wind,270.0,96.1,Sapphire Wind Farm,-29.7,151.41,2026-03-14T14:39:41.968198
2026/03/15 00:40:00,SNOWNTH1,29.4,Snowtown Wind Farm Stage 2 Pty Ltd,Snowtown Wind Farm Stage 2 North,Wind,144.0,20.42,Snowtown Wind Farm Stage 2 North,-33.83,138.118611,2026-03-14T14:39:41.968198
2026/03/15 00:40:00,SNOWSTH1,37.6,Snowtown Wind Farm Stage 2 Pty Ltd,Snowtown South Wind Farm,Wind,126.0,29.84,Snowtown South Wind Farm,-33.83,138.118611,2026-03-14T14:39:41.968198
2026/03/15 00:40:00,SNOWTWN1,50.84,Snowtown Wind Farm Pty Ltd,Snowtown Wind Farm Units 1 And 47,Wind,99.0,51.35,Snowtown Wind Farm Units 1 And 47,-33.83,138.118611,2026-03-14T14:39:41.968198
2026/03/15 00:40:00,STARHLWF,16.9,Starfish Hill Wind Farm Pty Ltd,Starfish Hill Wind Farm,Wind,35.0,48.29,Starfish Hill Wind Farm,-35.58,138.14,2026-03-14T14:39:41.968198
2026/03/15 00:40:00,STOCKYD1,41.43,Stockyard Hill Wind Farm Pty Ltd,Stockyard Hill Wind Farm,Wind,511.0,8.11,Stockyard Hill Wind Farm,-37.535833,143.251389,2026-03-14T14:39:41.968198
2026/03/15 00:40:00,STWF1,27.67,PARF Company 8 Pty Ltd as The Trustee for Silverton Project Trust,Silverton Wind Farm,Wind,198.0,13.97,Silverton Wind Farm,-37.683168,142.551678,2026-03-14T14:39:41.968198
2026/03/15 00:40:00,TARALGA1,6.48,Taralga Wind Farm Nominees No 2 Pty Ltd (ATF Taralga Wind Farm Operating Trust),Taralga Wind Farm,Wind,106.0,6.11,Taralga Wind Farm,-34.42352,149.826267,2026-03-14T14:39:41.968198
2026/03/15 00:40:00,WAMBOWF1,185.84,Stanwell Corporation Limited,Wambo Wind Farm 1,Wind,245.0,75.85,Wambo Wind Farm 1,-35.187301,149.524945,2026-03-14T14:39:41.968198
2026/03/15 00:40:00,WATERLWF,39.3,Waterloo Wind Farm Pty Ltd,Waterloo Wind Farm,Wind,130.0,30.23,Waterloo Wind Farm,-34.00094,138.911567,2026-03-14T14:39:41.968198
2026/03/15 00:40:00,WGWF1,93.1,Willogoleche Power Pty Ltd As The Trustee For The Willogoleche Operating Trust,Willogoleche Wind Farm,Wind,119.0,78.24,Willogoleche Wind Farm,-33.39,138.85,2026-03-14T14:39:41.968198
2026/03/15 00:40:00,WOODLWN1,5.59,Woodlawn Wind Pty Ltd,Woodlawn Wind Farm,Wind,48.0,11.65,Woodlawn Wind Farm,-35.08,149.62,2026-03-14T14:39:41.968198
2026/03/15 00:40:00,WPWF,13.99,AGL SA Generation Pty Limited,Wattle Point Wind Farm,Wind,91.0,15.37,Wattle Point Wind Farm,-35.111624,137.7219,2026-03-14T14:39:41.968198
2026/03/15 00:40:00,WRWF1,152.55,White Rock Wind Farm Pty Ltd,White Rock Wind Farm,Wind,172.0,88.69,White Rock Wind Farm,-29.79,151.54,2026-03-14T14:39:41.968198
2026/03/15 00:40:00,YENDWF1,11.91,Lal Lal Wind Farms Nom Co Pty Ltd,Yendon Wind Farm,Wind,142.0,8.39,Yendon Wind Farm,-37.629987,144.022717,2026-03-14T14:39:41.968198
