SETTLEMENTDATE,DUID,SCADAVALUE,Participant,Station Name,Fuel Source - Primary,MAX_CAP,utilisation_pct,Plant,Latitude,Longitude,timestamp_utc
2026/02/06 14:30:00,CAPTL_WF,82.71,Iberdrola Australia Holdings Pty Limited,Capital Wind Farm,Wind,140.0,59.08,Capital Wind Farm,-35.1,149.31,2026-02-06T04:30:47.633956
2026/02/06 14:30:00,CHALLHWF,2.6,Pacific Hydro Challicum Hills Pty Ltd,Challicum Hills Wind Farm,Wind,52.0,5.0,Challicum Hills Wind Farm,-37.38,143.11,2026-02-06T04:30:47.633956
2026/02/06 14:30:00,CULLRGWF,19.06,Cullerin Range Wind Farm Pty Ltd,Cullerin Range Wind Farm,Wind,30.0,63.53,Cullerin Range Wind Farm,-34.81,149.4,2026-02-06T04:30:47.633956
2026/02/06 14:30:00,DIAPURWF1,1.3,Y.E.S. Energy (SA) Pty Ltd,Diapur Wind Farm,Wind,7.0,18.57,Diapur Wind Farm,-36.3425,141.43,2026-02-06T04:30:47.633956
2026/02/06 14:30:00,MLWF1,0.03,Mortons Lane Windfarm Pty Limited,Mortons Lane Wind Farm,Wind,20.0,0.15,Mortons Lane Wind Farm,-37.84,142.45,2026-02-06T04:30:47.633956
2026/02/06 14:30:00,WAUBRAWF,34.97,Pyrenees Wind Energy Developments Pty Ltd,Waubra Wind Farm,Wind,192.0,18.21,Waubra Wind Farm,-37.394498,143.638982,2026-02-06T04:30:47.633956
2026/02/06 14:30:00,WOOLNTH1,46.36,Hydro-Electric Corporation,Woolnorth Studland Bay / Bluff Point Wind Farm,Wind,140.0,33.11,Woolnorth Studland Bay / Bluff Point Wind Farm,-40.69,144.72,2026-02-06T04:30:47.633956
2026/02/06 14:30:00,YAMBUKWF,2.5,Energy Pacific (Vic) Pty Ltd,Yambuk Wind Farm,Wind,30.0,8.33,Yambuk Wind Farm,-38.299083,142.027577,2026-02-06T04:30:47.633956
2026/02/06 14:30:00,YSWF1,4.4,Pacific Hydro Yaloak South Pty Ltd,Yaloak South Wind Farm,Wind,28.0,15.71,Yaloak South Wind Farm,-37.7163,144.242853,2026-02-06T04:30:47.633956
2026/02/06 14:30:00,ARWF1,2.7,Ararat Wind Farm Pty Ltd,Ararat Wind Farm,Wind,241.0,1.12,Ararat Wind Farm,-37.232778,143.031389,2026-02-06T04:30:47.633956
2026/02/06 14:30:00,BALDHWF1,13.58,Alinta Energy Retail Sales Pty Ltd,Bald Hills Wind Farm,Wind,106.0,12.81,Bald Hills Wind Farm,-38.79,145.93,2026-02-06T04:30:47.633956
2026/02/06 14:30:00,BANGOWF1,32.1,BWF Nominees Pty Ltd as The Trustee for BWF Trust,Bango 973 Wind Farm,Wind,155.0,20.71,Bango 973 Wind Farm,-34.551582,148.732808,2026-02-06T04:30:47.633956
2026/02/06 14:30:00,BANGOWF2,21.0,BWF Nominees Pty Ltd as The Trustee for BWF Trust,Bango 999 Wind Farm,Wind,82.0,25.61,Bango 999 Wind Farm,-34.551582,148.732808,2026-02-06T04:30:47.633956
2026/02/06 14:30:00,BLUFF1,28.7,AGL SA Generation Pty Limited,The Bluff Wind Farm,Wind,53.0,54.15,The Bluff Wind Farm,-33.367778,138.728611,2026-02-06T04:30:47.633956
2026/02/06 14:30:00,BOCORWF1,69.63,Boco Rock Wind Farm Pty Ltd,Boco Rock Wind Farm,Wind,111.0,62.73,Boco Rock Wind Farm,-36.578611,149.103333,2026-02-06T04:30:47.633956
2026/02/06 14:30:00,BRYB1WF1,1.51,Berrybank Development Pty Ltd,Berrybank Wind Farm,Wind,175.9,0.86,Berrybank Wind Farm,-37.94,143.52,2026-02-06T04:30:47.633956
2026/02/06 14:30:00,BRYB2WF2,3.57,Berrybank 2 Asset Pty Ltd as trustee for Berrybank 2 Asset Trust,Berrybank 2 Wind Farm,Wind,105.0,3.4,Berrybank 2 Wind Farm,-37.94,143.52,2026-02-06T04:30:47.633956
2026/02/06 14:30:00,BULGANA1,3.85,Bulgana Wind Farm Pty Ltd,Bulgana Green Power Hub,Wind,204.0,1.89,Bulgana Green Power Hub,-37.0975,142.973611,2026-02-06T04:30:47.633956
2026/02/06 14:30:00,CATHROCK,16.5,Cathedral Rocks Wind Farm Pty Ltd,Cathedral Rocks,Wind,66.0,25.0,Cathedral Rocks,-34.51,135.35,2026-02-06T04:30:47.633956
2026/02/06 14:30:00,CHYTWF1,9.84,Cherry Tree Wind Farm Pty Ltd as trustee for The Cherry Tree Project trust ,Cherry Tree Wind Farm,Wind,57.0,17.26,Cherry Tree Wind Farm,-37.1,145.26,2026-02-06T04:30:47.633956
2026/02/06 14:30:00,CLEMGPWF,4.83,Pacific Hydro Clements Gap Pty Ltd,Clements Gap Wind Farm,Wind,57.0,8.47,Clements Gap Wind Farm,-33.48,138.1,2026-02-06T04:30:47.633956
2026/02/06 14:30:00,CLRKCWF1,52.13,Stanwell Corporation Limited ,Clarke Creek Wind Farm,Wind,338.0,15.42,Clarke Creek Wind Farm,-22.85,149.45,2026-02-06T04:30:47.633956
2026/02/06 14:30:00,CLRKCWF2,12.26,Stanwell Corporation Limited ,Clarke Creek Wind Farm,Wind,101.0,12.14,Clarke Creek Wind Farm,-22.85,149.45,2026-02-06T04:30:47.633956
2026/02/06 14:30:00,CNUNDAWF,0.0,Canunda Power Pty Ltd,Canunda Wind Farm,Wind,46.0,0.0,Canunda Wind Farm,-37.73,140.39,2026-02-06T04:30:47.633956
2026/02/06 14:30:00,COLWF01,0.0,Collector Wind Farm Pty Ltd,Collector Wind Farm 1,Wind,219.0,0.0,Collector Wind Farm 1,-34.8719,149.3967,2026-02-06T04:30:47.633956
2026/02/06 14:30:00,COOPGWF1,88.54,PARF Company 10 Pty Limited as The Trustee for Coopers Gap Project Trust,Coopers Gap Wind Farm,Wind,440.0,20.12,Coopers Gap Wind Farm,-26.74,151.45,2026-02-06T04:30:47.633956
2026/02/06 14:30:00,CROOKWF2,63.86,Crookwell Development Pty Ltd ,Crookwell 2 Wind Farm,Wind,91.0,70.18,Crookwell 2 Wind Farm,-34.52,149.54,2026-02-06T04:30:47.633956
2026/02/06 14:30:00,CROOKWF3,36.85,Crookwell 3 Development Pty Ltd,Crookwell 3 Wind Farm,Wind,56.0,65.8,Crookwell 3 Wind Farm,-34.52,149.54,2026-02-06T04:30:47.633956
2026/02/06 14:30:00,CROWLWF1,4.93,Pacific Hydro Crowlands Pty Ltd ,Crowlands Wind Farm,Wind,79.0,6.24,Crowlands Wind Farm,-37.13,143.16,2026-02-06T04:30:47.633956
2026/02/06 14:30:00,CRURWF1,127.4,CRWF Nominees Pty Ltd As Trustee For The CRWF Trust,Crudine Ridge Wind Farm,Wind,138.0,92.32,Crudine Ridge Wind Farm,-32.97,149.64,2026-02-06T04:30:47.633956
2026/02/06 14:30:00,CTHLWF1,86.21,Wild Cattle Hill Pty Ltd,Cattle Hill Wind Farm,Wind,144.0,59.87,Cattle Hill Wind Farm,-42.15,146.69,2026-02-06T04:30:47.633956
2026/02/06 14:30:00,DULAWF1,54.2,Dulacca Energy Project Co Pty Ltd,Dulacca Wind Farm,Wind,173.0,31.33,Dulacca Wind Farm,-26.63,149.87,2026-02-06T04:30:47.633956
2026/02/06 14:30:00,DUNDWF1,3.04,Dundonnell Wind Farm Pty Ltd,Dundonnell Wind Farm,Wind,168.0,1.81,Dundonnell Wind Farm,-37.52,142.58,2026-02-06T04:30:47.633956
2026/02/06 14:30:00,DUNDWF2,1.18,Dundonnell Wind Farm Pty Ltd,Dundonnell Wind Farm,Wind,46.0,2.57,Dundonnell Wind Farm,-37.52,142.58,2026-02-06T04:30:47.633956
2026/02/06 14:30:00,DUNDWF3,0.49,Dundonnell Wind Farm Pty Ltd,Dundonnell Wind Farm,Wind,122.0,0.4,Dundonnell Wind Farm,-37.52,142.58,2026-02-06T04:30:47.633956
2026/02/06 14:30:00,ELAINWF1,1.33,Lal Lal Wind Farms Nom Co Pty Ltd,Elaine Wind Farm,Wind,82.0,1.62,Elaine Wind Farm,-37.36,144.0,2026-02-06T04:30:47.633956
2026/02/06 14:30:00,FLYCRKWF,22.4,Iberdrola Australia Energy Markets Pty Limited,Flyers Creek Wind Farm,Wind,140.0,16.0,Flyers Creek Wind Farm,-33.365556,148.981944,2026-02-06T04:30:47.633956
2026/02/06 14:30:00,GPWFEST1,0.32,Golden Plains WF1 Pty Ltd as Trustee for the Golden Plains WF1 Unit Trust,Golden Plains Wind Farm East,Wind,240.0,0.13,Golden Plains Wind Farm East,-37.945091,143.752614,2026-02-06T04:30:47.633956
2026/02/06 14:30:00,GPWFEST2,1.75,Golden Plains WF1 Pty Ltd as Trustee for the Golden Plains WF1 Unit Trust,Golden Plains Wind Farm East,Wind,253.0,0.69,Golden Plains Wind Farm East,-37.945091,143.752614,2026-02-06T04:30:47.633956
2026/02/06 14:30:00,GPWFEST3,1.95,Golden Plains WF1 Pty Ltd as Trustee for the Golden Plains WF1 Unit Trust,Golden Plains Wind Farm East,Wind,240.0,0.81,Golden Plains Wind Farm East,-37.945091,143.752614,2026-02-06T04:30:47.633956
2026/02/06 14:30:00,GRANWF1,42.78,Granville Harbour Operations Pty Ltd as The Trustee for Granville Harbour Operations Trust,Granville Harbour Wind Farm,Wind,111.0,38.54,Granville Harbour Wind Farm,-41.8,145.06,2026-02-06T04:30:47.633956
2026/02/06 14:30:00,GSWF1A,14.55,Goyder Wind Farm 1 Pty Ltd as the Trustee for Goyder Wind Farm 1 Trust,Goyder South Wind Farm 1A,Wind,201.0,7.24,Goyder South Wind Farm 1A,-33.679758,138.937597,2026-02-06T04:30:47.633956
2026/02/06 14:30:00,GSWF1B1,11.07,Goyder Wind Farm 1B Pty Ltd as the Trustee for the Goyder Wind Farm 1B Trust,Goyder South Wind Farm 1B,Wind,196.0,5.65,Goyder South Wind Farm 1B,-33.679758,138.937597,2026-02-06T04:30:47.633956
2026/02/06 14:30:00,GULLRWF1,67.48,New Gullen Range Wind Farm Pty Ltd,Gullen Range Wind Farm,Wind,161.0,41.91,Gullen Range Wind Farm,-34.34,149.27,2026-02-06T04:30:47.633956
2026/02/06 14:30:00,GULLRWF2,65.88,New Gullen Range Wind Farm Pty Ltd,Gullen Range Wind Farm,Wind,107.0,61.57,Gullen Range Wind Farm,-34.34,149.27,2026-02-06T04:30:47.633956
2026/02/06 14:30:00,GUNNING1,20.48,Gunning Wind Energy Developments Pty Ltd,Gunning Wind Farm,Wind,47.0,43.57,Gunning Wind Farm,-34.813333,149.4,2026-02-06T04:30:47.633956
2026/02/06 14:30:00,HALLWF1,46.56,AGL SA Generation Pty Limited,Hallett 1 Wind Farm,Wind,95.0,49.01,Hallett 1 Wind Farm,-33.367778,138.728611,2026-02-06T04:30:47.633956
2026/02/06 14:30:00,HALLWF2,45.01,AGL SA Generation Pty Limited,Hallett 2 Wind Farm,Wind,71.0,63.39,Hallett 2 Wind Farm,-33.367778,138.728611,2026-02-06T04:30:47.633956
2026/02/06 14:30:00,HD1WF1,4.84,Hawkesdale Asset Pty Ltd as trustee for Hawkesdale Asset Trust,Hawkesdale Wind Farm,Wind,89.0,5.44,Hawkesdale Wind Farm,-38.147894,142.361381,2026-02-06T04:30:47.633956
2026/02/06 14:30:00,HDWF1,19.2,HWF1 Pty Ltd,Hornsdale Wind Farm,Wind,102.0,18.82,Hornsdale Wind Farm,-33.050556,138.543611,2026-02-06T04:30:47.633956
2026/02/06 14:30:00,HDWF2,34.3,HWF 2 Pty Ltd,Hornsdale Wind Farm 2,Wind,102.0,33.63,Hornsdale Wind Farm 2,-33.06,138.54,2026-02-06T04:30:47.633956
2026/02/06 14:30:00,HDWF3,34.5,HWF3 Pty Ltd,Hornsdale Wind Farm 3,Wind,109.0,31.65,Hornsdale Wind Farm 3,-33.06,138.54,2026-02-06T04:30:47.633956
2026/02/06 14:30:00,KABANWF1,71.38,Kaban Wind Farm Pty Ltd as trustee for Kaban Wind Farm Trust,Kaban Wind Farm,Wind,152.0,46.96,Kaban Wind Farm,-17.56,145.41,2026-02-06T04:30:47.633956
2026/02/06 14:30:00,KEPWF1,10.2,Kennedy Energy Park Pty Ltd,Kennedy Energy Park,Wind,43.0,23.72,Kennedy Energy Park,-20.88,144.42,2026-02-06T04:30:47.633956
2026/02/06 14:30:00,KIATAWF1,5.3,Kiata ProjectCo Pty Ltd Atf Kiata Project Trust,Kiata Wind Farm,Wind,31.0,17.1,Kiata Wind Farm,-36.4,141.75,2026-02-06T04:30:47.633956
2026/02/06 14:30:00,LGAPWF1,0.0,Lincoln Gap Wind Farm (Operations) Pty Ltd,Lincoln Gap Wind Farm,Wind,123.0,0.0,Lincoln Gap Wind Farm,-32.564279,137.557328,2026-02-06T04:30:47.633956
2026/02/06 14:30:00,LGAPWF1,0.0,Lincoln Gap Wind Farm (Operations) Pty Ltd,Lincoln Gap Wind Farm,Wind,123.0,0.0,Lincoln Gap Wind Farm,-32.564279,137.557328,2026-02-06T04:30:47.633956
2026/02/06 14:30:00,LGAPWF2,2.96,Lincoln Gap Wind Farm (Operations) Pty Ltd,Lincoln Gap Wind Farm,Wind,85.0,3.48,Lincoln Gap Wind Farm,-32.564279,137.557328,2026-02-06T04:30:47.633956
2026/02/06 14:30:00,LGAPWF2,2.96,Lincoln Gap Wind Farm (Operations) Pty Ltd,Lincoln Gap Wind Farm,Wind,85.0,3.48,Lincoln Gap Wind Farm,-32.564279,137.557328,2026-02-06T04:30:47.633956
2026/02/06 14:30:00,LKBONNY1,22.51,Lake Bonney Wind Power Pty Ltd,Lake Bonney Wind Farm Stage 1,Wind,81.0,27.79,Lake Bonney Wind Farm Stage 1,-37.76,140.4,2026-02-06T04:30:47.633956
2026/02/06 14:30:00,LKBONNY2,34.4,Lake Bonney Wind Power Pty Ltd,Lake Bonney Stage 2 Windfarm,Wind,159.0,21.64,Lake Bonney Stage 2 Windfarm,-37.76,140.4,2026-02-06T04:30:47.633956
2026/02/06 14:30:00,LKBONNY3,4.35,Lake Bonney Wind Power Pty Ltd,Lake Bonney Stage 3 Wind Farm,Wind,39.0,11.15,Lake Bonney Stage 3 Wind Farm,-37.737781,140.388137,2026-02-06T04:30:47.633956
2026/02/06 14:30:00,MACARTH1,16.1,AGL Hydro Partnership,Macarthur Wind Farm,Wind,420.0,3.83,Macarthur Wind Farm,-38.048957,142.192112,2026-02-06T04:30:47.633956
2026/02/06 14:30:00,MCINTYR1,126.73,MacIntyre UJV Operator Pty Ltd,MacIntyre Wind Farm,Wind,890.0,14.24,MacIntyre Wind Farm,-28.32,151.54,2026-02-06T04:30:47.633956
2026/02/06 14:30:00,MERCER01,3.9,Mt Mercer Windfarm Pty Ltd,Mt Mercer Wind Farm,Wind,131.0,2.98,Mt Mercer Wind Farm,-37.841111,143.871111,2026-02-06T04:30:47.633956
2026/02/06 14:30:00,MEWF1,72.73,Ergon Energy Queensland Pty Ltd ,Mount Emerald Wind Farm,Wind,178.0,40.86,Mount Emerald Wind Farm,-17.133007,145.380644,2026-02-06T04:30:47.633956
2026/02/06 14:30:00,MRTLSWF1,8.49,Mortlake South Wind Farm Pty Ltd,Mortlake South Wind Farm,Wind,153.0,5.55,Mortlake South Wind Farm,-38.127337,142.857801,2026-02-06T04:30:47.633956
2026/02/06 14:30:00,MTGELWF1,0.0,Mt. Gellibrand Wind Farm Pty Ltd,Mt Gellibrand Wind Farm,Wind,132.0,0.0,Mt Gellibrand Wind Farm,-38.23,143.77,2026-02-06T04:30:47.633956
2026/02/06 14:30:00,MTMILLAR,22.0,Mt Millar Wind Farm Pty Ltd,Mt Millar Wind Farm,Wind,70.0,31.43,Mt Millar Wind Farm,-33.624444,136.703611,2026-02-06T04:30:47.633956
2026/02/06 14:30:00,MUSSELR1,150.9,Hydro-Electric Corporation,Musselroe Wind Farm,Wind,168.0,89.82,Musselroe Wind Farm,-40.780225,148.010799,2026-02-06T04:30:47.633956
2026/02/06 14:30:00,MUWAWF1,19.48,Telstra Energy (Generation) Pty Ltd,Murra Warra Wind Farm,Wind,225.7,8.63,Murra Warra Wind Farm,-36.432404,142.317853,2026-02-06T04:30:47.633956
2026/02/06 14:30:00,MUWAWF2,22.4,Murra Warra II Project Co Pty Ltd ATF The Murra Warra II Project Trust,Murra Warra Wind Farm Stage 2,Wind,203.0,11.03,Murra Warra Wind Farm Stage 2,-36.43,142.32,2026-02-06T04:30:47.633956
2026/02/06 14:30:00,NBHWF1,26.2,AGL SA Generation Pty Limited,North Brown Hill Wind Farm,Wind,132.0,19.85,North Brown Hill Wind Farm,-33.367778,138.728611,2026-02-06T04:30:47.633956
2026/02/06 14:30:00,OAKLAND1,0.0,AGL Hydro Partnership,Oaklands Hill Wind Farm,Wind,63.0,0.0,Oaklands Hill Wind Farm,-37.683078,142.551678,2026-02-06T04:30:47.633956
2026/02/06 14:30:00,PAREPW1,25.58,Iberdrola Australia Energy Markets Pty Limited,Port Augusta Renewable Energy Park,Wind,201.0,12.73,Port Augusta Renewable Energy Park,-32.566944,137.856111,2026-02-06T04:30:47.633956
2026/02/06 14:30:00,RYANCWF1,12.7,Ryan Corner Development Pty Ltd,Ryan Corner Wind Farm,Wind,205.0,6.2,Ryan Corner Wind Farm,-38.271017,142.140647,2026-02-06T04:30:47.633956
2026/02/06 14:30:00,RYEPARK1,75.62,Rye Park Renewable Energy Pty Ltd as trustee for Rye Park Wind Farm Trust,Rye Park Renewable Energy,Wind,384.0,19.69,Rye Park Renewable Energy,-32.138333,148.972778,2026-02-06T04:30:47.633956
2026/02/06 14:30:00,SALTCRK1,0.28,Salt Creek Wind Farm Pty Ltd,Salt Creek Wind Farm,Wind,54.0,0.52,Salt Creek Wind Farm,-37.95,142.63,2026-02-06T04:30:47.633956
2026/02/06 14:30:00,SAPHWF1,0.0,The Trustee For The SWF1 Operations Trust,Sapphire Wind Farm,Wind,270.0,0.0,Sapphire Wind Farm,-29.7,151.41,2026-02-06T04:30:47.633956
2026/02/06 14:30:00,SNOWNTH1,16.1,Snowtown Wind Farm Stage 2 Pty Ltd,Snowtown Wind Farm Stage 2 North,Wind,144.0,11.18,Snowtown Wind Farm Stage 2 North,-33.83,138.118611,2026-02-06T04:30:47.633956
2026/02/06 14:30:00,SNOWSTH1,16.2,Snowtown Wind Farm Stage 2 Pty Ltd,Snowtown South Wind Farm,Wind,126.0,12.86,Snowtown South Wind Farm,-33.83,138.118611,2026-02-06T04:30:47.633956
2026/02/06 14:30:00,SNOWTWN1,3.17,Snowtown Wind Farm Pty Ltd,Snowtown Wind Farm Units 1 And 47,Wind,99.0,3.2,Snowtown Wind Farm Units 1 And 47,-33.83,138.118611,2026-02-06T04:30:47.633956
2026/02/06 14:30:00,STARHLWF,9.0,Starfish Hill Wind Farm Pty Ltd,Starfish Hill Wind Farm,Wind,35.0,25.71,Starfish Hill Wind Farm,-35.58,138.14,2026-02-06T04:30:47.633956
2026/02/06 14:30:00,STOCKYD1,47.31,Stockyard Hill Wind Farm Pty Ltd,Stockyard Hill Wind Farm,Wind,511.0,9.26,Stockyard Hill Wind Farm,-37.535833,143.251389,2026-02-06T04:30:47.633956
2026/02/06 14:30:00,STWF1,0.0,PARF Company 8 Pty Ltd as The Trustee for Silverton Project Trust,Silverton Wind Farm,Wind,198.0,0.0,Silverton Wind Farm,-37.683168,142.551678,2026-02-06T04:30:47.633956
2026/02/06 14:30:00,TARALGA1,0.0,Taralga Wind Farm Nominees No 2 Pty Ltd (ATF Taralga Wind Farm Operating Trust),Taralga Wind Farm,Wind,106.0,0.0,Taralga Wind Farm,-34.42352,149.826267,2026-02-06T04:30:47.633956
2026/02/06 14:30:00,WAMBOWF1,21.71,Stanwell Corporation Limited,Wambo Wind Farm 1,Wind,245.0,8.86,Wambo Wind Farm 1,-35.187301,149.524945,2026-02-06T04:30:47.633956
2026/02/06 14:30:00,WATERLWF,0.0,Waterloo Wind Farm Pty Ltd,Waterloo Wind Farm,Wind,130.0,0.0,Waterloo Wind Farm,-34.00094,138.911567,2026-02-06T04:30:47.633956
2026/02/06 14:30:00,WGWF1,58.9,Willogoleche Power Pty Ltd As The Trustee For The Willogoleche Operating Trust,Willogoleche Wind Farm,Wind,119.0,49.5,Willogoleche Wind Farm,-33.39,138.85,2026-02-06T04:30:47.633956
2026/02/06 14:30:00,WOODLWN1,38.22,Woodlawn Wind Pty Ltd,Woodlawn Wind Farm,Wind,48.0,79.62,Woodlawn Wind Farm,-35.08,149.62,2026-02-06T04:30:47.633956
2026/02/06 14:30:00,WPWF,54.09,AGL SA Generation Pty Limited,Wattle Point Wind Farm,Wind,91.0,59.44,Wattle Point Wind Farm,-35.111624,137.7219,2026-02-06T04:30:47.633956
2026/02/06 14:30:00,WRWF1,0.0,White Rock Wind Farm Pty Ltd,White Rock Wind Farm,Wind,172.0,0.0,White Rock Wind Farm,-29.79,151.54,2026-02-06T04:30:47.633956
2026/02/06 14:30:00,YENDWF1,9.65,Lal Lal Wind Farms Nom Co Pty Ltd,Yendon Wind Farm,Wind,142.0,6.8,Yendon Wind Farm,-37.629987,144.022717,2026-02-06T04:30:47.633956
