SETTLEMENTDATE,DUID,SCADAVALUE,Participant,Station Name,Fuel Source - Primary,MAX_CAP,utilisation_pct,Plant,Latitude,Longitude,timestamp_utc
2026/03/28 17:30:00,CAPTL_WF,0.0,Iberdrola Australia Holdings Pty Limited,Capital Wind Farm,Wind,140.0,0.0,Capital Wind Farm,-35.1,149.31,2026-03-28T07:26:58.871007
2026/03/28 17:30:00,CHALLHWF,27.9,Pacific Hydro Challicum Hills Pty Ltd,Challicum Hills Wind Farm,Wind,52.0,53.65,Challicum Hills Wind Farm,-37.38,143.11,2026-03-28T07:26:58.871007
2026/03/28 17:30:00,CULLRGWF,0.0,Cullerin Range Wind Farm Pty Ltd,Cullerin Range Wind Farm,Wind,30.0,0.0,Cullerin Range Wind Farm,-34.81,149.4,2026-03-28T07:26:58.871007
2026/03/28 17:30:00,DIAPURWF1,2.3,Y.E.S. Energy (SA) Pty Ltd,Diapur Wind Farm,Wind,7.0,32.86,Diapur Wind Farm,-36.3425,141.43,2026-03-28T07:26:58.871007
2026/03/28 17:30:00,MLWF1,6.86,Mortons Lane Windfarm Pty Limited,Mortons Lane Wind Farm,Wind,20.0,34.3,Mortons Lane Wind Farm,-37.84,142.45,2026-03-28T07:26:58.871007
2026/03/28 17:30:00,WAUBRAWF,88.23,Pyrenees Wind Energy Developments Pty Ltd,Waubra Wind Farm,Wind,192.0,45.95,Waubra Wind Farm,-37.394498,143.638982,2026-03-28T07:26:58.871007
2026/03/28 17:30:00,WOOLNTH1,80.01,Hydro-Electric Corporation,Woolnorth Studland Bay / Bluff Point Wind Farm,Wind,140.0,57.15,Woolnorth Studland Bay / Bluff Point Wind Farm,-40.69,144.72,2026-03-28T07:26:58.871007
2026/03/28 17:30:00,YAMBUKWF,7.8,Energy Pacific (Vic) Pty Ltd,Yambuk Wind Farm,Wind,30.0,26.0,Yambuk Wind Farm,-38.299083,142.027577,2026-03-28T07:26:58.871007
2026/03/28 17:30:00,YSWF1,2.8,Pacific Hydro Yaloak South Pty Ltd,Yaloak South Wind Farm,Wind,28.0,10.0,Yaloak South Wind Farm,-37.7163,144.242853,2026-03-28T07:26:58.871007
2026/03/28 17:30:00,ARWF1,130.3,Ararat Wind Farm Pty Ltd,Ararat Wind Farm,Wind,241.0,54.07,Ararat Wind Farm,-37.232778,143.031389,2026-03-28T07:26:58.871007
2026/03/28 17:30:00,BALDHWF1,37.07,Alinta Energy Retail Sales Pty Ltd,Bald Hills Wind Farm,Wind,106.0,34.97,Bald Hills Wind Farm,-38.79,145.93,2026-03-28T07:26:58.871007
2026/03/28 17:30:00,BANGOWF1,15.7,BWF Nominees Pty Ltd as The Trustee for BWF Trust,Bango 973 Wind Farm,Wind,155.0,10.13,Bango 973 Wind Farm,-34.551582,148.732808,2026-03-28T07:26:58.871007
2026/03/28 17:30:00,BANGOWF2,8.7,BWF Nominees Pty Ltd as The Trustee for BWF Trust,Bango 999 Wind Farm,Wind,82.0,10.61,Bango 999 Wind Farm,-34.551582,148.732808,2026-03-28T07:26:58.871007
2026/03/28 17:30:00,BLUFF1,0.0,AGL SA Generation Pty Limited,The Bluff Wind Farm,Wind,53.0,0.0,The Bluff Wind Farm,-33.367778,138.728611,2026-03-28T07:26:58.871007
2026/03/28 17:30:00,BOCORWF1,55.46,Boco Rock Wind Farm Pty Ltd,Boco Rock Wind Farm,Wind,111.0,49.96,Boco Rock Wind Farm,-36.578611,149.103333,2026-03-28T07:26:58.871007
2026/03/28 17:30:00,BRYB1WF1,127.3,Berrybank Development Pty Ltd,Berrybank Wind Farm,Wind,175.9,72.37,Berrybank Wind Farm,-37.94,143.52,2026-03-28T07:26:58.871007
2026/03/28 17:30:00,BRYB2WF2,77.42,Berrybank 2 Asset Pty Ltd as trustee for Berrybank 2 Asset Trust,Berrybank 2 Wind Farm,Wind,105.0,73.73,Berrybank 2 Wind Farm,-37.94,143.52,2026-03-28T07:26:58.871007
2026/03/28 17:30:00,BULGANA1,76.15,Bulgana Wind Farm Pty Ltd,Bulgana Green Power Hub,Wind,204.0,37.33,Bulgana Green Power Hub,-37.0975,142.973611,2026-03-28T07:26:58.871007
2026/03/28 17:30:00,CATHROCK,11.4,Cathedral Rocks Wind Farm Pty Ltd,Cathedral Rocks,Wind,66.0,17.27,Cathedral Rocks,-34.51,135.35,2026-03-28T07:26:58.871007
2026/03/28 17:30:00,CHYTWF1,20.53,Cherry Tree Wind Farm Pty Ltd as trustee for The Cherry Tree Project trust ,Cherry Tree Wind Farm,Wind,57.0,36.02,Cherry Tree Wind Farm,-37.1,145.26,2026-03-28T07:26:58.871007
2026/03/28 17:30:00,CLEMGPWF,0.65,Pacific Hydro Clements Gap Pty Ltd,Clements Gap Wind Farm,Wind,57.0,1.14,Clements Gap Wind Farm,-33.48,138.1,2026-03-28T07:26:58.871007
2026/03/28 17:30:00,CLRKCWF1,0.0,Stanwell Corporation Limited ,Clarke Creek Wind Farm,Wind,338.0,0.0,Clarke Creek Wind Farm,-22.85,149.45,2026-03-28T07:26:58.871007
2026/03/28 17:30:00,CLRKCWF2,0.0,Stanwell Corporation Limited ,Clarke Creek Wind Farm,Wind,101.0,0.0,Clarke Creek Wind Farm,-22.85,149.45,2026-03-28T07:26:58.871007
2026/03/28 17:30:00,CNUNDAWF,5.31,Canunda Power Pty Ltd,Canunda Wind Farm,Wind,46.0,11.54,Canunda Wind Farm,-37.73,140.39,2026-03-28T07:26:58.871007
2026/03/28 17:30:00,COLWF01,0.0,Collector Wind Farm Pty Ltd,Collector Wind Farm 1,Wind,219.0,0.0,Collector Wind Farm 1,-34.8719,149.3967,2026-03-28T07:26:58.871007
2026/03/28 17:30:00,COOPGWF1,0.0,PARF Company 10 Pty Limited as The Trustee for Coopers Gap Project Trust,Coopers Gap Wind Farm,Wind,440.0,0.0,Coopers Gap Wind Farm,-26.74,151.45,2026-03-28T07:26:58.871007
2026/03/28 17:30:00,CROOKWF2,0.59,Crookwell Development Pty Ltd ,Crookwell 2 Wind Farm,Wind,91.0,0.65,Crookwell 2 Wind Farm,-34.52,149.54,2026-03-28T07:26:58.871007
2026/03/28 17:30:00,CROOKWF3,1.29,Crookwell 3 Development Pty Ltd,Crookwell 3 Wind Farm,Wind,56.0,2.3,Crookwell 3 Wind Farm,-34.52,149.54,2026-03-28T07:26:58.871007
2026/03/28 17:30:00,CROWLWF1,40.92,Pacific Hydro Crowlands Pty Ltd ,Crowlands Wind Farm,Wind,79.0,51.8,Crowlands Wind Farm,-37.13,143.16,2026-03-28T07:26:58.871007
2026/03/28 17:30:00,CRURWF1,0.0,CRWF Nominees Pty Ltd As Trustee For The CRWF Trust,Crudine Ridge Wind Farm,Wind,138.0,0.0,Crudine Ridge Wind Farm,-32.97,149.64,2026-03-28T07:26:58.871007
2026/03/28 17:30:00,CTHLWF1,42.55,Wild Cattle Hill Pty Ltd,Cattle Hill Wind Farm,Wind,144.0,29.55,Cattle Hill Wind Farm,-42.15,146.69,2026-03-28T07:26:58.871007
2026/03/28 17:30:00,DULAWF1,10.7,Dulacca Energy Project Co Pty Ltd,Dulacca Wind Farm,Wind,173.0,6.18,Dulacca Wind Farm,-26.63,149.87,2026-03-28T07:26:58.871007
2026/03/28 17:30:00,DUNDWF1,85.35,Dundonnell Wind Farm Pty Ltd,Dundonnell Wind Farm,Wind,168.0,50.8,Dundonnell Wind Farm,-37.52,142.58,2026-03-28T07:26:58.871007
2026/03/28 17:30:00,DUNDWF2,23.44,Dundonnell Wind Farm Pty Ltd,Dundonnell Wind Farm,Wind,46.0,50.96,Dundonnell Wind Farm,-37.52,142.58,2026-03-28T07:26:58.871007
2026/03/28 17:30:00,DUNDWF3,62.01,Dundonnell Wind Farm Pty Ltd,Dundonnell Wind Farm,Wind,122.0,50.83,Dundonnell Wind Farm,-37.52,142.58,2026-03-28T07:26:58.871007
2026/03/28 17:30:00,ELAINWF1,14.05,Lal Lal Wind Farms Nom Co Pty Ltd,Elaine Wind Farm,Wind,82.0,17.13,Elaine Wind Farm,-37.36,144.0,2026-03-28T07:26:58.871007
2026/03/28 17:30:00,FLYCRKWF,0.0,Iberdrola Australia Energy Markets Pty Limited,Flyers Creek Wind Farm,Wind,140.0,0.0,Flyers Creek Wind Farm,-33.365556,148.981944,2026-03-28T07:26:58.871007
2026/03/28 17:30:00,GPWFEST1,179.49,Golden Plains WF1 Pty Ltd as Trustee for the Golden Plains WF1 Unit Trust,Golden Plains Wind Farm East,Wind,240.0,74.79,Golden Plains Wind Farm East,-37.945091,143.752614,2026-03-28T07:26:58.871007
2026/03/28 17:30:00,GPWFEST2,140.64,Golden Plains WF1 Pty Ltd as Trustee for the Golden Plains WF1 Unit Trust,Golden Plains Wind Farm East,Wind,253.0,55.59,Golden Plains Wind Farm East,-37.945091,143.752614,2026-03-28T07:26:58.871007
2026/03/28 17:30:00,GPWFEST3,148.24,Golden Plains WF1 Pty Ltd as Trustee for the Golden Plains WF1 Unit Trust,Golden Plains Wind Farm East,Wind,240.0,61.77,Golden Plains Wind Farm East,-37.945091,143.752614,2026-03-28T07:26:58.871007
2026/03/28 17:30:00,GRANWF1,24.09,Granville Harbour Operations Pty Ltd as The Trustee for Granville Harbour Operations Trust,Granville Harbour Wind Farm,Wind,111.0,21.7,Granville Harbour Wind Farm,-41.8,145.06,2026-03-28T07:26:58.871007
2026/03/28 17:30:00,GSWF1A,8.99,Goyder Wind Farm 1 Pty Ltd as the Trustee for Goyder Wind Farm 1 Trust,Goyder South Wind Farm 1A,Wind,201.0,4.47,Goyder South Wind Farm 1A,-33.679758,138.937597,2026-03-28T07:26:58.871007
2026/03/28 17:30:00,GSWF1B1,3.08,Goyder Wind Farm 1B Pty Ltd as the Trustee for the Goyder Wind Farm 1B Trust,Goyder South Wind Farm 1B,Wind,196.0,1.57,Goyder South Wind Farm 1B,-33.679758,138.937597,2026-03-28T07:26:58.871007
2026/03/28 17:30:00,GULLRWF1,2.58,New Gullen Range Wind Farm Pty Ltd,Gullen Range Wind Farm,Wind,161.0,1.6,Gullen Range Wind Farm,-34.34,149.27,2026-03-28T07:26:58.871007
2026/03/28 17:30:00,GULLRWF2,3.4,New Gullen Range Wind Farm Pty Ltd,Gullen Range Wind Farm,Wind,107.0,3.18,Gullen Range Wind Farm,-34.34,149.27,2026-03-28T07:26:58.871007
2026/03/28 17:30:00,GUNNING1,0.0,Gunning Wind Energy Developments Pty Ltd,Gunning Wind Farm,Wind,47.0,0.0,Gunning Wind Farm,-34.813333,149.4,2026-03-28T07:26:58.871007
2026/03/28 17:30:00,HALLWF1,0.0,AGL SA Generation Pty Limited,Hallett 1 Wind Farm,Wind,95.0,0.0,Hallett 1 Wind Farm,-33.367778,138.728611,2026-03-28T07:26:58.871007
2026/03/28 17:30:00,HALLWF2,0.0,AGL SA Generation Pty Limited,Hallett 2 Wind Farm,Wind,71.0,0.0,Hallett 2 Wind Farm,-33.367778,138.728611,2026-03-28T07:26:58.871007
2026/03/28 17:30:00,HD1WF1,35.85,Hawkesdale Asset Pty Ltd as trustee for Hawkesdale Asset Trust,Hawkesdale Wind Farm,Wind,89.0,40.28,Hawkesdale Wind Farm,-38.147894,142.361381,2026-03-28T07:26:58.871007
2026/03/28 17:30:00,HDWF1,1.9,HWF1 Pty Ltd,Hornsdale Wind Farm,Wind,102.0,1.86,Hornsdale Wind Farm,-33.050556,138.543611,2026-03-28T07:26:58.871007
2026/03/28 17:30:00,HDWF2,1.6,HWF 2 Pty Ltd,Hornsdale Wind Farm 2,Wind,102.0,1.57,Hornsdale Wind Farm 2,-33.06,138.54,2026-03-28T07:26:58.871007
2026/03/28 17:30:00,HDWF3,3.2,HWF3 Pty Ltd,Hornsdale Wind Farm 3,Wind,109.0,2.94,Hornsdale Wind Farm 3,-33.06,138.54,2026-03-28T07:26:58.871007
2026/03/28 17:30:00,KABANWF1,39.56,Kaban Wind Farm Pty Ltd as trustee for Kaban Wind Farm Trust,Kaban Wind Farm,Wind,152.0,26.03,Kaban Wind Farm,-17.56,145.41,2026-03-28T07:26:58.871007
2026/03/28 17:30:00,KEPWF1,0.1,Kennedy Energy Park Pty Ltd,Kennedy Energy Park,Wind,43.0,0.23,Kennedy Energy Park,-20.88,144.42,2026-03-28T07:26:58.871007
2026/03/28 17:30:00,KIATAWF1,7.4,Kiata ProjectCo Pty Ltd Atf Kiata Project Trust,Kiata Wind Farm,Wind,31.0,23.87,Kiata Wind Farm,-36.4,141.75,2026-03-28T07:26:58.871007
2026/03/28 17:30:00,LGAPWF1,0.29,Lincoln Gap Wind Farm (Operations) Pty Ltd,Lincoln Gap Wind Farm,Wind,123.0,0.24,Lincoln Gap Wind Farm,-32.564279,137.557328,2026-03-28T07:26:58.871007
2026/03/28 17:30:00,LGAPWF1,0.29,Lincoln Gap Wind Farm (Operations) Pty Ltd,Lincoln Gap Wind Farm,Wind,123.0,0.24,Lincoln Gap Wind Farm,-32.564279,137.557328,2026-03-28T07:26:58.871007
2026/03/28 17:30:00,LGAPWF2,3.97,Lincoln Gap Wind Farm (Operations) Pty Ltd,Lincoln Gap Wind Farm,Wind,85.0,4.67,Lincoln Gap Wind Farm,-32.564279,137.557328,2026-03-28T07:26:58.871007
2026/03/28 17:30:00,LGAPWF2,3.97,Lincoln Gap Wind Farm (Operations) Pty Ltd,Lincoln Gap Wind Farm,Wind,85.0,4.67,Lincoln Gap Wind Farm,-32.564279,137.557328,2026-03-28T07:26:58.871007
2026/03/28 17:30:00,LKBONNY1,9.47,Lake Bonney Wind Power Pty Ltd,Lake Bonney Wind Farm Stage 1,Wind,81.0,11.69,Lake Bonney Wind Farm Stage 1,-37.76,140.4,2026-03-28T07:26:58.871007
2026/03/28 17:30:00,LKBONNY2,12.01,Lake Bonney Wind Power Pty Ltd,Lake Bonney Stage 2 Windfarm,Wind,159.0,7.55,Lake Bonney Stage 2 Windfarm,-37.76,140.4,2026-03-28T07:26:58.871007
2026/03/28 17:30:00,LKBONNY3,2.01,Lake Bonney Wind Power Pty Ltd,Lake Bonney Stage 3 Wind Farm,Wind,39.0,5.15,Lake Bonney Stage 3 Wind Farm,-37.737781,140.388137,2026-03-28T07:26:58.871007
2026/03/28 17:30:00,MACARTH1,72.0,AGL Hydro Partnership,Macarthur Wind Farm,Wind,420.0,17.14,Macarthur Wind Farm,-38.048957,142.192112,2026-03-28T07:26:58.871007
2026/03/28 17:30:00,MCINTYR1,15.57,MacIntyre UJV Operator Pty Ltd,MacIntyre Wind Farm,Wind,890.0,1.75,MacIntyre Wind Farm,-28.32,151.54,2026-03-28T07:26:58.871007
2026/03/28 17:30:00,MERCER01,64.0,Mt Mercer Windfarm Pty Ltd,Mt Mercer Wind Farm,Wind,131.0,48.85,Mt Mercer Wind Farm,-37.841111,143.871111,2026-03-28T07:26:58.871007
2026/03/28 17:30:00,MEWF1,44.36,Ergon Energy Queensland Pty Ltd ,Mount Emerald Wind Farm,Wind,178.0,24.92,Mount Emerald Wind Farm,-17.133007,145.380644,2026-03-28T07:26:58.871007
2026/03/28 17:30:00,MRTLSWF1,56.98,Mortlake South Wind Farm Pty Ltd,Mortlake South Wind Farm,Wind,153.0,37.24,Mortlake South Wind Farm,-38.127337,142.857801,2026-03-28T07:26:58.871007
2026/03/28 17:30:00,MTGELWF1,59.18,Mt. Gellibrand Wind Farm Pty Ltd,Mt Gellibrand Wind Farm,Wind,132.0,44.83,Mt Gellibrand Wind Farm,-38.23,143.77,2026-03-28T07:26:58.871007
2026/03/28 17:30:00,MTMILLAR,2.8,Mt Millar Wind Farm Pty Ltd,Mt Millar Wind Farm,Wind,70.0,4.0,Mt Millar Wind Farm,-33.624444,136.703611,2026-03-28T07:26:58.871007
2026/03/28 17:30:00,MUSSELR1,11.4,Hydro-Electric Corporation,Musselroe Wind Farm,Wind,168.0,6.79,Musselroe Wind Farm,-40.780225,148.010799,2026-03-28T07:26:58.871007
2026/03/28 17:30:00,MUWAWF1,76.1,Telstra Energy (Generation) Pty Ltd,Murra Warra Wind Farm,Wind,225.7,33.72,Murra Warra Wind Farm,-36.432404,142.317853,2026-03-28T07:26:58.871007
2026/03/28 17:30:00,MUWAWF2,53.6,Murra Warra II Project Co Pty Ltd ATF The Murra Warra II Project Trust,Murra Warra Wind Farm Stage 2,Wind,203.0,26.4,Murra Warra Wind Farm Stage 2,-36.43,142.32,2026-03-28T07:26:58.871007
2026/03/28 17:30:00,NBHWF1,0.0,AGL SA Generation Pty Limited,North Brown Hill Wind Farm,Wind,132.0,0.0,North Brown Hill Wind Farm,-33.367778,138.728611,2026-03-28T07:26:58.871007
2026/03/28 17:30:00,OAKLAND1,30.9,AGL Hydro Partnership,Oaklands Hill Wind Farm,Wind,63.0,49.05,Oaklands Hill Wind Farm,-37.683078,142.551678,2026-03-28T07:26:58.871007
2026/03/28 17:30:00,PAREPW1,45.31,Iberdrola Australia Energy Markets Pty Limited,Port Augusta Renewable Energy Park,Wind,201.0,22.54,Port Augusta Renewable Energy Park,-32.566944,137.856111,2026-03-28T07:26:58.871007
2026/03/28 17:30:00,RYANCWF1,54.42,Ryan Corner Development Pty Ltd,Ryan Corner Wind Farm,Wind,205.0,26.55,Ryan Corner Wind Farm,-38.271017,142.140647,2026-03-28T07:26:58.871007
2026/03/28 17:30:00,RYEPARK1,26.55,Rye Park Renewable Energy Pty Ltd as trustee for Rye Park Wind Farm Trust,Rye Park Renewable Energy,Wind,384.0,6.91,Rye Park Renewable Energy,-32.138333,148.972778,2026-03-28T07:26:58.871007
2026/03/28 17:30:00,SALTCRK1,16.82,Salt Creek Wind Farm Pty Ltd,Salt Creek Wind Farm,Wind,54.0,31.15,Salt Creek Wind Farm,-37.95,142.63,2026-03-28T07:26:58.871007
2026/03/28 17:30:00,SAPHWF1,29.14,The Trustee For The SWF1 Operations Trust,Sapphire Wind Farm,Wind,270.0,10.79,Sapphire Wind Farm,-29.7,151.41,2026-03-28T07:26:58.871007
2026/03/28 17:30:00,SNOWNTH1,6.9,Snowtown Wind Farm Stage 2 Pty Ltd,Snowtown Wind Farm Stage 2 North,Wind,144.0,4.79,Snowtown Wind Farm Stage 2 North,-33.83,138.118611,2026-03-28T07:26:58.871007
2026/03/28 17:30:00,SNOWSTH1,0.0,Snowtown Wind Farm Stage 2 Pty Ltd,Snowtown South Wind Farm,Wind,126.0,0.0,Snowtown South Wind Farm,-33.83,138.118611,2026-03-28T07:26:58.871007
2026/03/28 17:30:00,SNOWTWN1,0.0,Snowtown Wind Farm Pty Ltd,Snowtown Wind Farm Units 1 And 47,Wind,99.0,0.0,Snowtown Wind Farm Units 1 And 47,-33.83,138.118611,2026-03-28T07:26:58.871007
2026/03/28 17:30:00,STARHLWF,3.2,Starfish Hill Wind Farm Pty Ltd,Starfish Hill Wind Farm,Wind,35.0,9.14,Starfish Hill Wind Farm,-35.58,138.14,2026-03-28T07:26:58.871007
2026/03/28 17:30:00,STOCKYD1,388.26,Stockyard Hill Wind Farm Pty Ltd,Stockyard Hill Wind Farm,Wind,511.0,75.98,Stockyard Hill Wind Farm,-37.535833,143.251389,2026-03-28T07:26:58.871007
2026/03/28 17:30:00,STWF1,56.25,PARF Company 8 Pty Ltd as The Trustee for Silverton Project Trust,Silverton Wind Farm,Wind,198.0,28.41,Silverton Wind Farm,-37.683168,142.551678,2026-03-28T07:26:58.871007
2026/03/28 17:30:00,TARALGA1,2.48,Taralga Wind Farm Nominees No 2 Pty Ltd (ATF Taralga Wind Farm Operating Trust),Taralga Wind Farm,Wind,106.0,2.34,Taralga Wind Farm,-34.42352,149.826267,2026-03-28T07:26:58.871007
2026/03/28 17:30:00,WAMBOWF1,4.51,Stanwell Corporation Limited,Wambo Wind Farm 1,Wind,245.0,1.84,Wambo Wind Farm 1,-35.187301,149.524945,2026-03-28T07:26:58.871007
2026/03/28 17:30:00,WATERLWF,1.7,Waterloo Wind Farm Pty Ltd,Waterloo Wind Farm,Wind,130.0,1.31,Waterloo Wind Farm,-34.00094,138.911567,2026-03-28T07:26:58.871007
2026/03/28 17:30:00,WGWF1,6.8,Willogoleche Power Pty Ltd As The Trustee For The Willogoleche Operating Trust,Willogoleche Wind Farm,Wind,119.0,5.71,Willogoleche Wind Farm,-33.39,138.85,2026-03-28T07:26:58.871007
2026/03/28 17:30:00,WOODLWN1,7.38,Woodlawn Wind Pty Ltd,Woodlawn Wind Farm,Wind,48.0,15.38,Woodlawn Wind Farm,-35.08,149.62,2026-03-28T07:26:58.871007
2026/03/28 17:30:00,WPWF,20.96,AGL SA Generation Pty Limited,Wattle Point Wind Farm,Wind,91.0,23.03,Wattle Point Wind Farm,-35.111624,137.7219,2026-03-28T07:26:58.871007
2026/03/28 17:30:00,WRWF1,24.42,White Rock Wind Farm Pty Ltd,White Rock Wind Farm,Wind,172.0,14.2,White Rock Wind Farm,-29.79,151.54,2026-03-28T07:26:58.871007
2026/03/28 17:30:00,YENDWF1,25.18,Lal Lal Wind Farms Nom Co Pty Ltd,Yendon Wind Farm,Wind,142.0,17.73,Yendon Wind Farm,-37.629987,144.022717,2026-03-28T07:26:58.871007
