SETTLEMENTDATE,DUID,SCADAVALUE,Participant,Station Name,Fuel Source - Primary,MAX_CAP,utilisation_pct,Plant,Latitude,Longitude,timestamp_utc
2026/02/05 04:05:00,CAPTL_WF,0.0,Iberdrola Australia Holdings Pty Limited,Capital Wind Farm,Wind,140.0,0.0,Capital Wind Farm,-35.1,149.31,2026-02-04T18:03:27.030314
2026/02/05 04:05:00,CHALLHWF,7.1,Pacific Hydro Challicum Hills Pty Ltd,Challicum Hills Wind Farm,Wind,52.0,13.65,Challicum Hills Wind Farm,-37.38,143.11,2026-02-04T18:03:27.030314
2026/02/05 04:05:00,CULLRGWF,0.41,Cullerin Range Wind Farm Pty Ltd,Cullerin Range Wind Farm,Wind,30.0,1.37,Cullerin Range Wind Farm,-34.81,149.4,2026-02-04T18:03:27.030314
2026/02/05 04:05:00,DIAPURWF1,6.2,Y.E.S. Energy (SA) Pty Ltd,Diapur Wind Farm,Wind,7.0,88.57,Diapur Wind Farm,-36.3425,141.43,2026-02-04T18:03:27.030314
2026/02/05 04:05:00,MLWF1,1.11,Mortons Lane Windfarm Pty Limited,Mortons Lane Wind Farm,Wind,20.0,5.55,Mortons Lane Wind Farm,-37.84,142.45,2026-02-04T18:03:27.030314
2026/02/05 04:05:00,WAUBRAWF,131.33,Pyrenees Wind Energy Developments Pty Ltd,Waubra Wind Farm,Wind,192.0,68.4,Waubra Wind Farm,-37.394498,143.638982,2026-02-04T18:03:27.030314
2026/02/05 04:05:00,WOOLNTH1,75.94,Hydro-Electric Corporation,Woolnorth Studland Bay / Bluff Point Wind Farm,Wind,140.0,54.24,Woolnorth Studland Bay / Bluff Point Wind Farm,-40.69,144.72,2026-02-04T18:03:27.030314
2026/02/05 04:05:00,YAMBUKWF,9.2,Energy Pacific (Vic) Pty Ltd,Yambuk Wind Farm,Wind,30.0,30.67,Yambuk Wind Farm,-38.299083,142.027577,2026-02-04T18:03:27.030314
2026/02/05 04:05:00,YSWF1,2.3,Pacific Hydro Yaloak South Pty Ltd,Yaloak South Wind Farm,Wind,28.0,8.21,Yaloak South Wind Farm,-37.7163,144.242853,2026-02-04T18:03:27.030314
2026/02/05 04:05:00,ARWF1,156.0,Ararat Wind Farm Pty Ltd,Ararat Wind Farm,Wind,241.0,64.73,Ararat Wind Farm,-37.232778,143.031389,2026-02-04T18:03:27.030314
2026/02/05 04:05:00,BALDHWF1,27.31,Alinta Energy Retail Sales Pty Ltd,Bald Hills Wind Farm,Wind,106.0,25.76,Bald Hills Wind Farm,-38.79,145.93,2026-02-04T18:03:27.030314
2026/02/05 04:05:00,BANGOWF1,2.1,BWF Nominees Pty Ltd as The Trustee for BWF Trust,Bango 973 Wind Farm,Wind,155.0,1.35,Bango 973 Wind Farm,-34.551582,148.732808,2026-02-04T18:03:27.030314
2026/02/05 04:05:00,BANGOWF2,0.6,BWF Nominees Pty Ltd as The Trustee for BWF Trust,Bango 999 Wind Farm,Wind,82.0,0.73,Bango 999 Wind Farm,-34.551582,148.732808,2026-02-04T18:03:27.030314
2026/02/05 04:05:00,BLUFF1,0.0,AGL SA Generation Pty Limited,The Bluff Wind Farm,Wind,53.0,0.0,The Bluff Wind Farm,-33.367778,138.728611,2026-02-04T18:03:27.030314
2026/02/05 04:05:00,BOCORWF1,55.97,Boco Rock Wind Farm Pty Ltd,Boco Rock Wind Farm,Wind,111.0,50.42,Boco Rock Wind Farm,-36.578611,149.103333,2026-02-04T18:03:27.030314
2026/02/05 04:05:00,BRYB1WF1,8.48,Berrybank Development Pty Ltd,Berrybank Wind Farm,Wind,175.9,4.82,Berrybank Wind Farm,-37.94,143.52,2026-02-04T18:03:27.030314
2026/02/05 04:05:00,BRYB2WF2,7.96,Berrybank 2 Asset Pty Ltd as trustee for Berrybank 2 Asset Trust,Berrybank 2 Wind Farm,Wind,105.0,7.58,Berrybank 2 Wind Farm,-37.94,143.52,2026-02-04T18:03:27.030314
2026/02/05 04:05:00,BULGANA1,126.08,Bulgana Wind Farm Pty Ltd,Bulgana Green Power Hub,Wind,204.0,61.8,Bulgana Green Power Hub,-37.0975,142.973611,2026-02-04T18:03:27.030314
2026/02/05 04:05:00,CATHROCK,9.3,Cathedral Rocks Wind Farm Pty Ltd,Cathedral Rocks,Wind,66.0,14.09,Cathedral Rocks,-34.51,135.35,2026-02-04T18:03:27.030314
2026/02/05 04:05:00,CHYTWF1,39.96,Cherry Tree Wind Farm Pty Ltd as trustee for The Cherry Tree Project trust ,Cherry Tree Wind Farm,Wind,57.0,70.11,Cherry Tree Wind Farm,-37.1,145.26,2026-02-04T18:03:27.030314
2026/02/05 04:05:00,CLEMGPWF,14.12,Pacific Hydro Clements Gap Pty Ltd,Clements Gap Wind Farm,Wind,57.0,24.77,Clements Gap Wind Farm,-33.48,138.1,2026-02-04T18:03:27.030314
2026/02/05 04:05:00,CLRKCWF1,275.37,Stanwell Corporation Limited ,Clarke Creek Wind Farm,Wind,338.0,81.47,Clarke Creek Wind Farm,-22.85,149.45,2026-02-04T18:03:27.030314
2026/02/05 04:05:00,CLRKCWF2,99.04,Stanwell Corporation Limited ,Clarke Creek Wind Farm,Wind,101.0,98.06,Clarke Creek Wind Farm,-22.85,149.45,2026-02-04T18:03:27.030314
2026/02/05 04:05:00,CNUNDAWF,10.01,Canunda Power Pty Ltd,Canunda Wind Farm,Wind,46.0,21.76,Canunda Wind Farm,-37.73,140.39,2026-02-04T18:03:27.030314
2026/02/05 04:05:00,COLWF01,0.0,Collector Wind Farm Pty Ltd,Collector Wind Farm 1,Wind,219.0,0.0,Collector Wind Farm 1,-34.8719,149.3967,2026-02-04T18:03:27.030314
2026/02/05 04:05:00,COOPGWF1,273.74,PARF Company 10 Pty Limited as The Trustee for Coopers Gap Project Trust,Coopers Gap Wind Farm,Wind,440.0,62.21,Coopers Gap Wind Farm,-26.74,151.45,2026-02-04T18:03:27.030314
2026/02/05 04:05:00,CROOKWF2,5.12,Crookwell Development Pty Ltd ,Crookwell 2 Wind Farm,Wind,91.0,5.63,Crookwell 2 Wind Farm,-34.52,149.54,2026-02-04T18:03:27.030314
2026/02/05 04:05:00,CROOKWF3,0.76,Crookwell 3 Development Pty Ltd,Crookwell 3 Wind Farm,Wind,56.0,1.36,Crookwell 3 Wind Farm,-34.52,149.54,2026-02-04T18:03:27.030314
2026/02/05 04:05:00,CROWLWF1,38.6,Pacific Hydro Crowlands Pty Ltd ,Crowlands Wind Farm,Wind,79.0,48.86,Crowlands Wind Farm,-37.13,143.16,2026-02-04T18:03:27.030314
2026/02/05 04:05:00,CRURWF1,52.9,CRWF Nominees Pty Ltd As Trustee For The CRWF Trust,Crudine Ridge Wind Farm,Wind,138.0,38.33,Crudine Ridge Wind Farm,-32.97,149.64,2026-02-04T18:03:27.030314
2026/02/05 04:05:00,CTHLWF1,136.71,Wild Cattle Hill Pty Ltd,Cattle Hill Wind Farm,Wind,144.0,94.94,Cattle Hill Wind Farm,-42.15,146.69,2026-02-04T18:03:27.030314
2026/02/05 04:05:00,DULAWF1,93.8,Dulacca Energy Project Co Pty Ltd,Dulacca Wind Farm,Wind,173.0,54.22,Dulacca Wind Farm,-26.63,149.87,2026-02-04T18:03:27.030314
2026/02/05 04:05:00,DUNDWF1,15.06,Dundonnell Wind Farm Pty Ltd,Dundonnell Wind Farm,Wind,168.0,8.96,Dundonnell Wind Farm,-37.52,142.58,2026-02-04T18:03:27.030314
2026/02/05 04:05:00,DUNDWF2,6.95,Dundonnell Wind Farm Pty Ltd,Dundonnell Wind Farm,Wind,46.0,15.11,Dundonnell Wind Farm,-37.52,142.58,2026-02-04T18:03:27.030314
2026/02/05 04:05:00,DUNDWF3,12.74,Dundonnell Wind Farm Pty Ltd,Dundonnell Wind Farm,Wind,122.0,10.44,Dundonnell Wind Farm,-37.52,142.58,2026-02-04T18:03:27.030314
2026/02/05 04:05:00,ELAINWF1,1.08,Lal Lal Wind Farms Nom Co Pty Ltd,Elaine Wind Farm,Wind,82.0,1.32,Elaine Wind Farm,-37.36,144.0,2026-02-04T18:03:27.030314
2026/02/05 04:05:00,FLYCRKWF,34.46,Iberdrola Australia Energy Markets Pty Limited,Flyers Creek Wind Farm,Wind,140.0,24.61,Flyers Creek Wind Farm,-33.365556,148.981944,2026-02-04T18:03:27.030314
2026/02/05 04:05:00,GPWFEST1,35.56,Golden Plains WF1 Pty Ltd as Trustee for the Golden Plains WF1 Unit Trust,Golden Plains Wind Farm East,Wind,240.0,14.82,Golden Plains Wind Farm East,-37.945091,143.752614,2026-02-04T18:03:27.030314
2026/02/05 04:05:00,GPWFEST2,27.87,Golden Plains WF1 Pty Ltd as Trustee for the Golden Plains WF1 Unit Trust,Golden Plains Wind Farm East,Wind,253.0,11.02,Golden Plains Wind Farm East,-37.945091,143.752614,2026-02-04T18:03:27.030314
2026/02/05 04:05:00,GPWFEST3,25.92,Golden Plains WF1 Pty Ltd as Trustee for the Golden Plains WF1 Unit Trust,Golden Plains Wind Farm East,Wind,240.0,10.8,Golden Plains Wind Farm East,-37.945091,143.752614,2026-02-04T18:03:27.030314
2026/02/05 04:05:00,GRANWF1,61.49,Granville Harbour Operations Pty Ltd as The Trustee for Granville Harbour Operations Trust,Granville Harbour Wind Farm,Wind,111.0,55.4,Granville Harbour Wind Farm,-41.8,145.06,2026-02-04T18:03:27.030314
2026/02/05 04:05:00,GSWF1A,13.97,Goyder Wind Farm 1 Pty Ltd as the Trustee for Goyder Wind Farm 1 Trust,Goyder South Wind Farm 1A,Wind,201.0,6.95,Goyder South Wind Farm 1A,-33.679758,138.937597,2026-02-04T18:03:27.030314
2026/02/05 04:05:00,GSWF1B1,3.49,Goyder Wind Farm 1B Pty Ltd as the Trustee for the Goyder Wind Farm 1B Trust,Goyder South Wind Farm 1B,Wind,196.0,1.78,Goyder South Wind Farm 1B,-33.679758,138.937597,2026-02-04T18:03:27.030314
2026/02/05 04:05:00,GULLRWF1,0.23,New Gullen Range Wind Farm Pty Ltd,Gullen Range Wind Farm,Wind,161.0,0.14,Gullen Range Wind Farm,-34.34,149.27,2026-02-04T18:03:27.030314
2026/02/05 04:05:00,GULLRWF2,3.04,New Gullen Range Wind Farm Pty Ltd,Gullen Range Wind Farm,Wind,107.0,2.84,Gullen Range Wind Farm,-34.34,149.27,2026-02-04T18:03:27.030314
2026/02/05 04:05:00,GUNNING1,0.25,Gunning Wind Energy Developments Pty Ltd,Gunning Wind Farm,Wind,47.0,0.53,Gunning Wind Farm,-34.813333,149.4,2026-02-04T18:03:27.030314
2026/02/05 04:05:00,HALLWF1,0.0,AGL SA Generation Pty Limited,Hallett 1 Wind Farm,Wind,95.0,0.0,Hallett 1 Wind Farm,-33.367778,138.728611,2026-02-04T18:03:27.030314
2026/02/05 04:05:00,HALLWF2,0.63,AGL SA Generation Pty Limited,Hallett 2 Wind Farm,Wind,71.0,0.89,Hallett 2 Wind Farm,-33.367778,138.728611,2026-02-04T18:03:27.030314
2026/02/05 04:05:00,HD1WF1,0.0,Hawkesdale Asset Pty Ltd as trustee for Hawkesdale Asset Trust,Hawkesdale Wind Farm,Wind,89.0,0.0,Hawkesdale Wind Farm,-38.147894,142.361381,2026-02-04T18:03:27.030314
2026/02/05 04:05:00,HDWF1,3.2,HWF1 Pty Ltd,Hornsdale Wind Farm,Wind,102.0,3.14,Hornsdale Wind Farm,-33.050556,138.543611,2026-02-04T18:03:27.030314
2026/02/05 04:05:00,HDWF2,1.8,HWF 2 Pty Ltd,Hornsdale Wind Farm 2,Wind,102.0,1.76,Hornsdale Wind Farm 2,-33.06,138.54,2026-02-04T18:03:27.030314
2026/02/05 04:05:00,HDWF3,3.6,HWF3 Pty Ltd,Hornsdale Wind Farm 3,Wind,109.0,3.3,Hornsdale Wind Farm 3,-33.06,138.54,2026-02-04T18:03:27.030314
2026/02/05 04:05:00,KABANWF1,22.72,Kaban Wind Farm Pty Ltd as trustee for Kaban Wind Farm Trust,Kaban Wind Farm,Wind,152.0,14.95,Kaban Wind Farm,-17.56,145.41,2026-02-04T18:03:27.030314
2026/02/05 04:05:00,KEPWF1,26.8,Kennedy Energy Park Pty Ltd,Kennedy Energy Park,Wind,43.0,62.33,Kennedy Energy Park,-20.88,144.42,2026-02-04T18:03:27.030314
2026/02/05 04:05:00,KIATAWF1,25.3,Kiata ProjectCo Pty Ltd Atf Kiata Project Trust,Kiata Wind Farm,Wind,31.0,81.61,Kiata Wind Farm,-36.4,141.75,2026-02-04T18:03:27.030314
2026/02/05 04:05:00,LGAPWF1,38.87,Lincoln Gap Wind Farm (Operations) Pty Ltd,Lincoln Gap Wind Farm,Wind,123.0,31.6,Lincoln Gap Wind Farm,-32.564279,137.557328,2026-02-04T18:03:27.030314
2026/02/05 04:05:00,LGAPWF1,38.87,Lincoln Gap Wind Farm (Operations) Pty Ltd,Lincoln Gap Wind Farm,Wind,123.0,31.6,Lincoln Gap Wind Farm,-32.564279,137.557328,2026-02-04T18:03:27.030314
2026/02/05 04:05:00,LGAPWF2,19.84,Lincoln Gap Wind Farm (Operations) Pty Ltd,Lincoln Gap Wind Farm,Wind,85.0,23.34,Lincoln Gap Wind Farm,-32.564279,137.557328,2026-02-04T18:03:27.030314
2026/02/05 04:05:00,LGAPWF2,19.84,Lincoln Gap Wind Farm (Operations) Pty Ltd,Lincoln Gap Wind Farm,Wind,85.0,23.34,Lincoln Gap Wind Farm,-32.564279,137.557328,2026-02-04T18:03:27.030314
2026/02/05 04:05:00,LKBONNY1,12.15,Lake Bonney Wind Power Pty Ltd,Lake Bonney Wind Farm Stage 1,Wind,81.0,15.0,Lake Bonney Wind Farm Stage 1,-37.76,140.4,2026-02-04T18:03:27.030314
2026/02/05 04:05:00,LKBONNY2,21.64,Lake Bonney Wind Power Pty Ltd,Lake Bonney Stage 2 Windfarm,Wind,159.0,13.61,Lake Bonney Stage 2 Windfarm,-37.76,140.4,2026-02-04T18:03:27.030314
2026/02/05 04:05:00,LKBONNY3,2.74,Lake Bonney Wind Power Pty Ltd,Lake Bonney Stage 3 Wind Farm,Wind,39.0,7.03,Lake Bonney Stage 3 Wind Farm,-37.737781,140.388137,2026-02-04T18:03:27.030314
2026/02/05 04:05:00,MACARTH1,0.0,AGL Hydro Partnership,Macarthur Wind Farm,Wind,420.0,0.0,Macarthur Wind Farm,-38.048957,142.192112,2026-02-04T18:03:27.030314
2026/02/05 04:05:00,MCINTYR1,110.54,MacIntyre UJV Operator Pty Ltd,MacIntyre Wind Farm,Wind,890.0,12.42,MacIntyre Wind Farm,-28.32,151.54,2026-02-04T18:03:27.030314
2026/02/05 04:05:00,MERCER01,11.8,Mt Mercer Windfarm Pty Ltd,Mt Mercer Wind Farm,Wind,131.0,9.01,Mt Mercer Wind Farm,-37.841111,143.871111,2026-02-04T18:03:27.030314
2026/02/05 04:05:00,MEWF1,39.7,Ergon Energy Queensland Pty Ltd ,Mount Emerald Wind Farm,Wind,178.0,22.3,Mount Emerald Wind Farm,-17.133007,145.380644,2026-02-04T18:03:27.030314
2026/02/05 04:05:00,MRTLSWF1,0.13,Mortlake South Wind Farm Pty Ltd,Mortlake South Wind Farm,Wind,153.0,0.08,Mortlake South Wind Farm,-38.127337,142.857801,2026-02-04T18:03:27.030314
2026/02/05 04:05:00,MTGELWF1,4.19,Mt. Gellibrand Wind Farm Pty Ltd,Mt Gellibrand Wind Farm,Wind,132.0,3.17,Mt Gellibrand Wind Farm,-38.23,143.77,2026-02-04T18:03:27.030314
2026/02/05 04:05:00,MTMILLAR,34.5,Mt Millar Wind Farm Pty Ltd,Mt Millar Wind Farm,Wind,70.0,49.29,Mt Millar Wind Farm,-33.624444,136.703611,2026-02-04T18:03:27.030314
2026/02/05 04:05:00,MUSSELR1,150.7,Hydro-Electric Corporation,Musselroe Wind Farm,Wind,168.0,89.7,Musselroe Wind Farm,-40.780225,148.010799,2026-02-04T18:03:27.030314
2026/02/05 04:05:00,MUWAWF1,31.39,Telstra Energy (Generation) Pty Ltd,Murra Warra Wind Farm,Wind,225.7,13.91,Murra Warra Wind Farm,-36.432404,142.317853,2026-02-04T18:03:27.030314
2026/02/05 04:05:00,MUWAWF2,36.5,Murra Warra II Project Co Pty Ltd ATF The Murra Warra II Project Trust,Murra Warra Wind Farm Stage 2,Wind,203.0,17.98,Murra Warra Wind Farm Stage 2,-36.43,142.32,2026-02-04T18:03:27.030314
2026/02/05 04:05:00,NBHWF1,0.0,AGL SA Generation Pty Limited,North Brown Hill Wind Farm,Wind,132.0,0.0,North Brown Hill Wind Farm,-33.367778,138.728611,2026-02-04T18:03:27.030314
2026/02/05 04:05:00,OAKLAND1,4.3,AGL Hydro Partnership,Oaklands Hill Wind Farm,Wind,63.0,6.83,Oaklands Hill Wind Farm,-37.683078,142.551678,2026-02-04T18:03:27.030314
2026/02/05 04:05:00,PAREPW1,66.09,Iberdrola Australia Energy Markets Pty Limited,Port Augusta Renewable Energy Park,Wind,201.0,32.88,Port Augusta Renewable Energy Park,-32.566944,137.856111,2026-02-04T18:03:27.030314
2026/02/05 04:05:00,RYANCWF1,20.37,Ryan Corner Development Pty Ltd,Ryan Corner Wind Farm,Wind,205.0,9.94,Ryan Corner Wind Farm,-38.271017,142.140647,2026-02-04T18:03:27.030314
2026/02/05 04:05:00,RYEPARK1,3.31,Rye Park Renewable Energy Pty Ltd as trustee for Rye Park Wind Farm Trust,Rye Park Renewable Energy,Wind,384.0,0.86,Rye Park Renewable Energy,-32.138333,148.972778,2026-02-04T18:03:27.030314
2026/02/05 04:05:00,SALTCRK1,2.18,Salt Creek Wind Farm Pty Ltd,Salt Creek Wind Farm,Wind,54.0,4.04,Salt Creek Wind Farm,-37.95,142.63,2026-02-04T18:03:27.030314
2026/02/05 04:05:00,SAPHWF1,0.0,The Trustee For The SWF1 Operations Trust,Sapphire Wind Farm,Wind,270.0,0.0,Sapphire Wind Farm,-29.7,151.41,2026-02-04T18:03:27.030314
2026/02/05 04:05:00,SNOWNTH1,25.0,Snowtown Wind Farm Stage 2 Pty Ltd,Snowtown Wind Farm Stage 2 North,Wind,144.0,17.36,Snowtown Wind Farm Stage 2 North,-33.83,138.118611,2026-02-04T18:03:27.030314
2026/02/05 04:05:00,SNOWSTH1,22.4,Snowtown Wind Farm Stage 2 Pty Ltd,Snowtown South Wind Farm,Wind,126.0,17.78,Snowtown South Wind Farm,-33.83,138.118611,2026-02-04T18:03:27.030314
2026/02/05 04:05:00,SNOWTWN1,27.71,Snowtown Wind Farm Pty Ltd,Snowtown Wind Farm Units 1 And 47,Wind,99.0,27.99,Snowtown Wind Farm Units 1 And 47,-33.83,138.118611,2026-02-04T18:03:27.030314
2026/02/05 04:05:00,STARHLWF,15.2,Starfish Hill Wind Farm Pty Ltd,Starfish Hill Wind Farm,Wind,35.0,43.43,Starfish Hill Wind Farm,-35.58,138.14,2026-02-04T18:03:27.030314
2026/02/05 04:05:00,STOCKYD1,66.98,Stockyard Hill Wind Farm Pty Ltd,Stockyard Hill Wind Farm,Wind,511.0,13.11,Stockyard Hill Wind Farm,-37.535833,143.251389,2026-02-04T18:03:27.030314
2026/02/05 04:05:00,STWF1,75.26,PARF Company 8 Pty Ltd as The Trustee for Silverton Project Trust,Silverton Wind Farm,Wind,198.0,38.01,Silverton Wind Farm,-37.683168,142.551678,2026-02-04T18:03:27.030314
2026/02/05 04:05:00,TARALGA1,18.69,Taralga Wind Farm Nominees No 2 Pty Ltd (ATF Taralga Wind Farm Operating Trust),Taralga Wind Farm,Wind,106.0,17.63,Taralga Wind Farm,-34.42352,149.826267,2026-02-04T18:03:27.030314
2026/02/05 04:05:00,WAMBOWF1,66.02,Stanwell Corporation Limited,Wambo Wind Farm 1,Wind,245.0,26.95,Wambo Wind Farm 1,-35.187301,149.524945,2026-02-04T18:03:27.030314
2026/02/05 04:05:00,WATERLWF,7.5,Waterloo Wind Farm Pty Ltd,Waterloo Wind Farm,Wind,130.0,5.77,Waterloo Wind Farm,-34.00094,138.911567,2026-02-04T18:03:27.030314
2026/02/05 04:05:00,WGWF1,0.0,Willogoleche Power Pty Ltd As The Trustee For The Willogoleche Operating Trust,Willogoleche Wind Farm,Wind,119.0,0.0,Willogoleche Wind Farm,-33.39,138.85,2026-02-04T18:03:27.030314
2026/02/05 04:05:00,WOODLWN1,0.0,Woodlawn Wind Pty Ltd,Woodlawn Wind Farm,Wind,48.0,0.0,Woodlawn Wind Farm,-35.08,149.62,2026-02-04T18:03:27.030314
2026/02/05 04:05:00,WPWF,62.01,AGL SA Generation Pty Limited,Wattle Point Wind Farm,Wind,91.0,68.14,Wattle Point Wind Farm,-35.111624,137.7219,2026-02-04T18:03:27.030314
2026/02/05 04:05:00,WRWF1,0.0,White Rock Wind Farm Pty Ltd,White Rock Wind Farm,Wind,172.0,0.0,White Rock Wind Farm,-29.79,151.54,2026-02-04T18:03:27.030314
2026/02/05 04:05:00,YENDWF1,4.82,Lal Lal Wind Farms Nom Co Pty Ltd,Yendon Wind Farm,Wind,142.0,3.39,Yendon Wind Farm,-37.629987,144.022717,2026-02-04T18:03:27.030314
