SETTLEMENTDATE,DUID,SCADAVALUE,Participant,Station Name,Fuel Source - Primary,MAX_CAP,utilisation_pct,Plant,Latitude,Longitude,timestamp_utc
2026/02/26 20:30:00,CAPTL_WF,76.94,Iberdrola Australia Holdings Pty Limited,Capital Wind Farm,Wind,140.0,54.96,Capital Wind Farm,-35.1,149.31,2026-02-26T10:26:42.054576
2026/02/26 20:30:00,CHALLHWF,23.5,Pacific Hydro Challicum Hills Pty Ltd,Challicum Hills Wind Farm,Wind,52.0,45.19,Challicum Hills Wind Farm,-37.38,143.11,2026-02-26T10:26:42.054576
2026/02/26 20:30:00,CULLRGWF,29.98,Cullerin Range Wind Farm Pty Ltd,Cullerin Range Wind Farm,Wind,30.0,99.93,Cullerin Range Wind Farm,-34.81,149.4,2026-02-26T10:26:42.054576
2026/02/26 20:30:00,DIAPURWF1,0.4,Y.E.S. Energy (SA) Pty Ltd,Diapur Wind Farm,Wind,7.0,5.71,Diapur Wind Farm,-36.3425,141.43,2026-02-26T10:26:42.054576
2026/02/26 20:30:00,MLWF1,8.59,Mortons Lane Windfarm Pty Limited,Mortons Lane Wind Farm,Wind,20.0,42.95,Mortons Lane Wind Farm,-37.84,142.45,2026-02-26T10:26:42.054576
2026/02/26 20:30:00,WAUBRAWF,104.12,Pyrenees Wind Energy Developments Pty Ltd,Waubra Wind Farm,Wind,192.0,54.23,Waubra Wind Farm,-37.394498,143.638982,2026-02-26T10:26:42.054576
2026/02/26 20:30:00,WOOLNTH1,25.37,Hydro-Electric Corporation,Woolnorth Studland Bay / Bluff Point Wind Farm,Wind,140.0,18.12,Woolnorth Studland Bay / Bluff Point Wind Farm,-40.69,144.72,2026-02-26T10:26:42.054576
2026/02/26 20:30:00,YAMBUKWF,14.7,Energy Pacific (Vic) Pty Ltd,Yambuk Wind Farm,Wind,30.0,49.0,Yambuk Wind Farm,-38.299083,142.027577,2026-02-26T10:26:42.054576
2026/02/26 20:30:00,YSWF1,3.1,Pacific Hydro Yaloak South Pty Ltd,Yaloak South Wind Farm,Wind,28.0,11.07,Yaloak South Wind Farm,-37.7163,144.242853,2026-02-26T10:26:42.054576
2026/02/26 20:30:00,ARWF1,69.7,Ararat Wind Farm Pty Ltd,Ararat Wind Farm,Wind,241.0,28.92,Ararat Wind Farm,-37.232778,143.031389,2026-02-26T10:26:42.054576
2026/02/26 20:30:00,BALDHWF1,101.86,Alinta Energy Retail Sales Pty Ltd,Bald Hills Wind Farm,Wind,106.0,96.09,Bald Hills Wind Farm,-38.79,145.93,2026-02-26T10:26:42.054576
2026/02/26 20:30:00,BANGOWF1,147.1,BWF Nominees Pty Ltd as The Trustee for BWF Trust,Bango 973 Wind Farm,Wind,155.0,94.9,Bango 973 Wind Farm,-34.551582,148.732808,2026-02-26T10:26:42.054576
2026/02/26 20:30:00,BANGOWF2,81.6,BWF Nominees Pty Ltd as The Trustee for BWF Trust,Bango 999 Wind Farm,Wind,82.0,99.51,Bango 999 Wind Farm,-34.551582,148.732808,2026-02-26T10:26:42.054576
2026/02/26 20:30:00,BLUFF1,12.9,AGL SA Generation Pty Limited,The Bluff Wind Farm,Wind,53.0,24.34,The Bluff Wind Farm,-33.367778,138.728611,2026-02-26T10:26:42.054576
2026/02/26 20:30:00,BOCORWF1,22.58,Boco Rock Wind Farm Pty Ltd,Boco Rock Wind Farm,Wind,111.0,20.34,Boco Rock Wind Farm,-36.578611,149.103333,2026-02-26T10:26:42.054576
2026/02/26 20:30:00,BRYB1WF1,109.2,Berrybank Development Pty Ltd,Berrybank Wind Farm,Wind,175.9,62.08,Berrybank Wind Farm,-37.94,143.52,2026-02-26T10:26:42.054576
2026/02/26 20:30:00,BRYB2WF2,68.97,Berrybank 2 Asset Pty Ltd as trustee for Berrybank 2 Asset Trust,Berrybank 2 Wind Farm,Wind,105.0,65.69,Berrybank 2 Wind Farm,-37.94,143.52,2026-02-26T10:26:42.054576
2026/02/26 20:30:00,BULGANA1,93.88,Bulgana Wind Farm Pty Ltd,Bulgana Green Power Hub,Wind,204.0,46.02,Bulgana Green Power Hub,-37.0975,142.973611,2026-02-26T10:26:42.054576
2026/02/26 20:30:00,CATHROCK,22.0,Cathedral Rocks Wind Farm Pty Ltd,Cathedral Rocks,Wind,66.0,33.33,Cathedral Rocks,-34.51,135.35,2026-02-26T10:26:42.054576
2026/02/26 20:30:00,CHYTWF1,12.91,Cherry Tree Wind Farm Pty Ltd as trustee for The Cherry Tree Project trust ,Cherry Tree Wind Farm,Wind,57.0,22.65,Cherry Tree Wind Farm,-37.1,145.26,2026-02-26T10:26:42.054576
2026/02/26 20:30:00,CLEMGPWF,28.09,Pacific Hydro Clements Gap Pty Ltd,Clements Gap Wind Farm,Wind,57.0,49.28,Clements Gap Wind Farm,-33.48,138.1,2026-02-26T10:26:42.054576
2026/02/26 20:30:00,CLRKCWF1,0.0,Stanwell Corporation Limited ,Clarke Creek Wind Farm,Wind,338.0,0.0,Clarke Creek Wind Farm,-22.85,149.45,2026-02-26T10:26:42.054576
2026/02/26 20:30:00,CLRKCWF2,0.0,Stanwell Corporation Limited ,Clarke Creek Wind Farm,Wind,101.0,0.0,Clarke Creek Wind Farm,-22.85,149.45,2026-02-26T10:26:42.054576
2026/02/26 20:30:00,CNUNDAWF,38.44,Canunda Power Pty Ltd,Canunda Wind Farm,Wind,46.0,83.57,Canunda Wind Farm,-37.73,140.39,2026-02-26T10:26:42.054576
2026/02/26 20:30:00,COLWF01,168.12,Collector Wind Farm Pty Ltd,Collector Wind Farm 1,Wind,219.0,76.77,Collector Wind Farm 1,-34.8719,149.3967,2026-02-26T10:26:42.054576
2026/02/26 20:30:00,COOPGWF1,146.28,PARF Company 10 Pty Limited as The Trustee for Coopers Gap Project Trust,Coopers Gap Wind Farm,Wind,440.0,33.25,Coopers Gap Wind Farm,-26.74,151.45,2026-02-26T10:26:42.054576
2026/02/26 20:30:00,CROOKWF2,43.05,Crookwell Development Pty Ltd ,Crookwell 2 Wind Farm,Wind,91.0,47.31,Crookwell 2 Wind Farm,-34.52,149.54,2026-02-26T10:26:42.054576
2026/02/26 20:30:00,CROOKWF3,22.82,Crookwell 3 Development Pty Ltd,Crookwell 3 Wind Farm,Wind,56.0,40.75,Crookwell 3 Wind Farm,-34.52,149.54,2026-02-26T10:26:42.054576
2026/02/26 20:30:00,CROWLWF1,34.0,Pacific Hydro Crowlands Pty Ltd ,Crowlands Wind Farm,Wind,79.0,43.04,Crowlands Wind Farm,-37.13,143.16,2026-02-26T10:26:42.054576
2026/02/26 20:30:00,CRURWF1,88.3,CRWF Nominees Pty Ltd As Trustee For The CRWF Trust,Crudine Ridge Wind Farm,Wind,138.0,63.99,Crudine Ridge Wind Farm,-32.97,149.64,2026-02-26T10:26:42.054576
2026/02/26 20:30:00,CTHLWF1,0.0,Wild Cattle Hill Pty Ltd,Cattle Hill Wind Farm,Wind,144.0,0.0,Cattle Hill Wind Farm,-42.15,146.69,2026-02-26T10:26:42.054576
2026/02/26 20:30:00,DULAWF1,160.1,Dulacca Energy Project Co Pty Ltd,Dulacca Wind Farm,Wind,173.0,92.54,Dulacca Wind Farm,-26.63,149.87,2026-02-26T10:26:42.054576
2026/02/26 20:30:00,DUNDWF1,88.31,Dundonnell Wind Farm Pty Ltd,Dundonnell Wind Farm,Wind,168.0,52.57,Dundonnell Wind Farm,-37.52,142.58,2026-02-26T10:26:42.054576
2026/02/26 20:30:00,DUNDWF2,21.24,Dundonnell Wind Farm Pty Ltd,Dundonnell Wind Farm,Wind,46.0,46.17,Dundonnell Wind Farm,-37.52,142.58,2026-02-26T10:26:42.054576
2026/02/26 20:30:00,DUNDWF3,77.47,Dundonnell Wind Farm Pty Ltd,Dundonnell Wind Farm,Wind,122.0,63.5,Dundonnell Wind Farm,-37.52,142.58,2026-02-26T10:26:42.054576
2026/02/26 20:30:00,ELAINWF1,31.89,Lal Lal Wind Farms Nom Co Pty Ltd,Elaine Wind Farm,Wind,82.0,38.89,Elaine Wind Farm,-37.36,144.0,2026-02-26T10:26:42.054576
2026/02/26 20:30:00,FLYCRKWF,75.24,Iberdrola Australia Energy Markets Pty Limited,Flyers Creek Wind Farm,Wind,140.0,53.74,Flyers Creek Wind Farm,-33.365556,148.981944,2026-02-26T10:26:42.054576
2026/02/26 20:30:00,GPWFEST1,128.39,Golden Plains WF1 Pty Ltd as Trustee for the Golden Plains WF1 Unit Trust,Golden Plains Wind Farm East,Wind,240.0,53.5,Golden Plains Wind Farm East,-37.945091,143.752614,2026-02-26T10:26:42.054576
2026/02/26 20:30:00,GPWFEST2,121.5,Golden Plains WF1 Pty Ltd as Trustee for the Golden Plains WF1 Unit Trust,Golden Plains Wind Farm East,Wind,253.0,48.02,Golden Plains Wind Farm East,-37.945091,143.752614,2026-02-26T10:26:42.054576
2026/02/26 20:30:00,GPWFEST3,111.33,Golden Plains WF1 Pty Ltd as Trustee for the Golden Plains WF1 Unit Trust,Golden Plains Wind Farm East,Wind,240.0,46.39,Golden Plains Wind Farm East,-37.945091,143.752614,2026-02-26T10:26:42.054576
2026/02/26 20:30:00,GRANWF1,30.41,Granville Harbour Operations Pty Ltd as The Trustee for Granville Harbour Operations Trust,Granville Harbour Wind Farm,Wind,111.0,27.4,Granville Harbour Wind Farm,-41.8,145.06,2026-02-26T10:26:42.054576
2026/02/26 20:30:00,GSWF1A,135.81,Goyder Wind Farm 1 Pty Ltd as the Trustee for Goyder Wind Farm 1 Trust,Goyder South Wind Farm 1A,Wind,201.0,67.57,Goyder South Wind Farm 1A,-33.679758,138.937597,2026-02-26T10:26:42.054576
2026/02/26 20:30:00,GSWF1B1,114.73,Goyder Wind Farm 1B Pty Ltd as the Trustee for the Goyder Wind Farm 1B Trust,Goyder South Wind Farm 1B,Wind,196.0,58.54,Goyder South Wind Farm 1B,-33.679758,138.937597,2026-02-26T10:26:42.054576
2026/02/26 20:30:00,GULLRWF1,123.21,New Gullen Range Wind Farm Pty Ltd,Gullen Range Wind Farm,Wind,161.0,76.53,Gullen Range Wind Farm,-34.34,149.27,2026-02-26T10:26:42.054576
2026/02/26 20:30:00,GULLRWF2,108.34,New Gullen Range Wind Farm Pty Ltd,Gullen Range Wind Farm,Wind,107.0,101.25,Gullen Range Wind Farm,-34.34,149.27,2026-02-26T10:26:42.054576
2026/02/26 20:30:00,GUNNING1,41.21,Gunning Wind Energy Developments Pty Ltd,Gunning Wind Farm,Wind,47.0,87.68,Gunning Wind Farm,-34.813333,149.4,2026-02-26T10:26:42.054576
2026/02/26 20:30:00,HALLWF1,38.84,AGL SA Generation Pty Limited,Hallett 1 Wind Farm,Wind,95.0,40.88,Hallett 1 Wind Farm,-33.367778,138.728611,2026-02-26T10:26:42.054576
2026/02/26 20:30:00,HALLWF2,53.09,AGL SA Generation Pty Limited,Hallett 2 Wind Farm,Wind,71.0,74.77,Hallett 2 Wind Farm,-33.367778,138.728611,2026-02-26T10:26:42.054576
2026/02/26 20:30:00,HD1WF1,44.15,Hawkesdale Asset Pty Ltd as trustee for Hawkesdale Asset Trust,Hawkesdale Wind Farm,Wind,89.0,49.61,Hawkesdale Wind Farm,-38.147894,142.361381,2026-02-26T10:26:42.054576
2026/02/26 20:30:00,HDWF1,26.4,HWF1 Pty Ltd,Hornsdale Wind Farm,Wind,102.0,25.88,Hornsdale Wind Farm,-33.050556,138.543611,2026-02-26T10:26:42.054576
2026/02/26 20:30:00,HDWF2,14.0,HWF 2 Pty Ltd,Hornsdale Wind Farm 2,Wind,102.0,13.73,Hornsdale Wind Farm 2,-33.06,138.54,2026-02-26T10:26:42.054576
2026/02/26 20:30:00,HDWF3,24.8,HWF3 Pty Ltd,Hornsdale Wind Farm 3,Wind,109.0,22.75,Hornsdale Wind Farm 3,-33.06,138.54,2026-02-26T10:26:42.054576
2026/02/26 20:30:00,KABANWF1,37.25,Kaban Wind Farm Pty Ltd as trustee for Kaban Wind Farm Trust,Kaban Wind Farm,Wind,152.0,24.51,Kaban Wind Farm,-17.56,145.41,2026-02-26T10:26:42.054576
2026/02/26 20:30:00,KEPWF1,25.1,Kennedy Energy Park Pty Ltd,Kennedy Energy Park,Wind,43.0,58.37,Kennedy Energy Park,-20.88,144.42,2026-02-26T10:26:42.054576
2026/02/26 20:30:00,KIATAWF1,1.5,Kiata ProjectCo Pty Ltd Atf Kiata Project Trust,Kiata Wind Farm,Wind,31.0,4.84,Kiata Wind Farm,-36.4,141.75,2026-02-26T10:26:42.054576
2026/02/26 20:30:00,LGAPWF1,0.0,Lincoln Gap Wind Farm (Operations) Pty Ltd,Lincoln Gap Wind Farm,Wind,123.0,0.0,Lincoln Gap Wind Farm,-32.564279,137.557328,2026-02-26T10:26:42.054576
2026/02/26 20:30:00,LGAPWF1,0.0,Lincoln Gap Wind Farm (Operations) Pty Ltd,Lincoln Gap Wind Farm,Wind,123.0,0.0,Lincoln Gap Wind Farm,-32.564279,137.557328,2026-02-26T10:26:42.054576
2026/02/26 20:30:00,LGAPWF2,0.0,Lincoln Gap Wind Farm (Operations) Pty Ltd,Lincoln Gap Wind Farm,Wind,85.0,0.0,Lincoln Gap Wind Farm,-32.564279,137.557328,2026-02-26T10:26:42.054576
2026/02/26 20:30:00,LGAPWF2,0.0,Lincoln Gap Wind Farm (Operations) Pty Ltd,Lincoln Gap Wind Farm,Wind,85.0,0.0,Lincoln Gap Wind Farm,-32.564279,137.557328,2026-02-26T10:26:42.054576
2026/02/26 20:30:00,LKBONNY1,36.17,Lake Bonney Wind Power Pty Ltd,Lake Bonney Wind Farm Stage 1,Wind,81.0,44.65,Lake Bonney Wind Farm Stage 1,-37.76,140.4,2026-02-26T10:26:42.054576
2026/02/26 20:30:00,LKBONNY2,106.67,Lake Bonney Wind Power Pty Ltd,Lake Bonney Stage 2 Windfarm,Wind,159.0,67.09,Lake Bonney Stage 2 Windfarm,-37.76,140.4,2026-02-26T10:26:42.054576
2026/02/26 20:30:00,LKBONNY3,20.71,Lake Bonney Wind Power Pty Ltd,Lake Bonney Stage 3 Wind Farm,Wind,39.0,53.1,Lake Bonney Stage 3 Wind Farm,-37.737781,140.388137,2026-02-26T10:26:42.054576
2026/02/26 20:30:00,MACARTH1,144.1,AGL Hydro Partnership,Macarthur Wind Farm,Wind,420.0,34.31,Macarthur Wind Farm,-38.048957,142.192112,2026-02-26T10:26:42.054576
2026/02/26 20:30:00,MCINTYR1,356.65,MacIntyre UJV Operator Pty Ltd,MacIntyre Wind Farm,Wind,890.0,40.07,MacIntyre Wind Farm,-28.32,151.54,2026-02-26T10:26:42.054576
2026/02/26 20:30:00,MERCER01,45.8,Mt Mercer Windfarm Pty Ltd,Mt Mercer Wind Farm,Wind,131.0,34.96,Mt Mercer Wind Farm,-37.841111,143.871111,2026-02-26T10:26:42.054576
2026/02/26 20:30:00,MEWF1,49.48,Ergon Energy Queensland Pty Ltd ,Mount Emerald Wind Farm,Wind,178.0,27.8,Mount Emerald Wind Farm,-17.133007,145.380644,2026-02-26T10:26:42.054576
2026/02/26 20:30:00,MRTLSWF1,43.93,Mortlake South Wind Farm Pty Ltd,Mortlake South Wind Farm,Wind,153.0,28.71,Mortlake South Wind Farm,-38.127337,142.857801,2026-02-26T10:26:42.054576
2026/02/26 20:30:00,MTGELWF1,99.76,Mt. Gellibrand Wind Farm Pty Ltd,Mt Gellibrand Wind Farm,Wind,132.0,75.58,Mt Gellibrand Wind Farm,-38.23,143.77,2026-02-26T10:26:42.054576
2026/02/26 20:30:00,MTMILLAR,6.2,Mt Millar Wind Farm Pty Ltd,Mt Millar Wind Farm,Wind,70.0,8.86,Mt Millar Wind Farm,-33.624444,136.703611,2026-02-26T10:26:42.054576
2026/02/26 20:30:00,MUSSELR1,55.5,Hydro-Electric Corporation,Musselroe Wind Farm,Wind,168.0,33.04,Musselroe Wind Farm,-40.780225,148.010799,2026-02-26T10:26:42.054576
2026/02/26 20:30:00,MUWAWF1,38.96,Telstra Energy (Generation) Pty Ltd,Murra Warra Wind Farm,Wind,225.7,17.26,Murra Warra Wind Farm,-36.432404,142.317853,2026-02-26T10:26:42.054576
2026/02/26 20:30:00,MUWAWF2,38.7,Murra Warra II Project Co Pty Ltd ATF The Murra Warra II Project Trust,Murra Warra Wind Farm Stage 2,Wind,203.0,19.06,Murra Warra Wind Farm Stage 2,-36.43,142.32,2026-02-26T10:26:42.054576
2026/02/26 20:30:00,NBHWF1,32.8,AGL SA Generation Pty Limited,North Brown Hill Wind Farm,Wind,132.0,24.85,North Brown Hill Wind Farm,-33.367778,138.728611,2026-02-26T10:26:42.054576
2026/02/26 20:30:00,OAKLAND1,27.0,AGL Hydro Partnership,Oaklands Hill Wind Farm,Wind,63.0,42.86,Oaklands Hill Wind Farm,-37.683078,142.551678,2026-02-26T10:26:42.054576
2026/02/26 20:30:00,PAREPW1,16.37,Iberdrola Australia Energy Markets Pty Limited,Port Augusta Renewable Energy Park,Wind,201.0,8.14,Port Augusta Renewable Energy Park,-32.566944,137.856111,2026-02-26T10:26:42.054576
2026/02/26 20:30:00,RYANCWF1,149.61,Ryan Corner Development Pty Ltd,Ryan Corner Wind Farm,Wind,205.0,72.98,Ryan Corner Wind Farm,-38.271017,142.140647,2026-02-26T10:26:42.054576
2026/02/26 20:30:00,RYEPARK1,361.15,Rye Park Renewable Energy Pty Ltd as trustee for Rye Park Wind Farm Trust,Rye Park Renewable Energy,Wind,384.0,94.05,Rye Park Renewable Energy,-32.138333,148.972778,2026-02-26T10:26:42.054576
2026/02/26 20:30:00,SALTCRK1,29.07,Salt Creek Wind Farm Pty Ltd,Salt Creek Wind Farm,Wind,54.0,53.83,Salt Creek Wind Farm,-37.95,142.63,2026-02-26T10:26:42.054576
2026/02/26 20:30:00,SAPHWF1,197.93,The Trustee For The SWF1 Operations Trust,Sapphire Wind Farm,Wind,270.0,73.31,Sapphire Wind Farm,-29.7,151.41,2026-02-26T10:26:42.054576
2026/02/26 20:30:00,SNOWNTH1,36.3,Snowtown Wind Farm Stage 2 Pty Ltd,Snowtown Wind Farm Stage 2 North,Wind,144.0,25.21,Snowtown Wind Farm Stage 2 North,-33.83,138.118611,2026-02-26T10:26:42.054576
2026/02/26 20:30:00,SNOWSTH1,41.2,Snowtown Wind Farm Stage 2 Pty Ltd,Snowtown South Wind Farm,Wind,126.0,32.7,Snowtown South Wind Farm,-33.83,138.118611,2026-02-26T10:26:42.054576
2026/02/26 20:30:00,SNOWTWN1,27.74,Snowtown Wind Farm Pty Ltd,Snowtown Wind Farm Units 1 And 47,Wind,99.0,28.02,Snowtown Wind Farm Units 1 And 47,-33.83,138.118611,2026-02-26T10:26:42.054576
2026/02/26 20:30:00,STARHLWF,25.69,Starfish Hill Wind Farm Pty Ltd,Starfish Hill Wind Farm,Wind,35.0,73.4,Starfish Hill Wind Farm,-35.58,138.14,2026-02-26T10:26:42.054576
2026/02/26 20:30:00,STOCKYD1,278.83,Stockyard Hill Wind Farm Pty Ltd,Stockyard Hill Wind Farm,Wind,511.0,54.57,Stockyard Hill Wind Farm,-37.535833,143.251389,2026-02-26T10:26:42.054576
2026/02/26 20:30:00,STWF1,6.29,PARF Company 8 Pty Ltd as The Trustee for Silverton Project Trust,Silverton Wind Farm,Wind,198.0,3.18,Silverton Wind Farm,-37.683168,142.551678,2026-02-26T10:26:42.054576
2026/02/26 20:30:00,TARALGA1,64.35,Taralga Wind Farm Nominees No 2 Pty Ltd (ATF Taralga Wind Farm Operating Trust),Taralga Wind Farm,Wind,106.0,60.71,Taralga Wind Farm,-34.42352,149.826267,2026-02-26T10:26:42.054576
2026/02/26 20:30:00,WAMBOWF1,43.33,Stanwell Corporation Limited,Wambo Wind Farm 1,Wind,245.0,17.69,Wambo Wind Farm 1,-35.187301,149.524945,2026-02-26T10:26:42.054576
2026/02/26 20:30:00,WATERLWF,39.7,Waterloo Wind Farm Pty Ltd,Waterloo Wind Farm,Wind,130.0,30.54,Waterloo Wind Farm,-34.00094,138.911567,2026-02-26T10:26:42.054576
2026/02/26 20:30:00,WGWF1,54.1,Willogoleche Power Pty Ltd As The Trustee For The Willogoleche Operating Trust,Willogoleche Wind Farm,Wind,119.0,45.46,Willogoleche Wind Farm,-33.39,138.85,2026-02-26T10:26:42.054576
2026/02/26 20:30:00,WOODLWN1,39.63,Woodlawn Wind Pty Ltd,Woodlawn Wind Farm,Wind,48.0,82.56,Woodlawn Wind Farm,-35.08,149.62,2026-02-26T10:26:42.054576
2026/02/26 20:30:00,WPWF,58.01,AGL SA Generation Pty Limited,Wattle Point Wind Farm,Wind,91.0,63.75,Wattle Point Wind Farm,-35.111624,137.7219,2026-02-26T10:26:42.054576
2026/02/26 20:30:00,WRWF1,140.3,White Rock Wind Farm Pty Ltd,White Rock Wind Farm,Wind,172.0,81.57,White Rock Wind Farm,-29.79,151.54,2026-02-26T10:26:42.054576
2026/02/26 20:30:00,YENDWF1,36.65,Lal Lal Wind Farms Nom Co Pty Ltd,Yendon Wind Farm,Wind,142.0,25.81,Yendon Wind Farm,-37.629987,144.022717,2026-02-26T10:26:42.054576
