SETTLEMENTDATE,DUID,SCADAVALUE,Participant,Station Name,Fuel Source - Primary,MAX_CAP,utilisation_pct,Plant,Latitude,Longitude,timestamp_utc
2026/03/13 19:00:00,CAPTL_WF,94.5,Iberdrola Australia Holdings Pty Limited,Capital Wind Farm,Wind,140.0,67.5,Capital Wind Farm,-35.1,149.31,2026-03-13T08:58:39.586184
2026/03/13 19:00:00,CHALLHWF,20.9,Pacific Hydro Challicum Hills Pty Ltd,Challicum Hills Wind Farm,Wind,52.0,40.19,Challicum Hills Wind Farm,-37.38,143.11,2026-03-13T08:58:39.586184
2026/03/13 19:00:00,CULLRGWF,26.03,Cullerin Range Wind Farm Pty Ltd,Cullerin Range Wind Farm,Wind,30.0,86.77,Cullerin Range Wind Farm,-34.81,149.4,2026-03-13T08:58:39.586184
2026/03/13 19:00:00,DIAPURWF1,2.3,Y.E.S. Energy (SA) Pty Ltd,Diapur Wind Farm,Wind,7.0,32.86,Diapur Wind Farm,-36.3425,141.43,2026-03-13T08:58:39.586184
2026/03/13 19:00:00,MLWF1,9.49,Mortons Lane Windfarm Pty Limited,Mortons Lane Wind Farm,Wind,20.0,47.45,Mortons Lane Wind Farm,-37.84,142.45,2026-03-13T08:58:39.586184
2026/03/13 19:00:00,WAUBRAWF,108.0,Pyrenees Wind Energy Developments Pty Ltd,Waubra Wind Farm,Wind,192.0,56.25,Waubra Wind Farm,-37.394498,143.638982,2026-03-13T08:58:39.586184
2026/03/13 19:00:00,WOOLNTH1,39.54,Hydro-Electric Corporation,Woolnorth Studland Bay / Bluff Point Wind Farm,Wind,140.0,28.24,Woolnorth Studland Bay / Bluff Point Wind Farm,-40.69,144.72,2026-03-13T08:58:39.586184
2026/03/13 19:00:00,YAMBUKWF,3.5,Energy Pacific (Vic) Pty Ltd,Yambuk Wind Farm,Wind,30.0,11.67,Yambuk Wind Farm,-38.299083,142.027577,2026-03-13T08:58:39.586184
2026/03/13 19:00:00,YSWF1,3.2,Pacific Hydro Yaloak South Pty Ltd,Yaloak South Wind Farm,Wind,28.0,11.43,Yaloak South Wind Farm,-37.7163,144.242853,2026-03-13T08:58:39.586184
2026/03/13 19:00:00,ARWF1,0.0,Ararat Wind Farm Pty Ltd,Ararat Wind Farm,Wind,241.0,0.0,Ararat Wind Farm,-37.232778,143.031389,2026-03-13T08:58:39.586184
2026/03/13 19:00:00,BALDHWF1,3.73,Alinta Energy Retail Sales Pty Ltd,Bald Hills Wind Farm,Wind,106.0,3.52,Bald Hills Wind Farm,-38.79,145.93,2026-03-13T08:58:39.586184
2026/03/13 19:00:00,BANGOWF1,98.5,BWF Nominees Pty Ltd as The Trustee for BWF Trust,Bango 973 Wind Farm,Wind,155.0,63.55,Bango 973 Wind Farm,-34.551582,148.732808,2026-03-13T08:58:39.586184
2026/03/13 19:00:00,BANGOWF2,57.2,BWF Nominees Pty Ltd as The Trustee for BWF Trust,Bango 999 Wind Farm,Wind,82.0,69.76,Bango 999 Wind Farm,-34.551582,148.732808,2026-03-13T08:58:39.586184
2026/03/13 19:00:00,BLUFF1,28.0,AGL SA Generation Pty Limited,The Bluff Wind Farm,Wind,53.0,52.83,The Bluff Wind Farm,-33.367778,138.728611,2026-03-13T08:58:39.586184
2026/03/13 19:00:00,BOCORWF1,10.4,Boco Rock Wind Farm Pty Ltd,Boco Rock Wind Farm,Wind,111.0,9.37,Boco Rock Wind Farm,-36.578611,149.103333,2026-03-13T08:58:39.586184
2026/03/13 19:00:00,BRYB1WF1,54.88,Berrybank Development Pty Ltd,Berrybank Wind Farm,Wind,175.9,31.2,Berrybank Wind Farm,-37.94,143.52,2026-03-13T08:58:39.586184
2026/03/13 19:00:00,BRYB2WF2,32.92,Berrybank 2 Asset Pty Ltd as trustee for Berrybank 2 Asset Trust,Berrybank 2 Wind Farm,Wind,105.0,31.35,Berrybank 2 Wind Farm,-37.94,143.52,2026-03-13T08:58:39.586184
2026/03/13 19:00:00,BULGANA1,92.8,Bulgana Wind Farm Pty Ltd,Bulgana Green Power Hub,Wind,204.0,45.49,Bulgana Green Power Hub,-37.0975,142.973611,2026-03-13T08:58:39.586184
2026/03/13 19:00:00,CATHROCK,30.8,Cathedral Rocks Wind Farm Pty Ltd,Cathedral Rocks,Wind,66.0,46.67,Cathedral Rocks,-34.51,135.35,2026-03-13T08:58:39.586184
2026/03/13 19:00:00,CHYTWF1,46.42,Cherry Tree Wind Farm Pty Ltd as trustee for The Cherry Tree Project trust ,Cherry Tree Wind Farm,Wind,57.0,81.44,Cherry Tree Wind Farm,-37.1,145.26,2026-03-13T08:58:39.586184
2026/03/13 19:00:00,CLEMGPWF,37.31,Pacific Hydro Clements Gap Pty Ltd,Clements Gap Wind Farm,Wind,57.0,65.46,Clements Gap Wind Farm,-33.48,138.1,2026-03-13T08:58:39.586184
2026/03/13 19:00:00,CLRKCWF1,172.6,Stanwell Corporation Limited ,Clarke Creek Wind Farm,Wind,338.0,51.07,Clarke Creek Wind Farm,-22.85,149.45,2026-03-13T08:58:39.586184
2026/03/13 19:00:00,CLRKCWF2,24.59,Stanwell Corporation Limited ,Clarke Creek Wind Farm,Wind,101.0,24.35,Clarke Creek Wind Farm,-22.85,149.45,2026-03-13T08:58:39.586184
2026/03/13 19:00:00,CNUNDAWF,17.82,Canunda Power Pty Ltd,Canunda Wind Farm,Wind,46.0,38.74,Canunda Wind Farm,-37.73,140.39,2026-03-13T08:58:39.586184
2026/03/13 19:00:00,COLWF01,133.49,Collector Wind Farm Pty Ltd,Collector Wind Farm 1,Wind,219.0,60.95,Collector Wind Farm 1,-34.8719,149.3967,2026-03-13T08:58:39.586184
2026/03/13 19:00:00,COOPGWF1,324.33,PARF Company 10 Pty Limited as The Trustee for Coopers Gap Project Trust,Coopers Gap Wind Farm,Wind,440.0,73.71,Coopers Gap Wind Farm,-26.74,151.45,2026-03-13T08:58:39.586184
2026/03/13 19:00:00,CROOKWF2,48.22,Crookwell Development Pty Ltd ,Crookwell 2 Wind Farm,Wind,91.0,52.99,Crookwell 2 Wind Farm,-34.52,149.54,2026-03-13T08:58:39.586184
2026/03/13 19:00:00,CROOKWF3,30.76,Crookwell 3 Development Pty Ltd,Crookwell 3 Wind Farm,Wind,56.0,54.93,Crookwell 3 Wind Farm,-34.52,149.54,2026-03-13T08:58:39.586184
2026/03/13 19:00:00,CROWLWF1,36.21,Pacific Hydro Crowlands Pty Ltd ,Crowlands Wind Farm,Wind,79.0,45.84,Crowlands Wind Farm,-37.13,143.16,2026-03-13T08:58:39.586184
2026/03/13 19:00:00,CRURWF1,117.6,CRWF Nominees Pty Ltd As Trustee For The CRWF Trust,Crudine Ridge Wind Farm,Wind,138.0,85.22,Crudine Ridge Wind Farm,-32.97,149.64,2026-03-13T08:58:39.586184
2026/03/13 19:00:00,CTHLWF1,58.08,Wild Cattle Hill Pty Ltd,Cattle Hill Wind Farm,Wind,144.0,40.33,Cattle Hill Wind Farm,-42.15,146.69,2026-03-13T08:58:39.586184
2026/03/13 19:00:00,DULAWF1,1.4,Dulacca Energy Project Co Pty Ltd,Dulacca Wind Farm,Wind,173.0,0.81,Dulacca Wind Farm,-26.63,149.87,2026-03-13T08:58:39.586184
2026/03/13 19:00:00,DUNDWF1,84.0,Dundonnell Wind Farm Pty Ltd,Dundonnell Wind Farm,Wind,168.0,50.0,Dundonnell Wind Farm,-37.52,142.58,2026-03-13T08:58:39.586184
2026/03/13 19:00:00,DUNDWF2,23.11,Dundonnell Wind Farm Pty Ltd,Dundonnell Wind Farm,Wind,46.0,50.24,Dundonnell Wind Farm,-37.52,142.58,2026-03-13T08:58:39.586184
2026/03/13 19:00:00,DUNDWF3,60.82,Dundonnell Wind Farm Pty Ltd,Dundonnell Wind Farm,Wind,122.0,49.85,Dundonnell Wind Farm,-37.52,142.58,2026-03-13T08:58:39.586184
2026/03/13 19:00:00,ELAINWF1,15.15,Lal Lal Wind Farms Nom Co Pty Ltd,Elaine Wind Farm,Wind,82.0,18.48,Elaine Wind Farm,-37.36,144.0,2026-03-13T08:58:39.586184
2026/03/13 19:00:00,FLYCRKWF,79.66,Iberdrola Australia Energy Markets Pty Limited,Flyers Creek Wind Farm,Wind,140.0,56.9,Flyers Creek Wind Farm,-33.365556,148.981944,2026-03-13T08:58:39.586184
2026/03/13 19:00:00,GPWFEST1,67.13,Golden Plains WF1 Pty Ltd as Trustee for the Golden Plains WF1 Unit Trust,Golden Plains Wind Farm East,Wind,240.0,27.97,Golden Plains Wind Farm East,-37.945091,143.752614,2026-03-13T08:58:39.586184
2026/03/13 19:00:00,GPWFEST2,56.78,Golden Plains WF1 Pty Ltd as Trustee for the Golden Plains WF1 Unit Trust,Golden Plains Wind Farm East,Wind,253.0,22.44,Golden Plains Wind Farm East,-37.945091,143.752614,2026-03-13T08:58:39.586184
2026/03/13 19:00:00,GPWFEST3,40.4,Golden Plains WF1 Pty Ltd as Trustee for the Golden Plains WF1 Unit Trust,Golden Plains Wind Farm East,Wind,240.0,16.83,Golden Plains Wind Farm East,-37.945091,143.752614,2026-03-13T08:58:39.586184
2026/03/13 19:00:00,GRANWF1,2.47,Granville Harbour Operations Pty Ltd as The Trustee for Granville Harbour Operations Trust,Granville Harbour Wind Farm,Wind,111.0,2.23,Granville Harbour Wind Farm,-41.8,145.06,2026-03-13T08:58:39.586184
2026/03/13 19:00:00,GSWF1A,139.23,Goyder Wind Farm 1 Pty Ltd as the Trustee for Goyder Wind Farm 1 Trust,Goyder South Wind Farm 1A,Wind,201.0,69.27,Goyder South Wind Farm 1A,-33.679758,138.937597,2026-03-13T08:58:39.586184
2026/03/13 19:00:00,GSWF1B1,118.4,Goyder Wind Farm 1B Pty Ltd as the Trustee for the Goyder Wind Farm 1B Trust,Goyder South Wind Farm 1B,Wind,196.0,60.41,Goyder South Wind Farm 1B,-33.679758,138.937597,2026-03-13T08:58:39.586184
2026/03/13 19:00:00,GULLRWF1,53.77,New Gullen Range Wind Farm Pty Ltd,Gullen Range Wind Farm,Wind,161.0,33.4,Gullen Range Wind Farm,-34.34,149.27,2026-03-13T08:58:39.586184
2026/03/13 19:00:00,GULLRWF2,91.42,New Gullen Range Wind Farm Pty Ltd,Gullen Range Wind Farm,Wind,107.0,85.44,Gullen Range Wind Farm,-34.34,149.27,2026-03-13T08:58:39.586184
2026/03/13 19:00:00,GUNNING1,35.5,Gunning Wind Energy Developments Pty Ltd,Gunning Wind Farm,Wind,47.0,75.53,Gunning Wind Farm,-34.813333,149.4,2026-03-13T08:58:39.586184
2026/03/13 19:00:00,HALLWF1,79.5,AGL SA Generation Pty Limited,Hallett 1 Wind Farm,Wind,95.0,83.68,Hallett 1 Wind Farm,-33.367778,138.728611,2026-03-13T08:58:39.586184
2026/03/13 19:00:00,HALLWF2,64.08,AGL SA Generation Pty Limited,Hallett 2 Wind Farm,Wind,71.0,90.25,Hallett 2 Wind Farm,-33.367778,138.728611,2026-03-13T08:58:39.586184
2026/03/13 19:00:00,HD1WF1,37.07,Hawkesdale Asset Pty Ltd as trustee for Hawkesdale Asset Trust,Hawkesdale Wind Farm,Wind,89.0,41.65,Hawkesdale Wind Farm,-38.147894,142.361381,2026-03-13T08:58:39.586184
2026/03/13 19:00:00,HDWF1,57.3,HWF1 Pty Ltd,Hornsdale Wind Farm,Wind,102.0,56.18,Hornsdale Wind Farm,-33.050556,138.543611,2026-03-13T08:58:39.586184
2026/03/13 19:00:00,HDWF2,53.4,HWF 2 Pty Ltd,Hornsdale Wind Farm 2,Wind,102.0,52.35,Hornsdale Wind Farm 2,-33.06,138.54,2026-03-13T08:58:39.586184
2026/03/13 19:00:00,HDWF3,71.1,HWF3 Pty Ltd,Hornsdale Wind Farm 3,Wind,109.0,65.23,Hornsdale Wind Farm 3,-33.06,138.54,2026-03-13T08:58:39.586184
2026/03/13 19:00:00,KABANWF1,76.41,Kaban Wind Farm Pty Ltd as trustee for Kaban Wind Farm Trust,Kaban Wind Farm,Wind,152.0,50.27,Kaban Wind Farm,-17.56,145.41,2026-03-13T08:58:39.586184
2026/03/13 19:00:00,KEPWF1,26.9,Kennedy Energy Park Pty Ltd,Kennedy Energy Park,Wind,43.0,62.56,Kennedy Energy Park,-20.88,144.42,2026-03-13T08:58:39.586184
2026/03/13 19:00:00,KIATAWF1,6.5,Kiata ProjectCo Pty Ltd Atf Kiata Project Trust,Kiata Wind Farm,Wind,31.0,20.97,Kiata Wind Farm,-36.4,141.75,2026-03-13T08:58:39.586184
2026/03/13 19:00:00,LGAPWF1,29.35,Lincoln Gap Wind Farm (Operations) Pty Ltd,Lincoln Gap Wind Farm,Wind,123.0,23.86,Lincoln Gap Wind Farm,-32.564279,137.557328,2026-03-13T08:58:39.586184
2026/03/13 19:00:00,LGAPWF1,29.35,Lincoln Gap Wind Farm (Operations) Pty Ltd,Lincoln Gap Wind Farm,Wind,123.0,23.86,Lincoln Gap Wind Farm,-32.564279,137.557328,2026-03-13T08:58:39.586184
2026/03/13 19:00:00,LGAPWF2,43.05,Lincoln Gap Wind Farm (Operations) Pty Ltd,Lincoln Gap Wind Farm,Wind,85.0,50.65,Lincoln Gap Wind Farm,-32.564279,137.557328,2026-03-13T08:58:39.586184
2026/03/13 19:00:00,LGAPWF2,43.05,Lincoln Gap Wind Farm (Operations) Pty Ltd,Lincoln Gap Wind Farm,Wind,85.0,50.65,Lincoln Gap Wind Farm,-32.564279,137.557328,2026-03-13T08:58:39.586184
2026/03/13 19:00:00,LKBONNY1,21.17,Lake Bonney Wind Power Pty Ltd,Lake Bonney Wind Farm Stage 1,Wind,81.0,26.14,Lake Bonney Wind Farm Stage 1,-37.76,140.4,2026-03-13T08:58:39.586184
2026/03/13 19:00:00,LKBONNY2,49.77,Lake Bonney Wind Power Pty Ltd,Lake Bonney Stage 2 Windfarm,Wind,159.0,31.3,Lake Bonney Stage 2 Windfarm,-37.76,140.4,2026-03-13T08:58:39.586184
2026/03/13 19:00:00,LKBONNY3,10.77,Lake Bonney Wind Power Pty Ltd,Lake Bonney Stage 3 Wind Farm,Wind,39.0,27.62,Lake Bonney Stage 3 Wind Farm,-37.737781,140.388137,2026-03-13T08:58:39.586184
2026/03/13 19:00:00,MACARTH1,76.1,AGL Hydro Partnership,Macarthur Wind Farm,Wind,420.0,18.12,Macarthur Wind Farm,-38.048957,142.192112,2026-03-13T08:58:39.586184
2026/03/13 19:00:00,MCINTYR1,408.36,MacIntyre UJV Operator Pty Ltd,MacIntyre Wind Farm,Wind,890.0,45.88,MacIntyre Wind Farm,-28.32,151.54,2026-03-13T08:58:39.586184
2026/03/13 19:00:00,MERCER01,19.0,Mt Mercer Windfarm Pty Ltd,Mt Mercer Wind Farm,Wind,131.0,14.5,Mt Mercer Wind Farm,-37.841111,143.871111,2026-03-13T08:58:39.586184
2026/03/13 19:00:00,MEWF1,81.12,Ergon Energy Queensland Pty Ltd ,Mount Emerald Wind Farm,Wind,178.0,45.57,Mount Emerald Wind Farm,-17.133007,145.380644,2026-03-13T08:58:39.586184
2026/03/13 19:00:00,MRTLSWF1,45.72,Mortlake South Wind Farm Pty Ltd,Mortlake South Wind Farm,Wind,153.0,29.88,Mortlake South Wind Farm,-38.127337,142.857801,2026-03-13T08:58:39.586184
2026/03/13 19:00:00,MTGELWF1,19.66,Mt. Gellibrand Wind Farm Pty Ltd,Mt Gellibrand Wind Farm,Wind,132.0,14.89,Mt Gellibrand Wind Farm,-38.23,143.77,2026-03-13T08:58:39.586184
2026/03/13 19:00:00,MTMILLAR,17.7,Mt Millar Wind Farm Pty Ltd,Mt Millar Wind Farm,Wind,70.0,25.29,Mt Millar Wind Farm,-33.624444,136.703611,2026-03-13T08:58:39.586184
2026/03/13 19:00:00,MUSSELR1,33.6,Hydro-Electric Corporation,Musselroe Wind Farm,Wind,168.0,20.0,Musselroe Wind Farm,-40.780225,148.010799,2026-03-13T08:58:39.586184
2026/03/13 19:00:00,MUWAWF1,103.42,Telstra Energy (Generation) Pty Ltd,Murra Warra Wind Farm,Wind,225.7,45.82,Murra Warra Wind Farm,-36.432404,142.317853,2026-03-13T08:58:39.586184
2026/03/13 19:00:00,MUWAWF2,95.2,Murra Warra II Project Co Pty Ltd ATF The Murra Warra II Project Trust,Murra Warra Wind Farm Stage 2,Wind,203.0,46.9,Murra Warra Wind Farm Stage 2,-36.43,142.32,2026-03-13T08:58:39.586184
2026/03/13 19:00:00,NBHWF1,114.1,AGL SA Generation Pty Limited,North Brown Hill Wind Farm,Wind,132.0,86.44,North Brown Hill Wind Farm,-33.367778,138.728611,2026-03-13T08:58:39.586184
2026/03/13 19:00:00,OAKLAND1,25.5,AGL Hydro Partnership,Oaklands Hill Wind Farm,Wind,63.0,40.48,Oaklands Hill Wind Farm,-37.683078,142.551678,2026-03-13T08:58:39.586184
2026/03/13 19:00:00,PAREPW1,65.3,Iberdrola Australia Energy Markets Pty Limited,Port Augusta Renewable Energy Park,Wind,201.0,32.49,Port Augusta Renewable Energy Park,-32.566944,137.856111,2026-03-13T08:58:39.586184
2026/03/13 19:00:00,RYANCWF1,35.96,Ryan Corner Development Pty Ltd,Ryan Corner Wind Farm,Wind,205.0,17.54,Ryan Corner Wind Farm,-38.271017,142.140647,2026-03-13T08:58:39.586184
2026/03/13 19:00:00,RYEPARK1,278.94,Rye Park Renewable Energy Pty Ltd as trustee for Rye Park Wind Farm Trust,Rye Park Renewable Energy,Wind,384.0,72.64,Rye Park Renewable Energy,-32.138333,148.972778,2026-03-13T08:58:39.586184
2026/03/13 19:00:00,SALTCRK1,19.76,Salt Creek Wind Farm Pty Ltd,Salt Creek Wind Farm,Wind,54.0,36.59,Salt Creek Wind Farm,-37.95,142.63,2026-03-13T08:58:39.586184
2026/03/13 19:00:00,SAPHWF1,258.87,The Trustee For The SWF1 Operations Trust,Sapphire Wind Farm,Wind,270.0,95.88,Sapphire Wind Farm,-29.7,151.41,2026-03-13T08:58:39.586184
2026/03/13 19:00:00,SNOWNTH1,126.8,Snowtown Wind Farm Stage 2 Pty Ltd,Snowtown Wind Farm Stage 2 North,Wind,144.0,88.06,Snowtown Wind Farm Stage 2 North,-33.83,138.118611,2026-03-13T08:58:39.586184
2026/03/13 19:00:00,SNOWSTH1,117.8,Snowtown Wind Farm Stage 2 Pty Ltd,Snowtown South Wind Farm,Wind,126.0,93.49,Snowtown South Wind Farm,-33.83,138.118611,2026-03-13T08:58:39.586184
2026/03/13 19:00:00,SNOWTWN1,70.89,Snowtown Wind Farm Pty Ltd,Snowtown Wind Farm Units 1 And 47,Wind,99.0,71.61,Snowtown Wind Farm Units 1 And 47,-33.83,138.118611,2026-03-13T08:58:39.586184
2026/03/13 19:00:00,STARHLWF,24.59,Starfish Hill Wind Farm Pty Ltd,Starfish Hill Wind Farm,Wind,35.0,70.26,Starfish Hill Wind Farm,-35.58,138.14,2026-03-13T08:58:39.586184
2026/03/13 19:00:00,STOCKYD1,280.31,Stockyard Hill Wind Farm Pty Ltd,Stockyard Hill Wind Farm,Wind,511.0,54.86,Stockyard Hill Wind Farm,-37.535833,143.251389,2026-03-13T08:58:39.586184
2026/03/13 19:00:00,STWF1,142.25,PARF Company 8 Pty Ltd as The Trustee for Silverton Project Trust,Silverton Wind Farm,Wind,198.0,71.84,Silverton Wind Farm,-37.683168,142.551678,2026-03-13T08:58:39.586184
2026/03/13 19:00:00,TARALGA1,35.83,Taralga Wind Farm Nominees No 2 Pty Ltd (ATF Taralga Wind Farm Operating Trust),Taralga Wind Farm,Wind,106.0,33.8,Taralga Wind Farm,-34.42352,149.826267,2026-03-13T08:58:39.586184
2026/03/13 19:00:00,WAMBOWF1,225.76,Stanwell Corporation Limited,Wambo Wind Farm 1,Wind,245.0,92.15,Wambo Wind Farm 1,-35.187301,149.524945,2026-03-13T08:58:39.586184
2026/03/13 19:00:00,WATERLWF,65.4,Waterloo Wind Farm Pty Ltd,Waterloo Wind Farm,Wind,130.0,50.31,Waterloo Wind Farm,-34.00094,138.911567,2026-03-13T08:58:39.586184
2026/03/13 19:00:00,WGWF1,93.1,Willogoleche Power Pty Ltd As The Trustee For The Willogoleche Operating Trust,Willogoleche Wind Farm,Wind,119.0,78.24,Willogoleche Wind Farm,-33.39,138.85,2026-03-13T08:58:39.586184
2026/03/13 19:00:00,WOODLWN1,29.67,Woodlawn Wind Pty Ltd,Woodlawn Wind Farm,Wind,48.0,61.81,Woodlawn Wind Farm,-35.08,149.62,2026-03-13T08:58:39.586184
2026/03/13 19:00:00,WPWF,62.65,AGL SA Generation Pty Limited,Wattle Point Wind Farm,Wind,91.0,68.85,Wattle Point Wind Farm,-35.111624,137.7219,2026-03-13T08:58:39.586184
2026/03/13 19:00:00,WRWF1,157.39,White Rock Wind Farm Pty Ltd,White Rock Wind Farm,Wind,172.0,91.51,White Rock Wind Farm,-29.79,151.54,2026-03-13T08:58:39.586184
2026/03/13 19:00:00,YENDWF1,31.24,Lal Lal Wind Farms Nom Co Pty Ltd,Yendon Wind Farm,Wind,142.0,22.0,Yendon Wind Farm,-37.629987,144.022717,2026-03-13T08:58:39.586184
