SETTLEMENTDATE,DUID,SCADAVALUE,Participant,Station Name,Fuel Source - Primary,MAX_CAP,utilisation_pct,Plant,Latitude,Longitude,timestamp_utc
2026/03/05 20:00:00,CAPTL_WF,0.0,Iberdrola Australia Holdings Pty Limited,Capital Wind Farm,Wind,140.0,0.0,Capital Wind Farm,-35.1,149.31,2026-03-05T09:57:11.187343
2026/03/05 20:00:00,CHALLHWF,13.2,Pacific Hydro Challicum Hills Pty Ltd,Challicum Hills Wind Farm,Wind,52.0,25.38,Challicum Hills Wind Farm,-37.38,143.11,2026-03-05T09:57:11.187343
2026/03/05 20:00:00,CULLRGWF,2.1,Cullerin Range Wind Farm Pty Ltd,Cullerin Range Wind Farm,Wind,30.0,7.0,Cullerin Range Wind Farm,-34.81,149.4,2026-03-05T09:57:11.187343
2026/03/05 20:00:00,DIAPURWF1,7.0,Y.E.S. Energy (SA) Pty Ltd,Diapur Wind Farm,Wind,7.0,100.0,Diapur Wind Farm,-36.3425,141.43,2026-03-05T09:57:11.187343
2026/03/05 20:00:00,MLWF1,1.52,Mortons Lane Windfarm Pty Limited,Mortons Lane Wind Farm,Wind,20.0,7.6,Mortons Lane Wind Farm,-37.84,142.45,2026-03-05T09:57:11.187343
2026/03/05 20:00:00,WAUBRAWF,21.95,Pyrenees Wind Energy Developments Pty Ltd,Waubra Wind Farm,Wind,192.0,11.43,Waubra Wind Farm,-37.394498,143.638982,2026-03-05T09:57:11.187343
2026/03/05 20:00:00,WOOLNTH1,43.18,Hydro-Electric Corporation,Woolnorth Studland Bay / Bluff Point Wind Farm,Wind,140.0,30.84,Woolnorth Studland Bay / Bluff Point Wind Farm,-40.69,144.72,2026-03-05T09:57:11.187343
2026/03/05 20:00:00,YAMBUKWF,16.9,Energy Pacific (Vic) Pty Ltd,Yambuk Wind Farm,Wind,30.0,56.33,Yambuk Wind Farm,-38.299083,142.027577,2026-03-05T09:57:11.187343
2026/03/05 20:00:00,YSWF1,1.7,Pacific Hydro Yaloak South Pty Ltd,Yaloak South Wind Farm,Wind,28.0,6.07,Yaloak South Wind Farm,-37.7163,144.242853,2026-03-05T09:57:11.187343
2026/03/05 20:00:00,ARWF1,63.7,Ararat Wind Farm Pty Ltd,Ararat Wind Farm,Wind,241.0,26.43,Ararat Wind Farm,-37.232778,143.031389,2026-03-05T09:57:11.187343
2026/03/05 20:00:00,BALDHWF1,0.0,Alinta Energy Retail Sales Pty Ltd,Bald Hills Wind Farm,Wind,106.0,0.0,Bald Hills Wind Farm,-38.79,145.93,2026-03-05T09:57:11.187343
2026/03/05 20:00:00,BANGOWF1,0.8,BWF Nominees Pty Ltd as The Trustee for BWF Trust,Bango 973 Wind Farm,Wind,155.0,0.52,Bango 973 Wind Farm,-34.551582,148.732808,2026-03-05T09:57:11.187343
2026/03/05 20:00:00,BANGOWF2,0.0,BWF Nominees Pty Ltd as The Trustee for BWF Trust,Bango 999 Wind Farm,Wind,82.0,0.0,Bango 999 Wind Farm,-34.551582,148.732808,2026-03-05T09:57:11.187343
2026/03/05 20:00:00,BLUFF1,16.8,AGL SA Generation Pty Limited,The Bluff Wind Farm,Wind,53.0,31.7,The Bluff Wind Farm,-33.367778,138.728611,2026-03-05T09:57:11.187343
2026/03/05 20:00:00,BOCORWF1,10.44,Boco Rock Wind Farm Pty Ltd,Boco Rock Wind Farm,Wind,111.0,9.41,Boco Rock Wind Farm,-36.578611,149.103333,2026-03-05T09:57:11.187343
2026/03/05 20:00:00,BRYB1WF1,84.5,Berrybank Development Pty Ltd,Berrybank Wind Farm,Wind,175.9,48.04,Berrybank Wind Farm,-37.94,143.52,2026-03-05T09:57:11.187343
2026/03/05 20:00:00,BRYB2WF2,56.11,Berrybank 2 Asset Pty Ltd as trustee for Berrybank 2 Asset Trust,Berrybank 2 Wind Farm,Wind,105.0,53.44,Berrybank 2 Wind Farm,-37.94,143.52,2026-03-05T09:57:11.187343
2026/03/05 20:00:00,BULGANA1,28.94,Bulgana Wind Farm Pty Ltd,Bulgana Green Power Hub,Wind,204.0,14.19,Bulgana Green Power Hub,-37.0975,142.973611,2026-03-05T09:57:11.187343
2026/03/05 20:00:00,CATHROCK,3.5,Cathedral Rocks Wind Farm Pty Ltd,Cathedral Rocks,Wind,66.0,5.3,Cathedral Rocks,-34.51,135.35,2026-03-05T09:57:11.187343
2026/03/05 20:00:00,CHYTWF1,7.88,Cherry Tree Wind Farm Pty Ltd as trustee for The Cherry Tree Project trust ,Cherry Tree Wind Farm,Wind,57.0,13.82,Cherry Tree Wind Farm,-37.1,145.26,2026-03-05T09:57:11.187343
2026/03/05 20:00:00,CLEMGPWF,21.25,Pacific Hydro Clements Gap Pty Ltd,Clements Gap Wind Farm,Wind,57.0,37.28,Clements Gap Wind Farm,-33.48,138.1,2026-03-05T09:57:11.187343
2026/03/05 20:00:00,CLRKCWF1,148.85,Stanwell Corporation Limited ,Clarke Creek Wind Farm,Wind,338.0,44.04,Clarke Creek Wind Farm,-22.85,149.45,2026-03-05T09:57:11.187343
2026/03/05 20:00:00,CLRKCWF2,33.28,Stanwell Corporation Limited ,Clarke Creek Wind Farm,Wind,101.0,32.95,Clarke Creek Wind Farm,-22.85,149.45,2026-03-05T09:57:11.187343
2026/03/05 20:00:00,CNUNDAWF,6.11,Canunda Power Pty Ltd,Canunda Wind Farm,Wind,46.0,13.28,Canunda Wind Farm,-37.73,140.39,2026-03-05T09:57:11.187343
2026/03/05 20:00:00,COLWF01,1.28,Collector Wind Farm Pty Ltd,Collector Wind Farm 1,Wind,219.0,0.58,Collector Wind Farm 1,-34.8719,149.3967,2026-03-05T09:57:11.187343
2026/03/05 20:00:00,COOPGWF1,174.66,PARF Company 10 Pty Limited as The Trustee for Coopers Gap Project Trust,Coopers Gap Wind Farm,Wind,440.0,39.7,Coopers Gap Wind Farm,-26.74,151.45,2026-03-05T09:57:11.187343
2026/03/05 20:00:00,CROOKWF2,0.94,Crookwell Development Pty Ltd ,Crookwell 2 Wind Farm,Wind,91.0,1.03,Crookwell 2 Wind Farm,-34.52,149.54,2026-03-05T09:57:11.187343
2026/03/05 20:00:00,CROOKWF3,0.0,Crookwell 3 Development Pty Ltd,Crookwell 3 Wind Farm,Wind,56.0,0.0,Crookwell 3 Wind Farm,-34.52,149.54,2026-03-05T09:57:11.187343
2026/03/05 20:00:00,CROWLWF1,24.19,Pacific Hydro Crowlands Pty Ltd ,Crowlands Wind Farm,Wind,79.0,30.62,Crowlands Wind Farm,-37.13,143.16,2026-03-05T09:57:11.187343
2026/03/05 20:00:00,CRURWF1,17.6,CRWF Nominees Pty Ltd As Trustee For The CRWF Trust,Crudine Ridge Wind Farm,Wind,138.0,12.75,Crudine Ridge Wind Farm,-32.97,149.64,2026-03-05T09:57:11.187343
2026/03/05 20:00:00,CTHLWF1,131.32,Wild Cattle Hill Pty Ltd,Cattle Hill Wind Farm,Wind,144.0,91.19,Cattle Hill Wind Farm,-42.15,146.69,2026-03-05T09:57:11.187343
2026/03/05 20:00:00,DULAWF1,120.3,Dulacca Energy Project Co Pty Ltd,Dulacca Wind Farm,Wind,173.0,69.54,Dulacca Wind Farm,-26.63,149.87,2026-03-05T09:57:11.187343
2026/03/05 20:00:00,DUNDWF1,59.1,Dundonnell Wind Farm Pty Ltd,Dundonnell Wind Farm,Wind,168.0,35.18,Dundonnell Wind Farm,-37.52,142.58,2026-03-05T09:57:11.187343
2026/03/05 20:00:00,DUNDWF2,18.56,Dundonnell Wind Farm Pty Ltd,Dundonnell Wind Farm,Wind,46.0,40.35,Dundonnell Wind Farm,-37.52,142.58,2026-03-05T09:57:11.187343
2026/03/05 20:00:00,DUNDWF3,27.4,Dundonnell Wind Farm Pty Ltd,Dundonnell Wind Farm,Wind,122.0,22.46,Dundonnell Wind Farm,-37.52,142.58,2026-03-05T09:57:11.187343
2026/03/05 20:00:00,ELAINWF1,10.19,Lal Lal Wind Farms Nom Co Pty Ltd,Elaine Wind Farm,Wind,82.0,12.43,Elaine Wind Farm,-37.36,144.0,2026-03-05T09:57:11.187343
2026/03/05 20:00:00,FLYCRKWF,1.81,Iberdrola Australia Energy Markets Pty Limited,Flyers Creek Wind Farm,Wind,140.0,1.29,Flyers Creek Wind Farm,-33.365556,148.981944,2026-03-05T09:57:11.187343
2026/03/05 20:00:00,GPWFEST1,108.32,Golden Plains WF1 Pty Ltd as Trustee for the Golden Plains WF1 Unit Trust,Golden Plains Wind Farm East,Wind,240.0,45.13,Golden Plains Wind Farm East,-37.945091,143.752614,2026-03-05T09:57:11.187343
2026/03/05 20:00:00,GPWFEST2,50.84,Golden Plains WF1 Pty Ltd as Trustee for the Golden Plains WF1 Unit Trust,Golden Plains Wind Farm East,Wind,253.0,20.09,Golden Plains Wind Farm East,-37.945091,143.752614,2026-03-05T09:57:11.187343
2026/03/05 20:00:00,GPWFEST3,91.19,Golden Plains WF1 Pty Ltd as Trustee for the Golden Plains WF1 Unit Trust,Golden Plains Wind Farm East,Wind,240.0,38.0,Golden Plains Wind Farm East,-37.945091,143.752614,2026-03-05T09:57:11.187343
2026/03/05 20:00:00,GRANWF1,86.81,Granville Harbour Operations Pty Ltd as The Trustee for Granville Harbour Operations Trust,Granville Harbour Wind Farm,Wind,111.0,78.21,Granville Harbour Wind Farm,-41.8,145.06,2026-03-05T09:57:11.187343
2026/03/05 20:00:00,GSWF1A,54.99,Goyder Wind Farm 1 Pty Ltd as the Trustee for Goyder Wind Farm 1 Trust,Goyder South Wind Farm 1A,Wind,201.0,27.36,Goyder South Wind Farm 1A,-33.679758,138.937597,2026-03-05T09:57:11.187343
2026/03/05 20:00:00,GSWF1B1,7.47,Goyder Wind Farm 1B Pty Ltd as the Trustee for the Goyder Wind Farm 1B Trust,Goyder South Wind Farm 1B,Wind,196.0,3.81,Goyder South Wind Farm 1B,-33.679758,138.937597,2026-03-05T09:57:11.187343
2026/03/05 20:00:00,GULLRWF1,2.37,New Gullen Range Wind Farm Pty Ltd,Gullen Range Wind Farm,Wind,161.0,1.47,Gullen Range Wind Farm,-34.34,149.27,2026-03-05T09:57:11.187343
2026/03/05 20:00:00,GULLRWF2,0.0,New Gullen Range Wind Farm Pty Ltd,Gullen Range Wind Farm,Wind,107.0,0.0,Gullen Range Wind Farm,-34.34,149.27,2026-03-05T09:57:11.187343
2026/03/05 20:00:00,GUNNING1,0.65,Gunning Wind Energy Developments Pty Ltd,Gunning Wind Farm,Wind,47.0,1.38,Gunning Wind Farm,-34.813333,149.4,2026-03-05T09:57:11.187343
2026/03/05 20:00:00,HALLWF1,29.39,AGL SA Generation Pty Limited,Hallett 1 Wind Farm,Wind,95.0,30.94,Hallett 1 Wind Farm,-33.367778,138.728611,2026-03-05T09:57:11.187343
2026/03/05 20:00:00,HALLWF2,16.83,AGL SA Generation Pty Limited,Hallett 2 Wind Farm,Wind,71.0,23.7,Hallett 2 Wind Farm,-33.367778,138.728611,2026-03-05T09:57:11.187343
2026/03/05 20:00:00,HD1WF1,48.73,Hawkesdale Asset Pty Ltd as trustee for Hawkesdale Asset Trust,Hawkesdale Wind Farm,Wind,89.0,54.75,Hawkesdale Wind Farm,-38.147894,142.361381,2026-03-05T09:57:11.187343
2026/03/05 20:00:00,HDWF1,18.9,HWF1 Pty Ltd,Hornsdale Wind Farm,Wind,102.0,18.53,Hornsdale Wind Farm,-33.050556,138.543611,2026-03-05T09:57:11.187343
2026/03/05 20:00:00,HDWF2,15.6,HWF 2 Pty Ltd,Hornsdale Wind Farm 2,Wind,102.0,15.29,Hornsdale Wind Farm 2,-33.06,138.54,2026-03-05T09:57:11.187343
2026/03/05 20:00:00,HDWF3,21.0,HWF3 Pty Ltd,Hornsdale Wind Farm 3,Wind,109.0,19.27,Hornsdale Wind Farm 3,-33.06,138.54,2026-03-05T09:57:11.187343
2026/03/05 20:00:00,KABANWF1,97.58,Kaban Wind Farm Pty Ltd as trustee for Kaban Wind Farm Trust,Kaban Wind Farm,Wind,152.0,64.2,Kaban Wind Farm,-17.56,145.41,2026-03-05T09:57:11.187343
2026/03/05 20:00:00,KEPWF1,22.9,Kennedy Energy Park Pty Ltd,Kennedy Energy Park,Wind,43.0,53.26,Kennedy Energy Park,-20.88,144.42,2026-03-05T09:57:11.187343
2026/03/05 20:00:00,KIATAWF1,16.6,Kiata ProjectCo Pty Ltd Atf Kiata Project Trust,Kiata Wind Farm,Wind,31.0,53.55,Kiata Wind Farm,-36.4,141.75,2026-03-05T09:57:11.187343
2026/03/05 20:00:00,LGAPWF1,31.94,Lincoln Gap Wind Farm (Operations) Pty Ltd,Lincoln Gap Wind Farm,Wind,123.0,25.97,Lincoln Gap Wind Farm,-32.564279,137.557328,2026-03-05T09:57:11.187343
2026/03/05 20:00:00,LGAPWF1,31.94,Lincoln Gap Wind Farm (Operations) Pty Ltd,Lincoln Gap Wind Farm,Wind,123.0,25.97,Lincoln Gap Wind Farm,-32.564279,137.557328,2026-03-05T09:57:11.187343
2026/03/05 20:00:00,LGAPWF2,43.73,Lincoln Gap Wind Farm (Operations) Pty Ltd,Lincoln Gap Wind Farm,Wind,85.0,51.45,Lincoln Gap Wind Farm,-32.564279,137.557328,2026-03-05T09:57:11.187343
2026/03/05 20:00:00,LGAPWF2,43.73,Lincoln Gap Wind Farm (Operations) Pty Ltd,Lincoln Gap Wind Farm,Wind,85.0,51.45,Lincoln Gap Wind Farm,-32.564279,137.557328,2026-03-05T09:57:11.187343
2026/03/05 20:00:00,LKBONNY1,8.48,Lake Bonney Wind Power Pty Ltd,Lake Bonney Wind Farm Stage 1,Wind,81.0,10.47,Lake Bonney Wind Farm Stage 1,-37.76,140.4,2026-03-05T09:57:11.187343
2026/03/05 20:00:00,LKBONNY2,22.81,Lake Bonney Wind Power Pty Ltd,Lake Bonney Stage 2 Windfarm,Wind,159.0,14.35,Lake Bonney Stage 2 Windfarm,-37.76,140.4,2026-03-05T09:57:11.187343
2026/03/05 20:00:00,LKBONNY3,7.65,Lake Bonney Wind Power Pty Ltd,Lake Bonney Stage 3 Wind Farm,Wind,39.0,19.62,Lake Bonney Stage 3 Wind Farm,-37.737781,140.388137,2026-03-05T09:57:11.187343
2026/03/05 20:00:00,MACARTH1,105.6,AGL Hydro Partnership,Macarthur Wind Farm,Wind,420.0,25.14,Macarthur Wind Farm,-38.048957,142.192112,2026-03-05T09:57:11.187343
2026/03/05 20:00:00,MCINTYR1,110.12,MacIntyre UJV Operator Pty Ltd,MacIntyre Wind Farm,Wind,890.0,12.37,MacIntyre Wind Farm,-28.32,151.54,2026-03-05T09:57:11.187343
2026/03/05 20:00:00,MERCER01,26.4,Mt Mercer Windfarm Pty Ltd,Mt Mercer Wind Farm,Wind,131.0,20.15,Mt Mercer Wind Farm,-37.841111,143.871111,2026-03-05T09:57:11.187343
2026/03/05 20:00:00,MEWF1,113.37,Ergon Energy Queensland Pty Ltd ,Mount Emerald Wind Farm,Wind,178.0,63.69,Mount Emerald Wind Farm,-17.133007,145.380644,2026-03-05T09:57:11.187343
2026/03/05 20:00:00,MRTLSWF1,44.71,Mortlake South Wind Farm Pty Ltd,Mortlake South Wind Farm,Wind,153.0,29.22,Mortlake South Wind Farm,-38.127337,142.857801,2026-03-05T09:57:11.187343
2026/03/05 20:00:00,MTGELWF1,49.16,Mt. Gellibrand Wind Farm Pty Ltd,Mt Gellibrand Wind Farm,Wind,132.0,37.24,Mt Gellibrand Wind Farm,-38.23,143.77,2026-03-05T09:57:11.187343
2026/03/05 20:00:00,MTMILLAR,18.2,Mt Millar Wind Farm Pty Ltd,Mt Millar Wind Farm,Wind,70.0,26.0,Mt Millar Wind Farm,-33.624444,136.703611,2026-03-05T09:57:11.187343
2026/03/05 20:00:00,MUSSELR1,152.2,Hydro-Electric Corporation,Musselroe Wind Farm,Wind,168.0,90.6,Musselroe Wind Farm,-40.780225,148.010799,2026-03-05T09:57:11.187343
2026/03/05 20:00:00,MUWAWF1,26.89,Telstra Energy (Generation) Pty Ltd,Murra Warra Wind Farm,Wind,225.7,11.91,Murra Warra Wind Farm,-36.432404,142.317853,2026-03-05T09:57:11.187343
2026/03/05 20:00:00,MUWAWF2,6.9,Murra Warra II Project Co Pty Ltd ATF The Murra Warra II Project Trust,Murra Warra Wind Farm Stage 2,Wind,203.0,3.4,Murra Warra Wind Farm Stage 2,-36.43,142.32,2026-03-05T09:57:11.187343
2026/03/05 20:00:00,NBHWF1,42.6,AGL SA Generation Pty Limited,North Brown Hill Wind Farm,Wind,132.0,32.27,North Brown Hill Wind Farm,-33.367778,138.728611,2026-03-05T09:57:11.187343
2026/03/05 20:00:00,OAKLAND1,11.8,AGL Hydro Partnership,Oaklands Hill Wind Farm,Wind,63.0,18.73,Oaklands Hill Wind Farm,-37.683078,142.551678,2026-03-05T09:57:11.187343
2026/03/05 20:00:00,PAREPW1,119.81,Iberdrola Australia Energy Markets Pty Limited,Port Augusta Renewable Energy Park,Wind,201.0,59.61,Port Augusta Renewable Energy Park,-32.566944,137.856111,2026-03-05T09:57:11.187343
2026/03/05 20:00:00,RYANCWF1,135.38,Ryan Corner Development Pty Ltd,Ryan Corner Wind Farm,Wind,205.0,66.04,Ryan Corner Wind Farm,-38.271017,142.140647,2026-03-05T09:57:11.187343
2026/03/05 20:00:00,RYEPARK1,6.1,Rye Park Renewable Energy Pty Ltd as trustee for Rye Park Wind Farm Trust,Rye Park Renewable Energy,Wind,384.0,1.59,Rye Park Renewable Energy,-32.138333,148.972778,2026-03-05T09:57:11.187343
2026/03/05 20:00:00,SALTCRK1,8.82,Salt Creek Wind Farm Pty Ltd,Salt Creek Wind Farm,Wind,54.0,16.33,Salt Creek Wind Farm,-37.95,142.63,2026-03-05T09:57:11.187343
2026/03/05 20:00:00,SAPHWF1,172.36,The Trustee For The SWF1 Operations Trust,Sapphire Wind Farm,Wind,270.0,63.84,Sapphire Wind Farm,-29.7,151.41,2026-03-05T09:57:11.187343
2026/03/05 20:00:00,SNOWNTH1,93.1,Snowtown Wind Farm Stage 2 Pty Ltd,Snowtown Wind Farm Stage 2 North,Wind,144.0,64.65,Snowtown Wind Farm Stage 2 North,-33.83,138.118611,2026-03-05T09:57:11.187343
2026/03/05 20:00:00,SNOWSTH1,57.2,Snowtown Wind Farm Stage 2 Pty Ltd,Snowtown South Wind Farm,Wind,126.0,45.4,Snowtown South Wind Farm,-33.83,138.118611,2026-03-05T09:57:11.187343
2026/03/05 20:00:00,SNOWTWN1,63.53,Snowtown Wind Farm Pty Ltd,Snowtown Wind Farm Units 1 And 47,Wind,99.0,64.17,Snowtown Wind Farm Units 1 And 47,-33.83,138.118611,2026-03-05T09:57:11.187343
2026/03/05 20:00:00,STARHLWF,7.4,Starfish Hill Wind Farm Pty Ltd,Starfish Hill Wind Farm,Wind,35.0,21.14,Starfish Hill Wind Farm,-35.58,138.14,2026-03-05T09:57:11.187343
2026/03/05 20:00:00,STOCKYD1,231.74,Stockyard Hill Wind Farm Pty Ltd,Stockyard Hill Wind Farm,Wind,511.0,45.35,Stockyard Hill Wind Farm,-37.535833,143.251389,2026-03-05T09:57:11.187343
2026/03/05 20:00:00,STWF1,81.4,PARF Company 8 Pty Ltd as The Trustee for Silverton Project Trust,Silverton Wind Farm,Wind,198.0,41.11,Silverton Wind Farm,-37.683168,142.551678,2026-03-05T09:57:11.187343
2026/03/05 20:00:00,TARALGA1,5.9,Taralga Wind Farm Nominees No 2 Pty Ltd (ATF Taralga Wind Farm Operating Trust),Taralga Wind Farm,Wind,106.0,5.57,Taralga Wind Farm,-34.42352,149.826267,2026-03-05T09:57:11.187343
2026/03/05 20:00:00,WAMBOWF1,123.14,Stanwell Corporation Limited,Wambo Wind Farm 1,Wind,245.0,50.26,Wambo Wind Farm 1,-35.187301,149.524945,2026-03-05T09:57:11.187343
2026/03/05 20:00:00,WATERLWF,25.0,Waterloo Wind Farm Pty Ltd,Waterloo Wind Farm,Wind,130.0,19.23,Waterloo Wind Farm,-34.00094,138.911567,2026-03-05T09:57:11.187343
2026/03/05 20:00:00,WGWF1,15.8,Willogoleche Power Pty Ltd As The Trustee For The Willogoleche Operating Trust,Willogoleche Wind Farm,Wind,119.0,13.28,Willogoleche Wind Farm,-33.39,138.85,2026-03-05T09:57:11.187343
2026/03/05 20:00:00,WOODLWN1,0.0,Woodlawn Wind Pty Ltd,Woodlawn Wind Farm,Wind,48.0,0.0,Woodlawn Wind Farm,-35.08,149.62,2026-03-05T09:57:11.187343
2026/03/05 20:00:00,WPWF,20.9,AGL SA Generation Pty Limited,Wattle Point Wind Farm,Wind,91.0,22.97,Wattle Point Wind Farm,-35.111624,137.7219,2026-03-05T09:57:11.187343
2026/03/05 20:00:00,WRWF1,86.73,White Rock Wind Farm Pty Ltd,White Rock Wind Farm,Wind,172.0,50.42,White Rock Wind Farm,-29.79,151.54,2026-03-05T09:57:11.187343
2026/03/05 20:00:00,YENDWF1,13.72,Lal Lal Wind Farms Nom Co Pty Ltd,Yendon Wind Farm,Wind,142.0,9.66,Yendon Wind Farm,-37.629987,144.022717,2026-03-05T09:57:11.187343
