SETTLEMENTDATE,DUID,SCADAVALUE,Participant,Station Name,Fuel Source - Primary,MAX_CAP,utilisation_pct,Plant,Latitude,Longitude,timestamp_utc
2026/02/27 05:30:00,CAPTL_WF,52.76,Iberdrola Australia Holdings Pty Limited,Capital Wind Farm,Wind,140.0,37.69,Capital Wind Farm,-35.1,149.31,2026-02-26T19:31:41.631441
2026/02/27 05:30:00,CHALLHWF,1.9,Pacific Hydro Challicum Hills Pty Ltd,Challicum Hills Wind Farm,Wind,52.0,3.65,Challicum Hills Wind Farm,-37.38,143.11,2026-02-26T19:31:41.631441
2026/02/27 05:30:00,CULLRGWF,28.01,Cullerin Range Wind Farm Pty Ltd,Cullerin Range Wind Farm,Wind,30.0,93.37,Cullerin Range Wind Farm,-34.81,149.4,2026-02-26T19:31:41.631441
2026/02/27 05:30:00,DIAPURWF1,8.3,Y.E.S. Energy (SA) Pty Ltd,Diapur Wind Farm,Wind,7.0,118.57,Diapur Wind Farm,-36.3425,141.43,2026-02-26T19:31:41.631441
2026/02/27 05:30:00,MLWF1,3.16,Mortons Lane Windfarm Pty Limited,Mortons Lane Wind Farm,Wind,20.0,15.8,Mortons Lane Wind Farm,-37.84,142.45,2026-02-26T19:31:41.631441
2026/02/27 05:30:00,WAUBRAWF,73.0,Pyrenees Wind Energy Developments Pty Ltd,Waubra Wind Farm,Wind,192.0,38.02,Waubra Wind Farm,-37.394498,143.638982,2026-02-26T19:31:41.631441
2026/02/27 05:30:00,WOOLNTH1,79.4,Hydro-Electric Corporation,Woolnorth Studland Bay / Bluff Point Wind Farm,Wind,140.0,56.71,Woolnorth Studland Bay / Bluff Point Wind Farm,-40.69,144.72,2026-02-26T19:31:41.631441
2026/02/27 05:30:00,YAMBUKWF,6.8,Energy Pacific (Vic) Pty Ltd,Yambuk Wind Farm,Wind,30.0,22.67,Yambuk Wind Farm,-38.299083,142.027577,2026-02-26T19:31:41.631441
2026/02/27 05:30:00,YSWF1,0.0,Pacific Hydro Yaloak South Pty Ltd,Yaloak South Wind Farm,Wind,28.0,0.0,Yaloak South Wind Farm,-37.7163,144.242853,2026-02-26T19:31:41.631441
2026/02/27 05:30:00,ARWF1,8.5,Ararat Wind Farm Pty Ltd,Ararat Wind Farm,Wind,241.0,3.53,Ararat Wind Farm,-37.232778,143.031389,2026-02-26T19:31:41.631441
2026/02/27 05:30:00,BALDHWF1,0.0,Alinta Energy Retail Sales Pty Ltd,Bald Hills Wind Farm,Wind,106.0,0.0,Bald Hills Wind Farm,-38.79,145.93,2026-02-26T19:31:41.631441
2026/02/27 05:30:00,BANGOWF1,104.5,BWF Nominees Pty Ltd as The Trustee for BWF Trust,Bango 973 Wind Farm,Wind,155.0,67.42,Bango 973 Wind Farm,-34.551582,148.732808,2026-02-26T19:31:41.631441
2026/02/27 05:30:00,BANGOWF2,80.2,BWF Nominees Pty Ltd as The Trustee for BWF Trust,Bango 999 Wind Farm,Wind,82.0,97.8,Bango 999 Wind Farm,-34.551582,148.732808,2026-02-26T19:31:41.631441
2026/02/27 05:30:00,BLUFF1,5.6,AGL SA Generation Pty Limited,The Bluff Wind Farm,Wind,53.0,10.57,The Bluff Wind Farm,-33.367778,138.728611,2026-02-26T19:31:41.631441
2026/02/27 05:30:00,BOCORWF1,13.45,Boco Rock Wind Farm Pty Ltd,Boco Rock Wind Farm,Wind,111.0,12.12,Boco Rock Wind Farm,-36.578611,149.103333,2026-02-26T19:31:41.631441
2026/02/27 05:30:00,BRYB1WF1,64.38,Berrybank Development Pty Ltd,Berrybank Wind Farm,Wind,175.9,36.6,Berrybank Wind Farm,-37.94,143.52,2026-02-26T19:31:41.631441
2026/02/27 05:30:00,BRYB2WF2,33.48,Berrybank 2 Asset Pty Ltd as trustee for Berrybank 2 Asset Trust,Berrybank 2 Wind Farm,Wind,105.0,31.89,Berrybank 2 Wind Farm,-37.94,143.52,2026-02-26T19:31:41.631441
2026/02/27 05:30:00,BULGANA1,9.49,Bulgana Wind Farm Pty Ltd,Bulgana Green Power Hub,Wind,204.0,4.65,Bulgana Green Power Hub,-37.0975,142.973611,2026-02-26T19:31:41.631441
2026/02/27 05:30:00,CATHROCK,9.5,Cathedral Rocks Wind Farm Pty Ltd,Cathedral Rocks,Wind,66.0,14.39,Cathedral Rocks,-34.51,135.35,2026-02-26T19:31:41.631441
2026/02/27 05:30:00,CHYTWF1,5.29,Cherry Tree Wind Farm Pty Ltd as trustee for The Cherry Tree Project trust ,Cherry Tree Wind Farm,Wind,57.0,9.28,Cherry Tree Wind Farm,-37.1,145.26,2026-02-26T19:31:41.631441
2026/02/27 05:30:00,CLEMGPWF,22.04,Pacific Hydro Clements Gap Pty Ltd,Clements Gap Wind Farm,Wind,57.0,38.67,Clements Gap Wind Farm,-33.48,138.1,2026-02-26T19:31:41.631441
2026/02/27 05:30:00,CLRKCWF1,0.0,Stanwell Corporation Limited ,Clarke Creek Wind Farm,Wind,338.0,0.0,Clarke Creek Wind Farm,-22.85,149.45,2026-02-26T19:31:41.631441
2026/02/27 05:30:00,CLRKCWF2,0.0,Stanwell Corporation Limited ,Clarke Creek Wind Farm,Wind,101.0,0.0,Clarke Creek Wind Farm,-22.85,149.45,2026-02-26T19:31:41.631441
2026/02/27 05:30:00,CNUNDAWF,21.12,Canunda Power Pty Ltd,Canunda Wind Farm,Wind,46.0,45.91,Canunda Wind Farm,-37.73,140.39,2026-02-26T19:31:41.631441
2026/02/27 05:30:00,COLWF01,0.0,Collector Wind Farm Pty Ltd,Collector Wind Farm 1,Wind,219.0,0.0,Collector Wind Farm 1,-34.8719,149.3967,2026-02-26T19:31:41.631441
2026/02/27 05:30:00,COOPGWF1,307.15,PARF Company 10 Pty Limited as The Trustee for Coopers Gap Project Trust,Coopers Gap Wind Farm,Wind,440.0,69.81,Coopers Gap Wind Farm,-26.74,151.45,2026-02-26T19:31:41.631441
2026/02/27 05:30:00,CROOKWF2,42.06,Crookwell Development Pty Ltd ,Crookwell 2 Wind Farm,Wind,91.0,46.22,Crookwell 2 Wind Farm,-34.52,149.54,2026-02-26T19:31:41.631441
2026/02/27 05:30:00,CROOKWF3,34.19,Crookwell 3 Development Pty Ltd,Crookwell 3 Wind Farm,Wind,56.0,61.05,Crookwell 3 Wind Farm,-34.52,149.54,2026-02-26T19:31:41.631441
2026/02/27 05:30:00,CROWLWF1,20.29,Pacific Hydro Crowlands Pty Ltd ,Crowlands Wind Farm,Wind,79.0,25.68,Crowlands Wind Farm,-37.13,143.16,2026-02-26T19:31:41.631441
2026/02/27 05:30:00,CRURWF1,113.6,CRWF Nominees Pty Ltd As Trustee For The CRWF Trust,Crudine Ridge Wind Farm,Wind,138.0,82.32,Crudine Ridge Wind Farm,-32.97,149.64,2026-02-26T19:31:41.631441
2026/02/27 05:30:00,CTHLWF1,0.32,Wild Cattle Hill Pty Ltd,Cattle Hill Wind Farm,Wind,144.0,0.22,Cattle Hill Wind Farm,-42.15,146.69,2026-02-26T19:31:41.631441
2026/02/27 05:30:00,DULAWF1,123.2,Dulacca Energy Project Co Pty Ltd,Dulacca Wind Farm,Wind,173.0,71.21,Dulacca Wind Farm,-26.63,149.87,2026-02-26T19:31:41.631441
2026/02/27 05:30:00,DUNDWF1,63.16,Dundonnell Wind Farm Pty Ltd,Dundonnell Wind Farm,Wind,168.0,37.6,Dundonnell Wind Farm,-37.52,142.58,2026-02-26T19:31:41.631441
2026/02/27 05:30:00,DUNDWF2,20.28,Dundonnell Wind Farm Pty Ltd,Dundonnell Wind Farm,Wind,46.0,44.09,Dundonnell Wind Farm,-37.52,142.58,2026-02-26T19:31:41.631441
2026/02/27 05:30:00,DUNDWF3,55.68,Dundonnell Wind Farm Pty Ltd,Dundonnell Wind Farm,Wind,122.0,45.64,Dundonnell Wind Farm,-37.52,142.58,2026-02-26T19:31:41.631441
2026/02/27 05:30:00,ELAINWF1,2.77,Lal Lal Wind Farms Nom Co Pty Ltd,Elaine Wind Farm,Wind,82.0,3.38,Elaine Wind Farm,-37.36,144.0,2026-02-26T19:31:41.631441
2026/02/27 05:30:00,FLYCRKWF,72.52,Iberdrola Australia Energy Markets Pty Limited,Flyers Creek Wind Farm,Wind,140.0,51.8,Flyers Creek Wind Farm,-33.365556,148.981944,2026-02-26T19:31:41.631441
2026/02/27 05:30:00,GPWFEST1,75.63,Golden Plains WF1 Pty Ltd as Trustee for the Golden Plains WF1 Unit Trust,Golden Plains Wind Farm East,Wind,240.0,31.51,Golden Plains Wind Farm East,-37.945091,143.752614,2026-02-26T19:31:41.631441
2026/02/27 05:30:00,GPWFEST2,53.8,Golden Plains WF1 Pty Ltd as Trustee for the Golden Plains WF1 Unit Trust,Golden Plains Wind Farm East,Wind,253.0,21.26,Golden Plains Wind Farm East,-37.945091,143.752614,2026-02-26T19:31:41.631441
2026/02/27 05:30:00,GPWFEST3,53.48,Golden Plains WF1 Pty Ltd as Trustee for the Golden Plains WF1 Unit Trust,Golden Plains Wind Farm East,Wind,240.0,22.28,Golden Plains Wind Farm East,-37.945091,143.752614,2026-02-26T19:31:41.631441
2026/02/27 05:30:00,GRANWF1,44.89,Granville Harbour Operations Pty Ltd as The Trustee for Granville Harbour Operations Trust,Granville Harbour Wind Farm,Wind,111.0,40.44,Granville Harbour Wind Farm,-41.8,145.06,2026-02-26T19:31:41.631441
2026/02/27 05:30:00,GSWF1A,29.06,Goyder Wind Farm 1 Pty Ltd as the Trustee for Goyder Wind Farm 1 Trust,Goyder South Wind Farm 1A,Wind,201.0,14.46,Goyder South Wind Farm 1A,-33.679758,138.937597,2026-02-26T19:31:41.631441
2026/02/27 05:30:00,GSWF1B1,5.29,Goyder Wind Farm 1B Pty Ltd as the Trustee for the Goyder Wind Farm 1B Trust,Goyder South Wind Farm 1B,Wind,196.0,2.7,Goyder South Wind Farm 1B,-33.679758,138.937597,2026-02-26T19:31:41.631441
2026/02/27 05:30:00,GULLRWF1,109.87,New Gullen Range Wind Farm Pty Ltd,Gullen Range Wind Farm,Wind,161.0,68.24,Gullen Range Wind Farm,-34.34,149.27,2026-02-26T19:31:41.631441
2026/02/27 05:30:00,GULLRWF2,108.72,New Gullen Range Wind Farm Pty Ltd,Gullen Range Wind Farm,Wind,107.0,101.61,Gullen Range Wind Farm,-34.34,149.27,2026-02-26T19:31:41.631441
2026/02/27 05:30:00,GUNNING1,45.09,Gunning Wind Energy Developments Pty Ltd,Gunning Wind Farm,Wind,47.0,95.94,Gunning Wind Farm,-34.813333,149.4,2026-02-26T19:31:41.631441
2026/02/27 05:30:00,HALLWF1,33.81,AGL SA Generation Pty Limited,Hallett 1 Wind Farm,Wind,95.0,35.59,Hallett 1 Wind Farm,-33.367778,138.728611,2026-02-26T19:31:41.631441
2026/02/27 05:30:00,HALLWF2,11.38,AGL SA Generation Pty Limited,Hallett 2 Wind Farm,Wind,71.0,16.03,Hallett 2 Wind Farm,-33.367778,138.728611,2026-02-26T19:31:41.631441
2026/02/27 05:30:00,HD1WF1,39.2,Hawkesdale Asset Pty Ltd as trustee for Hawkesdale Asset Trust,Hawkesdale Wind Farm,Wind,89.0,44.04,Hawkesdale Wind Farm,-38.147894,142.361381,2026-02-26T19:31:41.631441
2026/02/27 05:30:00,HDWF1,29.4,HWF1 Pty Ltd,Hornsdale Wind Farm,Wind,102.0,28.82,Hornsdale Wind Farm,-33.050556,138.543611,2026-02-26T19:31:41.631441
2026/02/27 05:30:00,HDWF2,13.0,HWF 2 Pty Ltd,Hornsdale Wind Farm 2,Wind,102.0,12.75,Hornsdale Wind Farm 2,-33.06,138.54,2026-02-26T19:31:41.631441
2026/02/27 05:30:00,HDWF3,18.9,HWF3 Pty Ltd,Hornsdale Wind Farm 3,Wind,109.0,17.34,Hornsdale Wind Farm 3,-33.06,138.54,2026-02-26T19:31:41.631441
2026/02/27 05:30:00,KABANWF1,44.91,Kaban Wind Farm Pty Ltd as trustee for Kaban Wind Farm Trust,Kaban Wind Farm,Wind,152.0,29.55,Kaban Wind Farm,-17.56,145.41,2026-02-26T19:31:41.631441
2026/02/27 05:30:00,KEPWF1,29.0,Kennedy Energy Park Pty Ltd,Kennedy Energy Park,Wind,43.0,67.44,Kennedy Energy Park,-20.88,144.42,2026-02-26T19:31:41.631441
2026/02/27 05:30:00,KIATAWF1,25.3,Kiata ProjectCo Pty Ltd Atf Kiata Project Trust,Kiata Wind Farm,Wind,31.0,81.61,Kiata Wind Farm,-36.4,141.75,2026-02-26T19:31:41.631441
2026/02/27 05:30:00,LGAPWF1,3.77,Lincoln Gap Wind Farm (Operations) Pty Ltd,Lincoln Gap Wind Farm,Wind,123.0,3.07,Lincoln Gap Wind Farm,-32.564279,137.557328,2026-02-26T19:31:41.631441
2026/02/27 05:30:00,LGAPWF1,3.77,Lincoln Gap Wind Farm (Operations) Pty Ltd,Lincoln Gap Wind Farm,Wind,123.0,3.07,Lincoln Gap Wind Farm,-32.564279,137.557328,2026-02-26T19:31:41.631441
2026/02/27 05:30:00,LGAPWF2,7.1,Lincoln Gap Wind Farm (Operations) Pty Ltd,Lincoln Gap Wind Farm,Wind,85.0,8.35,Lincoln Gap Wind Farm,-32.564279,137.557328,2026-02-26T19:31:41.631441
2026/02/27 05:30:00,LGAPWF2,7.1,Lincoln Gap Wind Farm (Operations) Pty Ltd,Lincoln Gap Wind Farm,Wind,85.0,8.35,Lincoln Gap Wind Farm,-32.564279,137.557328,2026-02-26T19:31:41.631441
2026/02/27 05:30:00,LKBONNY1,23.58,Lake Bonney Wind Power Pty Ltd,Lake Bonney Wind Farm Stage 1,Wind,81.0,29.11,Lake Bonney Wind Farm Stage 1,-37.76,140.4,2026-02-26T19:31:41.631441
2026/02/27 05:30:00,LKBONNY2,78.63,Lake Bonney Wind Power Pty Ltd,Lake Bonney Stage 2 Windfarm,Wind,159.0,49.45,Lake Bonney Stage 2 Windfarm,-37.76,140.4,2026-02-26T19:31:41.631441
2026/02/27 05:30:00,LKBONNY3,19.2,Lake Bonney Wind Power Pty Ltd,Lake Bonney Stage 3 Wind Farm,Wind,39.0,49.23,Lake Bonney Stage 3 Wind Farm,-37.737781,140.388137,2026-02-26T19:31:41.631441
2026/02/27 05:30:00,MACARTH1,52.9,AGL Hydro Partnership,Macarthur Wind Farm,Wind,420.0,12.6,Macarthur Wind Farm,-38.048957,142.192112,2026-02-26T19:31:41.631441
2026/02/27 05:30:00,MCINTYR1,310.12,MacIntyre UJV Operator Pty Ltd,MacIntyre Wind Farm,Wind,890.0,34.84,MacIntyre Wind Farm,-28.32,151.54,2026-02-26T19:31:41.631441
2026/02/27 05:30:00,MERCER01,11.3,Mt Mercer Windfarm Pty Ltd,Mt Mercer Wind Farm,Wind,131.0,8.63,Mt Mercer Wind Farm,-37.841111,143.871111,2026-02-26T19:31:41.631441
2026/02/27 05:30:00,MEWF1,17.84,Ergon Energy Queensland Pty Ltd ,Mount Emerald Wind Farm,Wind,178.0,10.02,Mount Emerald Wind Farm,-17.133007,145.380644,2026-02-26T19:31:41.631441
2026/02/27 05:30:00,MRTLSWF1,62.56,Mortlake South Wind Farm Pty Ltd,Mortlake South Wind Farm,Wind,153.0,40.89,Mortlake South Wind Farm,-38.127337,142.857801,2026-02-26T19:31:41.631441
2026/02/27 05:30:00,MTGELWF1,35.5,Mt. Gellibrand Wind Farm Pty Ltd,Mt Gellibrand Wind Farm,Wind,132.0,26.89,Mt Gellibrand Wind Farm,-38.23,143.77,2026-02-26T19:31:41.631441
2026/02/27 05:30:00,MTMILLAR,3.8,Mt Millar Wind Farm Pty Ltd,Mt Millar Wind Farm,Wind,70.0,5.43,Mt Millar Wind Farm,-33.624444,136.703611,2026-02-26T19:31:41.631441
2026/02/27 05:30:00,MUSSELR1,21.7,Hydro-Electric Corporation,Musselroe Wind Farm,Wind,168.0,12.92,Musselroe Wind Farm,-40.780225,148.010799,2026-02-26T19:31:41.631441
2026/02/27 05:30:00,MUWAWF1,107.89,Telstra Energy (Generation) Pty Ltd,Murra Warra Wind Farm,Wind,225.7,47.8,Murra Warra Wind Farm,-36.432404,142.317853,2026-02-26T19:31:41.631441
2026/02/27 05:30:00,MUWAWF2,85.2,Murra Warra II Project Co Pty Ltd ATF The Murra Warra II Project Trust,Murra Warra Wind Farm Stage 2,Wind,203.0,41.97,Murra Warra Wind Farm Stage 2,-36.43,142.32,2026-02-26T19:31:41.631441
2026/02/27 05:30:00,NBHWF1,51.9,AGL SA Generation Pty Limited,North Brown Hill Wind Farm,Wind,132.0,39.32,North Brown Hill Wind Farm,-33.367778,138.728611,2026-02-26T19:31:41.631441
2026/02/27 05:30:00,OAKLAND1,2.9,AGL Hydro Partnership,Oaklands Hill Wind Farm,Wind,63.0,4.6,Oaklands Hill Wind Farm,-37.683078,142.551678,2026-02-26T19:31:41.631441
2026/02/27 05:30:00,PAREPW1,5.55,Iberdrola Australia Energy Markets Pty Limited,Port Augusta Renewable Energy Park,Wind,201.0,2.76,Port Augusta Renewable Energy Park,-32.566944,137.856111,2026-02-26T19:31:41.631441
2026/02/27 05:30:00,RYANCWF1,59.32,Ryan Corner Development Pty Ltd,Ryan Corner Wind Farm,Wind,205.0,28.94,Ryan Corner Wind Farm,-38.271017,142.140647,2026-02-26T19:31:41.631441
2026/02/27 05:30:00,RYEPARK1,342.59,Rye Park Renewable Energy Pty Ltd as trustee for Rye Park Wind Farm Trust,Rye Park Renewable Energy,Wind,384.0,89.22,Rye Park Renewable Energy,-32.138333,148.972778,2026-02-26T19:31:41.631441
2026/02/27 05:30:00,SALTCRK1,17.98,Salt Creek Wind Farm Pty Ltd,Salt Creek Wind Farm,Wind,54.0,33.3,Salt Creek Wind Farm,-37.95,142.63,2026-02-26T19:31:41.631441
2026/02/27 05:30:00,SAPHWF1,261.27,The Trustee For The SWF1 Operations Trust,Sapphire Wind Farm,Wind,270.0,96.77,Sapphire Wind Farm,-29.7,151.41,2026-02-26T19:31:41.631441
2026/02/27 05:30:00,SNOWNTH1,17.5,Snowtown Wind Farm Stage 2 Pty Ltd,Snowtown Wind Farm Stage 2 North,Wind,144.0,12.15,Snowtown Wind Farm Stage 2 North,-33.83,138.118611,2026-02-26T19:31:41.631441
2026/02/27 05:30:00,SNOWSTH1,31.6,Snowtown Wind Farm Stage 2 Pty Ltd,Snowtown South Wind Farm,Wind,126.0,25.08,Snowtown South Wind Farm,-33.83,138.118611,2026-02-26T19:31:41.631441
2026/02/27 05:30:00,SNOWTWN1,25.67,Snowtown Wind Farm Pty Ltd,Snowtown Wind Farm Units 1 And 47,Wind,99.0,25.93,Snowtown Wind Farm Units 1 And 47,-33.83,138.118611,2026-02-26T19:31:41.631441
2026/02/27 05:30:00,STARHLWF,24.59,Starfish Hill Wind Farm Pty Ltd,Starfish Hill Wind Farm,Wind,35.0,70.26,Starfish Hill Wind Farm,-35.58,138.14,2026-02-26T19:31:41.631441
2026/02/27 05:30:00,STOCKYD1,64.36,Stockyard Hill Wind Farm Pty Ltd,Stockyard Hill Wind Farm,Wind,511.0,12.59,Stockyard Hill Wind Farm,-37.535833,143.251389,2026-02-26T19:31:41.631441
2026/02/27 05:30:00,STWF1,62.18,PARF Company 8 Pty Ltd as The Trustee for Silverton Project Trust,Silverton Wind Farm,Wind,198.0,31.4,Silverton Wind Farm,-37.683168,142.551678,2026-02-26T19:31:41.631441
2026/02/27 05:30:00,TARALGA1,40.21,Taralga Wind Farm Nominees No 2 Pty Ltd (ATF Taralga Wind Farm Operating Trust),Taralga Wind Farm,Wind,106.0,37.93,Taralga Wind Farm,-34.42352,149.826267,2026-02-26T19:31:41.631441
2026/02/27 05:30:00,WAMBOWF1,78.46,Stanwell Corporation Limited,Wambo Wind Farm 1,Wind,245.0,32.02,Wambo Wind Farm 1,-35.187301,149.524945,2026-02-26T19:31:41.631441
2026/02/27 05:30:00,WATERLWF,12.0,Waterloo Wind Farm Pty Ltd,Waterloo Wind Farm,Wind,130.0,9.23,Waterloo Wind Farm,-34.00094,138.911567,2026-02-26T19:31:41.631441
2026/02/27 05:30:00,WGWF1,12.1,Willogoleche Power Pty Ltd As The Trustee For The Willogoleche Operating Trust,Willogoleche Wind Farm,Wind,119.0,10.17,Willogoleche Wind Farm,-33.39,138.85,2026-02-26T19:31:41.631441
2026/02/27 05:30:00,WOODLWN1,32.68,Woodlawn Wind Pty Ltd,Woodlawn Wind Farm,Wind,48.0,68.08,Woodlawn Wind Farm,-35.08,149.62,2026-02-26T19:31:41.631441
2026/02/27 05:30:00,WPWF,20.09,AGL SA Generation Pty Limited,Wattle Point Wind Farm,Wind,91.0,22.08,Wattle Point Wind Farm,-35.111624,137.7219,2026-02-26T19:31:41.631441
2026/02/27 05:30:00,WRWF1,165.19,White Rock Wind Farm Pty Ltd,White Rock Wind Farm,Wind,172.0,96.04,White Rock Wind Farm,-29.79,151.54,2026-02-26T19:31:41.631441
2026/02/27 05:30:00,YENDWF1,1.36,Lal Lal Wind Farms Nom Co Pty Ltd,Yendon Wind Farm,Wind,142.0,0.96,Yendon Wind Farm,-37.629987,144.022717,2026-02-26T19:31:41.631441
