SETTLEMENTDATE,DUID,SCADAVALUE,Participant,Station Name,Fuel Source - Primary,MAX_CAP,utilisation_pct,Plant,Latitude,Longitude,timestamp_utc
2026/04/03 18:00:00,CAPTL_WF,100.14,Iberdrola Australia Holdings Pty Limited,Capital Wind Farm,Wind,140.0,71.53,Capital Wind Farm,-35.1,149.31,2026-04-03T08:01:26.667680
2026/04/03 18:00:00,CHALLHWF,20.2,Pacific Hydro Challicum Hills Pty Ltd,Challicum Hills Wind Farm,Wind,52.0,38.85,Challicum Hills Wind Farm,-37.38,143.11,2026-04-03T08:01:26.667680
2026/04/03 18:00:00,CULLRGWF,22.86,Cullerin Range Wind Farm Pty Ltd,Cullerin Range Wind Farm,Wind,30.0,76.2,Cullerin Range Wind Farm,-34.81,149.4,2026-04-03T08:01:26.667680
2026/04/03 18:00:00,DIAPURWF1,2.2,Y.E.S. Energy (SA) Pty Ltd,Diapur Wind Farm,Wind,7.0,31.43,Diapur Wind Farm,-36.3425,141.43,2026-04-03T08:01:26.667680
2026/04/03 18:00:00,MLWF1,8.3,Mortons Lane Windfarm Pty Limited,Mortons Lane Wind Farm,Wind,20.0,41.5,Mortons Lane Wind Farm,-37.84,142.45,2026-04-03T08:01:26.667680
2026/04/03 18:00:00,WAUBRAWF,73.88,Pyrenees Wind Energy Developments Pty Ltd,Waubra Wind Farm,Wind,192.0,38.48,Waubra Wind Farm,-37.394498,143.638982,2026-04-03T08:01:26.667680
2026/04/03 18:00:00,WOOLNTH1,23.78,Hydro-Electric Corporation,Woolnorth Studland Bay / Bluff Point Wind Farm,Wind,140.0,16.99,Woolnorth Studland Bay / Bluff Point Wind Farm,-40.69,144.72,2026-04-03T08:01:26.667680
2026/04/03 18:00:00,YAMBUKWF,4.8,Energy Pacific (Vic) Pty Ltd,Yambuk Wind Farm,Wind,30.0,16.0,Yambuk Wind Farm,-38.299083,142.027577,2026-04-03T08:01:26.667680
2026/04/03 18:00:00,YSWF1,10.1,Pacific Hydro Yaloak South Pty Ltd,Yaloak South Wind Farm,Wind,28.0,36.07,Yaloak South Wind Farm,-37.7163,144.242853,2026-04-03T08:01:26.667680
2026/04/03 18:00:00,ARWF1,81.4,Ararat Wind Farm Pty Ltd,Ararat Wind Farm,Wind,241.0,33.78,Ararat Wind Farm,-37.232778,143.031389,2026-04-03T08:01:26.667680
2026/04/03 18:00:00,BALDHWF1,10.65,Alinta Energy Retail Sales Pty Ltd,Bald Hills Wind Farm,Wind,106.0,10.05,Bald Hills Wind Farm,-38.79,145.93,2026-04-03T08:01:26.667680
2026/04/03 18:00:00,BANGOWF1,2.7,BWF Nominees Pty Ltd as The Trustee for BWF Trust,Bango 973 Wind Farm,Wind,155.0,1.74,Bango 973 Wind Farm,-34.551582,148.732808,2026-04-03T08:01:26.667680
2026/04/03 18:00:00,BANGOWF2,1.3,BWF Nominees Pty Ltd as The Trustee for BWF Trust,Bango 999 Wind Farm,Wind,82.0,1.59,Bango 999 Wind Farm,-34.551582,148.732808,2026-04-03T08:01:26.667680
2026/04/03 18:00:00,BLUFF1,9.4,AGL SA Generation Pty Limited,The Bluff Wind Farm,Wind,53.0,17.74,The Bluff Wind Farm,-33.367778,138.728611,2026-04-03T08:01:26.667680
2026/04/03 18:00:00,BOCORWF1,45.93,Boco Rock Wind Farm Pty Ltd,Boco Rock Wind Farm,Wind,111.0,41.38,Boco Rock Wind Farm,-36.578611,149.103333,2026-04-03T08:01:26.667680
2026/04/03 18:00:00,BRYB1WF1,52.88,Berrybank Development Pty Ltd,Berrybank Wind Farm,Wind,175.9,30.06,Berrybank Wind Farm,-37.94,143.52,2026-04-03T08:01:26.667680
2026/04/03 18:00:00,BRYB2WF2,37.28,Berrybank 2 Asset Pty Ltd as trustee for Berrybank 2 Asset Trust,Berrybank 2 Wind Farm,Wind,105.0,35.5,Berrybank 2 Wind Farm,-37.94,143.52,2026-04-03T08:01:26.667680
2026/04/03 18:00:00,BULGANA1,0.0,Bulgana Wind Farm Pty Ltd,Bulgana Green Power Hub,Wind,204.0,0.0,Bulgana Green Power Hub,-37.0975,142.973611,2026-04-03T08:01:26.667680
2026/04/03 18:00:00,CATHROCK,37.8,Cathedral Rocks Wind Farm Pty Ltd,Cathedral Rocks,Wind,66.0,57.27,Cathedral Rocks,-34.51,135.35,2026-04-03T08:01:26.667680
2026/04/03 18:00:00,CHYTWF1,56.62,Cherry Tree Wind Farm Pty Ltd as trustee for The Cherry Tree Project trust ,Cherry Tree Wind Farm,Wind,57.0,99.33,Cherry Tree Wind Farm,-37.1,145.26,2026-04-03T08:01:26.667680
2026/04/03 18:00:00,CLEMGPWF,52.8,Pacific Hydro Clements Gap Pty Ltd,Clements Gap Wind Farm,Wind,57.0,92.63,Clements Gap Wind Farm,-33.48,138.1,2026-04-03T08:01:26.667680
2026/04/03 18:00:00,CLRKCWF1,82.01,Stanwell Corporation Limited ,Clarke Creek Wind Farm,Wind,338.0,24.26,Clarke Creek Wind Farm,-22.85,149.45,2026-04-03T08:01:26.667680
2026/04/03 18:00:00,CLRKCWF2,30.67,Stanwell Corporation Limited ,Clarke Creek Wind Farm,Wind,101.0,30.37,Clarke Creek Wind Farm,-22.85,149.45,2026-04-03T08:01:26.667680
2026/04/03 18:00:00,CNUNDAWF,5.11,Canunda Power Pty Ltd,Canunda Wind Farm,Wind,46.0,11.11,Canunda Wind Farm,-37.73,140.39,2026-04-03T08:01:26.667680
2026/04/03 18:00:00,COLWF01,115.32,Collector Wind Farm Pty Ltd,Collector Wind Farm 1,Wind,219.0,52.66,Collector Wind Farm 1,-34.8719,149.3967,2026-04-03T08:01:26.667680
2026/04/03 18:00:00,COOPGWF1,117.15,PARF Company 10 Pty Limited as The Trustee for Coopers Gap Project Trust,Coopers Gap Wind Farm,Wind,440.0,26.62,Coopers Gap Wind Farm,-26.74,151.45,2026-04-03T08:01:26.667680
2026/04/03 18:00:00,CROOKWF2,32.77,Crookwell Development Pty Ltd ,Crookwell 2 Wind Farm,Wind,91.0,36.01,Crookwell 2 Wind Farm,-34.52,149.54,2026-04-03T08:01:26.667680
2026/04/03 18:00:00,CROOKWF3,32.59,Crookwell 3 Development Pty Ltd,Crookwell 3 Wind Farm,Wind,56.0,58.2,Crookwell 3 Wind Farm,-34.52,149.54,2026-04-03T08:01:26.667680
2026/04/03 18:00:00,CROWLWF1,38.53,Pacific Hydro Crowlands Pty Ltd ,Crowlands Wind Farm,Wind,79.0,48.77,Crowlands Wind Farm,-37.13,143.16,2026-04-03T08:01:26.667680
2026/04/03 18:00:00,CRURWF1,26.5,CRWF Nominees Pty Ltd As Trustee For The CRWF Trust,Crudine Ridge Wind Farm,Wind,138.0,19.2,Crudine Ridge Wind Farm,-32.97,149.64,2026-04-03T08:01:26.667680
2026/04/03 18:00:00,CTHLWF1,34.21,Wild Cattle Hill Pty Ltd,Cattle Hill Wind Farm,Wind,144.0,23.76,Cattle Hill Wind Farm,-42.15,146.69,2026-04-03T08:01:26.667680
2026/04/03 18:00:00,DULAWF1,8.4,Dulacca Energy Project Co Pty Ltd,Dulacca Wind Farm,Wind,173.0,4.86,Dulacca Wind Farm,-26.63,149.87,2026-04-03T08:01:26.667680
2026/04/03 18:00:00,DUNDWF1,50.92,Dundonnell Wind Farm Pty Ltd,Dundonnell Wind Farm,Wind,168.0,30.31,Dundonnell Wind Farm,-37.52,142.58,2026-04-03T08:01:26.667680
2026/04/03 18:00:00,DUNDWF2,15.89,Dundonnell Wind Farm Pty Ltd,Dundonnell Wind Farm,Wind,46.0,34.54,Dundonnell Wind Farm,-37.52,142.58,2026-04-03T08:01:26.667680
2026/04/03 18:00:00,DUNDWF3,44.65,Dundonnell Wind Farm Pty Ltd,Dundonnell Wind Farm,Wind,122.0,36.6,Dundonnell Wind Farm,-37.52,142.58,2026-04-03T08:01:26.667680
2026/04/03 18:00:00,ELAINWF1,26.23,Lal Lal Wind Farms Nom Co Pty Ltd,Elaine Wind Farm,Wind,82.0,31.99,Elaine Wind Farm,-37.36,144.0,2026-04-03T08:01:26.667680
2026/04/03 18:00:00,FLYCRKWF,0.0,Iberdrola Australia Energy Markets Pty Limited,Flyers Creek Wind Farm,Wind,140.0,0.0,Flyers Creek Wind Farm,-33.365556,148.981944,2026-04-03T08:01:26.667680
2026/04/03 18:00:00,GPWFEST1,81.91,Golden Plains WF1 Pty Ltd as Trustee for the Golden Plains WF1 Unit Trust,Golden Plains Wind Farm East,Wind,240.0,34.13,Golden Plains Wind Farm East,-37.945091,143.752614,2026-04-03T08:01:26.667680
2026/04/03 18:00:00,GPWFEST2,45.56,Golden Plains WF1 Pty Ltd as Trustee for the Golden Plains WF1 Unit Trust,Golden Plains Wind Farm East,Wind,253.0,18.01,Golden Plains Wind Farm East,-37.945091,143.752614,2026-04-03T08:01:26.667680
2026/04/03 18:00:00,GPWFEST3,39.95,Golden Plains WF1 Pty Ltd as Trustee for the Golden Plains WF1 Unit Trust,Golden Plains Wind Farm East,Wind,240.0,16.65,Golden Plains Wind Farm East,-37.945091,143.752614,2026-04-03T08:01:26.667680
2026/04/03 18:00:00,GRANWF1,10.91,Granville Harbour Operations Pty Ltd as The Trustee for Granville Harbour Operations Trust,Granville Harbour Wind Farm,Wind,111.0,9.83,Granville Harbour Wind Farm,-41.8,145.06,2026-04-03T08:01:26.667680
2026/04/03 18:00:00,GSWF1A,109.61,Goyder Wind Farm 1 Pty Ltd as the Trustee for Goyder Wind Farm 1 Trust,Goyder South Wind Farm 1A,Wind,201.0,54.53,Goyder South Wind Farm 1A,-33.679758,138.937597,2026-04-03T08:01:26.667680
2026/04/03 18:00:00,GSWF1B1,73.07,Goyder Wind Farm 1B Pty Ltd as the Trustee for the Goyder Wind Farm 1B Trust,Goyder South Wind Farm 1B,Wind,196.0,37.28,Goyder South Wind Farm 1B,-33.679758,138.937597,2026-04-03T08:01:26.667680
2026/04/03 18:00:00,GULLRWF1,49.62,New Gullen Range Wind Farm Pty Ltd,Gullen Range Wind Farm,Wind,161.0,30.82,Gullen Range Wind Farm,-34.34,149.27,2026-04-03T08:01:26.667680
2026/04/03 18:00:00,GULLRWF2,84.19,New Gullen Range Wind Farm Pty Ltd,Gullen Range Wind Farm,Wind,107.0,78.68,Gullen Range Wind Farm,-34.34,149.27,2026-04-03T08:01:26.667680
2026/04/03 18:00:00,GUNNING1,30.07,Gunning Wind Energy Developments Pty Ltd,Gunning Wind Farm,Wind,47.0,63.98,Gunning Wind Farm,-34.813333,149.4,2026-04-03T08:01:26.667680
2026/04/03 18:00:00,HALLWF1,47.07,AGL SA Generation Pty Limited,Hallett 1 Wind Farm,Wind,95.0,49.55,Hallett 1 Wind Farm,-33.367778,138.728611,2026-04-03T08:01:26.667680
2026/04/03 18:00:00,HALLWF2,34.71,AGL SA Generation Pty Limited,Hallett 2 Wind Farm,Wind,71.0,48.89,Hallett 2 Wind Farm,-33.367778,138.728611,2026-04-03T08:01:26.667680
2026/04/03 18:00:00,HD1WF1,21.13,Hawkesdale Asset Pty Ltd as trustee for Hawkesdale Asset Trust,Hawkesdale Wind Farm,Wind,89.0,23.74,Hawkesdale Wind Farm,-38.147894,142.361381,2026-04-03T08:01:26.667680
2026/04/03 18:00:00,HDWF1,70.0,HWF1 Pty Ltd,Hornsdale Wind Farm,Wind,102.0,68.63,Hornsdale Wind Farm,-33.050556,138.543611,2026-04-03T08:01:26.667680
2026/04/03 18:00:00,HDWF2,80.3,HWF 2 Pty Ltd,Hornsdale Wind Farm 2,Wind,102.0,78.73,Hornsdale Wind Farm 2,-33.06,138.54,2026-04-03T08:01:26.667680
2026/04/03 18:00:00,HDWF3,77.6,HWF3 Pty Ltd,Hornsdale Wind Farm 3,Wind,109.0,71.19,Hornsdale Wind Farm 3,-33.06,138.54,2026-04-03T08:01:26.667680
2026/04/03 18:00:00,KABANWF1,73.16,Kaban Wind Farm Pty Ltd as trustee for Kaban Wind Farm Trust,Kaban Wind Farm,Wind,152.0,48.13,Kaban Wind Farm,-17.56,145.41,2026-04-03T08:01:26.667680
2026/04/03 18:00:00,KEPWF1,8.4,Kennedy Energy Park Pty Ltd,Kennedy Energy Park,Wind,43.0,19.53,Kennedy Energy Park,-20.88,144.42,2026-04-03T08:01:26.667680
2026/04/03 18:00:00,KIATAWF1,11.1,Kiata ProjectCo Pty Ltd Atf Kiata Project Trust,Kiata Wind Farm,Wind,31.0,35.81,Kiata Wind Farm,-36.4,141.75,2026-04-03T08:01:26.667680
2026/04/03 18:00:00,LGAPWF1,6.38,Lincoln Gap Wind Farm (Operations) Pty Ltd,Lincoln Gap Wind Farm,Wind,123.0,5.19,Lincoln Gap Wind Farm,-32.564279,137.557328,2026-04-03T08:01:26.667680
2026/04/03 18:00:00,LGAPWF1,6.38,Lincoln Gap Wind Farm (Operations) Pty Ltd,Lincoln Gap Wind Farm,Wind,123.0,5.19,Lincoln Gap Wind Farm,-32.564279,137.557328,2026-04-03T08:01:26.667680
2026/04/03 18:00:00,LGAPWF2,10.45,Lincoln Gap Wind Farm (Operations) Pty Ltd,Lincoln Gap Wind Farm,Wind,85.0,12.29,Lincoln Gap Wind Farm,-32.564279,137.557328,2026-04-03T08:01:26.667680
2026/04/03 18:00:00,LGAPWF2,10.45,Lincoln Gap Wind Farm (Operations) Pty Ltd,Lincoln Gap Wind Farm,Wind,85.0,12.29,Lincoln Gap Wind Farm,-32.564279,137.557328,2026-04-03T08:01:26.667680
2026/04/03 18:00:00,LKBONNY1,8.31,Lake Bonney Wind Power Pty Ltd,Lake Bonney Wind Farm Stage 1,Wind,81.0,10.26,Lake Bonney Wind Farm Stage 1,-37.76,140.4,2026-04-03T08:01:26.667680
2026/04/03 18:00:00,LKBONNY2,22.28,Lake Bonney Wind Power Pty Ltd,Lake Bonney Stage 2 Windfarm,Wind,159.0,14.01,Lake Bonney Stage 2 Windfarm,-37.76,140.4,2026-04-03T08:01:26.667680
2026/04/03 18:00:00,LKBONNY3,5.08,Lake Bonney Wind Power Pty Ltd,Lake Bonney Stage 3 Wind Farm,Wind,39.0,13.03,Lake Bonney Stage 3 Wind Farm,-37.737781,140.388137,2026-04-03T08:01:26.667680
2026/04/03 18:00:00,MACARTH1,58.5,AGL Hydro Partnership,Macarthur Wind Farm,Wind,420.0,13.93,Macarthur Wind Farm,-38.048957,142.192112,2026-04-03T08:01:26.667680
2026/04/03 18:00:00,MCINTYR1,185.46,MacIntyre UJV Operator Pty Ltd,MacIntyre Wind Farm,Wind,890.0,20.84,MacIntyre Wind Farm,-28.32,151.54,2026-04-03T08:01:26.667680
2026/04/03 18:00:00,MERCER01,25.1,Mt Mercer Windfarm Pty Ltd,Mt Mercer Wind Farm,Wind,131.0,19.16,Mt Mercer Wind Farm,-37.841111,143.871111,2026-04-03T08:01:26.667680
2026/04/03 18:00:00,MEWF1,36.94,Ergon Energy Queensland Pty Ltd ,Mount Emerald Wind Farm,Wind,178.0,20.75,Mount Emerald Wind Farm,-17.133007,145.380644,2026-04-03T08:01:26.667680
2026/04/03 18:00:00,MRTLSWF1,28.14,Mortlake South Wind Farm Pty Ltd,Mortlake South Wind Farm,Wind,153.0,18.39,Mortlake South Wind Farm,-38.127337,142.857801,2026-04-03T08:01:26.667680
2026/04/03 18:00:00,MTGELWF1,45.28,Mt. Gellibrand Wind Farm Pty Ltd,Mt Gellibrand Wind Farm,Wind,132.0,34.3,Mt Gellibrand Wind Farm,-38.23,143.77,2026-04-03T08:01:26.667680
2026/04/03 18:00:00,MTMILLAR,13.9,Mt Millar Wind Farm Pty Ltd,Mt Millar Wind Farm,Wind,70.0,19.86,Mt Millar Wind Farm,-33.624444,136.703611,2026-04-03T08:01:26.667680
2026/04/03 18:00:00,MUSSELR1,12.3,Hydro-Electric Corporation,Musselroe Wind Farm,Wind,168.0,7.32,Musselroe Wind Farm,-40.780225,148.010799,2026-04-03T08:01:26.667680
2026/04/03 18:00:00,MUWAWF1,77.01,Telstra Energy (Generation) Pty Ltd,Murra Warra Wind Farm,Wind,225.7,34.12,Murra Warra Wind Farm,-36.432404,142.317853,2026-04-03T08:01:26.667680
2026/04/03 18:00:00,MUWAWF2,80.5,Murra Warra II Project Co Pty Ltd ATF The Murra Warra II Project Trust,Murra Warra Wind Farm Stage 2,Wind,203.0,39.66,Murra Warra Wind Farm Stage 2,-36.43,142.32,2026-04-03T08:01:26.667680
2026/04/03 18:00:00,NBHWF1,78.0,AGL SA Generation Pty Limited,North Brown Hill Wind Farm,Wind,132.0,59.09,North Brown Hill Wind Farm,-33.367778,138.728611,2026-04-03T08:01:26.667680
2026/04/03 18:00:00,OAKLAND1,18.2,AGL Hydro Partnership,Oaklands Hill Wind Farm,Wind,63.0,28.89,Oaklands Hill Wind Farm,-37.683078,142.551678,2026-04-03T08:01:26.667680
2026/04/03 18:00:00,PAREPW1,61.17,Iberdrola Australia Energy Markets Pty Limited,Port Augusta Renewable Energy Park,Wind,201.0,30.43,Port Augusta Renewable Energy Park,-32.566944,137.856111,2026-04-03T08:01:26.667680
2026/04/03 18:00:00,RYANCWF1,23.72,Ryan Corner Development Pty Ltd,Ryan Corner Wind Farm,Wind,205.0,11.57,Ryan Corner Wind Farm,-38.271017,142.140647,2026-04-03T08:01:26.667680
2026/04/03 18:00:00,RYEPARK1,58.02,Rye Park Renewable Energy Pty Ltd as trustee for Rye Park Wind Farm Trust,Rye Park Renewable Energy,Wind,384.0,15.11,Rye Park Renewable Energy,-32.138333,148.972778,2026-04-03T08:01:26.667680
2026/04/03 18:00:00,SALTCRK1,16.28,Salt Creek Wind Farm Pty Ltd,Salt Creek Wind Farm,Wind,54.0,30.15,Salt Creek Wind Farm,-37.95,142.63,2026-04-03T08:01:26.667680
2026/04/03 18:00:00,SAPHWF1,116.41,The Trustee For The SWF1 Operations Trust,Sapphire Wind Farm,Wind,270.0,43.11,Sapphire Wind Farm,-29.7,151.41,2026-04-03T08:01:26.667680
2026/04/03 18:00:00,SNOWNTH1,71.6,Snowtown Wind Farm Stage 2 Pty Ltd,Snowtown Wind Farm Stage 2 North,Wind,144.0,49.72,Snowtown Wind Farm Stage 2 North,-33.83,138.118611,2026-04-03T08:01:26.667680
2026/04/03 18:00:00,SNOWSTH1,102.4,Snowtown Wind Farm Stage 2 Pty Ltd,Snowtown South Wind Farm,Wind,126.0,81.27,Snowtown South Wind Farm,-33.83,138.118611,2026-04-03T08:01:26.667680
2026/04/03 18:00:00,SNOWTWN1,76.18,Snowtown Wind Farm Pty Ltd,Snowtown Wind Farm Units 1 And 47,Wind,99.0,76.95,Snowtown Wind Farm Units 1 And 47,-33.83,138.118611,2026-04-03T08:01:26.667680
2026/04/03 18:00:00,STARHLWF,26.49,Starfish Hill Wind Farm Pty Ltd,Starfish Hill Wind Farm,Wind,35.0,75.69,Starfish Hill Wind Farm,-35.58,138.14,2026-04-03T08:01:26.667680
2026/04/03 18:00:00,STOCKYD1,224.28,Stockyard Hill Wind Farm Pty Ltd,Stockyard Hill Wind Farm,Wind,511.0,43.89,Stockyard Hill Wind Farm,-37.535833,143.251389,2026-04-03T08:01:26.667680
2026/04/03 18:00:00,STWF1,99.69,PARF Company 8 Pty Ltd as The Trustee for Silverton Project Trust,Silverton Wind Farm,Wind,198.0,50.35,Silverton Wind Farm,-37.683168,142.551678,2026-04-03T08:01:26.667680
2026/04/03 18:00:00,TARALGA1,22.34,Taralga Wind Farm Nominees No 2 Pty Ltd (ATF Taralga Wind Farm Operating Trust),Taralga Wind Farm,Wind,106.0,21.08,Taralga Wind Farm,-34.42352,149.826267,2026-04-03T08:01:26.667680
2026/04/03 18:00:00,WAMBOWF1,71.95,Stanwell Corporation Limited,Wambo Wind Farm 1,Wind,245.0,29.37,Wambo Wind Farm 1,-35.187301,149.524945,2026-04-03T08:01:26.667680
2026/04/03 18:00:00,WATERLWF,35.4,Waterloo Wind Farm Pty Ltd,Waterloo Wind Farm,Wind,130.0,27.23,Waterloo Wind Farm,-34.00094,138.911567,2026-04-03T08:01:26.667680
2026/04/03 18:00:00,WGWF1,51.4,Willogoleche Power Pty Ltd As The Trustee For The Willogoleche Operating Trust,Willogoleche Wind Farm,Wind,119.0,43.19,Willogoleche Wind Farm,-33.39,138.85,2026-04-03T08:01:26.667680
2026/04/03 18:00:00,WOODLWN1,28.44,Woodlawn Wind Pty Ltd,Woodlawn Wind Farm,Wind,48.0,59.25,Woodlawn Wind Farm,-35.08,149.62,2026-04-03T08:01:26.667680
2026/04/03 18:00:00,WPWF,52.08,AGL SA Generation Pty Limited,Wattle Point Wind Farm,Wind,91.0,57.23,Wattle Point Wind Farm,-35.111624,137.7219,2026-04-03T08:01:26.667680
2026/04/03 18:00:00,WRWF1,67.89,White Rock Wind Farm Pty Ltd,White Rock Wind Farm,Wind,172.0,39.47,White Rock Wind Farm,-29.79,151.54,2026-04-03T08:01:26.667680
2026/04/03 18:00:00,YENDWF1,47.04,Lal Lal Wind Farms Nom Co Pty Ltd,Yendon Wind Farm,Wind,142.0,33.13,Yendon Wind Farm,-37.629987,144.022717,2026-04-03T08:01:26.667680
