SETTLEMENTDATE,DUID,SCADAVALUE,Participant,Station Name,Fuel Source - Primary,MAX_CAP,utilisation_pct,Plant,Latitude,Longitude,timestamp_utc
2026/02/07 10:55:00,CAPTL_WF,12.26,Iberdrola Australia Holdings Pty Limited,Capital Wind Farm,Wind,140.0,8.76,Capital Wind Farm,-35.1,149.31,2026-02-07T00:52:21.283916
2026/02/07 10:55:00,CHALLHWF,0.0,Pacific Hydro Challicum Hills Pty Ltd,Challicum Hills Wind Farm,Wind,52.0,0.0,Challicum Hills Wind Farm,-37.38,143.11,2026-02-07T00:52:21.283916
2026/02/07 10:55:00,CULLRGWF,5.55,Cullerin Range Wind Farm Pty Ltd,Cullerin Range Wind Farm,Wind,30.0,18.5,Cullerin Range Wind Farm,-34.81,149.4,2026-02-07T00:52:21.283916
2026/02/07 10:55:00,DIAPURWF1,0.0,Y.E.S. Energy (SA) Pty Ltd,Diapur Wind Farm,Wind,7.0,0.0,Diapur Wind Farm,-36.3425,141.43,2026-02-07T00:52:21.283916
2026/02/07 10:55:00,MLWF1,0.8,Mortons Lane Windfarm Pty Limited,Mortons Lane Wind Farm,Wind,20.0,4.0,Mortons Lane Wind Farm,-37.84,142.45,2026-02-07T00:52:21.283916
2026/02/07 10:55:00,WAUBRAWF,2.73,Pyrenees Wind Energy Developments Pty Ltd,Waubra Wind Farm,Wind,192.0,1.42,Waubra Wind Farm,-37.394498,143.638982,2026-02-07T00:52:21.283916
2026/02/07 10:55:00,WOOLNTH1,19.94,Hydro-Electric Corporation,Woolnorth Studland Bay / Bluff Point Wind Farm,Wind,140.0,14.24,Woolnorth Studland Bay / Bluff Point Wind Farm,-40.69,144.72,2026-02-07T00:52:21.283916
2026/02/07 10:55:00,YAMBUKWF,6.5,Energy Pacific (Vic) Pty Ltd,Yambuk Wind Farm,Wind,30.0,21.67,Yambuk Wind Farm,-38.299083,142.027577,2026-02-07T00:52:21.283916
2026/02/07 10:55:00,YSWF1,0.6,Pacific Hydro Yaloak South Pty Ltd,Yaloak South Wind Farm,Wind,28.0,2.14,Yaloak South Wind Farm,-37.7163,144.242853,2026-02-07T00:52:21.283916
2026/02/07 10:55:00,ARWF1,0.0,Ararat Wind Farm Pty Ltd,Ararat Wind Farm,Wind,241.0,0.0,Ararat Wind Farm,-37.232778,143.031389,2026-02-07T00:52:21.283916
2026/02/07 10:55:00,BALDHWF1,0.0,Alinta Energy Retail Sales Pty Ltd,Bald Hills Wind Farm,Wind,106.0,0.0,Bald Hills Wind Farm,-38.79,145.93,2026-02-07T00:52:21.283916
2026/02/07 10:55:00,BANGOWF1,9.9,BWF Nominees Pty Ltd as The Trustee for BWF Trust,Bango 973 Wind Farm,Wind,155.0,6.39,Bango 973 Wind Farm,-34.551582,148.732808,2026-02-07T00:52:21.283916
2026/02/07 10:55:00,BANGOWF2,4.0,BWF Nominees Pty Ltd as The Trustee for BWF Trust,Bango 999 Wind Farm,Wind,82.0,4.88,Bango 999 Wind Farm,-34.551582,148.732808,2026-02-07T00:52:21.283916
2026/02/07 10:55:00,BLUFF1,0.0,AGL SA Generation Pty Limited,The Bluff Wind Farm,Wind,53.0,0.0,The Bluff Wind Farm,-33.367778,138.728611,2026-02-07T00:52:21.283916
2026/02/07 10:55:00,BOCORWF1,20.41,Boco Rock Wind Farm Pty Ltd,Boco Rock Wind Farm,Wind,111.0,18.39,Boco Rock Wind Farm,-36.578611,149.103333,2026-02-07T00:52:21.283916
2026/02/07 10:55:00,BRYB1WF1,10.53,Berrybank Development Pty Ltd,Berrybank Wind Farm,Wind,175.9,5.99,Berrybank Wind Farm,-37.94,143.52,2026-02-07T00:52:21.283916
2026/02/07 10:55:00,BRYB2WF2,5.87,Berrybank 2 Asset Pty Ltd as trustee for Berrybank 2 Asset Trust,Berrybank 2 Wind Farm,Wind,105.0,5.59,Berrybank 2 Wind Farm,-37.94,143.52,2026-02-07T00:52:21.283916
2026/02/07 10:55:00,BULGANA1,0.0,Bulgana Wind Farm Pty Ltd,Bulgana Green Power Hub,Wind,204.0,0.0,Bulgana Green Power Hub,-37.0975,142.973611,2026-02-07T00:52:21.283916
2026/02/07 10:55:00,CATHROCK,12.6,Cathedral Rocks Wind Farm Pty Ltd,Cathedral Rocks,Wind,66.0,19.09,Cathedral Rocks,-34.51,135.35,2026-02-07T00:52:21.283916
2026/02/07 10:55:00,CHYTWF1,0.0,Cherry Tree Wind Farm Pty Ltd as trustee for The Cherry Tree Project trust ,Cherry Tree Wind Farm,Wind,57.0,0.0,Cherry Tree Wind Farm,-37.1,145.26,2026-02-07T00:52:21.283916
2026/02/07 10:55:00,CLEMGPWF,0.0,Pacific Hydro Clements Gap Pty Ltd,Clements Gap Wind Farm,Wind,57.0,0.0,Clements Gap Wind Farm,-33.48,138.1,2026-02-07T00:52:21.283916
2026/02/07 10:55:00,CLRKCWF1,47.36,Stanwell Corporation Limited ,Clarke Creek Wind Farm,Wind,338.0,14.01,Clarke Creek Wind Farm,-22.85,149.45,2026-02-07T00:52:21.283916
2026/02/07 10:55:00,CLRKCWF2,0.0,Stanwell Corporation Limited ,Clarke Creek Wind Farm,Wind,101.0,0.0,Clarke Creek Wind Farm,-22.85,149.45,2026-02-07T00:52:21.283916
2026/02/07 10:55:00,CNUNDAWF,13.12,Canunda Power Pty Ltd,Canunda Wind Farm,Wind,46.0,28.52,Canunda Wind Farm,-37.73,140.39,2026-02-07T00:52:21.283916
2026/02/07 10:55:00,COLWF01,23.69,Collector Wind Farm Pty Ltd,Collector Wind Farm 1,Wind,219.0,10.82,Collector Wind Farm 1,-34.8719,149.3967,2026-02-07T00:52:21.283916
2026/02/07 10:55:00,COOPGWF1,64.41,PARF Company 10 Pty Limited as The Trustee for Coopers Gap Project Trust,Coopers Gap Wind Farm,Wind,440.0,14.64,Coopers Gap Wind Farm,-26.74,151.45,2026-02-07T00:52:21.283916
2026/02/07 10:55:00,CROOKWF2,8.43,Crookwell Development Pty Ltd ,Crookwell 2 Wind Farm,Wind,91.0,9.26,Crookwell 2 Wind Farm,-34.52,149.54,2026-02-07T00:52:21.283916
2026/02/07 10:55:00,CROOKWF3,8.45,Crookwell 3 Development Pty Ltd,Crookwell 3 Wind Farm,Wind,56.0,15.09,Crookwell 3 Wind Farm,-34.52,149.54,2026-02-07T00:52:21.283916
2026/02/07 10:55:00,CROWLWF1,0.33,Pacific Hydro Crowlands Pty Ltd ,Crowlands Wind Farm,Wind,79.0,0.42,Crowlands Wind Farm,-37.13,143.16,2026-02-07T00:52:21.283916
2026/02/07 10:55:00,CRURWF1,7.1,CRWF Nominees Pty Ltd As Trustee For The CRWF Trust,Crudine Ridge Wind Farm,Wind,138.0,5.14,Crudine Ridge Wind Farm,-32.97,149.64,2026-02-07T00:52:21.283916
2026/02/07 10:55:00,CTHLWF1,6.94,Wild Cattle Hill Pty Ltd,Cattle Hill Wind Farm,Wind,144.0,4.82,Cattle Hill Wind Farm,-42.15,146.69,2026-02-07T00:52:21.283916
2026/02/07 10:55:00,DULAWF1,4.1,Dulacca Energy Project Co Pty Ltd,Dulacca Wind Farm,Wind,173.0,2.37,Dulacca Wind Farm,-26.63,149.87,2026-02-07T00:52:21.283916
2026/02/07 10:55:00,DUNDWF1,3.6,Dundonnell Wind Farm Pty Ltd,Dundonnell Wind Farm,Wind,168.0,2.14,Dundonnell Wind Farm,-37.52,142.58,2026-02-07T00:52:21.283916
2026/02/07 10:55:00,DUNDWF2,0.46,Dundonnell Wind Farm Pty Ltd,Dundonnell Wind Farm,Wind,46.0,1.0,Dundonnell Wind Farm,-37.52,142.58,2026-02-07T00:52:21.283916
2026/02/07 10:55:00,DUNDWF3,1.9,Dundonnell Wind Farm Pty Ltd,Dundonnell Wind Farm,Wind,122.0,1.56,Dundonnell Wind Farm,-37.52,142.58,2026-02-07T00:52:21.283916
2026/02/07 10:55:00,ELAINWF1,3.02,Lal Lal Wind Farms Nom Co Pty Ltd,Elaine Wind Farm,Wind,82.0,3.68,Elaine Wind Farm,-37.36,144.0,2026-02-07T00:52:21.283916
2026/02/07 10:55:00,FLYCRKWF,6.22,Iberdrola Australia Energy Markets Pty Limited,Flyers Creek Wind Farm,Wind,140.0,4.44,Flyers Creek Wind Farm,-33.365556,148.981944,2026-02-07T00:52:21.283916
2026/02/07 10:55:00,GPWFEST1,24.38,Golden Plains WF1 Pty Ltd as Trustee for the Golden Plains WF1 Unit Trust,Golden Plains Wind Farm East,Wind,240.0,10.16,Golden Plains Wind Farm East,-37.945091,143.752614,2026-02-07T00:52:21.283916
2026/02/07 10:55:00,GPWFEST2,21.79,Golden Plains WF1 Pty Ltd as Trustee for the Golden Plains WF1 Unit Trust,Golden Plains Wind Farm East,Wind,253.0,8.61,Golden Plains Wind Farm East,-37.945091,143.752614,2026-02-07T00:52:21.283916
2026/02/07 10:55:00,GPWFEST3,14.83,Golden Plains WF1 Pty Ltd as Trustee for the Golden Plains WF1 Unit Trust,Golden Plains Wind Farm East,Wind,240.0,6.18,Golden Plains Wind Farm East,-37.945091,143.752614,2026-02-07T00:52:21.283916
2026/02/07 10:55:00,GRANWF1,0.83,Granville Harbour Operations Pty Ltd as The Trustee for Granville Harbour Operations Trust,Granville Harbour Wind Farm,Wind,111.0,0.75,Granville Harbour Wind Farm,-41.8,145.06,2026-02-07T00:52:21.283916
2026/02/07 10:55:00,GSWF1A,18.76,Goyder Wind Farm 1 Pty Ltd as the Trustee for Goyder Wind Farm 1 Trust,Goyder South Wind Farm 1A,Wind,201.0,9.33,Goyder South Wind Farm 1A,-33.679758,138.937597,2026-02-07T00:52:21.283916
2026/02/07 10:55:00,GSWF1B1,4.64,Goyder Wind Farm 1B Pty Ltd as the Trustee for the Goyder Wind Farm 1B Trust,Goyder South Wind Farm 1B,Wind,196.0,2.37,Goyder South Wind Farm 1B,-33.679758,138.937597,2026-02-07T00:52:21.283916
2026/02/07 10:55:00,GULLRWF1,23.92,New Gullen Range Wind Farm Pty Ltd,Gullen Range Wind Farm,Wind,161.0,14.86,Gullen Range Wind Farm,-34.34,149.27,2026-02-07T00:52:21.283916
2026/02/07 10:55:00,GULLRWF2,12.07,New Gullen Range Wind Farm Pty Ltd,Gullen Range Wind Farm,Wind,107.0,11.28,Gullen Range Wind Farm,-34.34,149.27,2026-02-07T00:52:21.283916
2026/02/07 10:55:00,GUNNING1,5.23,Gunning Wind Energy Developments Pty Ltd,Gunning Wind Farm,Wind,47.0,11.13,Gunning Wind Farm,-34.813333,149.4,2026-02-07T00:52:21.283916
2026/02/07 10:55:00,HALLWF1,0.0,AGL SA Generation Pty Limited,Hallett 1 Wind Farm,Wind,95.0,0.0,Hallett 1 Wind Farm,-33.367778,138.728611,2026-02-07T00:52:21.283916
2026/02/07 10:55:00,HALLWF2,0.0,AGL SA Generation Pty Limited,Hallett 2 Wind Farm,Wind,71.0,0.0,Hallett 2 Wind Farm,-33.367778,138.728611,2026-02-07T00:52:21.283916
2026/02/07 10:55:00,HD1WF1,3.27,Hawkesdale Asset Pty Ltd as trustee for Hawkesdale Asset Trust,Hawkesdale Wind Farm,Wind,89.0,3.67,Hawkesdale Wind Farm,-38.147894,142.361381,2026-02-07T00:52:21.283916
2026/02/07 10:55:00,HDWF1,5.2,HWF1 Pty Ltd,Hornsdale Wind Farm,Wind,102.0,5.1,Hornsdale Wind Farm,-33.050556,138.543611,2026-02-07T00:52:21.283916
2026/02/07 10:55:00,HDWF2,7.5,HWF 2 Pty Ltd,Hornsdale Wind Farm 2,Wind,102.0,7.35,Hornsdale Wind Farm 2,-33.06,138.54,2026-02-07T00:52:21.283916
2026/02/07 10:55:00,HDWF3,4.1,HWF3 Pty Ltd,Hornsdale Wind Farm 3,Wind,109.0,3.76,Hornsdale Wind Farm 3,-33.06,138.54,2026-02-07T00:52:21.283916
2026/02/07 10:55:00,KABANWF1,0.65,Kaban Wind Farm Pty Ltd as trustee for Kaban Wind Farm Trust,Kaban Wind Farm,Wind,152.0,0.43,Kaban Wind Farm,-17.56,145.41,2026-02-07T00:52:21.283916
2026/02/07 10:55:00,KEPWF1,5.8,Kennedy Energy Park Pty Ltd,Kennedy Energy Park,Wind,43.0,13.49,Kennedy Energy Park,-20.88,144.42,2026-02-07T00:52:21.283916
2026/02/07 10:55:00,KIATAWF1,0.0,Kiata ProjectCo Pty Ltd Atf Kiata Project Trust,Kiata Wind Farm,Wind,31.0,0.0,Kiata Wind Farm,-36.4,141.75,2026-02-07T00:52:21.283916
2026/02/07 10:55:00,LGAPWF1,0.0,Lincoln Gap Wind Farm (Operations) Pty Ltd,Lincoln Gap Wind Farm,Wind,123.0,0.0,Lincoln Gap Wind Farm,-32.564279,137.557328,2026-02-07T00:52:21.283916
2026/02/07 10:55:00,LGAPWF1,0.0,Lincoln Gap Wind Farm (Operations) Pty Ltd,Lincoln Gap Wind Farm,Wind,123.0,0.0,Lincoln Gap Wind Farm,-32.564279,137.557328,2026-02-07T00:52:21.283916
2026/02/07 10:55:00,LGAPWF2,0.0,Lincoln Gap Wind Farm (Operations) Pty Ltd,Lincoln Gap Wind Farm,Wind,85.0,0.0,Lincoln Gap Wind Farm,-32.564279,137.557328,2026-02-07T00:52:21.283916
2026/02/07 10:55:00,LGAPWF2,0.0,Lincoln Gap Wind Farm (Operations) Pty Ltd,Lincoln Gap Wind Farm,Wind,85.0,0.0,Lincoln Gap Wind Farm,-32.564279,137.557328,2026-02-07T00:52:21.283916
2026/02/07 10:55:00,LKBONNY1,11.25,Lake Bonney Wind Power Pty Ltd,Lake Bonney Wind Farm Stage 1,Wind,81.0,13.89,Lake Bonney Wind Farm Stage 1,-37.76,140.4,2026-02-07T00:52:21.283916
2026/02/07 10:55:00,LKBONNY2,36.34,Lake Bonney Wind Power Pty Ltd,Lake Bonney Stage 2 Windfarm,Wind,159.0,22.86,Lake Bonney Stage 2 Windfarm,-37.76,140.4,2026-02-07T00:52:21.283916
2026/02/07 10:55:00,LKBONNY3,6.81,Lake Bonney Wind Power Pty Ltd,Lake Bonney Stage 3 Wind Farm,Wind,39.0,17.46,Lake Bonney Stage 3 Wind Farm,-37.737781,140.388137,2026-02-07T00:52:21.283916
2026/02/07 10:55:00,MACARTH1,17.9,AGL Hydro Partnership,Macarthur Wind Farm,Wind,420.0,4.26,Macarthur Wind Farm,-38.048957,142.192112,2026-02-07T00:52:21.283916
2026/02/07 10:55:00,MCINTYR1,43.95,MacIntyre UJV Operator Pty Ltd,MacIntyre Wind Farm,Wind,890.0,4.94,MacIntyre Wind Farm,-28.32,151.54,2026-02-07T00:52:21.283916
2026/02/07 10:55:00,MERCER01,4.8,Mt Mercer Windfarm Pty Ltd,Mt Mercer Wind Farm,Wind,131.0,3.66,Mt Mercer Wind Farm,-37.841111,143.871111,2026-02-07T00:52:21.283916
2026/02/07 10:55:00,MEWF1,36.45,Ergon Energy Queensland Pty Ltd ,Mount Emerald Wind Farm,Wind,178.0,20.48,Mount Emerald Wind Farm,-17.133007,145.380644,2026-02-07T00:52:21.283916
2026/02/07 10:55:00,MRTLSWF1,7.33,Mortlake South Wind Farm Pty Ltd,Mortlake South Wind Farm,Wind,153.0,4.79,Mortlake South Wind Farm,-38.127337,142.857801,2026-02-07T00:52:21.283916
2026/02/07 10:55:00,MTGELWF1,15.85,Mt. Gellibrand Wind Farm Pty Ltd,Mt Gellibrand Wind Farm,Wind,132.0,12.01,Mt Gellibrand Wind Farm,-38.23,143.77,2026-02-07T00:52:21.283916
2026/02/07 10:55:00,MTMILLAR,2.4,Mt Millar Wind Farm Pty Ltd,Mt Millar Wind Farm,Wind,70.0,3.43,Mt Millar Wind Farm,-33.624444,136.703611,2026-02-07T00:52:21.283916
2026/02/07 10:55:00,MUSSELR1,16.0,Hydro-Electric Corporation,Musselroe Wind Farm,Wind,168.0,9.52,Musselroe Wind Farm,-40.780225,148.010799,2026-02-07T00:52:21.283916
2026/02/07 10:55:00,MUWAWF1,0.0,Telstra Energy (Generation) Pty Ltd,Murra Warra Wind Farm,Wind,225.7,0.0,Murra Warra Wind Farm,-36.432404,142.317853,2026-02-07T00:52:21.283916
2026/02/07 10:55:00,MUWAWF2,0.0,Murra Warra II Project Co Pty Ltd ATF The Murra Warra II Project Trust,Murra Warra Wind Farm Stage 2,Wind,203.0,0.0,Murra Warra Wind Farm Stage 2,-36.43,142.32,2026-02-07T00:52:21.283916
2026/02/07 10:55:00,NBHWF1,0.0,AGL SA Generation Pty Limited,North Brown Hill Wind Farm,Wind,132.0,0.0,North Brown Hill Wind Farm,-33.367778,138.728611,2026-02-07T00:52:21.283916
2026/02/07 10:55:00,OAKLAND1,0.0,AGL Hydro Partnership,Oaklands Hill Wind Farm,Wind,63.0,0.0,Oaklands Hill Wind Farm,-37.683078,142.551678,2026-02-07T00:52:21.283916
2026/02/07 10:55:00,PAREPW1,0.0,Iberdrola Australia Energy Markets Pty Limited,Port Augusta Renewable Energy Park,Wind,201.0,0.0,Port Augusta Renewable Energy Park,-32.566944,137.856111,2026-02-07T00:52:21.283916
2026/02/07 10:55:00,RYANCWF1,19.07,Ryan Corner Development Pty Ltd,Ryan Corner Wind Farm,Wind,205.0,9.3,Ryan Corner Wind Farm,-38.271017,142.140647,2026-02-07T00:52:21.283916
2026/02/07 10:55:00,RYEPARK1,30.84,Rye Park Renewable Energy Pty Ltd as trustee for Rye Park Wind Farm Trust,Rye Park Renewable Energy,Wind,384.0,8.03,Rye Park Renewable Energy,-32.138333,148.972778,2026-02-07T00:52:21.283916
2026/02/07 10:55:00,SALTCRK1,1.66,Salt Creek Wind Farm Pty Ltd,Salt Creek Wind Farm,Wind,54.0,3.07,Salt Creek Wind Farm,-37.95,142.63,2026-02-07T00:52:21.283916
2026/02/07 10:55:00,SAPHWF1,63.45,The Trustee For The SWF1 Operations Trust,Sapphire Wind Farm,Wind,270.0,23.5,Sapphire Wind Farm,-29.7,151.41,2026-02-07T00:52:21.283916
2026/02/07 10:55:00,SNOWNTH1,0.0,Snowtown Wind Farm Stage 2 Pty Ltd,Snowtown Wind Farm Stage 2 North,Wind,144.0,0.0,Snowtown Wind Farm Stage 2 North,-33.83,138.118611,2026-02-07T00:52:21.283916
2026/02/07 10:55:00,SNOWSTH1,0.0,Snowtown Wind Farm Stage 2 Pty Ltd,Snowtown South Wind Farm,Wind,126.0,0.0,Snowtown South Wind Farm,-33.83,138.118611,2026-02-07T00:52:21.283916
2026/02/07 10:55:00,SNOWTWN1,0.0,Snowtown Wind Farm Pty Ltd,Snowtown Wind Farm Units 1 And 47,Wind,99.0,0.0,Snowtown Wind Farm Units 1 And 47,-33.83,138.118611,2026-02-07T00:52:21.283916
2026/02/07 10:55:00,STARHLWF,7.2,Starfish Hill Wind Farm Pty Ltd,Starfish Hill Wind Farm,Wind,35.0,20.57,Starfish Hill Wind Farm,-35.58,138.14,2026-02-07T00:52:21.283916
2026/02/07 10:55:00,STOCKYD1,7.01,Stockyard Hill Wind Farm Pty Ltd,Stockyard Hill Wind Farm,Wind,511.0,1.37,Stockyard Hill Wind Farm,-37.535833,143.251389,2026-02-07T00:52:21.283916
2026/02/07 10:55:00,STWF1,3.8,PARF Company 8 Pty Ltd as The Trustee for Silverton Project Trust,Silverton Wind Farm,Wind,198.0,1.92,Silverton Wind Farm,-37.683168,142.551678,2026-02-07T00:52:21.283916
2026/02/07 10:55:00,TARALGA1,13.21,Taralga Wind Farm Nominees No 2 Pty Ltd (ATF Taralga Wind Farm Operating Trust),Taralga Wind Farm,Wind,106.0,12.46,Taralga Wind Farm,-34.42352,149.826267,2026-02-07T00:52:21.283916
2026/02/07 10:55:00,WAMBOWF1,11.09,Stanwell Corporation Limited,Wambo Wind Farm 1,Wind,245.0,4.53,Wambo Wind Farm 1,-35.187301,149.524945,2026-02-07T00:52:21.283916
2026/02/07 10:55:00,WATERLWF,23.2,Waterloo Wind Farm Pty Ltd,Waterloo Wind Farm,Wind,130.0,17.85,Waterloo Wind Farm,-34.00094,138.911567,2026-02-07T00:52:21.283916
2026/02/07 10:55:00,WGWF1,0.0,Willogoleche Power Pty Ltd As The Trustee For The Willogoleche Operating Trust,Willogoleche Wind Farm,Wind,119.0,0.0,Willogoleche Wind Farm,-33.39,138.85,2026-02-07T00:52:21.283916
2026/02/07 10:55:00,WOODLWN1,11.54,Woodlawn Wind Pty Ltd,Woodlawn Wind Farm,Wind,48.0,24.04,Woodlawn Wind Farm,-35.08,149.62,2026-02-07T00:52:21.283916
2026/02/07 10:55:00,WPWF,56.76,AGL SA Generation Pty Limited,Wattle Point Wind Farm,Wind,91.0,62.37,Wattle Point Wind Farm,-35.111624,137.7219,2026-02-07T00:52:21.283916
2026/02/07 10:55:00,WRWF1,75.8,White Rock Wind Farm Pty Ltd,White Rock Wind Farm,Wind,172.0,44.07,White Rock Wind Farm,-29.79,151.54,2026-02-07T00:52:21.283916
2026/02/07 10:55:00,YENDWF1,2.26,Lal Lal Wind Farms Nom Co Pty Ltd,Yendon Wind Farm,Wind,142.0,1.59,Yendon Wind Farm,-37.629987,144.022717,2026-02-07T00:52:21.283916
