SETTLEMENTDATE,DUID,SCADAVALUE,Participant,Station Name,Fuel Source - Primary,REG_CAP,utilisation_pct,Plant,Latitude,Longitude,timestamp_utc
2026/01/30 15:10:00,CAPTL_WF,98.24,Iberdrola Australia Holdings Pty Limited,Capital Wind Farm,Wind,140.0,70.17,Capital Wind Farm,-35.1,149.31,2026-01-30T05:11:01.624036
2026/01/30 15:10:00,CHALLHWF,5.9,Pacific Hydro Challicum Hills Pty Ltd,Challicum Hills Wind Farm,Wind,52.5,11.24,Challicum Hills Wind Farm,-37.38,143.11,2026-01-30T05:11:01.624036
2026/01/30 15:10:00,CULLRGWF,8.98,Cullerin Range Wind Farm Pty Ltd,Cullerin Range Wind Farm,Wind,30.0,29.93,Cullerin Range Wind Farm,-34.81,149.4,2026-01-30T05:11:01.624036
2026/01/30 15:10:00,DIAPURWF1,1.8,Y.E.S. Energy (SA) Pty Ltd,Diapur Wind Farm,Wind,8.0,22.5,Diapur Wind Farm,-36.3425,141.43,2026-01-30T05:11:01.624036
2026/01/30 15:10:00,MLWF1,6.2,Mortons Lane Windfarm Pty Limited,Mortons Lane Wind Farm,Wind,20.0,31.0,Mortons Lane Wind Farm,-37.84,142.45,2026-01-30T05:11:01.624036
2026/01/30 15:10:00,WAUBRAWF,79.05,Pyrenees Wind Energy Developments Pty Ltd,Waubra Wind Farm,Wind,192.0,41.17,Waubra Wind Farm,-37.394498,143.638982,2026-01-30T05:11:01.624036
2026/01/30 15:10:00,WOOLNTH1,15.07,Hydro-Electric Corporation,Woolnorth Studland Bay / Bluff Point Wind Farm,Wind,140.0,10.76,Woolnorth Studland Bay / Bluff Point Wind Farm,-40.69,144.72,2026-01-30T05:11:01.624036
2026/01/30 15:10:00,YAMBUKWF,3.2,Energy Pacific (Vic) Pty Ltd,Yambuk Wind Farm,Wind,30.0,10.67,Yambuk Wind Farm,-38.299083,142.027577,2026-01-30T05:11:01.624036
2026/01/30 15:10:00,YSWF1,5.0,Pacific Hydro Yaloak South Pty Ltd,Yaloak South Wind Farm,Wind,28.7,17.42,Yaloak South Wind Farm,-37.7163,144.242853,2026-01-30T05:11:01.624036
2026/01/30 15:10:00,ARWF1,62.3,Ararat Wind Farm Pty Ltd,Ararat Wind Farm,Wind,241.59,25.79,Ararat Wind Farm,-37.232778,143.031389,2026-01-30T05:11:01.624036
2026/01/30 15:10:00,BALDHWF1,13.82,Alinta Energy Retail Sales Pty Ltd,Bald Hills Wind Farm,Wind,106.6,12.96,Bald Hills Wind Farm,-38.79,145.93,2026-01-30T05:11:01.624036
2026/01/30 15:10:00,BANGOWF1,29.8,BWF Nominees Pty Ltd as The Trustee for BWF Trust,Bango 973 Wind Farm,Wind,159.0,18.74,Bango 973 Wind Farm,-34.551582,148.732808,2026-01-30T05:11:01.624036
2026/01/30 15:10:00,BANGOWF2,16.9,BWF Nominees Pty Ltd as The Trustee for BWF Trust,Bango 999 Wind Farm,Wind,84.8,19.93,Bango 999 Wind Farm,-34.551582,148.732808,2026-01-30T05:11:01.624036
2026/01/30 15:10:00,BLUFF1,8.4,AGL SA Generation Pty Limited,The Bluff Wind Farm,Wind,52.5,16.0,The Bluff Wind Farm,-33.367778,138.728611,2026-01-30T05:11:01.624036
2026/01/30 15:10:00,BOCORWF1,21.87,Boco Rock Wind Farm Pty Ltd,Boco Rock Wind Farm,Wind,113.18,19.32,Boco Rock Wind Farm,-36.578611,149.103333,2026-01-30T05:11:01.624036
2026/01/30 15:10:00,BRYB1WF1,53.05,Berrybank Development Pty Ltd,Berrybank Wind Farm,Wind,180.6,29.37,Berrybank Wind Farm,-37.94,143.52,2026-01-30T05:11:01.624036
2026/01/30 15:10:00,BRYB2WF2,32.48,Berrybank 2 Asset Pty Ltd as trustee for Berrybank 2 Asset Trust,Berrybank 2 Wind Farm,Wind,109.0,29.8,Berrybank 2 Wind Farm,-37.94,143.52,2026-01-30T05:11:01.624036
2026/01/30 15:10:00,BULGANA1,0.0,Bulgana Wind Farm Pty Ltd,Bulgana Green Power Hub,Wind,204.0,0.0,Bulgana Green Power Hub,-37.0975,142.973611,2026-01-30T05:11:01.624036
2026/01/30 15:10:00,CATHROCK,11.6,Cathedral Rocks Wind Farm Pty Ltd,Cathedral Rocks,Wind,66.0,17.58,Cathedral Rocks,34.51,135.35,2026-01-30T05:11:01.624036
2026/01/30 15:10:00,CHYTWF1,1.71,Cherry Tree Wind Farm Pty Ltd as trustee for The Cherry Tree Project trust ,Cherry Tree Wind Farm,Wind,57.6,2.97,Cherry Tree Wind Farm,-37.1,145.26,2026-01-30T05:11:01.624036
2026/01/30 15:10:00,CLEMGPWF,1.58,Pacific Hydro Clements Gap Pty Ltd,Clements Gap Wind Farm,Wind,57.0,2.77,Clements Gap Wind Farm,-33.48,138.1,2026-01-30T05:11:01.624036
2026/01/30 15:10:00,CLRKCWF1,30.75,Stanwell Corporation Limited ,Clarke Creek Wind Farm,Wind,345.5,8.9,Clarke Creek Wind Farm,-22.85,149.45,2026-01-30T05:11:01.624036
2026/01/30 15:10:00,CLRKCWF2,8.67,Stanwell Corporation Limited ,Clarke Creek Wind Farm,Wind,103.5,8.38,Clarke Creek Wind Farm,-22.85,149.45,2026-01-30T05:11:01.624036
2026/01/30 15:10:00,CNUNDAWF,4.51,Canunda Power Pty Ltd,Canunda Wind Farm,Wind,46.0,9.8,Canunda Wind Farm,-37.73,140.39,2026-01-30T05:11:01.624036
2026/01/30 15:10:00,COLWF01,71.75,Collector Wind Farm Pty Ltd,Collector Wind Farm 1,Wind,226.0,31.75,Collector Wind Farm 1,-34.8719,149.3967,2026-01-30T05:11:01.624036
2026/01/30 15:10:00,COOPGWF1,81.22,PARF Company 10 Pty Limited as The Trustee for Coopers Gap Project Trust,Coopers Gap Wind Farm,Wind,452.0,17.97,Coopers Gap Wind Farm,-26.74,151.45,2026-01-30T05:11:01.624036
2026/01/30 15:10:00,CROOKWF2,40.31,Crookwell Development Pty Ltd ,Crookwell 2 Wind Farm,Wind,96.04,41.97,Crookwell 2 Wind Farm,-34.52,149.54,2026-01-30T05:11:01.624036
2026/01/30 15:10:00,CROOKWF3,29.38,Crookwell 3 Development Pty Ltd,Crookwell 3 Wind Farm,Wind,57.0,51.54,Crookwell 3 Wind Farm,-34.52,149.54,2026-01-30T05:11:01.624036
2026/01/30 15:10:00,CROWLWF1,25.24,Pacific Hydro Crowlands Pty Ltd ,Crowlands Wind Farm,Wind,79.95,31.57,Crowlands Wind Farm,-37.13,143.16,2026-01-30T05:11:01.624036
2026/01/30 15:10:00,CRURWF1,4.9,CRWF Nominees Pty Ltd As Trustee For The CRWF Trust,Crudine Ridge Wind Farm,Wind,141.0,3.48,Crudine Ridge Wind Farm,-32.97,149.64,2026-01-30T05:11:01.624036
2026/01/30 15:10:00,CTHLWF1,0.0,Wild Cattle Hill Pty Ltd,Cattle Hill Wind Farm,Wind,148.0,0.0,Cattle Hill Wind Farm,-42.15,146.69,2026-01-30T05:11:01.624036
2026/01/30 15:10:00,DULAWF1,34.9,Dulacca Energy Project Co Pty Ltd,Dulacca Wind Farm,Wind,180.0,19.39,Dulacca Wind Farm,-26.63,149.87,2026-01-30T05:11:01.624036
2026/01/30 15:10:00,DUNDWF1,83.58,Dundonnell Wind Farm Pty Ltd,Dundonnell Wind Farm,Wind,168.0,49.75,Dundonnell Wind Farm,-37.52,142.58,2026-01-30T05:11:01.624036
2026/01/30 15:10:00,DUNDWF2,23.2,Dundonnell Wind Farm Pty Ltd,Dundonnell Wind Farm,Wind,46.0,50.43,Dundonnell Wind Farm,-37.52,142.58,2026-01-30T05:11:01.624036
2026/01/30 15:10:00,DUNDWF3,52.41,Dundonnell Wind Farm Pty Ltd,Dundonnell Wind Farm,Wind,121.0,43.31,Dundonnell Wind Farm,-37.52,142.58,2026-01-30T05:11:01.624036
2026/01/30 15:10:00,ELAINWF1,13.99,Lal Lal Wind Farms Nom Co Pty Ltd,Elaine Wind Farm,Wind,83.6,16.73,Elaine Wind Farm,-37.36,144,2026-01-30T05:11:01.624036
2026/01/30 15:10:00,FLYCRKWF,9.83,Iberdrola Australia Energy Markets Pty Limited,Flyers Creek Wind Farm,Wind,145.0,6.78,Flyers Creek Wind Farm,-33.365556,148.981944,2026-01-30T05:11:01.624036
2026/01/30 15:10:00,GPWFEST1,33.62,Golden Plains WF1 Pty Ltd as Trustee for the Golden Plains WF1 Unit Trust,Golden Plains Wind Farm East,Wind,248.0,13.56,Golden Plains Wind Farm East,-37.945091,143.752614,2026-01-30T05:11:01.624036
2026/01/30 15:10:00,GPWFEST2,38.78,Golden Plains WF1 Pty Ltd as Trustee for the Golden Plains WF1 Unit Trust,Golden Plains Wind Farm East,Wind,260.4,14.89,Golden Plains Wind Farm East,-37.945091,143.752614,2026-01-30T05:11:01.624036
2026/01/30 15:10:00,GPWFEST3,34.64,Golden Plains WF1 Pty Ltd as Trustee for the Golden Plains WF1 Unit Trust,Golden Plains Wind Farm East,Wind,248.0,13.97,Golden Plains Wind Farm East,-37.945091,143.752614,2026-01-30T05:11:01.624036
2026/01/30 15:10:00,GRANWF1,6.43,Granville Harbour Operations Pty Ltd as The Trustee for Granville Harbour Operations Trust,Granville Harbour Wind Farm,Wind,110.0,5.85,Granville Harbour Wind Farm,-41.8,145.06,2026-01-30T05:11:01.624036
2026/01/30 15:10:00,GSWF1A,6.25,Goyder Wind Farm 1 Pty Ltd as the Trustee for Goyder Wind Farm 1 Trust,Goyder South Wind Farm 1A,Wind,209.0,2.99,Goyder South Wind Farm 1A,-33.679758,138.937597,2026-01-30T05:11:01.624036
2026/01/30 15:10:00,GSWF1B1,8.42,Goyder Wind Farm 1B Pty Ltd as the Trustee for the Goyder Wind Farm 1B Trust,Goyder South Wind Farm 1B,Wind,203.0,4.15,Goyder South Wind Farm 1B,-33.679758,138.937597,2026-01-30T05:11:01.624036
2026/01/30 15:10:00,GULLRWF1,55.74,New Gullen Range Wind Farm Pty Ltd,Gullen Range Wind Farm,Wind,165.0,33.78,Gullen Range Wind Farm,-34.34,149.27,2026-01-30T05:11:01.624036
2026/01/30 15:10:00,GULLRWF2,35.64,New Gullen Range Wind Farm Pty Ltd,Gullen Range Wind Farm,Wind,110.0,32.4,Gullen Range Wind Farm,-34.34,149.27,2026-01-30T05:11:01.624036
2026/01/30 15:10:00,GUNNING1,26.25,Gunning Wind Energy Developments Pty Ltd,Gunning Wind Farm,Wind,46.5,56.45,Gunning Wind Farm,-34.813333,149.4,2026-01-30T05:11:01.624036
2026/01/30 15:10:00,HALLWF1,12.1,AGL SA Generation Pty Limited,Hallett 1 Wind Farm,Wind,94.5,12.8,Hallett 1 Wind Farm,-33.367778,138.728611,2026-01-30T05:11:01.624036
2026/01/30 15:10:00,HALLWF2,2.07,AGL SA Generation Pty Limited,Hallett 2 Wind Farm,Wind,71.4,2.9,Hallett 2 Wind Farm,-33.367778,138.728611,2026-01-30T05:11:01.624036
2026/01/30 15:10:00,HD1WF1,26.8,Hawkesdale Asset Pty Ltd as trustee for Hawkesdale Asset Trust,Hawkesdale Wind Farm,Wind,96.6,27.74,Hawkesdale Wind Farm,-38.147894,142.361381,2026-01-30T05:11:01.624036
2026/01/30 15:10:00,HDWF1,7.1,HWF1 Pty Ltd,Hornsdale Wind Farm,Wind,102.4,6.93,Hornsdale Wind Farm,-33.050556,138.543611,2026-01-30T05:11:01.624036
2026/01/30 15:10:00,HDWF2,3.3,HWF 2 Pty Ltd,Hornsdale Wind Farm 2,Wind,102.4,3.22,Hornsdale Wind Farm 2,-33.06,138.54,2026-01-30T05:11:01.624036
2026/01/30 15:10:00,HDWF3,6.4,HWF3 Pty Ltd,Hornsdale Wind Farm 3,Wind,112.0,5.71,Hornsdale Wind Farm 3,-33.06,138.54,2026-01-30T05:11:01.624036
2026/01/30 15:10:00,KABANWF1,13.01,Kaban Wind Farm Pty Ltd as trustee for Kaban Wind Farm Trust,Kaban Wind Farm,Wind,156.0,8.34,Kaban Wind Farm,-17.56,145.41,2026-01-30T05:11:01.624036
2026/01/30 15:10:00,KEPWF1,0.0,Kennedy Energy Park Pty Ltd,Kennedy Energy Park,Wind,43.0,0.0,Kennedy Energy Park,-20.88,144.42,2026-01-30T05:11:01.624036
2026/01/30 15:10:00,KIATAWF1,11.7,Kiata ProjectCo Pty Ltd Atf Kiata Project Trust,Kiata Wind Farm,Wind,31.05,37.68,Kiata Wind Farm,-36.4,141.75,2026-01-30T05:11:01.624036
2026/01/30 15:10:00,LGAPWF1,4.1,Lincoln Gap Wind Farm (Operations) Pty Ltd,Lincoln Gap Wind Farm,Wind,126.0,3.25,Lincoln Gap Wind Farm,-32.564279,137.557328,2026-01-30T05:11:01.624036
2026/01/30 15:10:00,LGAPWF1,4.1,Lincoln Gap Wind Farm (Operations) Pty Ltd,Lincoln Gap Wind Farm,Wind,126.0,3.25,Lincoln Gap Wind Farm,-32.564279,137.557328,2026-01-30T05:11:01.624036
2026/01/30 15:10:00,LGAPWF2,9.95,Lincoln Gap Wind Farm (Operations) Pty Ltd,Lincoln Gap Wind Farm,Wind,86.0,11.57,Lincoln Gap Wind Farm,-32.564279,137.557328,2026-01-30T05:11:01.624036
2026/01/30 15:10:00,LGAPWF2,9.95,Lincoln Gap Wind Farm (Operations) Pty Ltd,Lincoln Gap Wind Farm,Wind,86.0,11.57,Lincoln Gap Wind Farm,-32.564279,137.557328,2026-01-30T05:11:01.624036
2026/01/30 15:10:00,LKBONNY1,10.72,Lake Bonney Wind Power Pty Ltd,Lake Bonney Wind Farm Stage 1,Wind,80.5,13.32,Lake Bonney Wind Farm Stage 1,-37.76,140.4,2026-01-30T05:11:01.624036
2026/01/30 15:10:00,LKBONNY2,11.69,Lake Bonney Wind Power Pty Ltd,Lake Bonney Stage 2 Windfarm,Wind,159.0,7.35,Lake Bonney Stage 2 Windfarm,-37.76,140.4,2026-01-30T05:11:01.624036
2026/01/30 15:10:00,LKBONNY3,2.96,Lake Bonney Wind Power Pty Ltd,Lake Bonney Stage 3 Wind Farm,Wind,39.0,7.59,Lake Bonney Stage 3 Wind Farm,-37.737781,140.388137,2026-01-30T05:11:01.624036
2026/01/30 15:10:00,MACARTH1,81.4,AGL Hydro Partnership,Macarthur Wind Farm,Wind,420.0,19.38,Macarthur Wind Farm,-38.048957,142.192112,2026-01-30T05:11:01.624036
2026/01/30 15:10:00,MCINTYR1,33.99,MacIntyre UJV Operator Pty Ltd,MacIntyre Wind Farm,Wind,923.0,3.68,MacIntyre Wind Farm,-28.32,151.54,2026-01-30T05:11:01.624036
2026/01/30 15:10:00,MERCER01,21.8,Mt Mercer Windfarm Pty Ltd,Mt Mercer Wind Farm,Wind,131.2,16.62,Mt Mercer Wind Farm,-37.841111,143.871111,2026-01-30T05:11:01.624036
2026/01/30 15:10:00,MEWF1,3.0,Ergon Energy Queensland Pty Ltd ,Mount Emerald Wind Farm,Wind,180.0,1.67,Mount Emerald Wind Farm,-17.133007,145.380644,2026-01-30T05:11:01.624036
2026/01/30 15:10:00,MRTLSWF1,62.93,Mortlake South Wind Farm Pty Ltd,Mortlake South Wind Farm,Wind,157.5,39.96,Mortlake South Wind Farm,-38.127337,142.857801,2026-01-30T05:11:01.624036
2026/01/30 15:10:00,MTGELWF1,14.21,Mt. Gellibrand Wind Farm Pty Ltd,Mt Gellibrand Wind Farm,Wind,138.0,10.3,Mt Gellibrand Wind Farm,-38.23,143.77,2026-01-30T05:11:01.624036
2026/01/30 15:10:00,MTMILLAR,21.1,Mt Millar Wind Farm Pty Ltd,Mt Millar Wind Farm,Wind,70.0,30.14,Mt Millar Wind Farm,-33.624444,136.703611,2026-01-30T05:11:01.624036
2026/01/30 15:10:00,MUSSELR1,40.8,Hydro-Electric Corporation,Musselroe Wind Farm,Wind,168.0,24.29,Musselroe Wind Farm,-40.780225,148.010799,2026-01-30T05:11:01.624036
2026/01/30 15:10:00,MUWAWF1,52.33,Telstra Energy (Generation) Pty Ltd,Murra Warra Wind Farm,Wind,231.8,22.58,Murra Warra Wind Farm,-36.432404,142.317853,2026-01-30T05:11:01.624036
2026/01/30 15:10:00,MUWAWF2,46.9,Murra Warra II Project Co Pty Ltd ATF The Murra Warra II Project Trust,Murra Warra Wind Farm Stage 2,Wind,209.0,22.44,Murra Warra Wind Farm Stage 2,-36.43,142.32,2026-01-30T05:11:01.624036
2026/01/30 15:10:00,NBHWF1,5.1,AGL SA Generation Pty Limited,North Brown Hill Wind Farm,Wind,132.3,3.85,North Brown Hill Wind Farm,-33.367778,138.728611,2026-01-30T05:11:01.624036
2026/01/30 15:10:00,OAKLAND1,28.6,AGL Hydro Partnership,Oaklands Hill Wind Farm,Wind,67.0,42.69,Oaklands Hill Wind Farm,-37.683078,142.551678,2026-01-30T05:11:01.624036
2026/01/30 15:10:00,PAREPW1,155.26,Iberdrola Australia Energy Markets Pty Limited,Port Augusta Renewable Energy Park,Wind,210.0,73.93,Port Augusta Renewable Energy Park,-32.566944,137.856111,2026-01-30T05:11:01.624036
2026/01/30 15:10:00,RYANCWF1,20.91,Ryan Corner Development Pty Ltd,Ryan Corner Wind Farm,Wind,218.4,9.57,Ryan Corner Wind Farm,-38.271017,142.140647,2026-01-30T05:11:01.624036
2026/01/30 15:10:00,RYEPARK1,110.26,Rye Park Renewable Energy Pty Ltd as trustee for Rye Park Wind Farm Trust,Rye Park Renewable Energy,Wind,396.0,27.84,Rye Park Renewable Energy,-32.138333,148.972778,2026-01-30T05:11:01.624036
2026/01/30 15:10:00,SALTCRK1,12.22,Salt Creek Wind Farm Pty Ltd,Salt Creek Wind Farm,Wind,54.0,22.63,Salt Creek Wind Farm,-37.95,142.63,2026-01-30T05:11:01.624036
2026/01/30 15:10:00,SAPHWF1,0.0,The Trustee For The SWF1 Operations Trust,Sapphire Wind Farm,Wind,270.0,0.0,Sapphire Wind Farm,-29.7,151.41,2026-01-30T05:11:01.624036
2026/01/30 15:10:00,SNOWNTH1,12.6,Snowtown Wind Farm Stage 2 Pty Ltd,Snowtown Wind Farm Stage 2 North,Wind,144.0,8.75,Snowtown Wind Farm Stage 2 North,-33.83,138.118611,2026-01-30T05:11:01.624036
2026/01/30 15:10:00,SNOWSTH1,3.2,Snowtown Wind Farm Stage 2 Pty Ltd,Snowtown South Wind Farm,Wind,126.0,2.54,Snowtown South Wind Farm,-33.83,138.118611,2026-01-30T05:11:01.624036
2026/01/30 15:10:00,SNOWTWN1,2.21,Snowtown Wind Farm Pty Ltd,Snowtown Wind Farm Units 1 And 47,Wind,99.0,2.23,Snowtown Wind Farm Units 1 And 47,-33.83,138.118611,2026-01-30T05:11:01.624036
2026/01/30 15:10:00,STARHLWF,22.49,Starfish Hill Wind Farm Pty Ltd,Starfish Hill Wind Farm,Wind,34.5,65.19,Starfish Hill Wind Farm,-35.58,138.14,2026-01-30T05:11:01.624036
2026/01/30 15:10:00,STOCKYD1,300.66,Stockyard Hill Wind Farm Pty Ltd,Stockyard Hill Wind Farm,Wind,531.0,56.62,Stockyard Hill Wind Farm,-37.535833,143.251389,2026-01-30T05:11:01.624036
2026/01/30 15:10:00,STWF1,0.0,PARF Company 8 Pty Ltd as The Trustee for Silverton Project Trust,Silverton Wind Farm,Wind,198.94,0.0,Silverton Wind Farm,-37.683168,142.551678,2026-01-30T05:11:01.624036
2026/01/30 15:10:00,TARALGA1,38.53,Taralga Wind Farm Nominees No 2 Pty Ltd (ATF Taralga Wind Farm Operating Trust),Taralga Wind Farm,Wind,106.8,36.08,Taralga Wind Farm,-34.42352,149.826267,2026-01-30T05:11:01.624036
2026/01/30 15:10:00,WAMBOWF1,28.26,Stanwell Corporation Limited,Wambo Wind Farm 1,Wind,252.0,11.21,Wambo Wind Farm 1,-35.187301,149.524945,2026-01-30T05:11:01.624036
2026/01/30 15:10:00,WATERLWF,14.7,Waterloo Wind Farm Pty Ltd,Waterloo Wind Farm,Wind,130.8,11.24,Waterloo Wind Farm,-34.00094,138.911567,2026-01-30T05:11:01.624036
2026/01/30 15:10:00,WGWF1,8.7,Willogoleche Power Pty Ltd As The Trustee For The Willogoleche Operating Trust,Willogoleche Wind Farm,Wind,119.0,7.31,Willogoleche Wind Farm,-33.39,138.85,2026-01-30T05:11:01.624036
2026/01/30 15:10:00,WOODLWN1,28.61,Woodlawn Wind Pty Ltd,Woodlawn Wind Farm,Wind,48.3,59.23,Woodlawn Wind Farm,-35.08,149.62,2026-01-30T05:11:01.624036
2026/01/30 15:10:00,WPWF,79.39,AGL SA Generation Pty Limited,Wattle Point Wind Farm,Wind,90.75,87.48,Wattle Point Wind Farm,-35.111624,137.7219,2026-01-30T05:11:01.624036
2026/01/30 15:10:00,WRWF1,3.08,White Rock Wind Farm Pty Ltd,White Rock Wind Farm,Wind,175.0,1.76,White Rock Wind Farm,-29.79,151.54,2026-01-30T05:11:01.624036
2026/01/30 15:10:00,YENDWF1,30.13,Lal Lal Wind Farms Nom Co Pty Ltd,Yendon Wind Farm,Wind,144.4,20.87,Yendon Wind Farm,-37.629987,144.022717,2026-01-30T05:11:01.624036
