SETTLEMENTDATE,DUID,SCADAVALUE,Participant,Station Name,Fuel Source - Primary,MAX_CAP,utilisation_pct,Plant,Latitude,Longitude,timestamp_utc
2026/03/28 09:20:00,CAPTL_WF,32.57,Iberdrola Australia Holdings Pty Limited,Capital Wind Farm,Wind,140.0,23.26,Capital Wind Farm,-35.1,149.31,2026-03-27T23:19:33.069918
2026/03/28 09:20:00,CHALLHWF,22.7,Pacific Hydro Challicum Hills Pty Ltd,Challicum Hills Wind Farm,Wind,52.0,43.65,Challicum Hills Wind Farm,-37.38,143.11,2026-03-27T23:19:33.069918
2026/03/28 09:20:00,CULLRGWF,6.14,Cullerin Range Wind Farm Pty Ltd,Cullerin Range Wind Farm,Wind,30.0,20.47,Cullerin Range Wind Farm,-34.81,149.4,2026-03-27T23:19:33.069918
2026/03/28 09:20:00,DIAPURWF1,0.9,Y.E.S. Energy (SA) Pty Ltd,Diapur Wind Farm,Wind,7.0,12.86,Diapur Wind Farm,-36.3425,141.43,2026-03-27T23:19:33.069918
2026/03/28 09:20:00,MLWF1,10.33,Mortons Lane Windfarm Pty Limited,Mortons Lane Wind Farm,Wind,20.0,51.65,Mortons Lane Wind Farm,-37.84,142.45,2026-03-27T23:19:33.069918
2026/03/28 09:20:00,WAUBRAWF,116.6,Pyrenees Wind Energy Developments Pty Ltd,Waubra Wind Farm,Wind,192.0,60.73,Waubra Wind Farm,-37.394498,143.638982,2026-03-27T23:19:33.069918
2026/03/28 09:20:00,WOOLNTH1,40.13,Hydro-Electric Corporation,Woolnorth Studland Bay / Bluff Point Wind Farm,Wind,140.0,28.66,Woolnorth Studland Bay / Bluff Point Wind Farm,-40.69,144.72,2026-03-27T23:19:33.069918
2026/03/28 09:20:00,YAMBUKWF,15.1,Energy Pacific (Vic) Pty Ltd,Yambuk Wind Farm,Wind,30.0,50.33,Yambuk Wind Farm,-38.299083,142.027577,2026-03-27T23:19:33.069918
2026/03/28 09:20:00,YSWF1,3.3,Pacific Hydro Yaloak South Pty Ltd,Yaloak South Wind Farm,Wind,28.0,11.79,Yaloak South Wind Farm,-37.7163,144.242853,2026-03-27T23:19:33.069918
2026/03/28 09:20:00,ARWF1,88.4,Ararat Wind Farm Pty Ltd,Ararat Wind Farm,Wind,241.0,36.68,Ararat Wind Farm,-37.232778,143.031389,2026-03-27T23:19:33.069918
2026/03/28 09:20:00,BALDHWF1,21.54,Alinta Energy Retail Sales Pty Ltd,Bald Hills Wind Farm,Wind,106.0,20.32,Bald Hills Wind Farm,-38.79,145.93,2026-03-27T23:19:33.069918
2026/03/28 09:20:00,BANGOWF1,0.0,BWF Nominees Pty Ltd as The Trustee for BWF Trust,Bango 973 Wind Farm,Wind,155.0,0.0,Bango 973 Wind Farm,-34.551582,148.732808,2026-03-27T23:19:33.069918
2026/03/28 09:20:00,BANGOWF2,0.0,BWF Nominees Pty Ltd as The Trustee for BWF Trust,Bango 999 Wind Farm,Wind,82.0,0.0,Bango 999 Wind Farm,-34.551582,148.732808,2026-03-27T23:19:33.069918
2026/03/28 09:20:00,BLUFF1,0.0,AGL SA Generation Pty Limited,The Bluff Wind Farm,Wind,53.0,0.0,The Bluff Wind Farm,-33.367778,138.728611,2026-03-27T23:19:33.069918
2026/03/28 09:20:00,BOCORWF1,82.44,Boco Rock Wind Farm Pty Ltd,Boco Rock Wind Farm,Wind,111.0,74.27,Boco Rock Wind Farm,-36.578611,149.103333,2026-03-27T23:19:33.069918
2026/03/28 09:20:00,BRYB1WF1,39.51,Berrybank Development Pty Ltd,Berrybank Wind Farm,Wind,175.9,22.46,Berrybank Wind Farm,-37.94,143.52,2026-03-27T23:19:33.069918
2026/03/28 09:20:00,BRYB2WF2,25.78,Berrybank 2 Asset Pty Ltd as trustee for Berrybank 2 Asset Trust,Berrybank 2 Wind Farm,Wind,105.0,24.55,Berrybank 2 Wind Farm,-37.94,143.52,2026-03-27T23:19:33.069918
2026/03/28 09:20:00,BULGANA1,82.0,Bulgana Wind Farm Pty Ltd,Bulgana Green Power Hub,Wind,204.0,40.2,Bulgana Green Power Hub,-37.0975,142.973611,2026-03-27T23:19:33.069918
2026/03/28 09:20:00,CATHROCK,10.9,Cathedral Rocks Wind Farm Pty Ltd,Cathedral Rocks,Wind,66.0,16.52,Cathedral Rocks,-34.51,135.35,2026-03-27T23:19:33.069918
2026/03/28 09:20:00,CHYTWF1,16.87,Cherry Tree Wind Farm Pty Ltd as trustee for The Cherry Tree Project trust ,Cherry Tree Wind Farm,Wind,57.0,29.6,Cherry Tree Wind Farm,-37.1,145.26,2026-03-27T23:19:33.069918
2026/03/28 09:20:00,CLEMGPWF,13.4,Pacific Hydro Clements Gap Pty Ltd,Clements Gap Wind Farm,Wind,57.0,23.51,Clements Gap Wind Farm,-33.48,138.1,2026-03-27T23:19:33.069918
2026/03/28 09:20:00,CLRKCWF1,0.0,Stanwell Corporation Limited ,Clarke Creek Wind Farm,Wind,338.0,0.0,Clarke Creek Wind Farm,-22.85,149.45,2026-03-27T23:19:33.069918
2026/03/28 09:20:00,CLRKCWF2,0.0,Stanwell Corporation Limited ,Clarke Creek Wind Farm,Wind,101.0,0.0,Clarke Creek Wind Farm,-22.85,149.45,2026-03-27T23:19:33.069918
2026/03/28 09:20:00,CNUNDAWF,0.4,Canunda Power Pty Ltd,Canunda Wind Farm,Wind,46.0,0.87,Canunda Wind Farm,-37.73,140.39,2026-03-27T23:19:33.069918
2026/03/28 09:20:00,COLWF01,49.93,Collector Wind Farm Pty Ltd,Collector Wind Farm 1,Wind,219.0,22.8,Collector Wind Farm 1,-34.8719,149.3967,2026-03-27T23:19:33.069918
2026/03/28 09:20:00,COOPGWF1,0.0,PARF Company 10 Pty Limited as The Trustee for Coopers Gap Project Trust,Coopers Gap Wind Farm,Wind,440.0,0.0,Coopers Gap Wind Farm,-26.74,151.45,2026-03-27T23:19:33.069918
2026/03/28 09:20:00,CROOKWF2,16.36,Crookwell Development Pty Ltd ,Crookwell 2 Wind Farm,Wind,91.0,17.98,Crookwell 2 Wind Farm,-34.52,149.54,2026-03-27T23:19:33.069918
2026/03/28 09:20:00,CROOKWF3,16.82,Crookwell 3 Development Pty Ltd,Crookwell 3 Wind Farm,Wind,56.0,30.04,Crookwell 3 Wind Farm,-34.52,149.54,2026-03-27T23:19:33.069918
2026/03/28 09:20:00,CROWLWF1,44.28,Pacific Hydro Crowlands Pty Ltd ,Crowlands Wind Farm,Wind,79.0,56.05,Crowlands Wind Farm,-37.13,143.16,2026-03-27T23:19:33.069918
2026/03/28 09:20:00,CRURWF1,3.6,CRWF Nominees Pty Ltd As Trustee For The CRWF Trust,Crudine Ridge Wind Farm,Wind,138.0,2.61,Crudine Ridge Wind Farm,-32.97,149.64,2026-03-27T23:19:33.069918
2026/03/28 09:20:00,CTHLWF1,34.98,Wild Cattle Hill Pty Ltd,Cattle Hill Wind Farm,Wind,144.0,24.29,Cattle Hill Wind Farm,-42.15,146.69,2026-03-27T23:19:33.069918
2026/03/28 09:20:00,DULAWF1,146.3,Dulacca Energy Project Co Pty Ltd,Dulacca Wind Farm,Wind,173.0,84.57,Dulacca Wind Farm,-26.63,149.87,2026-03-27T23:19:33.069918
2026/03/28 09:20:00,DUNDWF1,69.76,Dundonnell Wind Farm Pty Ltd,Dundonnell Wind Farm,Wind,168.0,41.52,Dundonnell Wind Farm,-37.52,142.58,2026-03-27T23:19:33.069918
2026/03/28 09:20:00,DUNDWF2,23.64,Dundonnell Wind Farm Pty Ltd,Dundonnell Wind Farm,Wind,46.0,51.39,Dundonnell Wind Farm,-37.52,142.58,2026-03-27T23:19:33.069918
2026/03/28 09:20:00,DUNDWF3,62.26,Dundonnell Wind Farm Pty Ltd,Dundonnell Wind Farm,Wind,122.0,51.03,Dundonnell Wind Farm,-37.52,142.58,2026-03-27T23:19:33.069918
2026/03/28 09:20:00,ELAINWF1,13.34,Lal Lal Wind Farms Nom Co Pty Ltd,Elaine Wind Farm,Wind,82.0,16.27,Elaine Wind Farm,-37.36,144.0,2026-03-27T23:19:33.069918
2026/03/28 09:20:00,FLYCRKWF,2.71,Iberdrola Australia Energy Markets Pty Limited,Flyers Creek Wind Farm,Wind,140.0,1.94,Flyers Creek Wind Farm,-33.365556,148.981944,2026-03-27T23:19:33.069918
2026/03/28 09:20:00,GPWFEST1,1.12,Golden Plains WF1 Pty Ltd as Trustee for the Golden Plains WF1 Unit Trust,Golden Plains Wind Farm East,Wind,240.0,0.47,Golden Plains Wind Farm East,-37.945091,143.752614,2026-03-27T23:19:33.069918
2026/03/28 09:20:00,GPWFEST2,1.66,Golden Plains WF1 Pty Ltd as Trustee for the Golden Plains WF1 Unit Trust,Golden Plains Wind Farm East,Wind,253.0,0.66,Golden Plains Wind Farm East,-37.945091,143.752614,2026-03-27T23:19:33.069918
2026/03/28 09:20:00,GPWFEST3,31.94,Golden Plains WF1 Pty Ltd as Trustee for the Golden Plains WF1 Unit Trust,Golden Plains Wind Farm East,Wind,240.0,13.31,Golden Plains Wind Farm East,-37.945091,143.752614,2026-03-27T23:19:33.069918
2026/03/28 09:20:00,GRANWF1,19.16,Granville Harbour Operations Pty Ltd as The Trustee for Granville Harbour Operations Trust,Granville Harbour Wind Farm,Wind,111.0,17.26,Granville Harbour Wind Farm,-41.8,145.06,2026-03-27T23:19:33.069918
2026/03/28 09:20:00,GSWF1A,104.23,Goyder Wind Farm 1 Pty Ltd as the Trustee for Goyder Wind Farm 1 Trust,Goyder South Wind Farm 1A,Wind,201.0,51.86,Goyder South Wind Farm 1A,-33.679758,138.937597,2026-03-27T23:19:33.069918
2026/03/28 09:20:00,GSWF1B1,56.47,Goyder Wind Farm 1B Pty Ltd as the Trustee for the Goyder Wind Farm 1B Trust,Goyder South Wind Farm 1B,Wind,196.0,28.81,Goyder South Wind Farm 1B,-33.679758,138.937597,2026-03-27T23:19:33.069918
2026/03/28 09:20:00,GULLRWF1,34.96,New Gullen Range Wind Farm Pty Ltd,Gullen Range Wind Farm,Wind,161.0,21.71,Gullen Range Wind Farm,-34.34,149.27,2026-03-27T23:19:33.069918
2026/03/28 09:20:00,GULLRWF2,23.0,New Gullen Range Wind Farm Pty Ltd,Gullen Range Wind Farm,Wind,107.0,21.5,Gullen Range Wind Farm,-34.34,149.27,2026-03-27T23:19:33.069918
2026/03/28 09:20:00,GUNNING1,3.19,Gunning Wind Energy Developments Pty Ltd,Gunning Wind Farm,Wind,47.0,6.79,Gunning Wind Farm,-34.813333,149.4,2026-03-27T23:19:33.069918
2026/03/28 09:20:00,HALLWF1,0.0,AGL SA Generation Pty Limited,Hallett 1 Wind Farm,Wind,95.0,0.0,Hallett 1 Wind Farm,-33.367778,138.728611,2026-03-27T23:19:33.069918
2026/03/28 09:20:00,HALLWF2,0.0,AGL SA Generation Pty Limited,Hallett 2 Wind Farm,Wind,71.0,0.0,Hallett 2 Wind Farm,-33.367778,138.728611,2026-03-27T23:19:33.069918
2026/03/28 09:20:00,HD1WF1,0.0,Hawkesdale Asset Pty Ltd as trustee for Hawkesdale Asset Trust,Hawkesdale Wind Farm,Wind,89.0,0.0,Hawkesdale Wind Farm,-38.147894,142.361381,2026-03-27T23:19:33.069918
2026/03/28 09:20:00,HDWF1,75.0,HWF1 Pty Ltd,Hornsdale Wind Farm,Wind,102.0,73.53,Hornsdale Wind Farm,-33.050556,138.543611,2026-03-27T23:19:33.069918
2026/03/28 09:20:00,HDWF2,40.1,HWF 2 Pty Ltd,Hornsdale Wind Farm 2,Wind,102.0,39.31,Hornsdale Wind Farm 2,-33.06,138.54,2026-03-27T23:19:33.069918
2026/03/28 09:20:00,HDWF3,65.4,HWF3 Pty Ltd,Hornsdale Wind Farm 3,Wind,109.0,60.0,Hornsdale Wind Farm 3,-33.06,138.54,2026-03-27T23:19:33.069918
2026/03/28 09:20:00,KABANWF1,0.11,Kaban Wind Farm Pty Ltd as trustee for Kaban Wind Farm Trust,Kaban Wind Farm,Wind,152.0,0.07,Kaban Wind Farm,-17.56,145.41,2026-03-27T23:19:33.069918
2026/03/28 09:20:00,KEPWF1,10.0,Kennedy Energy Park Pty Ltd,Kennedy Energy Park,Wind,43.0,23.26,Kennedy Energy Park,-20.88,144.42,2026-03-27T23:19:33.069918
2026/03/28 09:20:00,KIATAWF1,0.0,Kiata ProjectCo Pty Ltd Atf Kiata Project Trust,Kiata Wind Farm,Wind,31.0,0.0,Kiata Wind Farm,-36.4,141.75,2026-03-27T23:19:33.069918
2026/03/28 09:20:00,LGAPWF1,10.49,Lincoln Gap Wind Farm (Operations) Pty Ltd,Lincoln Gap Wind Farm,Wind,123.0,8.53,Lincoln Gap Wind Farm,-32.564279,137.557328,2026-03-27T23:19:33.069918
2026/03/28 09:20:00,LGAPWF1,10.49,Lincoln Gap Wind Farm (Operations) Pty Ltd,Lincoln Gap Wind Farm,Wind,123.0,8.53,Lincoln Gap Wind Farm,-32.564279,137.557328,2026-03-27T23:19:33.069918
2026/03/28 09:20:00,LGAPWF2,15.47,Lincoln Gap Wind Farm (Operations) Pty Ltd,Lincoln Gap Wind Farm,Wind,85.0,18.2,Lincoln Gap Wind Farm,-32.564279,137.557328,2026-03-27T23:19:33.069918
2026/03/28 09:20:00,LGAPWF2,15.47,Lincoln Gap Wind Farm (Operations) Pty Ltd,Lincoln Gap Wind Farm,Wind,85.0,18.2,Lincoln Gap Wind Farm,-32.564279,137.557328,2026-03-27T23:19:33.069918
2026/03/28 09:20:00,LKBONNY1,2.86,Lake Bonney Wind Power Pty Ltd,Lake Bonney Wind Farm Stage 1,Wind,81.0,3.53,Lake Bonney Wind Farm Stage 1,-37.76,140.4,2026-03-27T23:19:33.069918
2026/03/28 09:20:00,LKBONNY2,5.87,Lake Bonney Wind Power Pty Ltd,Lake Bonney Stage 2 Windfarm,Wind,159.0,3.69,Lake Bonney Stage 2 Windfarm,-37.76,140.4,2026-03-27T23:19:33.069918
2026/03/28 09:20:00,LKBONNY3,2.51,Lake Bonney Wind Power Pty Ltd,Lake Bonney Stage 3 Wind Farm,Wind,39.0,6.44,Lake Bonney Stage 3 Wind Farm,-37.737781,140.388137,2026-03-27T23:19:33.069918
2026/03/28 09:20:00,MACARTH1,0.0,AGL Hydro Partnership,Macarthur Wind Farm,Wind,420.0,0.0,Macarthur Wind Farm,-38.048957,142.192112,2026-03-27T23:19:33.069918
2026/03/28 09:20:00,MCINTYR1,0.0,MacIntyre UJV Operator Pty Ltd,MacIntyre Wind Farm,Wind,890.0,0.0,MacIntyre Wind Farm,-28.32,151.54,2026-03-27T23:19:33.069918
2026/03/28 09:20:00,MERCER01,16.5,Mt Mercer Windfarm Pty Ltd,Mt Mercer Wind Farm,Wind,131.0,12.6,Mt Mercer Wind Farm,-37.841111,143.871111,2026-03-27T23:19:33.069918
2026/03/28 09:20:00,MEWF1,0.0,Ergon Energy Queensland Pty Ltd ,Mount Emerald Wind Farm,Wind,178.0,0.0,Mount Emerald Wind Farm,-17.133007,145.380644,2026-03-27T23:19:33.069918
2026/03/28 09:20:00,MRTLSWF1,61.59,Mortlake South Wind Farm Pty Ltd,Mortlake South Wind Farm,Wind,153.0,40.25,Mortlake South Wind Farm,-38.127337,142.857801,2026-03-27T23:19:33.069918
2026/03/28 09:20:00,MTGELWF1,17.37,Mt. Gellibrand Wind Farm Pty Ltd,Mt Gellibrand Wind Farm,Wind,132.0,13.16,Mt Gellibrand Wind Farm,-38.23,143.77,2026-03-27T23:19:33.069918
2026/03/28 09:20:00,MTMILLAR,10.0,Mt Millar Wind Farm Pty Ltd,Mt Millar Wind Farm,Wind,70.0,14.29,Mt Millar Wind Farm,-33.624444,136.703611,2026-03-27T23:19:33.069918
2026/03/28 09:20:00,MUSSELR1,31.6,Hydro-Electric Corporation,Musselroe Wind Farm,Wind,168.0,18.81,Musselroe Wind Farm,-40.780225,148.010799,2026-03-27T23:19:33.069918
2026/03/28 09:20:00,MUWAWF1,0.0,Telstra Energy (Generation) Pty Ltd,Murra Warra Wind Farm,Wind,225.7,0.0,Murra Warra Wind Farm,-36.432404,142.317853,2026-03-27T23:19:33.069918
2026/03/28 09:20:00,MUWAWF2,0.0,Murra Warra II Project Co Pty Ltd ATF The Murra Warra II Project Trust,Murra Warra Wind Farm Stage 2,Wind,203.0,0.0,Murra Warra Wind Farm Stage 2,-36.43,142.32,2026-03-27T23:19:33.069918
2026/03/28 09:20:00,NBHWF1,0.0,AGL SA Generation Pty Limited,North Brown Hill Wind Farm,Wind,132.0,0.0,North Brown Hill Wind Farm,-33.367778,138.728611,2026-03-27T23:19:33.069918
2026/03/28 09:20:00,OAKLAND1,0.0,AGL Hydro Partnership,Oaklands Hill Wind Farm,Wind,63.0,0.0,Oaklands Hill Wind Farm,-37.683078,142.551678,2026-03-27T23:19:33.069918
2026/03/28 09:20:00,PAREPW1,15.11,Iberdrola Australia Energy Markets Pty Limited,Port Augusta Renewable Energy Park,Wind,201.0,7.52,Port Augusta Renewable Energy Park,-32.566944,137.856111,2026-03-27T23:19:33.069918
2026/03/28 09:20:00,RYANCWF1,76.39,Ryan Corner Development Pty Ltd,Ryan Corner Wind Farm,Wind,205.0,37.26,Ryan Corner Wind Farm,-38.271017,142.140647,2026-03-27T23:19:33.069918
2026/03/28 09:20:00,RYEPARK1,71.94,Rye Park Renewable Energy Pty Ltd as trustee for Rye Park Wind Farm Trust,Rye Park Renewable Energy,Wind,384.0,18.73,Rye Park Renewable Energy,-32.138333,148.972778,2026-03-27T23:19:33.069918
2026/03/28 09:20:00,SALTCRK1,0.0,Salt Creek Wind Farm Pty Ltd,Salt Creek Wind Farm,Wind,54.0,0.0,Salt Creek Wind Farm,-37.95,142.63,2026-03-27T23:19:33.069918
2026/03/28 09:20:00,SAPHWF1,4.91,The Trustee For The SWF1 Operations Trust,Sapphire Wind Farm,Wind,270.0,1.82,Sapphire Wind Farm,-29.7,151.41,2026-03-27T23:19:33.069918
2026/03/28 09:20:00,SNOWNTH1,54.8,Snowtown Wind Farm Stage 2 Pty Ltd,Snowtown Wind Farm Stage 2 North,Wind,144.0,38.06,Snowtown Wind Farm Stage 2 North,-33.83,138.118611,2026-03-27T23:19:33.069918
2026/03/28 09:20:00,SNOWSTH1,81.0,Snowtown Wind Farm Stage 2 Pty Ltd,Snowtown South Wind Farm,Wind,126.0,64.29,Snowtown South Wind Farm,-33.83,138.118611,2026-03-27T23:19:33.069918
2026/03/28 09:20:00,SNOWTWN1,54.89,Snowtown Wind Farm Pty Ltd,Snowtown Wind Farm Units 1 And 47,Wind,99.0,55.44,Snowtown Wind Farm Units 1 And 47,-33.83,138.118611,2026-03-27T23:19:33.069918
2026/03/28 09:20:00,STARHLWF,4.9,Starfish Hill Wind Farm Pty Ltd,Starfish Hill Wind Farm,Wind,35.0,14.0,Starfish Hill Wind Farm,-35.58,138.14,2026-03-27T23:19:33.069918
2026/03/28 09:20:00,STOCKYD1,279.06,Stockyard Hill Wind Farm Pty Ltd,Stockyard Hill Wind Farm,Wind,511.0,54.61,Stockyard Hill Wind Farm,-37.535833,143.251389,2026-03-27T23:19:33.069918
2026/03/28 09:20:00,STWF1,0.0,PARF Company 8 Pty Ltd as The Trustee for Silverton Project Trust,Silverton Wind Farm,Wind,198.0,0.0,Silverton Wind Farm,-37.683168,142.551678,2026-03-27T23:19:33.069918
2026/03/28 09:20:00,TARALGA1,38.71,Taralga Wind Farm Nominees No 2 Pty Ltd (ATF Taralga Wind Farm Operating Trust),Taralga Wind Farm,Wind,106.0,36.52,Taralga Wind Farm,-34.42352,149.826267,2026-03-27T23:19:33.069918
2026/03/28 09:20:00,WAMBOWF1,113.24,Stanwell Corporation Limited,Wambo Wind Farm 1,Wind,245.0,46.22,Wambo Wind Farm 1,-35.187301,149.524945,2026-03-27T23:19:33.069918
2026/03/28 09:20:00,WATERLWF,44.5,Waterloo Wind Farm Pty Ltd,Waterloo Wind Farm,Wind,130.0,34.23,Waterloo Wind Farm,-34.00094,138.911567,2026-03-27T23:19:33.069918
2026/03/28 09:20:00,WGWF1,87.5,Willogoleche Power Pty Ltd As The Trustee For The Willogoleche Operating Trust,Willogoleche Wind Farm,Wind,119.0,73.53,Willogoleche Wind Farm,-33.39,138.85,2026-03-27T23:19:33.069918
2026/03/28 09:20:00,WOODLWN1,6.87,Woodlawn Wind Pty Ltd,Woodlawn Wind Farm,Wind,48.0,14.31,Woodlawn Wind Farm,-35.08,149.62,2026-03-27T23:19:33.069918
2026/03/28 09:20:00,WPWF,0.0,AGL SA Generation Pty Limited,Wattle Point Wind Farm,Wind,91.0,0.0,Wattle Point Wind Farm,-35.111624,137.7219,2026-03-27T23:19:33.069918
2026/03/28 09:20:00,WRWF1,0.0,White Rock Wind Farm Pty Ltd,White Rock Wind Farm,Wind,172.0,0.0,White Rock Wind Farm,-29.79,151.54,2026-03-27T23:19:33.069918
2026/03/28 09:20:00,YENDWF1,26.72,Lal Lal Wind Farms Nom Co Pty Ltd,Yendon Wind Farm,Wind,142.0,18.82,Yendon Wind Farm,-37.629987,144.022717,2026-03-27T23:19:33.069918
