SETTLEMENTDATE,DUID,SCADAVALUE,Participant,Station Name,Fuel Source - Primary,MAX_CAP,utilisation_pct,Plant,Latitude,Longitude,timestamp_utc
2026/04/13 01:10:00,CAPTL_WF,109.64,Iberdrola Australia Holdings Pty Limited,Capital Wind Farm,Wind,140.0,78.31,Capital Wind Farm,-35.1,149.31,2026-04-12T15:08:23.014612
2026/04/13 01:10:00,CHALLHWF,9.9,Pacific Hydro Challicum Hills Pty Ltd,Challicum Hills Wind Farm,Wind,52.0,19.04,Challicum Hills Wind Farm,-37.38,143.11,2026-04-12T15:08:23.014612
2026/04/13 01:10:00,CULLRGWF,28.36,Cullerin Range Wind Farm Pty Ltd,Cullerin Range Wind Farm,Wind,30.0,94.53,Cullerin Range Wind Farm,-34.81,149.4,2026-04-12T15:08:23.014612
2026/04/13 01:10:00,DIAPURWF1,3.4,Y.E.S. Energy (SA) Pty Ltd,Diapur Wind Farm,Wind,7.0,48.57,Diapur Wind Farm,-36.3425,141.43,2026-04-12T15:08:23.014612
2026/04/13 01:10:00,MLWF1,5.94,Mortons Lane Windfarm Pty Limited,Mortons Lane Wind Farm,Wind,20.0,29.7,Mortons Lane Wind Farm,-37.84,142.45,2026-04-12T15:08:23.014612
2026/04/13 01:10:00,WAUBRAWF,75.12,Pyrenees Wind Energy Developments Pty Ltd,Waubra Wind Farm,Wind,192.0,39.13,Waubra Wind Farm,-37.394498,143.638982,2026-04-12T15:08:23.014612
2026/04/13 01:10:00,WOOLNTH1,107.42,Hydro-Electric Corporation,Woolnorth Studland Bay / Bluff Point Wind Farm,Wind,140.0,76.73,Woolnorth Studland Bay / Bluff Point Wind Farm,-40.69,144.72,2026-04-12T15:08:23.014612
2026/04/13 01:10:00,YAMBUKWF,27.4,Energy Pacific (Vic) Pty Ltd,Yambuk Wind Farm,Wind,30.0,91.33,Yambuk Wind Farm,-38.299083,142.027577,2026-04-12T15:08:23.014612
2026/04/13 01:10:00,YSWF1,14.6,Pacific Hydro Yaloak South Pty Ltd,Yaloak South Wind Farm,Wind,28.0,52.14,Yaloak South Wind Farm,-37.7163,144.242853,2026-04-12T15:08:23.014612
2026/04/13 01:10:00,ARWF1,33.8,Ararat Wind Farm Pty Ltd,Ararat Wind Farm,Wind,241.0,14.02,Ararat Wind Farm,-37.232778,143.031389,2026-04-12T15:08:23.014612
2026/04/13 01:10:00,BALDHWF1,89.15,Alinta Energy Retail Sales Pty Ltd,Bald Hills Wind Farm,Wind,106.0,84.1,Bald Hills Wind Farm,-38.79,145.93,2026-04-12T15:08:23.014612
2026/04/13 01:10:00,BANGOWF1,118.5,BWF Nominees Pty Ltd as The Trustee for BWF Trust,Bango 973 Wind Farm,Wind,155.0,76.45,Bango 973 Wind Farm,-34.551582,148.732808,2026-04-12T15:08:23.014612
2026/04/13 01:10:00,BANGOWF2,56.8,BWF Nominees Pty Ltd as The Trustee for BWF Trust,Bango 999 Wind Farm,Wind,82.0,69.27,Bango 999 Wind Farm,-34.551582,148.732808,2026-04-12T15:08:23.014612
2026/04/13 01:10:00,BLUFF1,2.3,AGL SA Generation Pty Limited,The Bluff Wind Farm,Wind,53.0,4.34,The Bluff Wind Farm,-33.367778,138.728611,2026-04-12T15:08:23.014612
2026/04/13 01:10:00,BOCORWF1,35.0,Boco Rock Wind Farm Pty Ltd,Boco Rock Wind Farm,Wind,111.0,31.53,Boco Rock Wind Farm,-36.578611,149.103333,2026-04-12T15:08:23.014612
2026/04/13 01:10:00,BRYB1WF1,72.07,Berrybank Development Pty Ltd,Berrybank Wind Farm,Wind,175.9,40.97,Berrybank Wind Farm,-37.94,143.52,2026-04-12T15:08:23.014612
2026/04/13 01:10:00,BRYB2WF2,56.06,Berrybank 2 Asset Pty Ltd as trustee for Berrybank 2 Asset Trust,Berrybank 2 Wind Farm,Wind,105.0,53.39,Berrybank 2 Wind Farm,-37.94,143.52,2026-04-12T15:08:23.014612
2026/04/13 01:10:00,BULGANA1,3.81,Bulgana Wind Farm Pty Ltd,Bulgana Green Power Hub,Wind,204.0,1.87,Bulgana Green Power Hub,-37.0975,142.973611,2026-04-12T15:08:23.014612
2026/04/13 01:10:00,CATHROCK,0.9,Cathedral Rocks Wind Farm Pty Ltd,Cathedral Rocks,Wind,66.0,1.36,Cathedral Rocks,-34.51,135.35,2026-04-12T15:08:23.014612
2026/04/13 01:10:00,CHYTWF1,27.55,Cherry Tree Wind Farm Pty Ltd as trustee for The Cherry Tree Project trust ,Cherry Tree Wind Farm,Wind,57.0,48.33,Cherry Tree Wind Farm,-37.1,145.26,2026-04-12T15:08:23.014612
2026/04/13 01:10:00,CLEMGPWF,0.0,Pacific Hydro Clements Gap Pty Ltd,Clements Gap Wind Farm,Wind,57.0,0.0,Clements Gap Wind Farm,-33.48,138.1,2026-04-12T15:08:23.014612
2026/04/13 01:10:00,CLRKCWF1,194.07,Stanwell Corporation Limited ,Clarke Creek Wind Farm,Wind,338.0,57.42,Clarke Creek Wind Farm,-22.85,149.45,2026-04-12T15:08:23.014612
2026/04/13 01:10:00,CLRKCWF2,41.22,Stanwell Corporation Limited ,Clarke Creek Wind Farm,Wind,101.0,40.81,Clarke Creek Wind Farm,-22.85,149.45,2026-04-12T15:08:23.014612
2026/04/13 01:10:00,CNUNDAWF,8.81,Canunda Power Pty Ltd,Canunda Wind Farm,Wind,46.0,19.15,Canunda Wind Farm,-37.73,140.39,2026-04-12T15:08:23.014612
2026/04/13 01:10:00,COLWF01,207.54,Collector Wind Farm Pty Ltd,Collector Wind Farm 1,Wind,219.0,94.77,Collector Wind Farm 1,-34.8719,149.3967,2026-04-12T15:08:23.014612
2026/04/13 01:10:00,COOPGWF1,299.16,PARF Company 10 Pty Limited as The Trustee for Coopers Gap Project Trust,Coopers Gap Wind Farm,Wind,440.0,67.99,Coopers Gap Wind Farm,-26.74,151.45,2026-04-12T15:08:23.014612
2026/04/13 01:10:00,CROOKWF2,86.39,Crookwell Development Pty Ltd ,Crookwell 2 Wind Farm,Wind,91.0,94.93,Crookwell 2 Wind Farm,-34.52,149.54,2026-04-12T15:08:23.014612
2026/04/13 01:10:00,CROOKWF3,31.81,Crookwell 3 Development Pty Ltd,Crookwell 3 Wind Farm,Wind,56.0,56.8,Crookwell 3 Wind Farm,-34.52,149.54,2026-04-12T15:08:23.014612
2026/04/13 01:10:00,CROWLWF1,15.6,Pacific Hydro Crowlands Pty Ltd ,Crowlands Wind Farm,Wind,79.0,19.75,Crowlands Wind Farm,-37.13,143.16,2026-04-12T15:08:23.014612
2026/04/13 01:10:00,CRURWF1,98.6,CRWF Nominees Pty Ltd As Trustee For The CRWF Trust,Crudine Ridge Wind Farm,Wind,138.0,71.45,Crudine Ridge Wind Farm,-32.97,149.64,2026-04-12T15:08:23.014612
2026/04/13 01:10:00,CTHLWF1,90.36,Wild Cattle Hill Pty Ltd,Cattle Hill Wind Farm,Wind,144.0,62.75,Cattle Hill Wind Farm,-42.15,146.69,2026-04-12T15:08:23.014612
2026/04/13 01:10:00,DULAWF1,153.4,Dulacca Energy Project Co Pty Ltd,Dulacca Wind Farm,Wind,173.0,88.67,Dulacca Wind Farm,-26.63,149.87,2026-04-12T15:08:23.014612
2026/04/13 01:10:00,DUNDWF1,49.81,Dundonnell Wind Farm Pty Ltd,Dundonnell Wind Farm,Wind,168.0,29.65,Dundonnell Wind Farm,-37.52,142.58,2026-04-12T15:08:23.014612
2026/04/13 01:10:00,DUNDWF2,12.97,Dundonnell Wind Farm Pty Ltd,Dundonnell Wind Farm,Wind,46.0,28.2,Dundonnell Wind Farm,-37.52,142.58,2026-04-12T15:08:23.014612
2026/04/13 01:10:00,DUNDWF3,51.68,Dundonnell Wind Farm Pty Ltd,Dundonnell Wind Farm,Wind,122.0,42.36,Dundonnell Wind Farm,-37.52,142.58,2026-04-12T15:08:23.014612
2026/04/13 01:10:00,ELAINWF1,31.24,Lal Lal Wind Farms Nom Co Pty Ltd,Elaine Wind Farm,Wind,82.0,38.1,Elaine Wind Farm,-37.36,144.0,2026-04-12T15:08:23.014612
2026/04/13 01:10:00,FLYCRKWF,66.99,Iberdrola Australia Energy Markets Pty Limited,Flyers Creek Wind Farm,Wind,140.0,47.85,Flyers Creek Wind Farm,-33.365556,148.981944,2026-04-12T15:08:23.014612
2026/04/13 01:10:00,GPWFEST1,103.08,Golden Plains WF1 Pty Ltd as Trustee for the Golden Plains WF1 Unit Trust,Golden Plains Wind Farm East,Wind,240.0,42.95,Golden Plains Wind Farm East,-37.945091,143.752614,2026-04-12T15:08:23.014612
2026/04/13 01:10:00,GPWFEST2,70.4,Golden Plains WF1 Pty Ltd as Trustee for the Golden Plains WF1 Unit Trust,Golden Plains Wind Farm East,Wind,253.0,27.83,Golden Plains Wind Farm East,-37.945091,143.752614,2026-04-12T15:08:23.014612
2026/04/13 01:10:00,GPWFEST3,78.06,Golden Plains WF1 Pty Ltd as Trustee for the Golden Plains WF1 Unit Trust,Golden Plains Wind Farm East,Wind,240.0,32.52,Golden Plains Wind Farm East,-37.945091,143.752614,2026-04-12T15:08:23.014612
2026/04/13 01:10:00,GRANWF1,80.63,Granville Harbour Operations Pty Ltd as The Trustee for Granville Harbour Operations Trust,Granville Harbour Wind Farm,Wind,111.0,72.64,Granville Harbour Wind Farm,-41.8,145.06,2026-04-12T15:08:23.014612
2026/04/13 01:10:00,GSWF1A,50.31,Goyder Wind Farm 1 Pty Ltd as the Trustee for Goyder Wind Farm 1 Trust,Goyder South Wind Farm 1A,Wind,201.0,25.03,Goyder South Wind Farm 1A,-33.679758,138.937597,2026-04-12T15:08:23.014612
2026/04/13 01:10:00,GSWF1B1,41.41,Goyder Wind Farm 1B Pty Ltd as the Trustee for the Goyder Wind Farm 1B Trust,Goyder South Wind Farm 1B,Wind,196.0,21.13,Goyder South Wind Farm 1B,-33.679758,138.937597,2026-04-12T15:08:23.014612
2026/04/13 01:10:00,GULLRWF1,115.95,New Gullen Range Wind Farm Pty Ltd,Gullen Range Wind Farm,Wind,161.0,72.02,Gullen Range Wind Farm,-34.34,149.27,2026-04-12T15:08:23.014612
2026/04/13 01:10:00,GULLRWF2,67.34,New Gullen Range Wind Farm Pty Ltd,Gullen Range Wind Farm,Wind,107.0,62.93,Gullen Range Wind Farm,-34.34,149.27,2026-04-12T15:08:23.014612
2026/04/13 01:10:00,GUNNING1,40.29,Gunning Wind Energy Developments Pty Ltd,Gunning Wind Farm,Wind,47.0,85.72,Gunning Wind Farm,-34.813333,149.4,2026-04-12T15:08:23.014612
2026/04/13 01:10:00,HALLWF1,5.91,AGL SA Generation Pty Limited,Hallett 1 Wind Farm,Wind,95.0,6.22,Hallett 1 Wind Farm,-33.367778,138.728611,2026-04-12T15:08:23.014612
2026/04/13 01:10:00,HALLWF2,9.43,AGL SA Generation Pty Limited,Hallett 2 Wind Farm,Wind,71.0,13.28,Hallett 2 Wind Farm,-33.367778,138.728611,2026-04-12T15:08:23.014612
2026/04/13 01:10:00,HD1WF1,50.7,Hawkesdale Asset Pty Ltd as trustee for Hawkesdale Asset Trust,Hawkesdale Wind Farm,Wind,89.0,56.97,Hawkesdale Wind Farm,-38.147894,142.361381,2026-04-12T15:08:23.014612
2026/04/13 01:10:00,HDWF1,7.2,HWF1 Pty Ltd,Hornsdale Wind Farm,Wind,102.0,7.06,Hornsdale Wind Farm,-33.050556,138.543611,2026-04-12T15:08:23.014612
2026/04/13 01:10:00,HDWF2,7.5,HWF 2 Pty Ltd,Hornsdale Wind Farm 2,Wind,102.0,7.35,Hornsdale Wind Farm 2,-33.06,138.54,2026-04-12T15:08:23.014612
2026/04/13 01:10:00,HDWF3,9.2,HWF3 Pty Ltd,Hornsdale Wind Farm 3,Wind,109.0,8.44,Hornsdale Wind Farm 3,-33.06,138.54,2026-04-12T15:08:23.014612
2026/04/13 01:10:00,KABANWF1,92.01,Kaban Wind Farm Pty Ltd as trustee for Kaban Wind Farm Trust,Kaban Wind Farm,Wind,152.0,60.53,Kaban Wind Farm,-17.56,145.41,2026-04-12T15:08:23.014612
2026/04/13 01:10:00,KEPWF1,27.2,Kennedy Energy Park Pty Ltd,Kennedy Energy Park,Wind,43.0,63.26,Kennedy Energy Park,-20.88,144.42,2026-04-12T15:08:23.014612
2026/04/13 01:10:00,KIATAWF1,10.1,Kiata ProjectCo Pty Ltd Atf Kiata Project Trust,Kiata Wind Farm,Wind,31.0,32.58,Kiata Wind Farm,-36.4,141.75,2026-04-12T15:08:23.014612
2026/04/13 01:10:00,LGAPWF1,12.05,Lincoln Gap Wind Farm (Operations) Pty Ltd,Lincoln Gap Wind Farm,Wind,123.0,9.8,Lincoln Gap Wind Farm,-32.564279,137.557328,2026-04-12T15:08:23.014612
2026/04/13 01:10:00,LGAPWF1,12.05,Lincoln Gap Wind Farm (Operations) Pty Ltd,Lincoln Gap Wind Farm,Wind,123.0,9.8,Lincoln Gap Wind Farm,-32.564279,137.557328,2026-04-12T15:08:23.014612
2026/04/13 01:10:00,LGAPWF2,6.33,Lincoln Gap Wind Farm (Operations) Pty Ltd,Lincoln Gap Wind Farm,Wind,85.0,7.45,Lincoln Gap Wind Farm,-32.564279,137.557328,2026-04-12T15:08:23.014612
2026/04/13 01:10:00,LGAPWF2,6.33,Lincoln Gap Wind Farm (Operations) Pty Ltd,Lincoln Gap Wind Farm,Wind,85.0,7.45,Lincoln Gap Wind Farm,-32.564279,137.557328,2026-04-12T15:08:23.014612
2026/04/13 01:10:00,LKBONNY1,9.38,Lake Bonney Wind Power Pty Ltd,Lake Bonney Wind Farm Stage 1,Wind,81.0,11.58,Lake Bonney Wind Farm Stage 1,-37.76,140.4,2026-04-12T15:08:23.014612
2026/04/13 01:10:00,LKBONNY2,25.3,Lake Bonney Wind Power Pty Ltd,Lake Bonney Stage 2 Windfarm,Wind,159.0,15.91,Lake Bonney Stage 2 Windfarm,-37.76,140.4,2026-04-12T15:08:23.014612
2026/04/13 01:10:00,LKBONNY3,6.98,Lake Bonney Wind Power Pty Ltd,Lake Bonney Stage 3 Wind Farm,Wind,39.0,17.9,Lake Bonney Stage 3 Wind Farm,-37.737781,140.388137,2026-04-12T15:08:23.014612
2026/04/13 01:10:00,MACARTH1,66.7,AGL Hydro Partnership,Macarthur Wind Farm,Wind,420.0,15.88,Macarthur Wind Farm,-38.048957,142.192112,2026-04-12T15:08:23.014612
2026/04/13 01:10:00,MCINTYR1,86.89,MacIntyre UJV Operator Pty Ltd,MacIntyre Wind Farm,Wind,890.0,9.76,MacIntyre Wind Farm,-28.32,151.54,2026-04-12T15:08:23.014612
2026/04/13 01:10:00,MERCER01,34.8,Mt Mercer Windfarm Pty Ltd,Mt Mercer Wind Farm,Wind,131.0,26.56,Mt Mercer Wind Farm,-37.841111,143.871111,2026-04-12T15:08:23.014612
2026/04/13 01:10:00,MEWF1,63.42,Ergon Energy Queensland Pty Ltd ,Mount Emerald Wind Farm,Wind,178.0,35.63,Mount Emerald Wind Farm,-17.133007,145.380644,2026-04-12T15:08:23.014612
2026/04/13 01:10:00,MRTLSWF1,46.48,Mortlake South Wind Farm Pty Ltd,Mortlake South Wind Farm,Wind,153.0,30.38,Mortlake South Wind Farm,-38.127337,142.857801,2026-04-12T15:08:23.014612
2026/04/13 01:10:00,MTGELWF1,54.72,Mt. Gellibrand Wind Farm Pty Ltd,Mt Gellibrand Wind Farm,Wind,132.0,41.45,Mt Gellibrand Wind Farm,-38.23,143.77,2026-04-12T15:08:23.014612
2026/04/13 01:10:00,MTMILLAR,1.9,Mt Millar Wind Farm Pty Ltd,Mt Millar Wind Farm,Wind,70.0,2.71,Mt Millar Wind Farm,-33.624444,136.703611,2026-04-12T15:08:23.014612
2026/04/13 01:10:00,MUSSELR1,95.4,Hydro-Electric Corporation,Musselroe Wind Farm,Wind,168.0,56.79,Musselroe Wind Farm,-40.780225,148.010799,2026-04-12T15:08:23.014612
2026/04/13 01:10:00,MUWAWF1,61.34,Telstra Energy (Generation) Pty Ltd,Murra Warra Wind Farm,Wind,225.7,27.18,Murra Warra Wind Farm,-36.432404,142.317853,2026-04-12T15:08:23.014612
2026/04/13 01:10:00,MUWAWF2,41.3,Murra Warra II Project Co Pty Ltd ATF The Murra Warra II Project Trust,Murra Warra Wind Farm Stage 2,Wind,203.0,20.34,Murra Warra Wind Farm Stage 2,-36.43,142.32,2026-04-12T15:08:23.014612
2026/04/13 01:10:00,NBHWF1,4.4,AGL SA Generation Pty Limited,North Brown Hill Wind Farm,Wind,132.0,3.33,North Brown Hill Wind Farm,-33.367778,138.728611,2026-04-12T15:08:23.014612
2026/04/13 01:10:00,OAKLAND1,18.7,AGL Hydro Partnership,Oaklands Hill Wind Farm,Wind,63.0,29.68,Oaklands Hill Wind Farm,-37.683078,142.551678,2026-04-12T15:08:23.014612
2026/04/13 01:10:00,PAREPW1,8.25,Iberdrola Australia Energy Markets Pty Limited,Port Augusta Renewable Energy Park,Wind,201.0,4.1,Port Augusta Renewable Energy Park,-32.566944,137.856111,2026-04-12T15:08:23.014612
2026/04/13 01:10:00,RYANCWF1,103.04,Ryan Corner Development Pty Ltd,Ryan Corner Wind Farm,Wind,205.0,50.26,Ryan Corner Wind Farm,-38.271017,142.140647,2026-04-12T15:08:23.014612
2026/04/13 01:10:00,RYEPARK1,165.24,Rye Park Renewable Energy Pty Ltd as trustee for Rye Park Wind Farm Trust,Rye Park Renewable Energy,Wind,384.0,43.03,Rye Park Renewable Energy,-32.138333,148.972778,2026-04-12T15:08:23.014612
2026/04/13 01:10:00,SALTCRK1,20.95,Salt Creek Wind Farm Pty Ltd,Salt Creek Wind Farm,Wind,54.0,38.8,Salt Creek Wind Farm,-37.95,142.63,2026-04-12T15:08:23.014612
2026/04/13 01:10:00,SAPHWF1,150.95,The Trustee For The SWF1 Operations Trust,Sapphire Wind Farm,Wind,270.0,55.91,Sapphire Wind Farm,-29.7,151.41,2026-04-12T15:08:23.014612
2026/04/13 01:10:00,SNOWNTH1,1.4,Snowtown Wind Farm Stage 2 Pty Ltd,Snowtown Wind Farm Stage 2 North,Wind,144.0,0.97,Snowtown Wind Farm Stage 2 North,-33.83,138.118611,2026-04-12T15:08:23.014612
2026/04/13 01:10:00,SNOWSTH1,3.9,Snowtown Wind Farm Stage 2 Pty Ltd,Snowtown South Wind Farm,Wind,126.0,3.1,Snowtown South Wind Farm,-33.83,138.118611,2026-04-12T15:08:23.014612
2026/04/13 01:10:00,SNOWTWN1,0.0,Snowtown Wind Farm Pty Ltd,Snowtown Wind Farm Units 1 And 47,Wind,99.0,0.0,Snowtown Wind Farm Units 1 And 47,-33.83,138.118611,2026-04-12T15:08:23.014612
2026/04/13 01:10:00,STARHLWF,1.1,Starfish Hill Wind Farm Pty Ltd,Starfish Hill Wind Farm,Wind,35.0,3.14,Starfish Hill Wind Farm,-35.58,138.14,2026-04-12T15:08:23.014612
2026/04/13 01:10:00,STOCKYD1,192.55,Stockyard Hill Wind Farm Pty Ltd,Stockyard Hill Wind Farm,Wind,511.0,37.68,Stockyard Hill Wind Farm,-37.535833,143.251389,2026-04-12T15:08:23.014612
2026/04/13 01:10:00,STWF1,67.45,PARF Company 8 Pty Ltd as The Trustee for Silverton Project Trust,Silverton Wind Farm,Wind,198.0,34.07,Silverton Wind Farm,-37.683168,142.551678,2026-04-12T15:08:23.014612
2026/04/13 01:10:00,TARALGA1,72.51,Taralga Wind Farm Nominees No 2 Pty Ltd (ATF Taralga Wind Farm Operating Trust),Taralga Wind Farm,Wind,106.0,68.41,Taralga Wind Farm,-34.42352,149.826267,2026-04-12T15:08:23.014612
2026/04/13 01:10:00,WAMBOWF1,204.17,Stanwell Corporation Limited,Wambo Wind Farm 1,Wind,245.0,83.33,Wambo Wind Farm 1,-35.187301,149.524945,2026-04-12T15:08:23.014612
2026/04/13 01:10:00,WATERLWF,13.6,Waterloo Wind Farm Pty Ltd,Waterloo Wind Farm,Wind,130.0,10.46,Waterloo Wind Farm,-34.00094,138.911567,2026-04-12T15:08:23.014612
2026/04/13 01:10:00,WGWF1,8.7,Willogoleche Power Pty Ltd As The Trustee For The Willogoleche Operating Trust,Willogoleche Wind Farm,Wind,119.0,7.31,Willogoleche Wind Farm,-33.39,138.85,2026-04-12T15:08:23.014612
2026/04/13 01:10:00,WOODLWN1,45.95,Woodlawn Wind Pty Ltd,Woodlawn Wind Farm,Wind,48.0,95.73,Woodlawn Wind Farm,-35.08,149.62,2026-04-12T15:08:23.014612
2026/04/13 01:10:00,WPWF,2.59,AGL SA Generation Pty Limited,Wattle Point Wind Farm,Wind,91.0,2.85,Wattle Point Wind Farm,-35.111624,137.7219,2026-04-12T15:08:23.014612
2026/04/13 01:10:00,WRWF1,121.26,White Rock Wind Farm Pty Ltd,White Rock Wind Farm,Wind,172.0,70.5,White Rock Wind Farm,-29.79,151.54,2026-04-12T15:08:23.014612
2026/04/13 01:10:00,YENDWF1,35.36,Lal Lal Wind Farms Nom Co Pty Ltd,Yendon Wind Farm,Wind,142.0,24.9,Yendon Wind Farm,-37.629987,144.022717,2026-04-12T15:08:23.014612
