SETTLEMENTDATE,DUID,SCADAVALUE,Participant,Station Name,Fuel Source - Primary,MAX_CAP,utilisation_pct,Plant,Latitude,Longitude,timestamp_utc
2026/02/03 03:00:00,CAPTL_WF,51.05,Iberdrola Australia Holdings Pty Limited,Capital Wind Farm,Wind,140.0,36.46,Capital Wind Farm,-35.1,149.31,2026-02-02T16:58:49.647527
2026/02/03 03:00:00,CHALLHWF,0.0,Pacific Hydro Challicum Hills Pty Ltd,Challicum Hills Wind Farm,Wind,52.0,0.0,Challicum Hills Wind Farm,-37.38,143.11,2026-02-02T16:58:49.647527
2026/02/03 03:00:00,CULLRGWF,26.38,Cullerin Range Wind Farm Pty Ltd,Cullerin Range Wind Farm,Wind,30.0,87.93,Cullerin Range Wind Farm,-34.81,149.4,2026-02-02T16:58:49.647527
2026/02/03 03:00:00,DIAPURWF1,8.1,Y.E.S. Energy (SA) Pty Ltd,Diapur Wind Farm,Wind,7.0,115.71,Diapur Wind Farm,-36.3425,141.43,2026-02-02T16:58:49.647527
2026/02/03 03:00:00,MLWF1,3.08,Mortons Lane Windfarm Pty Limited,Mortons Lane Wind Farm,Wind,20.0,15.4,Mortons Lane Wind Farm,-37.84,142.45,2026-02-02T16:58:49.647527
2026/02/03 03:00:00,WAUBRAWF,10.5,Pyrenees Wind Energy Developments Pty Ltd,Waubra Wind Farm,Wind,192.0,5.47,Waubra Wind Farm,-37.394498,143.638982,2026-02-02T16:58:49.647527
2026/02/03 03:00:00,WOOLNTH1,13.94,Hydro-Electric Corporation,Woolnorth Studland Bay / Bluff Point Wind Farm,Wind,140.0,9.96,Woolnorth Studland Bay / Bluff Point Wind Farm,-40.69,144.72,2026-02-02T16:58:49.647527
2026/02/03 03:00:00,YAMBUKWF,5.9,Energy Pacific (Vic) Pty Ltd,Yambuk Wind Farm,Wind,30.0,19.67,Yambuk Wind Farm,-38.299083,142.027577,2026-02-02T16:58:49.647527
2026/02/03 03:00:00,YSWF1,0.2,Pacific Hydro Yaloak South Pty Ltd,Yaloak South Wind Farm,Wind,28.0,0.71,Yaloak South Wind Farm,-37.7163,144.242853,2026-02-02T16:58:49.647527
2026/02/03 03:00:00,ARWF1,0.0,Ararat Wind Farm Pty Ltd,Ararat Wind Farm,Wind,241.0,0.0,Ararat Wind Farm,-37.232778,143.031389,2026-02-02T16:58:49.647527
2026/02/03 03:00:00,BALDHWF1,53.16,Alinta Energy Retail Sales Pty Ltd,Bald Hills Wind Farm,Wind,106.0,50.15,Bald Hills Wind Farm,-38.79,145.93,2026-02-02T16:58:49.647527
2026/02/03 03:00:00,BANGOWF1,131.8,BWF Nominees Pty Ltd as The Trustee for BWF Trust,Bango 973 Wind Farm,Wind,155.0,85.03,Bango 973 Wind Farm,-34.551582,148.732808,2026-02-02T16:58:49.647527
2026/02/03 03:00:00,BANGOWF2,65.3,BWF Nominees Pty Ltd as The Trustee for BWF Trust,Bango 999 Wind Farm,Wind,82.0,79.63,Bango 999 Wind Farm,-34.551582,148.732808,2026-02-02T16:58:49.647527
2026/02/03 03:00:00,BLUFF1,25.6,AGL SA Generation Pty Limited,The Bluff Wind Farm,Wind,53.0,48.3,The Bluff Wind Farm,-33.367778,138.728611,2026-02-02T16:58:49.647527
2026/02/03 03:00:00,BOCORWF1,47.8,Boco Rock Wind Farm Pty Ltd,Boco Rock Wind Farm,Wind,111.0,43.06,Boco Rock Wind Farm,-36.578611,149.103333,2026-02-02T16:58:49.647527
2026/02/03 03:00:00,BRYB1WF1,26.93,Berrybank Development Pty Ltd,Berrybank Wind Farm,Wind,175.9,15.31,Berrybank Wind Farm,-37.94,143.52,2026-02-02T16:58:49.647527
2026/02/03 03:00:00,BRYB2WF2,26.07,Berrybank 2 Asset Pty Ltd as trustee for Berrybank 2 Asset Trust,Berrybank 2 Wind Farm,Wind,105.0,24.83,Berrybank 2 Wind Farm,-37.94,143.52,2026-02-02T16:58:49.647527
2026/02/03 03:00:00,BULGANA1,0.0,Bulgana Wind Farm Pty Ltd,Bulgana Green Power Hub,Wind,204.0,0.0,Bulgana Green Power Hub,-37.0975,142.973611,2026-02-02T16:58:49.647527
2026/02/03 03:00:00,CATHROCK,59.9,Cathedral Rocks Wind Farm Pty Ltd,Cathedral Rocks,Wind,66.0,90.76,Cathedral Rocks,-34.51,135.35,2026-02-02T16:58:49.647527
2026/02/03 03:00:00,CHYTWF1,5.6,Cherry Tree Wind Farm Pty Ltd as trustee for The Cherry Tree Project trust ,Cherry Tree Wind Farm,Wind,57.0,9.82,Cherry Tree Wind Farm,-37.1,145.26,2026-02-02T16:58:49.647527
2026/02/03 03:00:00,CLEMGPWF,36.16,Pacific Hydro Clements Gap Pty Ltd,Clements Gap Wind Farm,Wind,57.0,63.44,Clements Gap Wind Farm,-33.48,138.1,2026-02-02T16:58:49.647527
2026/02/03 03:00:00,CLRKCWF1,231.87,Stanwell Corporation Limited ,Clarke Creek Wind Farm,Wind,338.0,68.6,Clarke Creek Wind Farm,-22.85,149.45,2026-02-02T16:58:49.647527
2026/02/03 03:00:00,CLRKCWF2,83.7,Stanwell Corporation Limited ,Clarke Creek Wind Farm,Wind,101.0,82.87,Clarke Creek Wind Farm,-22.85,149.45,2026-02-02T16:58:49.647527
2026/02/03 03:00:00,CNUNDAWF,14.32,Canunda Power Pty Ltd,Canunda Wind Farm,Wind,46.0,31.13,Canunda Wind Farm,-37.73,140.39,2026-02-02T16:58:49.647527
2026/02/03 03:00:00,COLWF01,179.05,Collector Wind Farm Pty Ltd,Collector Wind Farm 1,Wind,219.0,81.76,Collector Wind Farm 1,-34.8719,149.3967,2026-02-02T16:58:49.647527
2026/02/03 03:00:00,COOPGWF1,345.09,PARF Company 10 Pty Limited as The Trustee for Coopers Gap Project Trust,Coopers Gap Wind Farm,Wind,440.0,78.43,Coopers Gap Wind Farm,-26.74,151.45,2026-02-02T16:58:49.647527
2026/02/03 03:00:00,CROOKWF2,37.91,Crookwell Development Pty Ltd ,Crookwell 2 Wind Farm,Wind,91.0,41.66,Crookwell 2 Wind Farm,-34.52,149.54,2026-02-02T16:58:49.647527
2026/02/03 03:00:00,CROOKWF3,20.26,Crookwell 3 Development Pty Ltd,Crookwell 3 Wind Farm,Wind,56.0,36.18,Crookwell 3 Wind Farm,-34.52,149.54,2026-02-02T16:58:49.647527
2026/02/03 03:00:00,CROWLWF1,1.22,Pacific Hydro Crowlands Pty Ltd ,Crowlands Wind Farm,Wind,79.0,1.54,Crowlands Wind Farm,-37.13,143.16,2026-02-02T16:58:49.647527
2026/02/03 03:00:00,CRURWF1,125.5,CRWF Nominees Pty Ltd As Trustee For The CRWF Trust,Crudine Ridge Wind Farm,Wind,138.0,90.94,Crudine Ridge Wind Farm,-32.97,149.64,2026-02-02T16:58:49.647527
2026/02/03 03:00:00,CTHLWF1,42.56,Wild Cattle Hill Pty Ltd,Cattle Hill Wind Farm,Wind,144.0,29.56,Cattle Hill Wind Farm,-42.15,146.69,2026-02-02T16:58:49.647527
2026/02/03 03:00:00,DULAWF1,105.4,Dulacca Energy Project Co Pty Ltd,Dulacca Wind Farm,Wind,173.0,60.92,Dulacca Wind Farm,-26.63,149.87,2026-02-02T16:58:49.647527
2026/02/03 03:00:00,DUNDWF1,24.4,Dundonnell Wind Farm Pty Ltd,Dundonnell Wind Farm,Wind,168.0,14.52,Dundonnell Wind Farm,-37.52,142.58,2026-02-02T16:58:49.647527
2026/02/03 03:00:00,DUNDWF2,9.83,Dundonnell Wind Farm Pty Ltd,Dundonnell Wind Farm,Wind,46.0,21.37,Dundonnell Wind Farm,-37.52,142.58,2026-02-02T16:58:49.647527
2026/02/03 03:00:00,DUNDWF3,15.58,Dundonnell Wind Farm Pty Ltd,Dundonnell Wind Farm,Wind,122.0,12.77,Dundonnell Wind Farm,-37.52,142.58,2026-02-02T16:58:49.647527
2026/02/03 03:00:00,ELAINWF1,10.51,Lal Lal Wind Farms Nom Co Pty Ltd,Elaine Wind Farm,Wind,82.0,12.82,Elaine Wind Farm,-37.36,144.0,2026-02-02T16:58:49.647527
2026/02/03 03:00:00,FLYCRKWF,71.79,Iberdrola Australia Energy Markets Pty Limited,Flyers Creek Wind Farm,Wind,140.0,51.28,Flyers Creek Wind Farm,-33.365556,148.981944,2026-02-02T16:58:49.647527
2026/02/03 03:00:00,GPWFEST1,25.55,Golden Plains WF1 Pty Ltd as Trustee for the Golden Plains WF1 Unit Trust,Golden Plains Wind Farm East,Wind,240.0,10.65,Golden Plains Wind Farm East,-37.945091,143.752614,2026-02-02T16:58:49.647527
2026/02/03 03:00:00,GPWFEST2,21.94,Golden Plains WF1 Pty Ltd as Trustee for the Golden Plains WF1 Unit Trust,Golden Plains Wind Farm East,Wind,253.0,8.67,Golden Plains Wind Farm East,-37.945091,143.752614,2026-02-02T16:58:49.647527
2026/02/03 03:00:00,GPWFEST3,30.05,Golden Plains WF1 Pty Ltd as Trustee for the Golden Plains WF1 Unit Trust,Golden Plains Wind Farm East,Wind,240.0,12.52,Golden Plains Wind Farm East,-37.945091,143.752614,2026-02-02T16:58:49.647527
2026/02/03 03:00:00,GRANWF1,5.17,Granville Harbour Operations Pty Ltd as The Trustee for Granville Harbour Operations Trust,Granville Harbour Wind Farm,Wind,111.0,4.66,Granville Harbour Wind Farm,-41.8,145.06,2026-02-02T16:58:49.647527
2026/02/03 03:00:00,GSWF1A,123.59,Goyder Wind Farm 1 Pty Ltd as the Trustee for Goyder Wind Farm 1 Trust,Goyder South Wind Farm 1A,Wind,201.0,61.49,Goyder South Wind Farm 1A,-33.679758,138.937597,2026-02-02T16:58:49.647527
2026/02/03 03:00:00,GSWF1B1,102.61,Goyder Wind Farm 1B Pty Ltd as the Trustee for the Goyder Wind Farm 1B Trust,Goyder South Wind Farm 1B,Wind,196.0,52.35,Goyder South Wind Farm 1B,-33.679758,138.937597,2026-02-02T16:58:49.647527
2026/02/03 03:00:00,GULLRWF1,130.28,New Gullen Range Wind Farm Pty Ltd,Gullen Range Wind Farm,Wind,161.0,80.92,Gullen Range Wind Farm,-34.34,149.27,2026-02-02T16:58:49.647527
2026/02/03 03:00:00,GULLRWF2,108.06,New Gullen Range Wind Farm Pty Ltd,Gullen Range Wind Farm,Wind,107.0,100.99,Gullen Range Wind Farm,-34.34,149.27,2026-02-02T16:58:49.647527
2026/02/03 03:00:00,GUNNING1,44.42,Gunning Wind Energy Developments Pty Ltd,Gunning Wind Farm,Wind,47.0,94.51,Gunning Wind Farm,-34.813333,149.4,2026-02-02T16:58:49.647527
2026/02/03 03:00:00,HALLWF1,66.8,AGL SA Generation Pty Limited,Hallett 1 Wind Farm,Wind,95.0,70.32,Hallett 1 Wind Farm,-33.367778,138.728611,2026-02-02T16:58:49.647527
2026/02/03 03:00:00,HALLWF2,56.88,AGL SA Generation Pty Limited,Hallett 2 Wind Farm,Wind,71.0,80.11,Hallett 2 Wind Farm,-33.367778,138.728611,2026-02-02T16:58:49.647527
2026/02/03 03:00:00,HD1WF1,59.95,Hawkesdale Asset Pty Ltd as trustee for Hawkesdale Asset Trust,Hawkesdale Wind Farm,Wind,89.0,67.36,Hawkesdale Wind Farm,-38.147894,142.361381,2026-02-02T16:58:49.647527
2026/02/03 03:00:00,HDWF1,81.2,HWF1 Pty Ltd,Hornsdale Wind Farm,Wind,102.0,79.61,Hornsdale Wind Farm,-33.050556,138.543611,2026-02-02T16:58:49.647527
2026/02/03 03:00:00,HDWF2,97.1,HWF 2 Pty Ltd,Hornsdale Wind Farm 2,Wind,102.0,95.2,Hornsdale Wind Farm 2,-33.06,138.54,2026-02-02T16:58:49.647527
2026/02/03 03:00:00,HDWF3,95.4,HWF3 Pty Ltd,Hornsdale Wind Farm 3,Wind,109.0,87.52,Hornsdale Wind Farm 3,-33.06,138.54,2026-02-02T16:58:49.647527
2026/02/03 03:00:00,KABANWF1,17.88,Kaban Wind Farm Pty Ltd as trustee for Kaban Wind Farm Trust,Kaban Wind Farm,Wind,152.0,11.76,Kaban Wind Farm,-17.56,145.41,2026-02-02T16:58:49.647527
2026/02/03 03:00:00,KEPWF1,0.0,Kennedy Energy Park Pty Ltd,Kennedy Energy Park,Wind,43.0,0.0,Kennedy Energy Park,-20.88,144.42,2026-02-02T16:58:49.647527
2026/02/03 03:00:00,KIATAWF1,22.5,Kiata ProjectCo Pty Ltd Atf Kiata Project Trust,Kiata Wind Farm,Wind,31.0,72.58,Kiata Wind Farm,-36.4,141.75,2026-02-02T16:58:49.647527
2026/02/03 03:00:00,LGAPWF1,33.07,Lincoln Gap Wind Farm (Operations) Pty Ltd,Lincoln Gap Wind Farm,Wind,123.0,26.89,Lincoln Gap Wind Farm,-32.564279,137.557328,2026-02-02T16:58:49.647527
2026/02/03 03:00:00,LGAPWF1,33.07,Lincoln Gap Wind Farm (Operations) Pty Ltd,Lincoln Gap Wind Farm,Wind,123.0,26.89,Lincoln Gap Wind Farm,-32.564279,137.557328,2026-02-02T16:58:49.647527
2026/02/03 03:00:00,LGAPWF2,29.25,Lincoln Gap Wind Farm (Operations) Pty Ltd,Lincoln Gap Wind Farm,Wind,85.0,34.41,Lincoln Gap Wind Farm,-32.564279,137.557328,2026-02-02T16:58:49.647527
2026/02/03 03:00:00,LGAPWF2,29.25,Lincoln Gap Wind Farm (Operations) Pty Ltd,Lincoln Gap Wind Farm,Wind,85.0,34.41,Lincoln Gap Wind Farm,-32.564279,137.557328,2026-02-02T16:58:49.647527
2026/02/03 03:00:00,LKBONNY1,15.36,Lake Bonney Wind Power Pty Ltd,Lake Bonney Wind Farm Stage 1,Wind,81.0,18.96,Lake Bonney Wind Farm Stage 1,-37.76,140.4,2026-02-02T16:58:49.647527
2026/02/03 03:00:00,LKBONNY2,57.44,Lake Bonney Wind Power Pty Ltd,Lake Bonney Stage 2 Windfarm,Wind,159.0,36.13,Lake Bonney Stage 2 Windfarm,-37.76,140.4,2026-02-02T16:58:49.647527
2026/02/03 03:00:00,LKBONNY3,19.87,Lake Bonney Wind Power Pty Ltd,Lake Bonney Stage 3 Wind Farm,Wind,39.0,50.95,Lake Bonney Stage 3 Wind Farm,-37.737781,140.388137,2026-02-02T16:58:49.647527
2026/02/03 03:00:00,MACARTH1,86.4,AGL Hydro Partnership,Macarthur Wind Farm,Wind,420.0,20.57,Macarthur Wind Farm,-38.048957,142.192112,2026-02-02T16:58:49.647527
2026/02/03 03:00:00,MCINTYR1,273.83,MacIntyre UJV Operator Pty Ltd,MacIntyre Wind Farm,Wind,890.0,30.77,MacIntyre Wind Farm,-28.32,151.54,2026-02-02T16:58:49.647527
2026/02/03 03:00:00,MERCER01,29.5,Mt Mercer Windfarm Pty Ltd,Mt Mercer Wind Farm,Wind,131.0,22.52,Mt Mercer Wind Farm,-37.841111,143.871111,2026-02-02T16:58:49.647527
2026/02/03 03:00:00,MEWF1,4.42,Ergon Energy Queensland Pty Ltd ,Mount Emerald Wind Farm,Wind,178.0,2.48,Mount Emerald Wind Farm,-17.133007,145.380644,2026-02-02T16:58:49.647527
2026/02/03 03:00:00,MRTLSWF1,29.02,Mortlake South Wind Farm Pty Ltd,Mortlake South Wind Farm,Wind,153.0,18.97,Mortlake South Wind Farm,-38.127337,142.857801,2026-02-02T16:58:49.647527
2026/02/03 03:00:00,MTGELWF1,22.46,Mt. Gellibrand Wind Farm Pty Ltd,Mt Gellibrand Wind Farm,Wind,132.0,17.02,Mt Gellibrand Wind Farm,-38.23,143.77,2026-02-02T16:58:49.647527
2026/02/03 03:00:00,MTMILLAR,24.9,Mt Millar Wind Farm Pty Ltd,Mt Millar Wind Farm,Wind,70.0,35.57,Mt Millar Wind Farm,-33.624444,136.703611,2026-02-02T16:58:49.647527
2026/02/03 03:00:00,MUSSELR1,3.1,Hydro-Electric Corporation,Musselroe Wind Farm,Wind,168.0,1.85,Musselroe Wind Farm,-40.780225,148.010799,2026-02-02T16:58:49.647527
2026/02/03 03:00:00,MUWAWF1,52.37,Telstra Energy (Generation) Pty Ltd,Murra Warra Wind Farm,Wind,225.7,23.2,Murra Warra Wind Farm,-36.432404,142.317853,2026-02-02T16:58:49.647527
2026/02/03 03:00:00,MUWAWF2,46.3,Murra Warra II Project Co Pty Ltd ATF The Murra Warra II Project Trust,Murra Warra Wind Farm Stage 2,Wind,203.0,22.81,Murra Warra Wind Farm Stage 2,-36.43,142.32,2026-02-02T16:58:49.647527
2026/02/03 03:00:00,NBHWF1,93.1,AGL SA Generation Pty Limited,North Brown Hill Wind Farm,Wind,132.0,70.53,North Brown Hill Wind Farm,-33.367778,138.728611,2026-02-02T16:58:49.647527
2026/02/03 03:00:00,OAKLAND1,12.0,AGL Hydro Partnership,Oaklands Hill Wind Farm,Wind,63.0,19.05,Oaklands Hill Wind Farm,-37.683078,142.551678,2026-02-02T16:58:49.647527
2026/02/03 03:00:00,PAREPW1,137.76,Iberdrola Australia Energy Markets Pty Limited,Port Augusta Renewable Energy Park,Wind,201.0,68.54,Port Augusta Renewable Energy Park,-32.566944,137.856111,2026-02-02T16:58:49.647527
2026/02/03 03:00:00,RYANCWF1,38.44,Ryan Corner Development Pty Ltd,Ryan Corner Wind Farm,Wind,205.0,18.75,Ryan Corner Wind Farm,-38.271017,142.140647,2026-02-02T16:58:49.647527
2026/02/03 03:00:00,RYEPARK1,374.11,Rye Park Renewable Energy Pty Ltd as trustee for Rye Park Wind Farm Trust,Rye Park Renewable Energy,Wind,384.0,97.42,Rye Park Renewable Energy,-32.138333,148.972778,2026-02-02T16:58:49.647527
2026/02/03 03:00:00,SALTCRK1,11.28,Salt Creek Wind Farm Pty Ltd,Salt Creek Wind Farm,Wind,54.0,20.89,Salt Creek Wind Farm,-37.95,142.63,2026-02-02T16:58:49.647527
2026/02/03 03:00:00,SAPHWF1,242.53,The Trustee For The SWF1 Operations Trust,Sapphire Wind Farm,Wind,270.0,89.83,Sapphire Wind Farm,-29.7,151.41,2026-02-02T16:58:49.647527
2026/02/03 03:00:00,SNOWNTH1,29.0,Snowtown Wind Farm Stage 2 Pty Ltd,Snowtown Wind Farm Stage 2 North,Wind,144.0,20.14,Snowtown Wind Farm Stage 2 North,-33.83,138.118611,2026-02-02T16:58:49.647527
2026/02/03 03:00:00,SNOWSTH1,39.7,Snowtown Wind Farm Stage 2 Pty Ltd,Snowtown South Wind Farm,Wind,126.0,31.51,Snowtown South Wind Farm,-33.83,138.118611,2026-02-02T16:58:49.647527
2026/02/03 03:00:00,SNOWTWN1,46.7,Snowtown Wind Farm Pty Ltd,Snowtown Wind Farm Units 1 And 47,Wind,99.0,47.17,Snowtown Wind Farm Units 1 And 47,-33.83,138.118611,2026-02-02T16:58:49.647527
2026/02/03 03:00:00,STARHLWF,21.69,Starfish Hill Wind Farm Pty Ltd,Starfish Hill Wind Farm,Wind,35.0,61.97,Starfish Hill Wind Farm,-35.58,138.14,2026-02-02T16:58:49.647527
2026/02/03 03:00:00,STOCKYD1,64.18,Stockyard Hill Wind Farm Pty Ltd,Stockyard Hill Wind Farm,Wind,511.0,12.56,Stockyard Hill Wind Farm,-37.535833,143.251389,2026-02-02T16:58:49.647527
2026/02/03 03:00:00,STWF1,0.0,PARF Company 8 Pty Ltd as The Trustee for Silverton Project Trust,Silverton Wind Farm,Wind,198.0,0.0,Silverton Wind Farm,-37.683168,142.551678,2026-02-02T16:58:49.647527
2026/02/03 03:00:00,TARALGA1,41.94,Taralga Wind Farm Nominees No 2 Pty Ltd (ATF Taralga Wind Farm Operating Trust),Taralga Wind Farm,Wind,106.0,39.57,Taralga Wind Farm,-34.42352,149.826267,2026-02-02T16:58:49.647527
2026/02/03 03:00:00,WAMBOWF1,105.3,Stanwell Corporation Limited,Wambo Wind Farm 1,Wind,245.0,42.98,Wambo Wind Farm 1,-35.187301,149.524945,2026-02-02T16:58:49.647527
2026/02/03 03:00:00,WATERLWF,87.7,Waterloo Wind Farm Pty Ltd,Waterloo Wind Farm,Wind,130.0,67.46,Waterloo Wind Farm,-34.00094,138.911567,2026-02-02T16:58:49.647527
2026/02/03 03:00:00,WGWF1,101.1,Willogoleche Power Pty Ltd As The Trustee For The Willogoleche Operating Trust,Willogoleche Wind Farm,Wind,119.0,84.96,Willogoleche Wind Farm,-33.39,138.85,2026-02-02T16:58:49.647527
2026/02/03 03:00:00,WOODLWN1,29.48,Woodlawn Wind Pty Ltd,Woodlawn Wind Farm,Wind,48.0,61.42,Woodlawn Wind Farm,-35.08,149.62,2026-02-02T16:58:49.647527
2026/02/03 03:00:00,WPWF,4.55,AGL SA Generation Pty Limited,Wattle Point Wind Farm,Wind,91.0,5.0,Wattle Point Wind Farm,-35.111624,137.7219,2026-02-02T16:58:49.647527
2026/02/03 03:00:00,WRWF1,162.26,White Rock Wind Farm Pty Ltd,White Rock Wind Farm,Wind,172.0,94.34,White Rock Wind Farm,-29.79,151.54,2026-02-02T16:58:49.647527
2026/02/03 03:00:00,YENDWF1,4.53,Lal Lal Wind Farms Nom Co Pty Ltd,Yendon Wind Farm,Wind,142.0,3.19,Yendon Wind Farm,-37.629987,144.022717,2026-02-02T16:58:49.647527
