SETTLEMENTDATE,DUID,SCADAVALUE,Participant,Station Name,Fuel Source - Primary,MAX_CAP,utilisation_pct,Plant,Latitude,Longitude,timestamp_utc
2026/02/16 03:05:00,CAPTL_WF,18.68,Iberdrola Australia Holdings Pty Limited,Capital Wind Farm,Wind,140.0,13.34,Capital Wind Farm,-35.1,149.31,2026-02-15T17:04:26.787102
2026/02/16 03:05:00,CHALLHWF,13.0,Pacific Hydro Challicum Hills Pty Ltd,Challicum Hills Wind Farm,Wind,52.0,25.0,Challicum Hills Wind Farm,-37.38,143.11,2026-02-15T17:04:26.787102
2026/02/16 03:05:00,CULLRGWF,19.53,Cullerin Range Wind Farm Pty Ltd,Cullerin Range Wind Farm,Wind,30.0,65.1,Cullerin Range Wind Farm,-34.81,149.4,2026-02-15T17:04:26.787102
2026/02/16 03:05:00,DIAPURWF1,8.1,Y.E.S. Energy (SA) Pty Ltd,Diapur Wind Farm,Wind,7.0,115.71,Diapur Wind Farm,-36.3425,141.43,2026-02-15T17:04:26.787102
2026/02/16 03:05:00,MLWF1,4.71,Mortons Lane Windfarm Pty Limited,Mortons Lane Wind Farm,Wind,20.0,23.55,Mortons Lane Wind Farm,-37.84,142.45,2026-02-15T17:04:26.787102
2026/02/16 03:05:00,WAUBRAWF,90.34,Pyrenees Wind Energy Developments Pty Ltd,Waubra Wind Farm,Wind,192.0,47.05,Waubra Wind Farm,-37.394498,143.638982,2026-02-15T17:04:26.787102
2026/02/16 03:05:00,WOOLNTH1,98.49,Hydro-Electric Corporation,Woolnorth Studland Bay / Bluff Point Wind Farm,Wind,140.0,70.35,Woolnorth Studland Bay / Bluff Point Wind Farm,-40.69,144.72,2026-02-15T17:04:26.787102
2026/02/16 03:05:00,YAMBUKWF,7.0,Energy Pacific (Vic) Pty Ltd,Yambuk Wind Farm,Wind,30.0,23.33,Yambuk Wind Farm,-38.299083,142.027577,2026-02-15T17:04:26.787102
2026/02/16 03:05:00,YSWF1,2.2,Pacific Hydro Yaloak South Pty Ltd,Yaloak South Wind Farm,Wind,28.0,7.86,Yaloak South Wind Farm,-37.7163,144.242853,2026-02-15T17:04:26.787102
2026/02/16 03:05:00,ARWF1,42.1,Ararat Wind Farm Pty Ltd,Ararat Wind Farm,Wind,241.0,17.47,Ararat Wind Farm,-37.232778,143.031389,2026-02-15T17:04:26.787102
2026/02/16 03:05:00,BALDHWF1,95.86,Alinta Energy Retail Sales Pty Ltd,Bald Hills Wind Farm,Wind,106.0,90.43,Bald Hills Wind Farm,-38.79,145.93,2026-02-15T17:04:26.787102
2026/02/16 03:05:00,BANGOWF1,93.3,BWF Nominees Pty Ltd as The Trustee for BWF Trust,Bango 973 Wind Farm,Wind,155.0,60.19,Bango 973 Wind Farm,-34.551582,148.732808,2026-02-15T17:04:26.787102
2026/02/16 03:05:00,BANGOWF2,49.0,BWF Nominees Pty Ltd as The Trustee for BWF Trust,Bango 999 Wind Farm,Wind,82.0,59.76,Bango 999 Wind Farm,-34.551582,148.732808,2026-02-15T17:04:26.787102
2026/02/16 03:05:00,BLUFF1,31.6,AGL SA Generation Pty Limited,The Bluff Wind Farm,Wind,53.0,59.62,The Bluff Wind Farm,-33.367778,138.728611,2026-02-15T17:04:26.787102
2026/02/16 03:05:00,BOCORWF1,15.71,Boco Rock Wind Farm Pty Ltd,Boco Rock Wind Farm,Wind,111.0,14.15,Boco Rock Wind Farm,-36.578611,149.103333,2026-02-15T17:04:26.787102
2026/02/16 03:05:00,BRYB1WF1,22.79,Berrybank Development Pty Ltd,Berrybank Wind Farm,Wind,175.9,12.96,Berrybank Wind Farm,-37.94,143.52,2026-02-15T17:04:26.787102
2026/02/16 03:05:00,BRYB2WF2,23.77,Berrybank 2 Asset Pty Ltd as trustee for Berrybank 2 Asset Trust,Berrybank 2 Wind Farm,Wind,105.0,22.64,Berrybank 2 Wind Farm,-37.94,143.52,2026-02-15T17:04:26.787102
2026/02/16 03:05:00,BULGANA1,34.87,Bulgana Wind Farm Pty Ltd,Bulgana Green Power Hub,Wind,204.0,17.09,Bulgana Green Power Hub,-37.0975,142.973611,2026-02-15T17:04:26.787102
2026/02/16 03:05:00,CATHROCK,46.2,Cathedral Rocks Wind Farm Pty Ltd,Cathedral Rocks,Wind,66.0,70.0,Cathedral Rocks,-34.51,135.35,2026-02-15T17:04:26.787102
2026/02/16 03:05:00,CHYTWF1,14.59,Cherry Tree Wind Farm Pty Ltd as trustee for The Cherry Tree Project trust ,Cherry Tree Wind Farm,Wind,57.0,25.6,Cherry Tree Wind Farm,-37.1,145.26,2026-02-15T17:04:26.787102
2026/02/16 03:05:00,CLEMGPWF,16.06,Pacific Hydro Clements Gap Pty Ltd,Clements Gap Wind Farm,Wind,57.0,28.18,Clements Gap Wind Farm,-33.48,138.1,2026-02-15T17:04:26.787102
2026/02/16 03:05:00,CLRKCWF1,151.76,Stanwell Corporation Limited ,Clarke Creek Wind Farm,Wind,338.0,44.9,Clarke Creek Wind Farm,-22.85,149.45,2026-02-15T17:04:26.787102
2026/02/16 03:05:00,CLRKCWF2,44.63,Stanwell Corporation Limited ,Clarke Creek Wind Farm,Wind,101.0,44.19,Clarke Creek Wind Farm,-22.85,149.45,2026-02-15T17:04:26.787102
2026/02/16 03:05:00,CNUNDAWF,12.21,Canunda Power Pty Ltd,Canunda Wind Farm,Wind,46.0,26.54,Canunda Wind Farm,-37.73,140.39,2026-02-15T17:04:26.787102
2026/02/16 03:05:00,COLWF01,64.94,Collector Wind Farm Pty Ltd,Collector Wind Farm 1,Wind,219.0,29.65,Collector Wind Farm 1,-34.8719,149.3967,2026-02-15T17:04:26.787102
2026/02/16 03:05:00,COOPGWF1,268.53,PARF Company 10 Pty Limited as The Trustee for Coopers Gap Project Trust,Coopers Gap Wind Farm,Wind,440.0,61.03,Coopers Gap Wind Farm,-26.74,151.45,2026-02-15T17:04:26.787102
2026/02/16 03:05:00,CROOKWF2,18.47,Crookwell Development Pty Ltd ,Crookwell 2 Wind Farm,Wind,91.0,20.3,Crookwell 2 Wind Farm,-34.52,149.54,2026-02-15T17:04:26.787102
2026/02/16 03:05:00,CROOKWF3,17.27,Crookwell 3 Development Pty Ltd,Crookwell 3 Wind Farm,Wind,56.0,30.84,Crookwell 3 Wind Farm,-34.52,149.54,2026-02-15T17:04:26.787102
2026/02/16 03:05:00,CROWLWF1,33.4,Pacific Hydro Crowlands Pty Ltd ,Crowlands Wind Farm,Wind,79.0,42.28,Crowlands Wind Farm,-37.13,143.16,2026-02-15T17:04:26.787102
2026/02/16 03:05:00,CRURWF1,60.6,CRWF Nominees Pty Ltd As Trustee For The CRWF Trust,Crudine Ridge Wind Farm,Wind,138.0,43.91,Crudine Ridge Wind Farm,-32.97,149.64,2026-02-15T17:04:26.787102
2026/02/16 03:05:00,CTHLWF1,5.45,Wild Cattle Hill Pty Ltd,Cattle Hill Wind Farm,Wind,144.0,3.78,Cattle Hill Wind Farm,-42.15,146.69,2026-02-15T17:04:26.787102
2026/02/16 03:05:00,DULAWF1,91.7,Dulacca Energy Project Co Pty Ltd,Dulacca Wind Farm,Wind,173.0,53.01,Dulacca Wind Farm,-26.63,149.87,2026-02-15T17:04:26.787102
2026/02/16 03:05:00,DUNDWF1,35.99,Dundonnell Wind Farm Pty Ltd,Dundonnell Wind Farm,Wind,168.0,21.42,Dundonnell Wind Farm,-37.52,142.58,2026-02-15T17:04:26.787102
2026/02/16 03:05:00,DUNDWF2,9.44,Dundonnell Wind Farm Pty Ltd,Dundonnell Wind Farm,Wind,46.0,20.52,Dundonnell Wind Farm,-37.52,142.58,2026-02-15T17:04:26.787102
2026/02/16 03:05:00,DUNDWF3,28.07,Dundonnell Wind Farm Pty Ltd,Dundonnell Wind Farm,Wind,122.0,23.01,Dundonnell Wind Farm,-37.52,142.58,2026-02-15T17:04:26.787102
2026/02/16 03:05:00,ELAINWF1,26.95,Lal Lal Wind Farms Nom Co Pty Ltd,Elaine Wind Farm,Wind,82.0,32.87,Elaine Wind Farm,-37.36,144.0,2026-02-15T17:04:26.787102
2026/02/16 03:05:00,FLYCRKWF,62.59,Iberdrola Australia Energy Markets Pty Limited,Flyers Creek Wind Farm,Wind,140.0,44.71,Flyers Creek Wind Farm,-33.365556,148.981944,2026-02-15T17:04:26.787102
2026/02/16 03:05:00,GPWFEST1,49.47,Golden Plains WF1 Pty Ltd as Trustee for the Golden Plains WF1 Unit Trust,Golden Plains Wind Farm East,Wind,240.0,20.61,Golden Plains Wind Farm East,-37.945091,143.752614,2026-02-15T17:04:26.787102
2026/02/16 03:05:00,GPWFEST2,36.94,Golden Plains WF1 Pty Ltd as Trustee for the Golden Plains WF1 Unit Trust,Golden Plains Wind Farm East,Wind,253.0,14.6,Golden Plains Wind Farm East,-37.945091,143.752614,2026-02-15T17:04:26.787102
2026/02/16 03:05:00,GPWFEST3,20.82,Golden Plains WF1 Pty Ltd as Trustee for the Golden Plains WF1 Unit Trust,Golden Plains Wind Farm East,Wind,240.0,8.68,Golden Plains Wind Farm East,-37.945091,143.752614,2026-02-15T17:04:26.787102
2026/02/16 03:05:00,GRANWF1,15.5,Granville Harbour Operations Pty Ltd as The Trustee for Granville Harbour Operations Trust,Granville Harbour Wind Farm,Wind,111.0,13.96,Granville Harbour Wind Farm,-41.8,145.06,2026-02-15T17:04:26.787102
2026/02/16 03:05:00,GSWF1A,108.64,Goyder Wind Farm 1 Pty Ltd as the Trustee for Goyder Wind Farm 1 Trust,Goyder South Wind Farm 1A,Wind,201.0,54.05,Goyder South Wind Farm 1A,-33.679758,138.937597,2026-02-15T17:04:26.787102
2026/02/16 03:05:00,GSWF1B1,121.59,Goyder Wind Farm 1B Pty Ltd as the Trustee for the Goyder Wind Farm 1B Trust,Goyder South Wind Farm 1B,Wind,196.0,62.04,Goyder South Wind Farm 1B,-33.679758,138.937597,2026-02-15T17:04:26.787102
2026/02/16 03:05:00,GULLRWF1,49.52,New Gullen Range Wind Farm Pty Ltd,Gullen Range Wind Farm,Wind,161.0,30.76,Gullen Range Wind Farm,-34.34,149.27,2026-02-15T17:04:26.787102
2026/02/16 03:05:00,GULLRWF2,57.68,New Gullen Range Wind Farm Pty Ltd,Gullen Range Wind Farm,Wind,107.0,53.91,Gullen Range Wind Farm,-34.34,149.27,2026-02-15T17:04:26.787102
2026/02/16 03:05:00,GUNNING1,32.75,Gunning Wind Energy Developments Pty Ltd,Gunning Wind Farm,Wind,47.0,69.68,Gunning Wind Farm,-34.813333,149.4,2026-02-15T17:04:26.787102
2026/02/16 03:05:00,HALLWF1,58.45,AGL SA Generation Pty Limited,Hallett 1 Wind Farm,Wind,95.0,61.53,Hallett 1 Wind Farm,-33.367778,138.728611,2026-02-15T17:04:26.787102
2026/02/16 03:05:00,HALLWF2,48.27,AGL SA Generation Pty Limited,Hallett 2 Wind Farm,Wind,71.0,67.99,Hallett 2 Wind Farm,-33.367778,138.728611,2026-02-15T17:04:26.787102
2026/02/16 03:05:00,HD1WF1,71.09,Hawkesdale Asset Pty Ltd as trustee for Hawkesdale Asset Trust,Hawkesdale Wind Farm,Wind,89.0,79.88,Hawkesdale Wind Farm,-38.147894,142.361381,2026-02-15T17:04:26.787102
2026/02/16 03:05:00,HDWF1,58.5,HWF1 Pty Ltd,Hornsdale Wind Farm,Wind,102.0,57.35,Hornsdale Wind Farm,-33.050556,138.543611,2026-02-15T17:04:26.787102
2026/02/16 03:05:00,HDWF2,42.3,HWF 2 Pty Ltd,Hornsdale Wind Farm 2,Wind,102.0,41.47,Hornsdale Wind Farm 2,-33.06,138.54,2026-02-15T17:04:26.787102
2026/02/16 03:05:00,HDWF3,47.5,HWF3 Pty Ltd,Hornsdale Wind Farm 3,Wind,109.0,43.58,Hornsdale Wind Farm 3,-33.06,138.54,2026-02-15T17:04:26.787102
2026/02/16 03:05:00,KABANWF1,12.81,Kaban Wind Farm Pty Ltd as trustee for Kaban Wind Farm Trust,Kaban Wind Farm,Wind,152.0,8.43,Kaban Wind Farm,-17.56,145.41,2026-02-15T17:04:26.787102
2026/02/16 03:05:00,KEPWF1,12.8,Kennedy Energy Park Pty Ltd,Kennedy Energy Park,Wind,43.0,29.77,Kennedy Energy Park,-20.88,144.42,2026-02-15T17:04:26.787102
2026/02/16 03:05:00,KIATAWF1,25.6,Kiata ProjectCo Pty Ltd Atf Kiata Project Trust,Kiata Wind Farm,Wind,31.0,82.58,Kiata Wind Farm,-36.4,141.75,2026-02-15T17:04:26.787102
2026/02/16 03:05:00,LGAPWF1,63.85,Lincoln Gap Wind Farm (Operations) Pty Ltd,Lincoln Gap Wind Farm,Wind,123.0,51.91,Lincoln Gap Wind Farm,-32.564279,137.557328,2026-02-15T17:04:26.787102
2026/02/16 03:05:00,LGAPWF1,63.85,Lincoln Gap Wind Farm (Operations) Pty Ltd,Lincoln Gap Wind Farm,Wind,123.0,51.91,Lincoln Gap Wind Farm,-32.564279,137.557328,2026-02-15T17:04:26.787102
2026/02/16 03:05:00,LGAPWF2,57.71,Lincoln Gap Wind Farm (Operations) Pty Ltd,Lincoln Gap Wind Farm,Wind,85.0,67.89,Lincoln Gap Wind Farm,-32.564279,137.557328,2026-02-15T17:04:26.787102
2026/02/16 03:05:00,LGAPWF2,57.71,Lincoln Gap Wind Farm (Operations) Pty Ltd,Lincoln Gap Wind Farm,Wind,85.0,67.89,Lincoln Gap Wind Farm,-32.564279,137.557328,2026-02-15T17:04:26.787102
2026/02/16 03:05:00,LKBONNY1,24.65,Lake Bonney Wind Power Pty Ltd,Lake Bonney Wind Farm Stage 1,Wind,81.0,30.43,Lake Bonney Wind Farm Stage 1,-37.76,140.4,2026-02-15T17:04:26.787102
2026/02/16 03:05:00,LKBONNY2,41.54,Lake Bonney Wind Power Pty Ltd,Lake Bonney Stage 2 Windfarm,Wind,159.0,26.13,Lake Bonney Stage 2 Windfarm,-37.76,140.4,2026-02-15T17:04:26.787102
2026/02/16 03:05:00,LKBONNY3,12.06,Lake Bonney Wind Power Pty Ltd,Lake Bonney Stage 3 Wind Farm,Wind,39.0,30.92,Lake Bonney Stage 3 Wind Farm,-37.737781,140.388137,2026-02-15T17:04:26.787102
2026/02/16 03:05:00,MACARTH1,126.4,AGL Hydro Partnership,Macarthur Wind Farm,Wind,420.0,30.1,Macarthur Wind Farm,-38.048957,142.192112,2026-02-15T17:04:26.787102
2026/02/16 03:05:00,MCINTYR1,368.66,MacIntyre UJV Operator Pty Ltd,MacIntyre Wind Farm,Wind,890.0,41.42,MacIntyre Wind Farm,-28.32,151.54,2026-02-15T17:04:26.787102
2026/02/16 03:05:00,MERCER01,48.8,Mt Mercer Windfarm Pty Ltd,Mt Mercer Wind Farm,Wind,131.0,37.25,Mt Mercer Wind Farm,-37.841111,143.871111,2026-02-15T17:04:26.787102
2026/02/16 03:05:00,MEWF1,0.0,Ergon Energy Queensland Pty Ltd ,Mount Emerald Wind Farm,Wind,178.0,0.0,Mount Emerald Wind Farm,-17.133007,145.380644,2026-02-15T17:04:26.787102
2026/02/16 03:05:00,MRTLSWF1,91.06,Mortlake South Wind Farm Pty Ltd,Mortlake South Wind Farm,Wind,153.0,59.52,Mortlake South Wind Farm,-38.127337,142.857801,2026-02-15T17:04:26.787102
2026/02/16 03:05:00,MTGELWF1,52.08,Mt. Gellibrand Wind Farm Pty Ltd,Mt Gellibrand Wind Farm,Wind,132.0,39.45,Mt Gellibrand Wind Farm,-38.23,143.77,2026-02-15T17:04:26.787102
2026/02/16 03:05:00,MTMILLAR,64.3,Mt Millar Wind Farm Pty Ltd,Mt Millar Wind Farm,Wind,70.0,91.86,Mt Millar Wind Farm,-33.624444,136.703611,2026-02-15T17:04:26.787102
2026/02/16 03:05:00,MUSSELR1,61.1,Hydro-Electric Corporation,Musselroe Wind Farm,Wind,168.0,36.37,Musselroe Wind Farm,-40.780225,148.010799,2026-02-15T17:04:26.787102
2026/02/16 03:05:00,MUWAWF1,91.09,Telstra Energy (Generation) Pty Ltd,Murra Warra Wind Farm,Wind,225.7,40.36,Murra Warra Wind Farm,-36.432404,142.317853,2026-02-15T17:04:26.787102
2026/02/16 03:05:00,MUWAWF2,100.6,Murra Warra II Project Co Pty Ltd ATF The Murra Warra II Project Trust,Murra Warra Wind Farm Stage 2,Wind,203.0,49.56,Murra Warra Wind Farm Stage 2,-36.43,142.32,2026-02-15T17:04:26.787102
2026/02/16 03:05:00,NBHWF1,77.1,AGL SA Generation Pty Limited,North Brown Hill Wind Farm,Wind,132.0,58.41,North Brown Hill Wind Farm,-33.367778,138.728611,2026-02-15T17:04:26.787102
2026/02/16 03:05:00,OAKLAND1,28.8,AGL Hydro Partnership,Oaklands Hill Wind Farm,Wind,63.0,45.71,Oaklands Hill Wind Farm,-37.683078,142.551678,2026-02-15T17:04:26.787102
2026/02/16 03:05:00,PAREPW1,91.18,Iberdrola Australia Energy Markets Pty Limited,Port Augusta Renewable Energy Park,Wind,201.0,45.36,Port Augusta Renewable Energy Park,-32.566944,137.856111,2026-02-15T17:04:26.787102
2026/02/16 03:05:00,RYANCWF1,98.21,Ryan Corner Development Pty Ltd,Ryan Corner Wind Farm,Wind,205.0,47.91,Ryan Corner Wind Farm,-38.271017,142.140647,2026-02-15T17:04:26.787102
2026/02/16 03:05:00,RYEPARK1,172.95,Rye Park Renewable Energy Pty Ltd as trustee for Rye Park Wind Farm Trust,Rye Park Renewable Energy,Wind,384.0,45.04,Rye Park Renewable Energy,-32.138333,148.972778,2026-02-15T17:04:26.787102
2026/02/16 03:05:00,SALTCRK1,13.37,Salt Creek Wind Farm Pty Ltd,Salt Creek Wind Farm,Wind,54.0,24.76,Salt Creek Wind Farm,-37.95,142.63,2026-02-15T17:04:26.787102
2026/02/16 03:05:00,SAPHWF1,261.84,The Trustee For The SWF1 Operations Trust,Sapphire Wind Farm,Wind,270.0,96.98,Sapphire Wind Farm,-29.7,151.41,2026-02-15T17:04:26.787102
2026/02/16 03:05:00,SNOWNTH1,87.5,Snowtown Wind Farm Stage 2 Pty Ltd,Snowtown Wind Farm Stage 2 North,Wind,144.0,60.76,Snowtown Wind Farm Stage 2 North,-33.83,138.118611,2026-02-15T17:04:26.787102
2026/02/16 03:05:00,SNOWSTH1,85.6,Snowtown Wind Farm Stage 2 Pty Ltd,Snowtown South Wind Farm,Wind,126.0,67.94,Snowtown South Wind Farm,-33.83,138.118611,2026-02-15T17:04:26.787102
2026/02/16 03:05:00,SNOWTWN1,76.47,Snowtown Wind Farm Pty Ltd,Snowtown Wind Farm Units 1 And 47,Wind,99.0,77.24,Snowtown Wind Farm Units 1 And 47,-33.83,138.118611,2026-02-15T17:04:26.787102
2026/02/16 03:05:00,STARHLWF,14.3,Starfish Hill Wind Farm Pty Ltd,Starfish Hill Wind Farm,Wind,35.0,40.86,Starfish Hill Wind Farm,-35.58,138.14,2026-02-15T17:04:26.787102
2026/02/16 03:05:00,STOCKYD1,275.74,Stockyard Hill Wind Farm Pty Ltd,Stockyard Hill Wind Farm,Wind,511.0,53.96,Stockyard Hill Wind Farm,-37.535833,143.251389,2026-02-15T17:04:26.787102
2026/02/16 03:05:00,STWF1,27.82,PARF Company 8 Pty Ltd as The Trustee for Silverton Project Trust,Silverton Wind Farm,Wind,198.0,14.05,Silverton Wind Farm,-37.683168,142.551678,2026-02-15T17:04:26.787102
2026/02/16 03:05:00,TARALGA1,27.33,Taralga Wind Farm Nominees No 2 Pty Ltd (ATF Taralga Wind Farm Operating Trust),Taralga Wind Farm,Wind,106.0,25.78,Taralga Wind Farm,-34.42352,149.826267,2026-02-15T17:04:26.787102
2026/02/16 03:05:00,WAMBOWF1,111.84,Stanwell Corporation Limited,Wambo Wind Farm 1,Wind,245.0,45.65,Wambo Wind Farm 1,-35.187301,149.524945,2026-02-15T17:04:26.787102
2026/02/16 03:05:00,WATERLWF,34.9,Waterloo Wind Farm Pty Ltd,Waterloo Wind Farm,Wind,130.0,26.85,Waterloo Wind Farm,-34.00094,138.911567,2026-02-15T17:04:26.787102
2026/02/16 03:05:00,WGWF1,64.0,Willogoleche Power Pty Ltd As The Trustee For The Willogoleche Operating Trust,Willogoleche Wind Farm,Wind,119.0,53.78,Willogoleche Wind Farm,-33.39,138.85,2026-02-15T17:04:26.787102
2026/02/16 03:05:00,WOODLWN1,10.02,Woodlawn Wind Pty Ltd,Woodlawn Wind Farm,Wind,48.0,20.88,Woodlawn Wind Farm,-35.08,149.62,2026-02-15T17:04:26.787102
2026/02/16 03:05:00,WPWF,9.77,AGL SA Generation Pty Limited,Wattle Point Wind Farm,Wind,91.0,10.74,Wattle Point Wind Farm,-35.111624,137.7219,2026-02-15T17:04:26.787102
2026/02/16 03:05:00,WRWF1,164.29,White Rock Wind Farm Pty Ltd,White Rock Wind Farm,Wind,172.0,95.52,White Rock Wind Farm,-29.79,151.54,2026-02-15T17:04:26.787102
2026/02/16 03:05:00,YENDWF1,63.73,Lal Lal Wind Farms Nom Co Pty Ltd,Yendon Wind Farm,Wind,142.0,44.88,Yendon Wind Farm,-37.629987,144.022717,2026-02-15T17:04:26.787102
