SETTLEMENTDATE,DUID,SCADAVALUE,Participant,Station Name,Fuel Source - Primary,MAX_CAP,utilisation_pct,Plant,Latitude,Longitude,timestamp_utc
2026/03/26 18:10:00,CAPTL_WF,75.56,Iberdrola Australia Holdings Pty Limited,Capital Wind Farm,Wind,140.0,53.97,Capital Wind Farm,-35.1,149.31,2026-03-26T08:06:31.485754
2026/03/26 18:10:00,CHALLHWF,24.5,Pacific Hydro Challicum Hills Pty Ltd,Challicum Hills Wind Farm,Wind,52.0,47.12,Challicum Hills Wind Farm,-37.38,143.11,2026-03-26T08:06:31.485754
2026/03/26 18:10:00,CULLRGWF,14.77,Cullerin Range Wind Farm Pty Ltd,Cullerin Range Wind Farm,Wind,30.0,49.23,Cullerin Range Wind Farm,-34.81,149.4,2026-03-26T08:06:31.485754
2026/03/26 18:10:00,DIAPURWF1,8.3,Y.E.S. Energy (SA) Pty Ltd,Diapur Wind Farm,Wind,7.0,118.57,Diapur Wind Farm,-36.3425,141.43,2026-03-26T08:06:31.485754
2026/03/26 18:10:00,MLWF1,17.62,Mortons Lane Windfarm Pty Limited,Mortons Lane Wind Farm,Wind,20.0,88.1,Mortons Lane Wind Farm,-37.84,142.45,2026-03-26T08:06:31.485754
2026/03/26 18:10:00,WAUBRAWF,156.25,Pyrenees Wind Energy Developments Pty Ltd,Waubra Wind Farm,Wind,192.0,81.38,Waubra Wind Farm,-37.394498,143.638982,2026-03-26T08:06:31.485754
2026/03/26 18:10:00,WOOLNTH1,95.26,Hydro-Electric Corporation,Woolnorth Studland Bay / Bluff Point Wind Farm,Wind,140.0,68.04,Woolnorth Studland Bay / Bluff Point Wind Farm,-40.69,144.72,2026-03-26T08:06:31.485754
2026/03/26 18:10:00,YAMBUKWF,28.0,Energy Pacific (Vic) Pty Ltd,Yambuk Wind Farm,Wind,30.0,93.33,Yambuk Wind Farm,-38.299083,142.027577,2026-03-26T08:06:31.485754
2026/03/26 18:10:00,YSWF1,13.5,Pacific Hydro Yaloak South Pty Ltd,Yaloak South Wind Farm,Wind,28.0,48.21,Yaloak South Wind Farm,-37.7163,144.242853,2026-03-26T08:06:31.485754
2026/03/26 18:10:00,ARWF1,75.5,Ararat Wind Farm Pty Ltd,Ararat Wind Farm,Wind,241.0,31.33,Ararat Wind Farm,-37.232778,143.031389,2026-03-26T08:06:31.485754
2026/03/26 18:10:00,BALDHWF1,87.32,Alinta Energy Retail Sales Pty Ltd,Bald Hills Wind Farm,Wind,106.0,82.38,Bald Hills Wind Farm,-38.79,145.93,2026-03-26T08:06:31.485754
2026/03/26 18:10:00,BANGOWF1,146.3,BWF Nominees Pty Ltd as The Trustee for BWF Trust,Bango 973 Wind Farm,Wind,155.0,94.39,Bango 973 Wind Farm,-34.551582,148.732808,2026-03-26T08:06:31.485754
2026/03/26 18:10:00,BANGOWF2,71.9,BWF Nominees Pty Ltd as The Trustee for BWF Trust,Bango 999 Wind Farm,Wind,82.0,87.68,Bango 999 Wind Farm,-34.551582,148.732808,2026-03-26T08:06:31.485754
2026/03/26 18:10:00,BLUFF1,7.2,AGL SA Generation Pty Limited,The Bluff Wind Farm,Wind,53.0,13.58,The Bluff Wind Farm,-33.367778,138.728611,2026-03-26T08:06:31.485754
2026/03/26 18:10:00,BOCORWF1,23.17,Boco Rock Wind Farm Pty Ltd,Boco Rock Wind Farm,Wind,111.0,20.87,Boco Rock Wind Farm,-36.578611,149.103333,2026-03-26T08:06:31.485754
2026/03/26 18:10:00,BRYB1WF1,74.77,Berrybank Development Pty Ltd,Berrybank Wind Farm,Wind,175.9,42.51,Berrybank Wind Farm,-37.94,143.52,2026-03-26T08:06:31.485754
2026/03/26 18:10:00,BRYB2WF2,60.26,Berrybank 2 Asset Pty Ltd as trustee for Berrybank 2 Asset Trust,Berrybank 2 Wind Farm,Wind,105.0,57.39,Berrybank 2 Wind Farm,-37.94,143.52,2026-03-26T08:06:31.485754
2026/03/26 18:10:00,BULGANA1,102.33,Bulgana Wind Farm Pty Ltd,Bulgana Green Power Hub,Wind,204.0,50.16,Bulgana Green Power Hub,-37.0975,142.973611,2026-03-26T08:06:31.485754
2026/03/26 18:10:00,CATHROCK,26.6,Cathedral Rocks Wind Farm Pty Ltd,Cathedral Rocks,Wind,66.0,40.3,Cathedral Rocks,-34.51,135.35,2026-03-26T08:06:31.485754
2026/03/26 18:10:00,CHYTWF1,56.55,Cherry Tree Wind Farm Pty Ltd as trustee for The Cherry Tree Project trust ,Cherry Tree Wind Farm,Wind,57.0,99.21,Cherry Tree Wind Farm,-37.1,145.26,2026-03-26T08:06:31.485754
2026/03/26 18:10:00,CLEMGPWF,50.42,Pacific Hydro Clements Gap Pty Ltd,Clements Gap Wind Farm,Wind,57.0,88.46,Clements Gap Wind Farm,-33.48,138.1,2026-03-26T08:06:31.485754
2026/03/26 18:10:00,CLRKCWF1,249.5,Stanwell Corporation Limited ,Clarke Creek Wind Farm,Wind,338.0,73.82,Clarke Creek Wind Farm,-22.85,149.45,2026-03-26T08:06:31.485754
2026/03/26 18:10:00,CLRKCWF2,49.47,Stanwell Corporation Limited ,Clarke Creek Wind Farm,Wind,101.0,48.98,Clarke Creek Wind Farm,-22.85,149.45,2026-03-26T08:06:31.485754
2026/03/26 18:10:00,CNUNDAWF,37.84,Canunda Power Pty Ltd,Canunda Wind Farm,Wind,46.0,82.26,Canunda Wind Farm,-37.73,140.39,2026-03-26T08:06:31.485754
2026/03/26 18:10:00,COLWF01,56.25,Collector Wind Farm Pty Ltd,Collector Wind Farm 1,Wind,219.0,25.68,Collector Wind Farm 1,-34.8719,149.3967,2026-03-26T08:06:31.485754
2026/03/26 18:10:00,COOPGWF1,18.94,PARF Company 10 Pty Limited as The Trustee for Coopers Gap Project Trust,Coopers Gap Wind Farm,Wind,440.0,4.3,Coopers Gap Wind Farm,-26.74,151.45,2026-03-26T08:06:31.485754
2026/03/26 18:10:00,CROOKWF2,37.74,Crookwell Development Pty Ltd ,Crookwell 2 Wind Farm,Wind,91.0,41.47,Crookwell 2 Wind Farm,-34.52,149.54,2026-03-26T08:06:31.485754
2026/03/26 18:10:00,CROOKWF3,27.05,Crookwell 3 Development Pty Ltd,Crookwell 3 Wind Farm,Wind,56.0,48.3,Crookwell 3 Wind Farm,-34.52,149.54,2026-03-26T08:06:31.485754
2026/03/26 18:10:00,CROWLWF1,53.44,Pacific Hydro Crowlands Pty Ltd ,Crowlands Wind Farm,Wind,79.0,67.65,Crowlands Wind Farm,-37.13,143.16,2026-03-26T08:06:31.485754
2026/03/26 18:10:00,CRURWF1,23.6,CRWF Nominees Pty Ltd As Trustee For The CRWF Trust,Crudine Ridge Wind Farm,Wind,138.0,17.1,Crudine Ridge Wind Farm,-32.97,149.64,2026-03-26T08:06:31.485754
2026/03/26 18:10:00,CTHLWF1,113.63,Wild Cattle Hill Pty Ltd,Cattle Hill Wind Farm,Wind,144.0,78.91,Cattle Hill Wind Farm,-42.15,146.69,2026-03-26T08:06:31.485754
2026/03/26 18:10:00,DULAWF1,7.5,Dulacca Energy Project Co Pty Ltd,Dulacca Wind Farm,Wind,173.0,4.34,Dulacca Wind Farm,-26.63,149.87,2026-03-26T08:06:31.485754
2026/03/26 18:10:00,DUNDWF1,83.69,Dundonnell Wind Farm Pty Ltd,Dundonnell Wind Farm,Wind,168.0,49.82,Dundonnell Wind Farm,-37.52,142.58,2026-03-26T08:06:31.485754
2026/03/26 18:10:00,DUNDWF2,22.99,Dundonnell Wind Farm Pty Ltd,Dundonnell Wind Farm,Wind,46.0,49.98,Dundonnell Wind Farm,-37.52,142.58,2026-03-26T08:06:31.485754
2026/03/26 18:10:00,DUNDWF3,60.53,Dundonnell Wind Farm Pty Ltd,Dundonnell Wind Farm,Wind,122.0,49.61,Dundonnell Wind Farm,-37.52,142.58,2026-03-26T08:06:31.485754
2026/03/26 18:10:00,ELAINWF1,13.02,Lal Lal Wind Farms Nom Co Pty Ltd,Elaine Wind Farm,Wind,82.0,15.88,Elaine Wind Farm,-37.36,144.0,2026-03-26T08:06:31.485754
2026/03/26 18:10:00,FLYCRKWF,63.37,Iberdrola Australia Energy Markets Pty Limited,Flyers Creek Wind Farm,Wind,140.0,45.26,Flyers Creek Wind Farm,-33.365556,148.981944,2026-03-26T08:06:31.485754
2026/03/26 18:10:00,GPWFEST1,55.12,Golden Plains WF1 Pty Ltd as Trustee for the Golden Plains WF1 Unit Trust,Golden Plains Wind Farm East,Wind,240.0,22.97,Golden Plains Wind Farm East,-37.945091,143.752614,2026-03-26T08:06:31.485754
2026/03/26 18:10:00,GPWFEST2,36.08,Golden Plains WF1 Pty Ltd as Trustee for the Golden Plains WF1 Unit Trust,Golden Plains Wind Farm East,Wind,253.0,14.26,Golden Plains Wind Farm East,-37.945091,143.752614,2026-03-26T08:06:31.485754
2026/03/26 18:10:00,GPWFEST3,78.52,Golden Plains WF1 Pty Ltd as Trustee for the Golden Plains WF1 Unit Trust,Golden Plains Wind Farm East,Wind,240.0,32.72,Golden Plains Wind Farm East,-37.945091,143.752614,2026-03-26T08:06:31.485754
2026/03/26 18:10:00,GRANWF1,81.35,Granville Harbour Operations Pty Ltd as The Trustee for Granville Harbour Operations Trust,Granville Harbour Wind Farm,Wind,111.0,73.29,Granville Harbour Wind Farm,-41.8,145.06,2026-03-26T08:06:31.485754
2026/03/26 18:10:00,GSWF1A,154.78,Goyder Wind Farm 1 Pty Ltd as the Trustee for Goyder Wind Farm 1 Trust,Goyder South Wind Farm 1A,Wind,201.0,77.0,Goyder South Wind Farm 1A,-33.679758,138.937597,2026-03-26T08:06:31.485754
2026/03/26 18:10:00,GSWF1B1,175.61,Goyder Wind Farm 1B Pty Ltd as the Trustee for the Goyder Wind Farm 1B Trust,Goyder South Wind Farm 1B,Wind,196.0,89.6,Goyder South Wind Farm 1B,-33.679758,138.937597,2026-03-26T08:06:31.485754
2026/03/26 18:10:00,GULLRWF1,68.01,New Gullen Range Wind Farm Pty Ltd,Gullen Range Wind Farm,Wind,161.0,42.24,Gullen Range Wind Farm,-34.34,149.27,2026-03-26T08:06:31.485754
2026/03/26 18:10:00,GULLRWF2,104.66,New Gullen Range Wind Farm Pty Ltd,Gullen Range Wind Farm,Wind,107.0,97.81,Gullen Range Wind Farm,-34.34,149.27,2026-03-26T08:06:31.485754
2026/03/26 18:10:00,GUNNING1,40.89,Gunning Wind Energy Developments Pty Ltd,Gunning Wind Farm,Wind,47.0,87.0,Gunning Wind Farm,-34.813333,149.4,2026-03-26T08:06:31.485754
2026/03/26 18:10:00,HALLWF1,2.5,AGL SA Generation Pty Limited,Hallett 1 Wind Farm,Wind,95.0,2.63,Hallett 1 Wind Farm,-33.367778,138.728611,2026-03-26T08:06:31.485754
2026/03/26 18:10:00,HALLWF2,3.01,AGL SA Generation Pty Limited,Hallett 2 Wind Farm,Wind,71.0,4.24,Hallett 2 Wind Farm,-33.367778,138.728611,2026-03-26T08:06:31.485754
2026/03/26 18:10:00,HD1WF1,45.35,Hawkesdale Asset Pty Ltd as trustee for Hawkesdale Asset Trust,Hawkesdale Wind Farm,Wind,89.0,50.96,Hawkesdale Wind Farm,-38.147894,142.361381,2026-03-26T08:06:31.485754
2026/03/26 18:10:00,HDWF1,91.4,HWF1 Pty Ltd,Hornsdale Wind Farm,Wind,102.0,89.61,Hornsdale Wind Farm,-33.050556,138.543611,2026-03-26T08:06:31.485754
2026/03/26 18:10:00,HDWF2,99.6,HWF 2 Pty Ltd,Hornsdale Wind Farm 2,Wind,102.0,97.65,Hornsdale Wind Farm 2,-33.06,138.54,2026-03-26T08:06:31.485754
2026/03/26 18:10:00,HDWF3,108.4,HWF3 Pty Ltd,Hornsdale Wind Farm 3,Wind,109.0,99.45,Hornsdale Wind Farm 3,-33.06,138.54,2026-03-26T08:06:31.485754
2026/03/26 18:10:00,KABANWF1,21.51,Kaban Wind Farm Pty Ltd as trustee for Kaban Wind Farm Trust,Kaban Wind Farm,Wind,152.0,14.15,Kaban Wind Farm,-17.56,145.41,2026-03-26T08:06:31.485754
2026/03/26 18:10:00,KEPWF1,4.8,Kennedy Energy Park Pty Ltd,Kennedy Energy Park,Wind,43.0,11.16,Kennedy Energy Park,-20.88,144.42,2026-03-26T08:06:31.485754
2026/03/26 18:10:00,KIATAWF1,30.9,Kiata ProjectCo Pty Ltd Atf Kiata Project Trust,Kiata Wind Farm,Wind,31.0,99.68,Kiata Wind Farm,-36.4,141.75,2026-03-26T08:06:31.485754
2026/03/26 18:10:00,LGAPWF1,10.45,Lincoln Gap Wind Farm (Operations) Pty Ltd,Lincoln Gap Wind Farm,Wind,123.0,8.5,Lincoln Gap Wind Farm,-32.564279,137.557328,2026-03-26T08:06:31.485754
2026/03/26 18:10:00,LGAPWF1,10.45,Lincoln Gap Wind Farm (Operations) Pty Ltd,Lincoln Gap Wind Farm,Wind,123.0,8.5,Lincoln Gap Wind Farm,-32.564279,137.557328,2026-03-26T08:06:31.485754
2026/03/26 18:10:00,LGAPWF2,79.46,Lincoln Gap Wind Farm (Operations) Pty Ltd,Lincoln Gap Wind Farm,Wind,85.0,93.48,Lincoln Gap Wind Farm,-32.564279,137.557328,2026-03-26T08:06:31.485754
2026/03/26 18:10:00,LGAPWF2,79.46,Lincoln Gap Wind Farm (Operations) Pty Ltd,Lincoln Gap Wind Farm,Wind,85.0,93.48,Lincoln Gap Wind Farm,-32.564279,137.557328,2026-03-26T08:06:31.485754
2026/03/26 18:10:00,LKBONNY1,22.24,Lake Bonney Wind Power Pty Ltd,Lake Bonney Wind Farm Stage 1,Wind,81.0,27.46,Lake Bonney Wind Farm Stage 1,-37.76,140.4,2026-03-26T08:06:31.485754
2026/03/26 18:10:00,LKBONNY2,29.53,Lake Bonney Wind Power Pty Ltd,Lake Bonney Stage 2 Windfarm,Wind,159.0,18.57,Lake Bonney Stage 2 Windfarm,-37.76,140.4,2026-03-26T08:06:31.485754
2026/03/26 18:10:00,LKBONNY3,10.94,Lake Bonney Wind Power Pty Ltd,Lake Bonney Stage 3 Wind Farm,Wind,39.0,28.05,Lake Bonney Stage 3 Wind Farm,-37.737781,140.388137,2026-03-26T08:06:31.485754
2026/03/26 18:10:00,MACARTH1,289.2,AGL Hydro Partnership,Macarthur Wind Farm,Wind,420.0,68.86,Macarthur Wind Farm,-38.048957,142.192112,2026-03-26T08:06:31.485754
2026/03/26 18:10:00,MCINTYR1,64.34,MacIntyre UJV Operator Pty Ltd,MacIntyre Wind Farm,Wind,890.0,7.23,MacIntyre Wind Farm,-28.32,151.54,2026-03-26T08:06:31.485754
2026/03/26 18:10:00,MERCER01,23.7,Mt Mercer Windfarm Pty Ltd,Mt Mercer Wind Farm,Wind,131.0,18.09,Mt Mercer Wind Farm,-37.841111,143.871111,2026-03-26T08:06:31.485754
2026/03/26 18:10:00,MEWF1,72.46,Ergon Energy Queensland Pty Ltd ,Mount Emerald Wind Farm,Wind,178.0,40.71,Mount Emerald Wind Farm,-17.133007,145.380644,2026-03-26T08:06:31.485754
2026/03/26 18:10:00,MRTLSWF1,145.48,Mortlake South Wind Farm Pty Ltd,Mortlake South Wind Farm,Wind,153.0,95.08,Mortlake South Wind Farm,-38.127337,142.857801,2026-03-26T08:06:31.485754
2026/03/26 18:10:00,MTGELWF1,97.63,Mt. Gellibrand Wind Farm Pty Ltd,Mt Gellibrand Wind Farm,Wind,132.0,73.96,Mt Gellibrand Wind Farm,-38.23,143.77,2026-03-26T08:06:31.485754
2026/03/26 18:10:00,MTMILLAR,66.7,Mt Millar Wind Farm Pty Ltd,Mt Millar Wind Farm,Wind,70.0,95.29,Mt Millar Wind Farm,-33.624444,136.703611,2026-03-26T08:06:31.485754
2026/03/26 18:10:00,MUSSELR1,120.6,Hydro-Electric Corporation,Musselroe Wind Farm,Wind,168.0,71.79,Musselroe Wind Farm,-40.780225,148.010799,2026-03-26T08:06:31.485754
2026/03/26 18:10:00,MUWAWF1,150.42,Telstra Energy (Generation) Pty Ltd,Murra Warra Wind Farm,Wind,225.7,66.65,Murra Warra Wind Farm,-36.432404,142.317853,2026-03-26T08:06:31.485754
2026/03/26 18:10:00,MUWAWF2,137.0,Murra Warra II Project Co Pty Ltd ATF The Murra Warra II Project Trust,Murra Warra Wind Farm Stage 2,Wind,203.0,67.49,Murra Warra Wind Farm Stage 2,-36.43,142.32,2026-03-26T08:06:31.485754
2026/03/26 18:10:00,NBHWF1,3.1,AGL SA Generation Pty Limited,North Brown Hill Wind Farm,Wind,132.0,2.35,North Brown Hill Wind Farm,-33.367778,138.728611,2026-03-26T08:06:31.485754
2026/03/26 18:10:00,OAKLAND1,52.6,AGL Hydro Partnership,Oaklands Hill Wind Farm,Wind,63.0,83.49,Oaklands Hill Wind Farm,-37.683078,142.551678,2026-03-26T08:06:31.485754
2026/03/26 18:10:00,PAREPW1,43.46,Iberdrola Australia Energy Markets Pty Limited,Port Augusta Renewable Energy Park,Wind,201.0,21.62,Port Augusta Renewable Energy Park,-32.566944,137.856111,2026-03-26T08:06:31.485754
2026/03/26 18:10:00,RYANCWF1,149.76,Ryan Corner Development Pty Ltd,Ryan Corner Wind Farm,Wind,205.0,73.05,Ryan Corner Wind Farm,-38.271017,142.140647,2026-03-26T08:06:31.485754
2026/03/26 18:10:00,RYEPARK1,367.89,Rye Park Renewable Energy Pty Ltd as trustee for Rye Park Wind Farm Trust,Rye Park Renewable Energy,Wind,384.0,95.8,Rye Park Renewable Energy,-32.138333,148.972778,2026-03-26T08:06:31.485754
2026/03/26 18:10:00,SALTCRK1,37.39,Salt Creek Wind Farm Pty Ltd,Salt Creek Wind Farm,Wind,54.0,69.24,Salt Creek Wind Farm,-37.95,142.63,2026-03-26T08:06:31.485754
2026/03/26 18:10:00,SAPHWF1,56.63,The Trustee For The SWF1 Operations Trust,Sapphire Wind Farm,Wind,270.0,20.97,Sapphire Wind Farm,-29.7,151.41,2026-03-26T08:06:31.485754
2026/03/26 18:10:00,SNOWNTH1,134.5,Snowtown Wind Farm Stage 2 Pty Ltd,Snowtown Wind Farm Stage 2 North,Wind,144.0,93.4,Snowtown Wind Farm Stage 2 North,-33.83,138.118611,2026-03-26T08:06:31.485754
2026/03/26 18:10:00,SNOWSTH1,117.4,Snowtown Wind Farm Stage 2 Pty Ltd,Snowtown South Wind Farm,Wind,126.0,93.17,Snowtown South Wind Farm,-33.83,138.118611,2026-03-26T08:06:31.485754
2026/03/26 18:10:00,SNOWTWN1,77.89,Snowtown Wind Farm Pty Ltd,Snowtown Wind Farm Units 1 And 47,Wind,99.0,78.68,Snowtown Wind Farm Units 1 And 47,-33.83,138.118611,2026-03-26T08:06:31.485754
2026/03/26 18:10:00,STARHLWF,25.79,Starfish Hill Wind Farm Pty Ltd,Starfish Hill Wind Farm,Wind,35.0,73.69,Starfish Hill Wind Farm,-35.58,138.14,2026-03-26T08:06:31.485754
2026/03/26 18:10:00,STOCKYD1,386.48,Stockyard Hill Wind Farm Pty Ltd,Stockyard Hill Wind Farm,Wind,511.0,75.63,Stockyard Hill Wind Farm,-37.535833,143.251389,2026-03-26T08:06:31.485754
2026/03/26 18:10:00,STWF1,132.33,PARF Company 8 Pty Ltd as The Trustee for Silverton Project Trust,Silverton Wind Farm,Wind,198.0,66.83,Silverton Wind Farm,-37.683168,142.551678,2026-03-26T08:06:31.485754
2026/03/26 18:10:00,TARALGA1,49.62,Taralga Wind Farm Nominees No 2 Pty Ltd (ATF Taralga Wind Farm Operating Trust),Taralga Wind Farm,Wind,106.0,46.81,Taralga Wind Farm,-34.42352,149.826267,2026-03-26T08:06:31.485754
2026/03/26 18:10:00,WAMBOWF1,46.15,Stanwell Corporation Limited,Wambo Wind Farm 1,Wind,245.0,18.84,Wambo Wind Farm 1,-35.187301,149.524945,2026-03-26T08:06:31.485754
2026/03/26 18:10:00,WATERLWF,119.6,Waterloo Wind Farm Pty Ltd,Waterloo Wind Farm,Wind,130.0,92.0,Waterloo Wind Farm,-34.00094,138.911567,2026-03-26T08:06:31.485754
2026/03/26 18:10:00,WGWF1,109.8,Willogoleche Power Pty Ltd As The Trustee For The Willogoleche Operating Trust,Willogoleche Wind Farm,Wind,119.0,92.27,Willogoleche Wind Farm,-33.39,138.85,2026-03-26T08:06:31.485754
2026/03/26 18:10:00,WOODLWN1,28.09,Woodlawn Wind Pty Ltd,Woodlawn Wind Farm,Wind,48.0,58.52,Woodlawn Wind Farm,-35.08,149.62,2026-03-26T08:06:31.485754
2026/03/26 18:10:00,WPWF,74.44,AGL SA Generation Pty Limited,Wattle Point Wind Farm,Wind,91.0,81.8,Wattle Point Wind Farm,-35.111624,137.7219,2026-03-26T08:06:31.485754
2026/03/26 18:10:00,WRWF1,46.93,White Rock Wind Farm Pty Ltd,White Rock Wind Farm,Wind,172.0,27.28,White Rock Wind Farm,-29.79,151.54,2026-03-26T08:06:31.485754
2026/03/26 18:10:00,YENDWF1,18.18,Lal Lal Wind Farms Nom Co Pty Ltd,Yendon Wind Farm,Wind,142.0,12.8,Yendon Wind Farm,-37.629987,144.022717,2026-03-26T08:06:31.485754
