SETTLEMENTDATE,DUID,SCADAVALUE,Participant,Station Name,Fuel Source - Primary,MAX_CAP,utilisation_pct,Plant,Latitude,Longitude,timestamp_utc
2026/04/07 06:55:00,CAPTL_WF,7.73,Iberdrola Australia Holdings Pty Limited,Capital Wind Farm,Wind,140.0,5.52,Capital Wind Farm,-35.1,149.31,2026-04-06T21:02:20.449598
2026/04/07 06:55:00,CHALLHWF,8.6,Pacific Hydro Challicum Hills Pty Ltd,Challicum Hills Wind Farm,Wind,52.0,16.54,Challicum Hills Wind Farm,-37.38,143.11,2026-04-06T21:02:20.449598
2026/04/07 06:55:00,CULLRGWF,14.87,Cullerin Range Wind Farm Pty Ltd,Cullerin Range Wind Farm,Wind,30.0,49.57,Cullerin Range Wind Farm,-34.81,149.4,2026-04-06T21:02:20.449598
2026/04/07 06:55:00,DIAPURWF1,7.3,Y.E.S. Energy (SA) Pty Ltd,Diapur Wind Farm,Wind,7.0,104.29,Diapur Wind Farm,-36.3425,141.43,2026-04-06T21:02:20.449598
2026/04/07 06:55:00,MLWF1,4.8,Mortons Lane Windfarm Pty Limited,Mortons Lane Wind Farm,Wind,20.0,24.0,Mortons Lane Wind Farm,-37.84,142.45,2026-04-06T21:02:20.449598
2026/04/07 06:55:00,WAUBRAWF,47.29,Pyrenees Wind Energy Developments Pty Ltd,Waubra Wind Farm,Wind,192.0,24.63,Waubra Wind Farm,-37.394498,143.638982,2026-04-06T21:02:20.449598
2026/04/07 06:55:00,WOOLNTH1,71.94,Hydro-Electric Corporation,Woolnorth Studland Bay / Bluff Point Wind Farm,Wind,140.0,51.39,Woolnorth Studland Bay / Bluff Point Wind Farm,-40.69,144.72,2026-04-06T21:02:20.449598
2026/04/07 06:55:00,YAMBUKWF,17.4,Energy Pacific (Vic) Pty Ltd,Yambuk Wind Farm,Wind,30.0,58.0,Yambuk Wind Farm,-38.299083,142.027577,2026-04-06T21:02:20.449598
2026/04/07 06:55:00,YSWF1,6.7,Pacific Hydro Yaloak South Pty Ltd,Yaloak South Wind Farm,Wind,28.0,23.93,Yaloak South Wind Farm,-37.7163,144.242853,2026-04-06T21:02:20.449598
2026/04/07 06:55:00,ARWF1,21.3,Ararat Wind Farm Pty Ltd,Ararat Wind Farm,Wind,241.0,8.84,Ararat Wind Farm,-37.232778,143.031389,2026-04-06T21:02:20.449598
2026/04/07 06:55:00,BALDHWF1,84.37,Alinta Energy Retail Sales Pty Ltd,Bald Hills Wind Farm,Wind,106.0,79.59,Bald Hills Wind Farm,-38.79,145.93,2026-04-06T21:02:20.449598
2026/04/07 06:55:00,BANGOWF1,49.2,BWF Nominees Pty Ltd as The Trustee for BWF Trust,Bango 973 Wind Farm,Wind,155.0,31.74,Bango 973 Wind Farm,-34.551582,148.732808,2026-04-06T21:02:20.449598
2026/04/07 06:55:00,BANGOWF2,28.9,BWF Nominees Pty Ltd as The Trustee for BWF Trust,Bango 999 Wind Farm,Wind,82.0,35.24,Bango 999 Wind Farm,-34.551582,148.732808,2026-04-06T21:02:20.449598
2026/04/07 06:55:00,BLUFF1,6.7,AGL SA Generation Pty Limited,The Bluff Wind Farm,Wind,53.0,12.64,The Bluff Wind Farm,-33.367778,138.728611,2026-04-06T21:02:20.449598
2026/04/07 06:55:00,BOCORWF1,14.64,Boco Rock Wind Farm Pty Ltd,Boco Rock Wind Farm,Wind,111.0,13.19,Boco Rock Wind Farm,-36.578611,149.103333,2026-04-06T21:02:20.449598
2026/04/07 06:55:00,BRYB1WF1,41.72,Berrybank Development Pty Ltd,Berrybank Wind Farm,Wind,175.9,23.72,Berrybank Wind Farm,-37.94,143.52,2026-04-06T21:02:20.449598
2026/04/07 06:55:00,BRYB2WF2,26.96,Berrybank 2 Asset Pty Ltd as trustee for Berrybank 2 Asset Trust,Berrybank 2 Wind Farm,Wind,105.0,25.68,Berrybank 2 Wind Farm,-37.94,143.52,2026-04-06T21:02:20.449598
2026/04/07 06:55:00,BULGANA1,0.0,Bulgana Wind Farm Pty Ltd,Bulgana Green Power Hub,Wind,204.0,0.0,Bulgana Green Power Hub,-37.0975,142.973611,2026-04-06T21:02:20.449598
2026/04/07 06:55:00,CATHROCK,5.5,Cathedral Rocks Wind Farm Pty Ltd,Cathedral Rocks,Wind,66.0,8.33,Cathedral Rocks,-34.51,135.35,2026-04-06T21:02:20.449598
2026/04/07 06:55:00,CHYTWF1,2.53,Cherry Tree Wind Farm Pty Ltd as trustee for The Cherry Tree Project trust ,Cherry Tree Wind Farm,Wind,57.0,4.44,Cherry Tree Wind Farm,-37.1,145.26,2026-04-06T21:02:20.449598
2026/04/07 06:55:00,CLEMGPWF,6.92,Pacific Hydro Clements Gap Pty Ltd,Clements Gap Wind Farm,Wind,57.0,12.14,Clements Gap Wind Farm,-33.48,138.1,2026-04-06T21:02:20.449598
2026/04/07 06:55:00,CLRKCWF1,164.95,Stanwell Corporation Limited ,Clarke Creek Wind Farm,Wind,338.0,48.8,Clarke Creek Wind Farm,-22.85,149.45,2026-04-06T21:02:20.449598
2026/04/07 06:55:00,CLRKCWF2,42.62,Stanwell Corporation Limited ,Clarke Creek Wind Farm,Wind,101.0,42.2,Clarke Creek Wind Farm,-22.85,149.45,2026-04-06T21:02:20.449598
2026/04/07 06:55:00,CNUNDAWF,19.82,Canunda Power Pty Ltd,Canunda Wind Farm,Wind,46.0,43.09,Canunda Wind Farm,-37.73,140.39,2026-04-06T21:02:20.449598
2026/04/07 06:55:00,COLWF01,42.2,Collector Wind Farm Pty Ltd,Collector Wind Farm 1,Wind,219.0,19.27,Collector Wind Farm 1,-34.8719,149.3967,2026-04-06T21:02:20.449598
2026/04/07 06:55:00,COOPGWF1,56.62,PARF Company 10 Pty Limited as The Trustee for Coopers Gap Project Trust,Coopers Gap Wind Farm,Wind,440.0,12.87,Coopers Gap Wind Farm,-26.74,151.45,2026-04-06T21:02:20.449598
2026/04/07 06:55:00,CROOKWF2,51.25,Crookwell Development Pty Ltd ,Crookwell 2 Wind Farm,Wind,91.0,56.32,Crookwell 2 Wind Farm,-34.52,149.54,2026-04-06T21:02:20.449598
2026/04/07 06:55:00,CROOKWF3,34.86,Crookwell 3 Development Pty Ltd,Crookwell 3 Wind Farm,Wind,56.0,62.25,Crookwell 3 Wind Farm,-34.52,149.54,2026-04-06T21:02:20.449598
2026/04/07 06:55:00,CROWLWF1,7.94,Pacific Hydro Crowlands Pty Ltd ,Crowlands Wind Farm,Wind,79.0,10.05,Crowlands Wind Farm,-37.13,143.16,2026-04-06T21:02:20.449598
2026/04/07 06:55:00,CRURWF1,38.9,CRWF Nominees Pty Ltd As Trustee For The CRWF Trust,Crudine Ridge Wind Farm,Wind,138.0,28.19,Crudine Ridge Wind Farm,-32.97,149.64,2026-04-06T21:02:20.449598
2026/04/07 06:55:00,CTHLWF1,57.68,Wild Cattle Hill Pty Ltd,Cattle Hill Wind Farm,Wind,144.0,40.06,Cattle Hill Wind Farm,-42.15,146.69,2026-04-06T21:02:20.449598
2026/04/07 06:55:00,DULAWF1,102.1,Dulacca Energy Project Co Pty Ltd,Dulacca Wind Farm,Wind,173.0,59.02,Dulacca Wind Farm,-26.63,149.87,2026-04-06T21:02:20.449598
2026/04/07 06:55:00,DUNDWF1,79.48,Dundonnell Wind Farm Pty Ltd,Dundonnell Wind Farm,Wind,168.0,47.31,Dundonnell Wind Farm,-37.52,142.58,2026-04-06T21:02:20.449598
2026/04/07 06:55:00,DUNDWF2,14.73,Dundonnell Wind Farm Pty Ltd,Dundonnell Wind Farm,Wind,46.0,32.02,Dundonnell Wind Farm,-37.52,142.58,2026-04-06T21:02:20.449598
2026/04/07 06:55:00,DUNDWF3,60.96,Dundonnell Wind Farm Pty Ltd,Dundonnell Wind Farm,Wind,122.0,49.97,Dundonnell Wind Farm,-37.52,142.58,2026-04-06T21:02:20.449598
2026/04/07 06:55:00,ELAINWF1,28.86,Lal Lal Wind Farms Nom Co Pty Ltd,Elaine Wind Farm,Wind,82.0,35.2,Elaine Wind Farm,-37.36,144.0,2026-04-06T21:02:20.449598
2026/04/07 06:55:00,FLYCRKWF,29.32,Iberdrola Australia Energy Markets Pty Limited,Flyers Creek Wind Farm,Wind,140.0,20.94,Flyers Creek Wind Farm,-33.365556,148.981944,2026-04-06T21:02:20.449598
2026/04/07 06:55:00,GPWFEST1,56.17,Golden Plains WF1 Pty Ltd as Trustee for the Golden Plains WF1 Unit Trust,Golden Plains Wind Farm East,Wind,240.0,23.4,Golden Plains Wind Farm East,-37.945091,143.752614,2026-04-06T21:02:20.449598
2026/04/07 06:55:00,GPWFEST2,43.96,Golden Plains WF1 Pty Ltd as Trustee for the Golden Plains WF1 Unit Trust,Golden Plains Wind Farm East,Wind,253.0,17.38,Golden Plains Wind Farm East,-37.945091,143.752614,2026-04-06T21:02:20.449598
2026/04/07 06:55:00,GPWFEST3,36.52,Golden Plains WF1 Pty Ltd as Trustee for the Golden Plains WF1 Unit Trust,Golden Plains Wind Farm East,Wind,240.0,15.22,Golden Plains Wind Farm East,-37.945091,143.752614,2026-04-06T21:02:20.449598
2026/04/07 06:55:00,GRANWF1,81.18,Granville Harbour Operations Pty Ltd as The Trustee for Granville Harbour Operations Trust,Granville Harbour Wind Farm,Wind,111.0,73.14,Granville Harbour Wind Farm,-41.8,145.06,2026-04-06T21:02:20.449598
2026/04/07 06:55:00,GSWF1A,83.76,Goyder Wind Farm 1 Pty Ltd as the Trustee for Goyder Wind Farm 1 Trust,Goyder South Wind Farm 1A,Wind,201.0,41.67,Goyder South Wind Farm 1A,-33.679758,138.937597,2026-04-06T21:02:20.449598
2026/04/07 06:55:00,GSWF1B1,70.49,Goyder Wind Farm 1B Pty Ltd as the Trustee for the Goyder Wind Farm 1B Trust,Goyder South Wind Farm 1B,Wind,196.0,35.96,Goyder South Wind Farm 1B,-33.679758,138.937597,2026-04-06T21:02:20.449598
2026/04/07 06:55:00,GULLRWF1,73.12,New Gullen Range Wind Farm Pty Ltd,Gullen Range Wind Farm,Wind,161.0,45.42,Gullen Range Wind Farm,-34.34,149.27,2026-04-06T21:02:20.449598
2026/04/07 06:55:00,GULLRWF2,33.56,New Gullen Range Wind Farm Pty Ltd,Gullen Range Wind Farm,Wind,107.0,31.36,Gullen Range Wind Farm,-34.34,149.27,2026-04-06T21:02:20.449598
2026/04/07 06:55:00,GUNNING1,26.1,Gunning Wind Energy Developments Pty Ltd,Gunning Wind Farm,Wind,47.0,55.53,Gunning Wind Farm,-34.813333,149.4,2026-04-06T21:02:20.449598
2026/04/07 06:55:00,HALLWF1,19.06,AGL SA Generation Pty Limited,Hallett 1 Wind Farm,Wind,95.0,20.06,Hallett 1 Wind Farm,-33.367778,138.728611,2026-04-06T21:02:20.449598
2026/04/07 06:55:00,HALLWF2,21.72,AGL SA Generation Pty Limited,Hallett 2 Wind Farm,Wind,71.0,30.59,Hallett 2 Wind Farm,-33.367778,138.728611,2026-04-06T21:02:20.449598
2026/04/07 06:55:00,HD1WF1,20.89,Hawkesdale Asset Pty Ltd as trustee for Hawkesdale Asset Trust,Hawkesdale Wind Farm,Wind,89.0,23.47,Hawkesdale Wind Farm,-38.147894,142.361381,2026-04-06T21:02:20.449598
2026/04/07 06:55:00,HDWF1,8.2,HWF1 Pty Ltd,Hornsdale Wind Farm,Wind,102.0,8.04,Hornsdale Wind Farm,-33.050556,138.543611,2026-04-06T21:02:20.449598
2026/04/07 06:55:00,HDWF2,6.0,HWF 2 Pty Ltd,Hornsdale Wind Farm 2,Wind,102.0,5.88,Hornsdale Wind Farm 2,-33.06,138.54,2026-04-06T21:02:20.449598
2026/04/07 06:55:00,HDWF3,9.7,HWF3 Pty Ltd,Hornsdale Wind Farm 3,Wind,109.0,8.9,Hornsdale Wind Farm 3,-33.06,138.54,2026-04-06T21:02:20.449598
2026/04/07 06:55:00,KABANWF1,107.0,Kaban Wind Farm Pty Ltd as trustee for Kaban Wind Farm Trust,Kaban Wind Farm,Wind,152.0,70.39,Kaban Wind Farm,-17.56,145.41,2026-04-06T21:02:20.449598
2026/04/07 06:55:00,KEPWF1,27.3,Kennedy Energy Park Pty Ltd,Kennedy Energy Park,Wind,43.0,63.49,Kennedy Energy Park,-20.88,144.42,2026-04-06T21:02:20.449598
2026/04/07 06:55:00,KIATAWF1,22.2,Kiata ProjectCo Pty Ltd Atf Kiata Project Trust,Kiata Wind Farm,Wind,31.0,71.61,Kiata Wind Farm,-36.4,141.75,2026-04-06T21:02:20.449598
2026/04/07 06:55:00,LGAPWF1,9.25,Lincoln Gap Wind Farm (Operations) Pty Ltd,Lincoln Gap Wind Farm,Wind,123.0,7.52,Lincoln Gap Wind Farm,-32.564279,137.557328,2026-04-06T21:02:20.449598
2026/04/07 06:55:00,LGAPWF1,9.25,Lincoln Gap Wind Farm (Operations) Pty Ltd,Lincoln Gap Wind Farm,Wind,123.0,7.52,Lincoln Gap Wind Farm,-32.564279,137.557328,2026-04-06T21:02:20.449598
2026/04/07 06:55:00,LGAPWF2,11.98,Lincoln Gap Wind Farm (Operations) Pty Ltd,Lincoln Gap Wind Farm,Wind,85.0,14.09,Lincoln Gap Wind Farm,-32.564279,137.557328,2026-04-06T21:02:20.449598
2026/04/07 06:55:00,LGAPWF2,11.98,Lincoln Gap Wind Farm (Operations) Pty Ltd,Lincoln Gap Wind Farm,Wind,85.0,14.09,Lincoln Gap Wind Farm,-32.564279,137.557328,2026-04-06T21:02:20.449598
2026/04/07 06:55:00,LKBONNY1,38.94,Lake Bonney Wind Power Pty Ltd,Lake Bonney Wind Farm Stage 1,Wind,81.0,48.07,Lake Bonney Wind Farm Stage 1,-37.76,140.4,2026-04-06T21:02:20.449598
2026/04/07 06:55:00,LKBONNY2,77.37,Lake Bonney Wind Power Pty Ltd,Lake Bonney Stage 2 Windfarm,Wind,159.0,48.66,Lake Bonney Stage 2 Windfarm,-37.76,140.4,2026-04-06T21:02:20.449598
2026/04/07 06:55:00,LKBONNY3,18.2,Lake Bonney Wind Power Pty Ltd,Lake Bonney Stage 3 Wind Farm,Wind,39.0,46.67,Lake Bonney Stage 3 Wind Farm,-37.737781,140.388137,2026-04-06T21:02:20.449598
2026/04/07 06:55:00,MACARTH1,22.7,AGL Hydro Partnership,Macarthur Wind Farm,Wind,420.0,5.4,Macarthur Wind Farm,-38.048957,142.192112,2026-04-06T21:02:20.449598
2026/04/07 06:55:00,MCINTYR1,127.52,MacIntyre UJV Operator Pty Ltd,MacIntyre Wind Farm,Wind,890.0,14.33,MacIntyre Wind Farm,-28.32,151.54,2026-04-06T21:02:20.449598
2026/04/07 06:55:00,MERCER01,51.6,Mt Mercer Windfarm Pty Ltd,Mt Mercer Wind Farm,Wind,131.0,39.39,Mt Mercer Wind Farm,-37.841111,143.871111,2026-04-06T21:02:20.449598
2026/04/07 06:55:00,MEWF1,125.47,Ergon Energy Queensland Pty Ltd ,Mount Emerald Wind Farm,Wind,178.0,70.49,Mount Emerald Wind Farm,-17.133007,145.380644,2026-04-06T21:02:20.449598
2026/04/07 06:55:00,MRTLSWF1,32.75,Mortlake South Wind Farm Pty Ltd,Mortlake South Wind Farm,Wind,153.0,21.41,Mortlake South Wind Farm,-38.127337,142.857801,2026-04-06T21:02:20.449598
2026/04/07 06:55:00,MTGELWF1,35.75,Mt. Gellibrand Wind Farm Pty Ltd,Mt Gellibrand Wind Farm,Wind,132.0,27.08,Mt Gellibrand Wind Farm,-38.23,143.77,2026-04-06T21:02:20.449598
2026/04/07 06:55:00,MTMILLAR,4.3,Mt Millar Wind Farm Pty Ltd,Mt Millar Wind Farm,Wind,70.0,6.14,Mt Millar Wind Farm,-33.624444,136.703611,2026-04-06T21:02:20.449598
2026/04/07 06:55:00,MUSSELR1,42.6,Hydro-Electric Corporation,Musselroe Wind Farm,Wind,168.0,25.36,Musselroe Wind Farm,-40.780225,148.010799,2026-04-06T21:02:20.449598
2026/04/07 06:55:00,MUWAWF1,102.66,Telstra Energy (Generation) Pty Ltd,Murra Warra Wind Farm,Wind,225.7,45.49,Murra Warra Wind Farm,-36.432404,142.317853,2026-04-06T21:02:20.449598
2026/04/07 06:55:00,MUWAWF2,74.9,Murra Warra II Project Co Pty Ltd ATF The Murra Warra II Project Trust,Murra Warra Wind Farm Stage 2,Wind,203.0,36.9,Murra Warra Wind Farm Stage 2,-36.43,142.32,2026-04-06T21:02:20.449598
2026/04/07 06:55:00,NBHWF1,12.7,AGL SA Generation Pty Limited,North Brown Hill Wind Farm,Wind,132.0,9.62,North Brown Hill Wind Farm,-33.367778,138.728611,2026-04-06T21:02:20.449598
2026/04/07 06:55:00,OAKLAND1,21.6,AGL Hydro Partnership,Oaklands Hill Wind Farm,Wind,63.0,34.29,Oaklands Hill Wind Farm,-37.683078,142.551678,2026-04-06T21:02:20.449598
2026/04/07 06:55:00,PAREPW1,19.62,Iberdrola Australia Energy Markets Pty Limited,Port Augusta Renewable Energy Park,Wind,201.0,9.76,Port Augusta Renewable Energy Park,-32.566944,137.856111,2026-04-06T21:02:20.449598
2026/04/07 06:55:00,RYANCWF1,114.2,Ryan Corner Development Pty Ltd,Ryan Corner Wind Farm,Wind,205.0,55.71,Ryan Corner Wind Farm,-38.271017,142.140647,2026-04-06T21:02:20.449598
2026/04/07 06:55:00,RYEPARK1,143.65,Rye Park Renewable Energy Pty Ltd as trustee for Rye Park Wind Farm Trust,Rye Park Renewable Energy,Wind,384.0,37.41,Rye Park Renewable Energy,-32.138333,148.972778,2026-04-06T21:02:20.449598
2026/04/07 06:55:00,SALTCRK1,19.4,Salt Creek Wind Farm Pty Ltd,Salt Creek Wind Farm,Wind,54.0,35.93,Salt Creek Wind Farm,-37.95,142.63,2026-04-06T21:02:20.449598
2026/04/07 06:55:00,SAPHWF1,66.09,The Trustee For The SWF1 Operations Trust,Sapphire Wind Farm,Wind,270.0,24.48,Sapphire Wind Farm,-29.7,151.41,2026-04-06T21:02:20.449598
2026/04/07 06:55:00,SNOWNTH1,1.0,Snowtown Wind Farm Stage 2 Pty Ltd,Snowtown Wind Farm Stage 2 North,Wind,144.0,0.69,Snowtown Wind Farm Stage 2 North,-33.83,138.118611,2026-04-06T21:02:20.449598
2026/04/07 06:55:00,SNOWSTH1,0.0,Snowtown Wind Farm Stage 2 Pty Ltd,Snowtown South Wind Farm,Wind,126.0,0.0,Snowtown South Wind Farm,-33.83,138.118611,2026-04-06T21:02:20.449598
2026/04/07 06:55:00,SNOWTWN1,0.0,Snowtown Wind Farm Pty Ltd,Snowtown Wind Farm Units 1 And 47,Wind,99.0,0.0,Snowtown Wind Farm Units 1 And 47,-33.83,138.118611,2026-04-06T21:02:20.449598
2026/04/07 06:55:00,STARHLWF,3.7,Starfish Hill Wind Farm Pty Ltd,Starfish Hill Wind Farm,Wind,35.0,10.57,Starfish Hill Wind Farm,-35.58,138.14,2026-04-06T21:02:20.449598
2026/04/07 06:55:00,STOCKYD1,223.53,Stockyard Hill Wind Farm Pty Ltd,Stockyard Hill Wind Farm,Wind,511.0,43.74,Stockyard Hill Wind Farm,-37.535833,143.251389,2026-04-06T21:02:20.449598
2026/04/07 06:55:00,STWF1,85.93,PARF Company 8 Pty Ltd as The Trustee for Silverton Project Trust,Silverton Wind Farm,Wind,198.0,43.4,Silverton Wind Farm,-37.683168,142.551678,2026-04-06T21:02:20.449598
2026/04/07 06:55:00,TARALGA1,79.43,Taralga Wind Farm Nominees No 2 Pty Ltd (ATF Taralga Wind Farm Operating Trust),Taralga Wind Farm,Wind,106.0,74.93,Taralga Wind Farm,-34.42352,149.826267,2026-04-06T21:02:20.449598
2026/04/07 06:55:00,WAMBOWF1,70.86,Stanwell Corporation Limited,Wambo Wind Farm 1,Wind,245.0,28.92,Wambo Wind Farm 1,-35.187301,149.524945,2026-04-06T21:02:20.449598
2026/04/07 06:55:00,WATERLWF,30.0,Waterloo Wind Farm Pty Ltd,Waterloo Wind Farm,Wind,130.0,23.08,Waterloo Wind Farm,-34.00094,138.911567,2026-04-06T21:02:20.449598
2026/04/07 06:55:00,WGWF1,23.7,Willogoleche Power Pty Ltd As The Trustee For The Willogoleche Operating Trust,Willogoleche Wind Farm,Wind,119.0,19.92,Willogoleche Wind Farm,-33.39,138.85,2026-04-06T21:02:20.449598
2026/04/07 06:55:00,WOODLWN1,4.87,Woodlawn Wind Pty Ltd,Woodlawn Wind Farm,Wind,48.0,10.15,Woodlawn Wind Farm,-35.08,149.62,2026-04-06T21:02:20.449598
2026/04/07 06:55:00,WPWF,25.9,AGL SA Generation Pty Limited,Wattle Point Wind Farm,Wind,91.0,28.46,Wattle Point Wind Farm,-35.111624,137.7219,2026-04-06T21:02:20.449598
2026/04/07 06:55:00,WRWF1,16.76,White Rock Wind Farm Pty Ltd,White Rock Wind Farm,Wind,172.0,9.74,White Rock Wind Farm,-29.79,151.54,2026-04-06T21:02:20.449598
2026/04/07 06:55:00,YENDWF1,41.56,Lal Lal Wind Farms Nom Co Pty Ltd,Yendon Wind Farm,Wind,142.0,29.27,Yendon Wind Farm,-37.629987,144.022717,2026-04-06T21:02:20.449598
