SETTLEMENTDATE,DUID,SCADAVALUE,Participant,Station Name,Fuel Source - Primary,MAX_CAP,utilisation_pct,Plant,Latitude,Longitude,timestamp_utc
2026/02/07 04:45:00,CAPTL_WF,22.15,Iberdrola Australia Holdings Pty Limited,Capital Wind Farm,Wind,140.0,15.82,Capital Wind Farm,-35.1,149.31,2026-02-06T18:45:34.236220
2026/02/07 04:45:00,CHALLHWF,3.3,Pacific Hydro Challicum Hills Pty Ltd,Challicum Hills Wind Farm,Wind,52.0,6.35,Challicum Hills Wind Farm,-37.38,143.11,2026-02-06T18:45:34.236220
2026/02/07 04:45:00,CULLRGWF,9.03,Cullerin Range Wind Farm Pty Ltd,Cullerin Range Wind Farm,Wind,30.0,30.1,Cullerin Range Wind Farm,-34.81,149.4,2026-02-06T18:45:34.236220
2026/02/07 04:45:00,DIAPURWF1,0.5,Y.E.S. Energy (SA) Pty Ltd,Diapur Wind Farm,Wind,7.0,7.14,Diapur Wind Farm,-36.3425,141.43,2026-02-06T18:45:34.236220
2026/02/07 04:45:00,MLWF1,3.34,Mortons Lane Windfarm Pty Limited,Mortons Lane Wind Farm,Wind,20.0,16.7,Mortons Lane Wind Farm,-37.84,142.45,2026-02-06T18:45:34.236220
2026/02/07 04:45:00,WAUBRAWF,0.0,Pyrenees Wind Energy Developments Pty Ltd,Waubra Wind Farm,Wind,192.0,0.0,Waubra Wind Farm,-37.394498,143.638982,2026-02-06T18:45:34.236220
2026/02/07 04:45:00,WOOLNTH1,10.57,Hydro-Electric Corporation,Woolnorth Studland Bay / Bluff Point Wind Farm,Wind,140.0,7.55,Woolnorth Studland Bay / Bluff Point Wind Farm,-40.69,144.72,2026-02-06T18:45:34.236220
2026/02/07 04:45:00,YAMBUKWF,1.8,Energy Pacific (Vic) Pty Ltd,Yambuk Wind Farm,Wind,30.0,6.0,Yambuk Wind Farm,-38.299083,142.027577,2026-02-06T18:45:34.236220
2026/02/07 04:45:00,YSWF1,1.4,Pacific Hydro Yaloak South Pty Ltd,Yaloak South Wind Farm,Wind,28.0,5.0,Yaloak South Wind Farm,-37.7163,144.242853,2026-02-06T18:45:34.236220
2026/02/07 04:45:00,ARWF1,7.2,Ararat Wind Farm Pty Ltd,Ararat Wind Farm,Wind,241.0,2.99,Ararat Wind Farm,-37.232778,143.031389,2026-02-06T18:45:34.236220
2026/02/07 04:45:00,BALDHWF1,0.0,Alinta Energy Retail Sales Pty Ltd,Bald Hills Wind Farm,Wind,106.0,0.0,Bald Hills Wind Farm,-38.79,145.93,2026-02-06T18:45:34.236220
2026/02/07 04:45:00,BANGOWF1,35.0,BWF Nominees Pty Ltd as The Trustee for BWF Trust,Bango 973 Wind Farm,Wind,155.0,22.58,Bango 973 Wind Farm,-34.551582,148.732808,2026-02-06T18:45:34.236220
2026/02/07 04:45:00,BANGOWF2,22.7,BWF Nominees Pty Ltd as The Trustee for BWF Trust,Bango 999 Wind Farm,Wind,82.0,27.68,Bango 999 Wind Farm,-34.551582,148.732808,2026-02-06T18:45:34.236220
2026/02/07 04:45:00,BLUFF1,21.9,AGL SA Generation Pty Limited,The Bluff Wind Farm,Wind,53.0,41.32,The Bluff Wind Farm,-33.367778,138.728611,2026-02-06T18:45:34.236220
2026/02/07 04:45:00,BOCORWF1,6.91,Boco Rock Wind Farm Pty Ltd,Boco Rock Wind Farm,Wind,111.0,6.23,Boco Rock Wind Farm,-36.578611,149.103333,2026-02-06T18:45:34.236220
2026/02/07 04:45:00,BRYB1WF1,59.02,Berrybank Development Pty Ltd,Berrybank Wind Farm,Wind,175.9,33.55,Berrybank Wind Farm,-37.94,143.52,2026-02-06T18:45:34.236220
2026/02/07 04:45:00,BRYB2WF2,40.92,Berrybank 2 Asset Pty Ltd as trustee for Berrybank 2 Asset Trust,Berrybank 2 Wind Farm,Wind,105.0,38.97,Berrybank 2 Wind Farm,-37.94,143.52,2026-02-06T18:45:34.236220
2026/02/07 04:45:00,BULGANA1,26.23,Bulgana Wind Farm Pty Ltd,Bulgana Green Power Hub,Wind,204.0,12.86,Bulgana Green Power Hub,-37.0975,142.973611,2026-02-06T18:45:34.236220
2026/02/07 04:45:00,CATHROCK,16.8,Cathedral Rocks Wind Farm Pty Ltd,Cathedral Rocks,Wind,66.0,25.45,Cathedral Rocks,-34.51,135.35,2026-02-06T18:45:34.236220
2026/02/07 04:45:00,CHYTWF1,1.91,Cherry Tree Wind Farm Pty Ltd as trustee for The Cherry Tree Project trust ,Cherry Tree Wind Farm,Wind,57.0,3.35,Cherry Tree Wind Farm,-37.1,145.26,2026-02-06T18:45:34.236220
2026/02/07 04:45:00,CLEMGPWF,8.0,Pacific Hydro Clements Gap Pty Ltd,Clements Gap Wind Farm,Wind,57.0,14.04,Clements Gap Wind Farm,-33.48,138.1,2026-02-06T18:45:34.236220
2026/02/07 04:45:00,CLRKCWF1,146.56,Stanwell Corporation Limited ,Clarke Creek Wind Farm,Wind,338.0,43.36,Clarke Creek Wind Farm,-22.85,149.45,2026-02-06T18:45:34.236220
2026/02/07 04:45:00,CLRKCWF2,38.47,Stanwell Corporation Limited ,Clarke Creek Wind Farm,Wind,101.0,38.09,Clarke Creek Wind Farm,-22.85,149.45,2026-02-06T18:45:34.236220
2026/02/07 04:45:00,CNUNDAWF,13.22,Canunda Power Pty Ltd,Canunda Wind Farm,Wind,46.0,28.74,Canunda Wind Farm,-37.73,140.39,2026-02-06T18:45:34.236220
2026/02/07 04:45:00,COLWF01,36.85,Collector Wind Farm Pty Ltd,Collector Wind Farm 1,Wind,219.0,16.83,Collector Wind Farm 1,-34.8719,149.3967,2026-02-06T18:45:34.236220
2026/02/07 04:45:00,COOPGWF1,279.72,PARF Company 10 Pty Limited as The Trustee for Coopers Gap Project Trust,Coopers Gap Wind Farm,Wind,440.0,63.57,Coopers Gap Wind Farm,-26.74,151.45,2026-02-06T18:45:34.236220
2026/02/07 04:45:00,CROOKWF2,61.13,Crookwell Development Pty Ltd ,Crookwell 2 Wind Farm,Wind,91.0,67.18,Crookwell 2 Wind Farm,-34.52,149.54,2026-02-06T18:45:34.236220
2026/02/07 04:45:00,CROOKWF3,38.71,Crookwell 3 Development Pty Ltd,Crookwell 3 Wind Farm,Wind,56.0,69.12,Crookwell 3 Wind Farm,-34.52,149.54,2026-02-06T18:45:34.236220
2026/02/07 04:45:00,CROWLWF1,0.36,Pacific Hydro Crowlands Pty Ltd ,Crowlands Wind Farm,Wind,79.0,0.46,Crowlands Wind Farm,-37.13,143.16,2026-02-06T18:45:34.236220
2026/02/07 04:45:00,CRURWF1,11.2,CRWF Nominees Pty Ltd As Trustee For The CRWF Trust,Crudine Ridge Wind Farm,Wind,138.0,8.12,Crudine Ridge Wind Farm,-32.97,149.64,2026-02-06T18:45:34.236220
2026/02/07 04:45:00,CTHLWF1,88.29,Wild Cattle Hill Pty Ltd,Cattle Hill Wind Farm,Wind,144.0,61.31,Cattle Hill Wind Farm,-42.15,146.69,2026-02-06T18:45:34.236220
2026/02/07 04:45:00,DULAWF1,25.8,Dulacca Energy Project Co Pty Ltd,Dulacca Wind Farm,Wind,173.0,14.91,Dulacca Wind Farm,-26.63,149.87,2026-02-06T18:45:34.236220
2026/02/07 04:45:00,DUNDWF1,63.69,Dundonnell Wind Farm Pty Ltd,Dundonnell Wind Farm,Wind,168.0,37.91,Dundonnell Wind Farm,-37.52,142.58,2026-02-06T18:45:34.236220
2026/02/07 04:45:00,DUNDWF2,20.8,Dundonnell Wind Farm Pty Ltd,Dundonnell Wind Farm,Wind,46.0,45.22,Dundonnell Wind Farm,-37.52,142.58,2026-02-06T18:45:34.236220
2026/02/07 04:45:00,DUNDWF3,58.53,Dundonnell Wind Farm Pty Ltd,Dundonnell Wind Farm,Wind,122.0,47.98,Dundonnell Wind Farm,-37.52,142.58,2026-02-06T18:45:34.236220
2026/02/07 04:45:00,ELAINWF1,9.04,Lal Lal Wind Farms Nom Co Pty Ltd,Elaine Wind Farm,Wind,82.0,11.02,Elaine Wind Farm,-37.36,144.0,2026-02-06T18:45:34.236220
2026/02/07 04:45:00,FLYCRKWF,3.55,Iberdrola Australia Energy Markets Pty Limited,Flyers Creek Wind Farm,Wind,140.0,2.54,Flyers Creek Wind Farm,-33.365556,148.981944,2026-02-06T18:45:34.236220
2026/02/07 04:45:00,GPWFEST1,59.71,Golden Plains WF1 Pty Ltd as Trustee for the Golden Plains WF1 Unit Trust,Golden Plains Wind Farm East,Wind,240.0,24.88,Golden Plains Wind Farm East,-37.945091,143.752614,2026-02-06T18:45:34.236220
2026/02/07 04:45:00,GPWFEST2,60.7,Golden Plains WF1 Pty Ltd as Trustee for the Golden Plains WF1 Unit Trust,Golden Plains Wind Farm East,Wind,253.0,23.99,Golden Plains Wind Farm East,-37.945091,143.752614,2026-02-06T18:45:34.236220
2026/02/07 04:45:00,GPWFEST3,66.53,Golden Plains WF1 Pty Ltd as Trustee for the Golden Plains WF1 Unit Trust,Golden Plains Wind Farm East,Wind,240.0,27.72,Golden Plains Wind Farm East,-37.945091,143.752614,2026-02-06T18:45:34.236220
2026/02/07 04:45:00,GRANWF1,0.7,Granville Harbour Operations Pty Ltd as The Trustee for Granville Harbour Operations Trust,Granville Harbour Wind Farm,Wind,111.0,0.63,Granville Harbour Wind Farm,-41.8,145.06,2026-02-06T18:45:34.236220
2026/02/07 04:45:00,GSWF1A,119.0,Goyder Wind Farm 1 Pty Ltd as the Trustee for Goyder Wind Farm 1 Trust,Goyder South Wind Farm 1A,Wind,201.0,59.2,Goyder South Wind Farm 1A,-33.679758,138.937597,2026-02-06T18:45:34.236220
2026/02/07 04:45:00,GSWF1B1,45.93,Goyder Wind Farm 1B Pty Ltd as the Trustee for the Goyder Wind Farm 1B Trust,Goyder South Wind Farm 1B,Wind,196.0,23.43,Goyder South Wind Farm 1B,-33.679758,138.937597,2026-02-06T18:45:34.236220
2026/02/07 04:45:00,GULLRWF1,74.78,New Gullen Range Wind Farm Pty Ltd,Gullen Range Wind Farm,Wind,161.0,46.45,Gullen Range Wind Farm,-34.34,149.27,2026-02-06T18:45:34.236220
2026/02/07 04:45:00,GULLRWF2,29.09,New Gullen Range Wind Farm Pty Ltd,Gullen Range Wind Farm,Wind,107.0,27.19,Gullen Range Wind Farm,-34.34,149.27,2026-02-06T18:45:34.236220
2026/02/07 04:45:00,GUNNING1,16.04,Gunning Wind Energy Developments Pty Ltd,Gunning Wind Farm,Wind,47.0,34.13,Gunning Wind Farm,-34.813333,149.4,2026-02-06T18:45:34.236220
2026/02/07 04:45:00,HALLWF1,45.88,AGL SA Generation Pty Limited,Hallett 1 Wind Farm,Wind,95.0,48.29,Hallett 1 Wind Farm,-33.367778,138.728611,2026-02-06T18:45:34.236220
2026/02/07 04:45:00,HALLWF2,35.16,AGL SA Generation Pty Limited,Hallett 2 Wind Farm,Wind,71.0,49.52,Hallett 2 Wind Farm,-33.367778,138.728611,2026-02-06T18:45:34.236220
2026/02/07 04:45:00,HD1WF1,6.68,Hawkesdale Asset Pty Ltd as trustee for Hawkesdale Asset Trust,Hawkesdale Wind Farm,Wind,89.0,7.51,Hawkesdale Wind Farm,-38.147894,142.361381,2026-02-06T18:45:34.236220
2026/02/07 04:45:00,HDWF1,79.2,HWF1 Pty Ltd,Hornsdale Wind Farm,Wind,102.0,77.65,Hornsdale Wind Farm,-33.050556,138.543611,2026-02-06T18:45:34.236220
2026/02/07 04:45:00,HDWF2,96.2,HWF 2 Pty Ltd,Hornsdale Wind Farm 2,Wind,102.0,94.31,Hornsdale Wind Farm 2,-33.06,138.54,2026-02-06T18:45:34.236220
2026/02/07 04:45:00,HDWF3,91.2,HWF3 Pty Ltd,Hornsdale Wind Farm 3,Wind,109.0,83.67,Hornsdale Wind Farm 3,-33.06,138.54,2026-02-06T18:45:34.236220
2026/02/07 04:45:00,KABANWF1,120.35,Kaban Wind Farm Pty Ltd as trustee for Kaban Wind Farm Trust,Kaban Wind Farm,Wind,152.0,79.18,Kaban Wind Farm,-17.56,145.41,2026-02-06T18:45:34.236220
2026/02/07 04:45:00,KEPWF1,18.1,Kennedy Energy Park Pty Ltd,Kennedy Energy Park,Wind,43.0,42.09,Kennedy Energy Park,-20.88,144.42,2026-02-06T18:45:34.236220
2026/02/07 04:45:00,KIATAWF1,4.8,Kiata ProjectCo Pty Ltd Atf Kiata Project Trust,Kiata Wind Farm,Wind,31.0,15.48,Kiata Wind Farm,-36.4,141.75,2026-02-06T18:45:34.236220
2026/02/07 04:45:00,LGAPWF1,0.0,Lincoln Gap Wind Farm (Operations) Pty Ltd,Lincoln Gap Wind Farm,Wind,123.0,0.0,Lincoln Gap Wind Farm,-32.564279,137.557328,2026-02-06T18:45:34.236220
2026/02/07 04:45:00,LGAPWF1,0.0,Lincoln Gap Wind Farm (Operations) Pty Ltd,Lincoln Gap Wind Farm,Wind,123.0,0.0,Lincoln Gap Wind Farm,-32.564279,137.557328,2026-02-06T18:45:34.236220
2026/02/07 04:45:00,LGAPWF2,0.0,Lincoln Gap Wind Farm (Operations) Pty Ltd,Lincoln Gap Wind Farm,Wind,85.0,0.0,Lincoln Gap Wind Farm,-32.564279,137.557328,2026-02-06T18:45:34.236220
2026/02/07 04:45:00,LGAPWF2,0.0,Lincoln Gap Wind Farm (Operations) Pty Ltd,Lincoln Gap Wind Farm,Wind,85.0,0.0,Lincoln Gap Wind Farm,-32.564279,137.557328,2026-02-06T18:45:34.236220
2026/02/07 04:45:00,LKBONNY1,18.58,Lake Bonney Wind Power Pty Ltd,Lake Bonney Wind Farm Stage 1,Wind,81.0,22.94,Lake Bonney Wind Farm Stage 1,-37.76,140.4,2026-02-06T18:45:34.236220
2026/02/07 04:45:00,LKBONNY2,46.06,Lake Bonney Wind Power Pty Ltd,Lake Bonney Stage 2 Windfarm,Wind,159.0,28.97,Lake Bonney Stage 2 Windfarm,-37.76,140.4,2026-02-06T18:45:34.236220
2026/02/07 04:45:00,LKBONNY3,7.09,Lake Bonney Wind Power Pty Ltd,Lake Bonney Stage 3 Wind Farm,Wind,39.0,18.18,Lake Bonney Stage 3 Wind Farm,-37.737781,140.388137,2026-02-06T18:45:34.236220
2026/02/07 04:45:00,MACARTH1,46.7,AGL Hydro Partnership,Macarthur Wind Farm,Wind,420.0,11.12,Macarthur Wind Farm,-38.048957,142.192112,2026-02-06T18:45:34.236220
2026/02/07 04:45:00,MCINTYR1,89.89,MacIntyre UJV Operator Pty Ltd,MacIntyre Wind Farm,Wind,890.0,10.1,MacIntyre Wind Farm,-28.32,151.54,2026-02-06T18:45:34.236220
2026/02/07 04:45:00,MERCER01,18.2,Mt Mercer Windfarm Pty Ltd,Mt Mercer Wind Farm,Wind,131.0,13.89,Mt Mercer Wind Farm,-37.841111,143.871111,2026-02-06T18:45:34.236220
2026/02/07 04:45:00,MEWF1,46.12,Ergon Energy Queensland Pty Ltd ,Mount Emerald Wind Farm,Wind,178.0,25.91,Mount Emerald Wind Farm,-17.133007,145.380644,2026-02-06T18:45:34.236220
2026/02/07 04:45:00,MRTLSWF1,5.82,Mortlake South Wind Farm Pty Ltd,Mortlake South Wind Farm,Wind,153.0,3.8,Mortlake South Wind Farm,-38.127337,142.857801,2026-02-06T18:45:34.236220
2026/02/07 04:45:00,MTGELWF1,15.72,Mt. Gellibrand Wind Farm Pty Ltd,Mt Gellibrand Wind Farm,Wind,132.0,11.91,Mt Gellibrand Wind Farm,-38.23,143.77,2026-02-06T18:45:34.236220
2026/02/07 04:45:00,MTMILLAR,7.6,Mt Millar Wind Farm Pty Ltd,Mt Millar Wind Farm,Wind,70.0,10.86,Mt Millar Wind Farm,-33.624444,136.703611,2026-02-06T18:45:34.236220
2026/02/07 04:45:00,MUSSELR1,70.2,Hydro-Electric Corporation,Musselroe Wind Farm,Wind,168.0,41.79,Musselroe Wind Farm,-40.780225,148.010799,2026-02-06T18:45:34.236220
2026/02/07 04:45:00,MUWAWF1,87.8,Telstra Energy (Generation) Pty Ltd,Murra Warra Wind Farm,Wind,225.7,38.9,Murra Warra Wind Farm,-36.432404,142.317853,2026-02-06T18:45:34.236220
2026/02/07 04:45:00,MUWAWF2,97.6,Murra Warra II Project Co Pty Ltd ATF The Murra Warra II Project Trust,Murra Warra Wind Farm Stage 2,Wind,203.0,48.08,Murra Warra Wind Farm Stage 2,-36.43,142.32,2026-02-06T18:45:34.236220
2026/02/07 04:45:00,NBHWF1,74.6,AGL SA Generation Pty Limited,North Brown Hill Wind Farm,Wind,132.0,56.52,North Brown Hill Wind Farm,-33.367778,138.728611,2026-02-06T18:45:34.236220
2026/02/07 04:45:00,OAKLAND1,9.0,AGL Hydro Partnership,Oaklands Hill Wind Farm,Wind,63.0,14.29,Oaklands Hill Wind Farm,-37.683078,142.551678,2026-02-06T18:45:34.236220
2026/02/07 04:45:00,PAREPW1,20.45,Iberdrola Australia Energy Markets Pty Limited,Port Augusta Renewable Energy Park,Wind,201.0,10.17,Port Augusta Renewable Energy Park,-32.566944,137.856111,2026-02-06T18:45:34.236220
2026/02/07 04:45:00,RYANCWF1,15.75,Ryan Corner Development Pty Ltd,Ryan Corner Wind Farm,Wind,205.0,7.68,Ryan Corner Wind Farm,-38.271017,142.140647,2026-02-06T18:45:34.236220
2026/02/07 04:45:00,RYEPARK1,116.24,Rye Park Renewable Energy Pty Ltd as trustee for Rye Park Wind Farm Trust,Rye Park Renewable Energy,Wind,384.0,30.27,Rye Park Renewable Energy,-32.138333,148.972778,2026-02-06T18:45:34.236220
2026/02/07 04:45:00,SALTCRK1,17.73,Salt Creek Wind Farm Pty Ltd,Salt Creek Wind Farm,Wind,54.0,32.83,Salt Creek Wind Farm,-37.95,142.63,2026-02-06T18:45:34.236220
2026/02/07 04:45:00,SAPHWF1,0.0,The Trustee For The SWF1 Operations Trust,Sapphire Wind Farm,Wind,270.0,0.0,Sapphire Wind Farm,-29.7,151.41,2026-02-06T18:45:34.236220
2026/02/07 04:45:00,SNOWNTH1,23.6,Snowtown Wind Farm Stage 2 Pty Ltd,Snowtown Wind Farm Stage 2 North,Wind,144.0,16.39,Snowtown Wind Farm Stage 2 North,-33.83,138.118611,2026-02-06T18:45:34.236220
2026/02/07 04:45:00,SNOWSTH1,43.3,Snowtown Wind Farm Stage 2 Pty Ltd,Snowtown South Wind Farm,Wind,126.0,34.37,Snowtown South Wind Farm,-33.83,138.118611,2026-02-06T18:45:34.236220
2026/02/07 04:45:00,SNOWTWN1,49.35,Snowtown Wind Farm Pty Ltd,Snowtown Wind Farm Units 1 And 47,Wind,99.0,49.85,Snowtown Wind Farm Units 1 And 47,-33.83,138.118611,2026-02-06T18:45:34.236220
2026/02/07 04:45:00,STARHLWF,16.9,Starfish Hill Wind Farm Pty Ltd,Starfish Hill Wind Farm,Wind,35.0,48.29,Starfish Hill Wind Farm,-35.58,138.14,2026-02-06T18:45:34.236220
2026/02/07 04:45:00,STOCKYD1,31.95,Stockyard Hill Wind Farm Pty Ltd,Stockyard Hill Wind Farm,Wind,511.0,6.25,Stockyard Hill Wind Farm,-37.535833,143.251389,2026-02-06T18:45:34.236220
2026/02/07 04:45:00,STWF1,10.92,PARF Company 8 Pty Ltd as The Trustee for Silverton Project Trust,Silverton Wind Farm,Wind,198.0,5.52,Silverton Wind Farm,-37.683168,142.551678,2026-02-06T18:45:34.236220
2026/02/07 04:45:00,TARALGA1,75.45,Taralga Wind Farm Nominees No 2 Pty Ltd (ATF Taralga Wind Farm Operating Trust),Taralga Wind Farm,Wind,106.0,71.18,Taralga Wind Farm,-34.42352,149.826267,2026-02-06T18:45:34.236220
2026/02/07 04:45:00,WAMBOWF1,67.87,Stanwell Corporation Limited,Wambo Wind Farm 1,Wind,245.0,27.7,Wambo Wind Farm 1,-35.187301,149.524945,2026-02-06T18:45:34.236220
2026/02/07 04:45:00,WATERLWF,65.5,Waterloo Wind Farm Pty Ltd,Waterloo Wind Farm,Wind,130.0,50.38,Waterloo Wind Farm,-34.00094,138.911567,2026-02-06T18:45:34.236220
2026/02/07 04:45:00,WGWF1,47.4,Willogoleche Power Pty Ltd As The Trustee For The Willogoleche Operating Trust,Willogoleche Wind Farm,Wind,119.0,39.83,Willogoleche Wind Farm,-33.39,138.85,2026-02-06T18:45:34.236220
2026/02/07 04:45:00,WOODLWN1,14.62,Woodlawn Wind Pty Ltd,Woodlawn Wind Farm,Wind,48.0,30.46,Woodlawn Wind Farm,-35.08,149.62,2026-02-06T18:45:34.236220
2026/02/07 04:45:00,WPWF,21.96,AGL SA Generation Pty Limited,Wattle Point Wind Farm,Wind,91.0,24.13,Wattle Point Wind Farm,-35.111624,137.7219,2026-02-06T18:45:34.236220
2026/02/07 04:45:00,WRWF1,0.0,White Rock Wind Farm Pty Ltd,White Rock Wind Farm,Wind,172.0,0.0,White Rock Wind Farm,-29.79,151.54,2026-02-06T18:45:34.236220
2026/02/07 04:45:00,YENDWF1,7.58,Lal Lal Wind Farms Nom Co Pty Ltd,Yendon Wind Farm,Wind,142.0,5.34,Yendon Wind Farm,-37.629987,144.022717,2026-02-06T18:45:34.236220
