SETTLEMENTDATE,DUID,SCADAVALUE,Participant,Station Name,Fuel Source - Primary,MAX_CAP,utilisation_pct,Plant,Latitude,Longitude,timestamp_utc
2026/03/02 19:30:00,CAPTL_WF,8.78,Iberdrola Australia Holdings Pty Limited,Capital Wind Farm,Wind,140.0,6.27,Capital Wind Farm,-35.1,149.31,2026-03-02T09:29:13.995896
2026/03/02 19:30:00,CHALLHWF,15.4,Pacific Hydro Challicum Hills Pty Ltd,Challicum Hills Wind Farm,Wind,52.0,29.62,Challicum Hills Wind Farm,-37.38,143.11,2026-03-02T09:29:13.995896
2026/03/02 19:30:00,CULLRGWF,1.14,Cullerin Range Wind Farm Pty Ltd,Cullerin Range Wind Farm,Wind,30.0,3.8,Cullerin Range Wind Farm,-34.81,149.4,2026-03-02T09:29:13.995896
2026/03/02 19:30:00,DIAPURWF1,3.1,Y.E.S. Energy (SA) Pty Ltd,Diapur Wind Farm,Wind,7.0,44.29,Diapur Wind Farm,-36.3425,141.43,2026-03-02T09:29:13.995896
2026/03/02 19:30:00,MLWF1,6.21,Mortons Lane Windfarm Pty Limited,Mortons Lane Wind Farm,Wind,20.0,31.05,Mortons Lane Wind Farm,-37.84,142.45,2026-03-02T09:29:13.995896
2026/03/02 19:30:00,WAUBRAWF,92.97,Pyrenees Wind Energy Developments Pty Ltd,Waubra Wind Farm,Wind,192.0,48.42,Waubra Wind Farm,-37.394498,143.638982,2026-03-02T09:29:13.995896
2026/03/02 19:30:00,WOOLNTH1,86.89,Hydro-Electric Corporation,Woolnorth Studland Bay / Bluff Point Wind Farm,Wind,140.0,62.06,Woolnorth Studland Bay / Bluff Point Wind Farm,-40.69,144.72,2026-03-02T09:29:13.995896
2026/03/02 19:30:00,YAMBUKWF,13.8,Energy Pacific (Vic) Pty Ltd,Yambuk Wind Farm,Wind,30.0,46.0,Yambuk Wind Farm,-38.299083,142.027577,2026-03-02T09:29:13.995896
2026/03/02 19:30:00,YSWF1,0.8,Pacific Hydro Yaloak South Pty Ltd,Yaloak South Wind Farm,Wind,28.0,2.86,Yaloak South Wind Farm,-37.7163,144.242853,2026-03-02T09:29:13.995896
2026/03/02 19:30:00,ARWF1,146.1,Ararat Wind Farm Pty Ltd,Ararat Wind Farm,Wind,241.0,60.62,Ararat Wind Farm,-37.232778,143.031389,2026-03-02T09:29:13.995896
2026/03/02 19:30:00,BALDHWF1,18.66,Alinta Energy Retail Sales Pty Ltd,Bald Hills Wind Farm,Wind,106.0,17.6,Bald Hills Wind Farm,-38.79,145.93,2026-03-02T09:29:13.995896
2026/03/02 19:30:00,BANGOWF1,1.4,BWF Nominees Pty Ltd as The Trustee for BWF Trust,Bango 973 Wind Farm,Wind,155.0,0.9,Bango 973 Wind Farm,-34.551582,148.732808,2026-03-02T09:29:13.995896
2026/03/02 19:30:00,BANGOWF2,3.6,BWF Nominees Pty Ltd as The Trustee for BWF Trust,Bango 999 Wind Farm,Wind,82.0,4.39,Bango 999 Wind Farm,-34.551582,148.732808,2026-03-02T09:29:13.995896
2026/03/02 19:30:00,BLUFF1,7.4,AGL SA Generation Pty Limited,The Bluff Wind Farm,Wind,53.0,13.96,The Bluff Wind Farm,-33.367778,138.728611,2026-03-02T09:29:13.995896
2026/03/02 19:30:00,BOCORWF1,77.37,Boco Rock Wind Farm Pty Ltd,Boco Rock Wind Farm,Wind,111.0,69.7,Boco Rock Wind Farm,-36.578611,149.103333,2026-03-02T09:29:13.995896
2026/03/02 19:30:00,BRYB1WF1,44.85,Berrybank Development Pty Ltd,Berrybank Wind Farm,Wind,175.9,25.5,Berrybank Wind Farm,-37.94,143.52,2026-03-02T09:29:13.995896
2026/03/02 19:30:00,BRYB2WF2,32.65,Berrybank 2 Asset Pty Ltd as trustee for Berrybank 2 Asset Trust,Berrybank 2 Wind Farm,Wind,105.0,31.1,Berrybank 2 Wind Farm,-37.94,143.52,2026-03-02T09:29:13.995896
2026/03/02 19:30:00,BULGANA1,136.14,Bulgana Wind Farm Pty Ltd,Bulgana Green Power Hub,Wind,204.0,66.74,Bulgana Green Power Hub,-37.0975,142.973611,2026-03-02T09:29:13.995896
2026/03/02 19:30:00,CATHROCK,8.8,Cathedral Rocks Wind Farm Pty Ltd,Cathedral Rocks,Wind,66.0,13.33,Cathedral Rocks,-34.51,135.35,2026-03-02T09:29:13.995896
2026/03/02 19:30:00,CHYTWF1,3.25,Cherry Tree Wind Farm Pty Ltd as trustee for The Cherry Tree Project trust ,Cherry Tree Wind Farm,Wind,57.0,5.7,Cherry Tree Wind Farm,-37.1,145.26,2026-03-02T09:29:13.995896
2026/03/02 19:30:00,CLEMGPWF,12.25,Pacific Hydro Clements Gap Pty Ltd,Clements Gap Wind Farm,Wind,57.0,21.49,Clements Gap Wind Farm,-33.48,138.1,2026-03-02T09:29:13.995896
2026/03/02 19:30:00,CLRKCWF1,295.62,Stanwell Corporation Limited ,Clarke Creek Wind Farm,Wind,338.0,87.46,Clarke Creek Wind Farm,-22.85,149.45,2026-03-02T09:29:13.995896
2026/03/02 19:30:00,CLRKCWF2,93.45,Stanwell Corporation Limited ,Clarke Creek Wind Farm,Wind,101.0,92.52,Clarke Creek Wind Farm,-22.85,149.45,2026-03-02T09:29:13.995896
2026/03/02 19:30:00,CNUNDAWF,7.01,Canunda Power Pty Ltd,Canunda Wind Farm,Wind,46.0,15.24,Canunda Wind Farm,-37.73,140.39,2026-03-02T09:29:13.995896
2026/03/02 19:30:00,COLWF01,0.0,Collector Wind Farm Pty Ltd,Collector Wind Farm 1,Wind,219.0,0.0,Collector Wind Farm 1,-34.8719,149.3967,2026-03-02T09:29:13.995896
2026/03/02 19:30:00,COOPGWF1,275.25,PARF Company 10 Pty Limited as The Trustee for Coopers Gap Project Trust,Coopers Gap Wind Farm,Wind,440.0,62.56,Coopers Gap Wind Farm,-26.74,151.45,2026-03-02T09:29:13.995896
2026/03/02 19:30:00,CROOKWF2,4.3,Crookwell Development Pty Ltd ,Crookwell 2 Wind Farm,Wind,91.0,4.73,Crookwell 2 Wind Farm,-34.52,149.54,2026-03-02T09:29:13.995896
2026/03/02 19:30:00,CROOKWF3,2.43,Crookwell 3 Development Pty Ltd,Crookwell 3 Wind Farm,Wind,56.0,4.34,Crookwell 3 Wind Farm,-34.52,149.54,2026-03-02T09:29:13.995896
2026/03/02 19:30:00,CROWLWF1,61.29,Pacific Hydro Crowlands Pty Ltd ,Crowlands Wind Farm,Wind,79.0,77.58,Crowlands Wind Farm,-37.13,143.16,2026-03-02T09:29:13.995896
2026/03/02 19:30:00,CRURWF1,12.0,CRWF Nominees Pty Ltd As Trustee For The CRWF Trust,Crudine Ridge Wind Farm,Wind,138.0,8.7,Crudine Ridge Wind Farm,-32.97,149.64,2026-03-02T09:29:13.995896
2026/03/02 19:30:00,CTHLWF1,4.29,Wild Cattle Hill Pty Ltd,Cattle Hill Wind Farm,Wind,144.0,2.98,Cattle Hill Wind Farm,-42.15,146.69,2026-03-02T09:29:13.995896
2026/03/02 19:30:00,DULAWF1,57.7,Dulacca Energy Project Co Pty Ltd,Dulacca Wind Farm,Wind,173.0,33.35,Dulacca Wind Farm,-26.63,149.87,2026-03-02T09:29:13.995896
2026/03/02 19:30:00,DUNDWF1,52.14,Dundonnell Wind Farm Pty Ltd,Dundonnell Wind Farm,Wind,168.0,31.04,Dundonnell Wind Farm,-37.52,142.58,2026-03-02T09:29:13.995896
2026/03/02 19:30:00,DUNDWF2,19.61,Dundonnell Wind Farm Pty Ltd,Dundonnell Wind Farm,Wind,46.0,42.63,Dundonnell Wind Farm,-37.52,142.58,2026-03-02T09:29:13.995896
2026/03/02 19:30:00,DUNDWF3,37.19,Dundonnell Wind Farm Pty Ltd,Dundonnell Wind Farm,Wind,122.0,30.48,Dundonnell Wind Farm,-37.52,142.58,2026-03-02T09:29:13.995896
2026/03/02 19:30:00,ELAINWF1,5.06,Lal Lal Wind Farms Nom Co Pty Ltd,Elaine Wind Farm,Wind,82.0,6.17,Elaine Wind Farm,-37.36,144.0,2026-03-02T09:29:13.995896
2026/03/02 19:30:00,FLYCRKWF,33.26,Iberdrola Australia Energy Markets Pty Limited,Flyers Creek Wind Farm,Wind,140.0,23.76,Flyers Creek Wind Farm,-33.365556,148.981944,2026-03-02T09:29:13.995896
2026/03/02 19:30:00,GPWFEST1,14.47,Golden Plains WF1 Pty Ltd as Trustee for the Golden Plains WF1 Unit Trust,Golden Plains Wind Farm East,Wind,240.0,6.03,Golden Plains Wind Farm East,-37.945091,143.752614,2026-03-02T09:29:13.995896
2026/03/02 19:30:00,GPWFEST2,7.97,Golden Plains WF1 Pty Ltd as Trustee for the Golden Plains WF1 Unit Trust,Golden Plains Wind Farm East,Wind,253.0,3.15,Golden Plains Wind Farm East,-37.945091,143.752614,2026-03-02T09:29:13.995896
2026/03/02 19:30:00,GPWFEST3,18.78,Golden Plains WF1 Pty Ltd as Trustee for the Golden Plains WF1 Unit Trust,Golden Plains Wind Farm East,Wind,240.0,7.82,Golden Plains Wind Farm East,-37.945091,143.752614,2026-03-02T09:29:13.995896
2026/03/02 19:30:00,GRANWF1,70.68,Granville Harbour Operations Pty Ltd as The Trustee for Granville Harbour Operations Trust,Granville Harbour Wind Farm,Wind,111.0,63.68,Granville Harbour Wind Farm,-41.8,145.06,2026-03-02T09:29:13.995896
2026/03/02 19:30:00,GSWF1A,60.45,Goyder Wind Farm 1 Pty Ltd as the Trustee for Goyder Wind Farm 1 Trust,Goyder South Wind Farm 1A,Wind,201.0,30.07,Goyder South Wind Farm 1A,-33.679758,138.937597,2026-03-02T09:29:13.995896
2026/03/02 19:30:00,GSWF1B1,44.55,Goyder Wind Farm 1B Pty Ltd as the Trustee for the Goyder Wind Farm 1B Trust,Goyder South Wind Farm 1B,Wind,196.0,22.73,Goyder South Wind Farm 1B,-33.679758,138.937597,2026-03-02T09:29:13.995896
2026/03/02 19:30:00,GULLRWF1,0.02,New Gullen Range Wind Farm Pty Ltd,Gullen Range Wind Farm,Wind,161.0,0.01,Gullen Range Wind Farm,-34.34,149.27,2026-03-02T09:29:13.995896
2026/03/02 19:30:00,GULLRWF2,0.0,New Gullen Range Wind Farm Pty Ltd,Gullen Range Wind Farm,Wind,107.0,0.0,Gullen Range Wind Farm,-34.34,149.27,2026-03-02T09:29:13.995896
2026/03/02 19:30:00,GUNNING1,0.0,Gunning Wind Energy Developments Pty Ltd,Gunning Wind Farm,Wind,47.0,0.0,Gunning Wind Farm,-34.813333,149.4,2026-03-02T09:29:13.995896
2026/03/02 19:30:00,HALLWF1,19.2,AGL SA Generation Pty Limited,Hallett 1 Wind Farm,Wind,95.0,20.21,Hallett 1 Wind Farm,-33.367778,138.728611,2026-03-02T09:29:13.995896
2026/03/02 19:30:00,HALLWF2,14.59,AGL SA Generation Pty Limited,Hallett 2 Wind Farm,Wind,71.0,20.55,Hallett 2 Wind Farm,-33.367778,138.728611,2026-03-02T09:29:13.995896
2026/03/02 19:30:00,HD1WF1,25.52,Hawkesdale Asset Pty Ltd as trustee for Hawkesdale Asset Trust,Hawkesdale Wind Farm,Wind,89.0,28.67,Hawkesdale Wind Farm,-38.147894,142.361381,2026-03-02T09:29:13.995896
2026/03/02 19:30:00,HDWF1,37.3,HWF1 Pty Ltd,Hornsdale Wind Farm,Wind,102.0,36.57,Hornsdale Wind Farm,-33.050556,138.543611,2026-03-02T09:29:13.995896
2026/03/02 19:30:00,HDWF2,41.8,HWF 2 Pty Ltd,Hornsdale Wind Farm 2,Wind,102.0,40.98,Hornsdale Wind Farm 2,-33.06,138.54,2026-03-02T09:29:13.995896
2026/03/02 19:30:00,HDWF3,46.2,HWF3 Pty Ltd,Hornsdale Wind Farm 3,Wind,109.0,42.39,Hornsdale Wind Farm 3,-33.06,138.54,2026-03-02T09:29:13.995896
2026/03/02 19:30:00,KABANWF1,79.92,Kaban Wind Farm Pty Ltd as trustee for Kaban Wind Farm Trust,Kaban Wind Farm,Wind,152.0,52.58,Kaban Wind Farm,-17.56,145.41,2026-03-02T09:29:13.995896
2026/03/02 19:30:00,KEPWF1,16.9,Kennedy Energy Park Pty Ltd,Kennedy Energy Park,Wind,43.0,39.3,Kennedy Energy Park,-20.88,144.42,2026-03-02T09:29:13.995896
2026/03/02 19:30:00,KIATAWF1,29.2,Kiata ProjectCo Pty Ltd Atf Kiata Project Trust,Kiata Wind Farm,Wind,31.0,94.19,Kiata Wind Farm,-36.4,141.75,2026-03-02T09:29:13.995896
2026/03/02 19:30:00,LGAPWF1,40.49,Lincoln Gap Wind Farm (Operations) Pty Ltd,Lincoln Gap Wind Farm,Wind,123.0,32.92,Lincoln Gap Wind Farm,-32.564279,137.557328,2026-03-02T09:29:13.995896
2026/03/02 19:30:00,LGAPWF1,40.49,Lincoln Gap Wind Farm (Operations) Pty Ltd,Lincoln Gap Wind Farm,Wind,123.0,32.92,Lincoln Gap Wind Farm,-32.564279,137.557328,2026-03-02T09:29:13.995896
2026/03/02 19:30:00,LGAPWF2,78.23,Lincoln Gap Wind Farm (Operations) Pty Ltd,Lincoln Gap Wind Farm,Wind,85.0,92.04,Lincoln Gap Wind Farm,-32.564279,137.557328,2026-03-02T09:29:13.995896
2026/03/02 19:30:00,LGAPWF2,78.23,Lincoln Gap Wind Farm (Operations) Pty Ltd,Lincoln Gap Wind Farm,Wind,85.0,92.04,Lincoln Gap Wind Farm,-32.564279,137.557328,2026-03-02T09:29:13.995896
2026/03/02 19:30:00,LKBONNY1,14.91,Lake Bonney Wind Power Pty Ltd,Lake Bonney Wind Farm Stage 1,Wind,81.0,18.41,Lake Bonney Wind Farm Stage 1,-37.76,140.4,2026-03-02T09:29:13.995896
2026/03/02 19:30:00,LKBONNY2,20.04,Lake Bonney Wind Power Pty Ltd,Lake Bonney Stage 2 Windfarm,Wind,159.0,12.6,Lake Bonney Stage 2 Windfarm,-37.76,140.4,2026-03-02T09:29:13.995896
2026/03/02 19:30:00,LKBONNY3,3.13,Lake Bonney Wind Power Pty Ltd,Lake Bonney Stage 3 Wind Farm,Wind,39.0,8.03,Lake Bonney Stage 3 Wind Farm,-37.737781,140.388137,2026-03-02T09:29:13.995896
2026/03/02 19:30:00,MACARTH1,78.5,AGL Hydro Partnership,Macarthur Wind Farm,Wind,420.0,18.69,Macarthur Wind Farm,-38.048957,142.192112,2026-03-02T09:29:13.995896
2026/03/02 19:30:00,MCINTYR1,183.34,MacIntyre UJV Operator Pty Ltd,MacIntyre Wind Farm,Wind,890.0,20.6,MacIntyre Wind Farm,-28.32,151.54,2026-03-02T09:29:13.995896
2026/03/02 19:30:00,MERCER01,3.3,Mt Mercer Windfarm Pty Ltd,Mt Mercer Wind Farm,Wind,131.0,2.52,Mt Mercer Wind Farm,-37.841111,143.871111,2026-03-02T09:29:13.995896
2026/03/02 19:30:00,MEWF1,47.52,Ergon Energy Queensland Pty Ltd ,Mount Emerald Wind Farm,Wind,178.0,26.7,Mount Emerald Wind Farm,-17.133007,145.380644,2026-03-02T09:29:13.995896
2026/03/02 19:30:00,MRTLSWF1,30.24,Mortlake South Wind Farm Pty Ltd,Mortlake South Wind Farm,Wind,153.0,19.76,Mortlake South Wind Farm,-38.127337,142.857801,2026-03-02T09:29:13.995896
2026/03/02 19:30:00,MTGELWF1,17.84,Mt. Gellibrand Wind Farm Pty Ltd,Mt Gellibrand Wind Farm,Wind,132.0,13.52,Mt Gellibrand Wind Farm,-38.23,143.77,2026-03-02T09:29:13.995896
2026/03/02 19:30:00,MTMILLAR,15.3,Mt Millar Wind Farm Pty Ltd,Mt Millar Wind Farm,Wind,70.0,21.86,Mt Millar Wind Farm,-33.624444,136.703611,2026-03-02T09:29:13.995896
2026/03/02 19:30:00,MUSSELR1,4.0,Hydro-Electric Corporation,Musselroe Wind Farm,Wind,168.0,2.38,Musselroe Wind Farm,-40.780225,148.010799,2026-03-02T09:29:13.995896
2026/03/02 19:30:00,MUWAWF1,75.04,Telstra Energy (Generation) Pty Ltd,Murra Warra Wind Farm,Wind,225.7,33.25,Murra Warra Wind Farm,-36.432404,142.317853,2026-03-02T09:29:13.995896
2026/03/02 19:30:00,MUWAWF2,96.2,Murra Warra II Project Co Pty Ltd ATF The Murra Warra II Project Trust,Murra Warra Wind Farm Stage 2,Wind,203.0,47.39,Murra Warra Wind Farm Stage 2,-36.43,142.32,2026-03-02T09:29:13.995896
2026/03/02 19:30:00,NBHWF1,27.8,AGL SA Generation Pty Limited,North Brown Hill Wind Farm,Wind,132.0,21.06,North Brown Hill Wind Farm,-33.367778,138.728611,2026-03-02T09:29:13.995896
2026/03/02 19:30:00,OAKLAND1,28.8,AGL Hydro Partnership,Oaklands Hill Wind Farm,Wind,63.0,45.71,Oaklands Hill Wind Farm,-37.683078,142.551678,2026-03-02T09:29:13.995896
2026/03/02 19:30:00,PAREPW1,87.26,Iberdrola Australia Energy Markets Pty Limited,Port Augusta Renewable Energy Park,Wind,201.0,43.41,Port Augusta Renewable Energy Park,-32.566944,137.856111,2026-03-02T09:29:13.995896
2026/03/02 19:30:00,RYANCWF1,69.49,Ryan Corner Development Pty Ltd,Ryan Corner Wind Farm,Wind,205.0,33.9,Ryan Corner Wind Farm,-38.271017,142.140647,2026-03-02T09:29:13.995896
2026/03/02 19:30:00,RYEPARK1,6.24,Rye Park Renewable Energy Pty Ltd as trustee for Rye Park Wind Farm Trust,Rye Park Renewable Energy,Wind,384.0,1.62,Rye Park Renewable Energy,-32.138333,148.972778,2026-03-02T09:29:13.995896
2026/03/02 19:30:00,SALTCRK1,14.73,Salt Creek Wind Farm Pty Ltd,Salt Creek Wind Farm,Wind,54.0,27.28,Salt Creek Wind Farm,-37.95,142.63,2026-03-02T09:29:13.995896
2026/03/02 19:30:00,SAPHWF1,201.75,The Trustee For The SWF1 Operations Trust,Sapphire Wind Farm,Wind,270.0,74.72,Sapphire Wind Farm,-29.7,151.41,2026-03-02T09:29:13.995896
2026/03/02 19:30:00,SNOWNTH1,102.9,Snowtown Wind Farm Stage 2 Pty Ltd,Snowtown Wind Farm Stage 2 North,Wind,144.0,71.46,Snowtown Wind Farm Stage 2 North,-33.83,138.118611,2026-03-02T09:29:13.995896
2026/03/02 19:30:00,SNOWSTH1,53.6,Snowtown Wind Farm Stage 2 Pty Ltd,Snowtown South Wind Farm,Wind,126.0,42.54,Snowtown South Wind Farm,-33.83,138.118611,2026-03-02T09:29:13.995896
2026/03/02 19:30:00,SNOWTWN1,59.18,Snowtown Wind Farm Pty Ltd,Snowtown Wind Farm Units 1 And 47,Wind,99.0,59.78,Snowtown Wind Farm Units 1 And 47,-33.83,138.118611,2026-03-02T09:29:13.995896
2026/03/02 19:30:00,STARHLWF,10.1,Starfish Hill Wind Farm Pty Ltd,Starfish Hill Wind Farm,Wind,35.0,28.86,Starfish Hill Wind Farm,-35.58,138.14,2026-03-02T09:29:13.995896
2026/03/02 19:30:00,STOCKYD1,181.53,Stockyard Hill Wind Farm Pty Ltd,Stockyard Hill Wind Farm,Wind,511.0,35.52,Stockyard Hill Wind Farm,-37.535833,143.251389,2026-03-02T09:29:13.995896
2026/03/02 19:30:00,STWF1,113.03,PARF Company 8 Pty Ltd as The Trustee for Silverton Project Trust,Silverton Wind Farm,Wind,198.0,57.09,Silverton Wind Farm,-37.683168,142.551678,2026-03-02T09:29:13.995896
2026/03/02 19:30:00,TARALGA1,4.07,Taralga Wind Farm Nominees No 2 Pty Ltd (ATF Taralga Wind Farm Operating Trust),Taralga Wind Farm,Wind,106.0,3.84,Taralga Wind Farm,-34.42352,149.826267,2026-03-02T09:29:13.995896
2026/03/02 19:30:00,WAMBOWF1,208.71,Stanwell Corporation Limited,Wambo Wind Farm 1,Wind,245.0,85.19,Wambo Wind Farm 1,-35.187301,149.524945,2026-03-02T09:29:13.995896
2026/03/02 19:30:00,WATERLWF,26.4,Waterloo Wind Farm Pty Ltd,Waterloo Wind Farm,Wind,130.0,20.31,Waterloo Wind Farm,-34.00094,138.911567,2026-03-02T09:29:13.995896
2026/03/02 19:30:00,WGWF1,19.7,Willogoleche Power Pty Ltd As The Trustee For The Willogoleche Operating Trust,Willogoleche Wind Farm,Wind,119.0,16.55,Willogoleche Wind Farm,-33.39,138.85,2026-03-02T09:29:13.995896
2026/03/02 19:30:00,WOODLWN1,0.0,Woodlawn Wind Pty Ltd,Woodlawn Wind Farm,Wind,48.0,0.0,Woodlawn Wind Farm,-35.08,149.62,2026-03-02T09:29:13.995896
2026/03/02 19:30:00,WPWF,58.73,AGL SA Generation Pty Limited,Wattle Point Wind Farm,Wind,91.0,64.54,Wattle Point Wind Farm,-35.111624,137.7219,2026-03-02T09:29:13.995896
2026/03/02 19:30:00,WRWF1,99.19,White Rock Wind Farm Pty Ltd,White Rock Wind Farm,Wind,172.0,57.67,White Rock Wind Farm,-29.79,151.54,2026-03-02T09:29:13.995896
2026/03/02 19:30:00,YENDWF1,7.37,Lal Lal Wind Farms Nom Co Pty Ltd,Yendon Wind Farm,Wind,142.0,5.19,Yendon Wind Farm,-37.629987,144.022717,2026-03-02T09:29:13.995896
