SETTLEMENTDATE,DUID,SCADAVALUE,Participant,Station Name,Fuel Source - Primary,MAX_CAP,utilisation_pct,Plant,Latitude,Longitude,timestamp_utc
2026/02/17 01:25:00,CAPTL_WF,0.0,Iberdrola Australia Holdings Pty Limited,Capital Wind Farm,Wind,140.0,0.0,Capital Wind Farm,-35.1,149.31,2026-02-16T15:22:18.377299
2026/02/17 01:25:00,CHALLHWF,31.3,Pacific Hydro Challicum Hills Pty Ltd,Challicum Hills Wind Farm,Wind,52.0,60.19,Challicum Hills Wind Farm,-37.38,143.11,2026-02-16T15:22:18.377299
2026/02/17 01:25:00,CULLRGWF,10.21,Cullerin Range Wind Farm Pty Ltd,Cullerin Range Wind Farm,Wind,30.0,34.03,Cullerin Range Wind Farm,-34.81,149.4,2026-02-16T15:22:18.377299
2026/02/17 01:25:00,DIAPURWF1,8.0,Y.E.S. Energy (SA) Pty Ltd,Diapur Wind Farm,Wind,7.0,114.29,Diapur Wind Farm,-36.3425,141.43,2026-02-16T15:22:18.377299
2026/02/17 01:25:00,MLWF1,16.62,Mortons Lane Windfarm Pty Limited,Mortons Lane Wind Farm,Wind,20.0,83.1,Mortons Lane Wind Farm,-37.84,142.45,2026-02-16T15:22:18.377299
2026/02/17 01:25:00,WAUBRAWF,91.91,Pyrenees Wind Energy Developments Pty Ltd,Waubra Wind Farm,Wind,192.0,47.87,Waubra Wind Farm,-37.394498,143.638982,2026-02-16T15:22:18.377299
2026/02/17 01:25:00,WOOLNTH1,102.2,Hydro-Electric Corporation,Woolnorth Studland Bay / Bluff Point Wind Farm,Wind,140.0,73.0,Woolnorth Studland Bay / Bluff Point Wind Farm,-40.69,144.72,2026-02-16T15:22:18.377299
2026/02/17 01:25:00,YAMBUKWF,19.8,Energy Pacific (Vic) Pty Ltd,Yambuk Wind Farm,Wind,30.0,66.0,Yambuk Wind Farm,-38.299083,142.027577,2026-02-16T15:22:18.377299
2026/02/17 01:25:00,YSWF1,10.1,Pacific Hydro Yaloak South Pty Ltd,Yaloak South Wind Farm,Wind,28.0,36.07,Yaloak South Wind Farm,-37.7163,144.242853,2026-02-16T15:22:18.377299
2026/02/17 01:25:00,ARWF1,72.3,Ararat Wind Farm Pty Ltd,Ararat Wind Farm,Wind,241.0,30.0,Ararat Wind Farm,-37.232778,143.031389,2026-02-16T15:22:18.377299
2026/02/17 01:25:00,BALDHWF1,57.07,Alinta Energy Retail Sales Pty Ltd,Bald Hills Wind Farm,Wind,106.0,53.84,Bald Hills Wind Farm,-38.79,145.93,2026-02-16T15:22:18.377299
2026/02/17 01:25:00,BANGOWF1,40.6,BWF Nominees Pty Ltd as The Trustee for BWF Trust,Bango 973 Wind Farm,Wind,155.0,26.19,Bango 973 Wind Farm,-34.551582,148.732808,2026-02-16T15:22:18.377299
2026/02/17 01:25:00,BANGOWF2,13.2,BWF Nominees Pty Ltd as The Trustee for BWF Trust,Bango 999 Wind Farm,Wind,82.0,16.1,Bango 999 Wind Farm,-34.551582,148.732808,2026-02-16T15:22:18.377299
2026/02/17 01:25:00,BLUFF1,41.3,AGL SA Generation Pty Limited,The Bluff Wind Farm,Wind,53.0,77.92,The Bluff Wind Farm,-33.367778,138.728611,2026-02-16T15:22:18.377299
2026/02/17 01:25:00,BOCORWF1,65.52,Boco Rock Wind Farm Pty Ltd,Boco Rock Wind Farm,Wind,111.0,59.03,Boco Rock Wind Farm,-36.578611,149.103333,2026-02-16T15:22:18.377299
2026/02/17 01:25:00,BRYB1WF1,139.27,Berrybank Development Pty Ltd,Berrybank Wind Farm,Wind,175.9,79.18,Berrybank Wind Farm,-37.94,143.52,2026-02-16T15:22:18.377299
2026/02/17 01:25:00,BRYB2WF2,81.27,Berrybank 2 Asset Pty Ltd as trustee for Berrybank 2 Asset Trust,Berrybank 2 Wind Farm,Wind,105.0,77.4,Berrybank 2 Wind Farm,-37.94,143.52,2026-02-16T15:22:18.377299
2026/02/17 01:25:00,BULGANA1,140.88,Bulgana Wind Farm Pty Ltd,Bulgana Green Power Hub,Wind,204.0,69.06,Bulgana Green Power Hub,-37.0975,142.973611,2026-02-16T15:22:18.377299
2026/02/17 01:25:00,CATHROCK,6.7,Cathedral Rocks Wind Farm Pty Ltd,Cathedral Rocks,Wind,66.0,10.15,Cathedral Rocks,-34.51,135.35,2026-02-16T15:22:18.377299
2026/02/17 01:25:00,CHYTWF1,17.64,Cherry Tree Wind Farm Pty Ltd as trustee for The Cherry Tree Project trust ,Cherry Tree Wind Farm,Wind,57.0,30.95,Cherry Tree Wind Farm,-37.1,145.26,2026-02-16T15:22:18.377299
2026/02/17 01:25:00,CLEMGPWF,44.16,Pacific Hydro Clements Gap Pty Ltd,Clements Gap Wind Farm,Wind,57.0,77.47,Clements Gap Wind Farm,-33.48,138.1,2026-02-16T15:22:18.377299
2026/02/17 01:25:00,CLRKCWF1,228.42,Stanwell Corporation Limited ,Clarke Creek Wind Farm,Wind,338.0,67.58,Clarke Creek Wind Farm,-22.85,149.45,2026-02-16T15:22:18.377299
2026/02/17 01:25:00,CLRKCWF2,76.6,Stanwell Corporation Limited ,Clarke Creek Wind Farm,Wind,101.0,75.84,Clarke Creek Wind Farm,-22.85,149.45,2026-02-16T15:22:18.377299
2026/02/17 01:25:00,CNUNDAWF,30.04,Canunda Power Pty Ltd,Canunda Wind Farm,Wind,46.0,65.3,Canunda Wind Farm,-37.73,140.39,2026-02-16T15:22:18.377299
2026/02/17 01:25:00,COLWF01,35.78,Collector Wind Farm Pty Ltd,Collector Wind Farm 1,Wind,219.0,16.34,Collector Wind Farm 1,-34.8719,149.3967,2026-02-16T15:22:18.377299
2026/02/17 01:25:00,COOPGWF1,383.31,PARF Company 10 Pty Limited as The Trustee for Coopers Gap Project Trust,Coopers Gap Wind Farm,Wind,440.0,87.12,Coopers Gap Wind Farm,-26.74,151.45,2026-02-16T15:22:18.377299
2026/02/17 01:25:00,CROOKWF2,21.8,Crookwell Development Pty Ltd ,Crookwell 2 Wind Farm,Wind,91.0,23.96,Crookwell 2 Wind Farm,-34.52,149.54,2026-02-16T15:22:18.377299
2026/02/17 01:25:00,CROOKWF3,20.97,Crookwell 3 Development Pty Ltd,Crookwell 3 Wind Farm,Wind,56.0,37.45,Crookwell 3 Wind Farm,-34.52,149.54,2026-02-16T15:22:18.377299
2026/02/17 01:25:00,CROWLWF1,61.41,Pacific Hydro Crowlands Pty Ltd ,Crowlands Wind Farm,Wind,79.0,77.73,Crowlands Wind Farm,-37.13,143.16,2026-02-16T15:22:18.377299
2026/02/17 01:25:00,CRURWF1,78.8,CRWF Nominees Pty Ltd As Trustee For The CRWF Trust,Crudine Ridge Wind Farm,Wind,138.0,57.1,Crudine Ridge Wind Farm,-32.97,149.64,2026-02-16T15:22:18.377299
2026/02/17 01:25:00,CTHLWF1,104.45,Wild Cattle Hill Pty Ltd,Cattle Hill Wind Farm,Wind,144.0,72.53,Cattle Hill Wind Farm,-42.15,146.69,2026-02-16T15:22:18.377299
2026/02/17 01:25:00,DULAWF1,124.5,Dulacca Energy Project Co Pty Ltd,Dulacca Wind Farm,Wind,173.0,71.97,Dulacca Wind Farm,-26.63,149.87,2026-02-16T15:22:18.377299
2026/02/17 01:25:00,DUNDWF1,155.2,Dundonnell Wind Farm Pty Ltd,Dundonnell Wind Farm,Wind,168.0,92.38,Dundonnell Wind Farm,-37.52,142.58,2026-02-16T15:22:18.377299
2026/02/17 01:25:00,DUNDWF2,43.13,Dundonnell Wind Farm Pty Ltd,Dundonnell Wind Farm,Wind,46.0,93.76,Dundonnell Wind Farm,-37.52,142.58,2026-02-16T15:22:18.377299
2026/02/17 01:25:00,DUNDWF3,111.86,Dundonnell Wind Farm Pty Ltd,Dundonnell Wind Farm,Wind,122.0,91.69,Dundonnell Wind Farm,-37.52,142.58,2026-02-16T15:22:18.377299
2026/02/17 01:25:00,ELAINWF1,53.0,Lal Lal Wind Farms Nom Co Pty Ltd,Elaine Wind Farm,Wind,82.0,64.63,Elaine Wind Farm,-37.36,144.0,2026-02-16T15:22:18.377299
2026/02/17 01:25:00,FLYCRKWF,58.79,Iberdrola Australia Energy Markets Pty Limited,Flyers Creek Wind Farm,Wind,140.0,41.99,Flyers Creek Wind Farm,-33.365556,148.981944,2026-02-16T15:22:18.377299
2026/02/17 01:25:00,GPWFEST1,182.91,Golden Plains WF1 Pty Ltd as Trustee for the Golden Plains WF1 Unit Trust,Golden Plains Wind Farm East,Wind,240.0,76.21,Golden Plains Wind Farm East,-37.945091,143.752614,2026-02-16T15:22:18.377299
2026/02/17 01:25:00,GPWFEST2,192.83,Golden Plains WF1 Pty Ltd as Trustee for the Golden Plains WF1 Unit Trust,Golden Plains Wind Farm East,Wind,253.0,76.22,Golden Plains Wind Farm East,-37.945091,143.752614,2026-02-16T15:22:18.377299
2026/02/17 01:25:00,GPWFEST3,200.69,Golden Plains WF1 Pty Ltd as Trustee for the Golden Plains WF1 Unit Trust,Golden Plains Wind Farm East,Wind,240.0,83.62,Golden Plains Wind Farm East,-37.945091,143.752614,2026-02-16T15:22:18.377299
2026/02/17 01:25:00,GRANWF1,0.0,Granville Harbour Operations Pty Ltd as The Trustee for Granville Harbour Operations Trust,Granville Harbour Wind Farm,Wind,111.0,0.0,Granville Harbour Wind Farm,-41.8,145.06,2026-02-16T15:22:18.377299
2026/02/17 01:25:00,GSWF1A,132.23,Goyder Wind Farm 1 Pty Ltd as the Trustee for Goyder Wind Farm 1 Trust,Goyder South Wind Farm 1A,Wind,201.0,65.79,Goyder South Wind Farm 1A,-33.679758,138.937597,2026-02-16T15:22:18.377299
2026/02/17 01:25:00,GSWF1B1,131.41,Goyder Wind Farm 1B Pty Ltd as the Trustee for the Goyder Wind Farm 1B Trust,Goyder South Wind Farm 1B,Wind,196.0,67.05,Goyder South Wind Farm 1B,-33.679758,138.937597,2026-02-16T15:22:18.377299
2026/02/17 01:25:00,GULLRWF1,30.6,New Gullen Range Wind Farm Pty Ltd,Gullen Range Wind Farm,Wind,161.0,19.01,Gullen Range Wind Farm,-34.34,149.27,2026-02-16T15:22:18.377299
2026/02/17 01:25:00,GULLRWF2,50.32,New Gullen Range Wind Farm Pty Ltd,Gullen Range Wind Farm,Wind,107.0,47.03,Gullen Range Wind Farm,-34.34,149.27,2026-02-16T15:22:18.377299
2026/02/17 01:25:00,GUNNING1,20.64,Gunning Wind Energy Developments Pty Ltd,Gunning Wind Farm,Wind,47.0,43.91,Gunning Wind Farm,-34.813333,149.4,2026-02-16T15:22:18.377299
2026/02/17 01:25:00,HALLWF1,63.69,AGL SA Generation Pty Limited,Hallett 1 Wind Farm,Wind,95.0,67.04,Hallett 1 Wind Farm,-33.367778,138.728611,2026-02-16T15:22:18.377299
2026/02/17 01:25:00,HALLWF2,59.45,AGL SA Generation Pty Limited,Hallett 2 Wind Farm,Wind,71.0,83.73,Hallett 2 Wind Farm,-33.367778,138.728611,2026-02-16T15:22:18.377299
2026/02/17 01:25:00,HD1WF1,88.59,Hawkesdale Asset Pty Ltd as trustee for Hawkesdale Asset Trust,Hawkesdale Wind Farm,Wind,89.0,99.54,Hawkesdale Wind Farm,-38.147894,142.361381,2026-02-16T15:22:18.377299
2026/02/17 01:25:00,HDWF1,73.4,HWF1 Pty Ltd,Hornsdale Wind Farm,Wind,102.0,71.96,Hornsdale Wind Farm,-33.050556,138.543611,2026-02-16T15:22:18.377299
2026/02/17 01:25:00,HDWF2,62.7,HWF 2 Pty Ltd,Hornsdale Wind Farm 2,Wind,102.0,61.47,Hornsdale Wind Farm 2,-33.06,138.54,2026-02-16T15:22:18.377299
2026/02/17 01:25:00,HDWF3,70.0,HWF3 Pty Ltd,Hornsdale Wind Farm 3,Wind,109.0,64.22,Hornsdale Wind Farm 3,-33.06,138.54,2026-02-16T15:22:18.377299
2026/02/17 01:25:00,KABANWF1,0.0,Kaban Wind Farm Pty Ltd as trustee for Kaban Wind Farm Trust,Kaban Wind Farm,Wind,152.0,0.0,Kaban Wind Farm,-17.56,145.41,2026-02-16T15:22:18.377299
2026/02/17 01:25:00,KEPWF1,23.3,Kennedy Energy Park Pty Ltd,Kennedy Energy Park,Wind,43.0,54.19,Kennedy Energy Park,-20.88,144.42,2026-02-16T15:22:18.377299
2026/02/17 01:25:00,KIATAWF1,0.0,Kiata ProjectCo Pty Ltd Atf Kiata Project Trust,Kiata Wind Farm,Wind,31.0,0.0,Kiata Wind Farm,-36.4,141.75,2026-02-16T15:22:18.377299
2026/02/17 01:25:00,LGAPWF1,69.25,Lincoln Gap Wind Farm (Operations) Pty Ltd,Lincoln Gap Wind Farm,Wind,123.0,56.3,Lincoln Gap Wind Farm,-32.564279,137.557328,2026-02-16T15:22:18.377299
2026/02/17 01:25:00,LGAPWF1,69.25,Lincoln Gap Wind Farm (Operations) Pty Ltd,Lincoln Gap Wind Farm,Wind,123.0,56.3,Lincoln Gap Wind Farm,-32.564279,137.557328,2026-02-16T15:22:18.377299
2026/02/17 01:25:00,LGAPWF2,69.7,Lincoln Gap Wind Farm (Operations) Pty Ltd,Lincoln Gap Wind Farm,Wind,85.0,82.0,Lincoln Gap Wind Farm,-32.564279,137.557328,2026-02-16T15:22:18.377299
2026/02/17 01:25:00,LGAPWF2,69.7,Lincoln Gap Wind Farm (Operations) Pty Ltd,Lincoln Gap Wind Farm,Wind,85.0,82.0,Lincoln Gap Wind Farm,-32.564279,137.557328,2026-02-16T15:22:18.377299
2026/02/17 01:25:00,LKBONNY1,51.35,Lake Bonney Wind Power Pty Ltd,Lake Bonney Wind Farm Stage 1,Wind,81.0,63.4,Lake Bonney Wind Farm Stage 1,-37.76,140.4,2026-02-16T15:22:18.377299
2026/02/17 01:25:00,LKBONNY2,98.85,Lake Bonney Wind Power Pty Ltd,Lake Bonney Stage 2 Windfarm,Wind,159.0,62.17,Lake Bonney Stage 2 Windfarm,-37.76,140.4,2026-02-16T15:22:18.377299
2026/02/17 01:25:00,LKBONNY3,23.05,Lake Bonney Wind Power Pty Ltd,Lake Bonney Stage 3 Wind Farm,Wind,39.0,59.1,Lake Bonney Stage 3 Wind Farm,-37.737781,140.388137,2026-02-16T15:22:18.377299
2026/02/17 01:25:00,MACARTH1,289.6,AGL Hydro Partnership,Macarthur Wind Farm,Wind,420.0,68.95,Macarthur Wind Farm,-38.048957,142.192112,2026-02-16T15:22:18.377299
2026/02/17 01:25:00,MCINTYR1,369.54,MacIntyre UJV Operator Pty Ltd,MacIntyre Wind Farm,Wind,890.0,41.52,MacIntyre Wind Farm,-28.32,151.54,2026-02-16T15:22:18.377299
2026/02/17 01:25:00,MERCER01,95.2,Mt Mercer Windfarm Pty Ltd,Mt Mercer Wind Farm,Wind,131.0,72.67,Mt Mercer Wind Farm,-37.841111,143.871111,2026-02-16T15:22:18.377299
2026/02/17 01:25:00,MEWF1,0.0,Ergon Energy Queensland Pty Ltd ,Mount Emerald Wind Farm,Wind,178.0,0.0,Mount Emerald Wind Farm,-17.133007,145.380644,2026-02-16T15:22:18.377299
2026/02/17 01:25:00,MRTLSWF1,105.95,Mortlake South Wind Farm Pty Ltd,Mortlake South Wind Farm,Wind,153.0,69.25,Mortlake South Wind Farm,-38.127337,142.857801,2026-02-16T15:22:18.377299
2026/02/17 01:25:00,MTGELWF1,54.79,Mt. Gellibrand Wind Farm Pty Ltd,Mt Gellibrand Wind Farm,Wind,132.0,41.51,Mt Gellibrand Wind Farm,-38.23,143.77,2026-02-16T15:22:18.377299
2026/02/17 01:25:00,MTMILLAR,62.4,Mt Millar Wind Farm Pty Ltd,Mt Millar Wind Farm,Wind,70.0,89.14,Mt Millar Wind Farm,-33.624444,136.703611,2026-02-16T15:22:18.377299
2026/02/17 01:25:00,MUSSELR1,16.1,Hydro-Electric Corporation,Musselroe Wind Farm,Wind,168.0,9.58,Musselroe Wind Farm,-40.780225,148.010799,2026-02-16T15:22:18.377299
2026/02/17 01:25:00,MUWAWF1,199.16,Telstra Energy (Generation) Pty Ltd,Murra Warra Wind Farm,Wind,225.7,88.24,Murra Warra Wind Farm,-36.432404,142.317853,2026-02-16T15:22:18.377299
2026/02/17 01:25:00,MUWAWF2,180.6,Murra Warra II Project Co Pty Ltd ATF The Murra Warra II Project Trust,Murra Warra Wind Farm Stage 2,Wind,203.0,88.97,Murra Warra Wind Farm Stage 2,-36.43,142.32,2026-02-16T15:22:18.377299
2026/02/17 01:25:00,NBHWF1,107.7,AGL SA Generation Pty Limited,North Brown Hill Wind Farm,Wind,132.0,81.59,North Brown Hill Wind Farm,-33.367778,138.728611,2026-02-16T15:22:18.377299
2026/02/17 01:25:00,OAKLAND1,57.3,AGL Hydro Partnership,Oaklands Hill Wind Farm,Wind,63.0,90.95,Oaklands Hill Wind Farm,-37.683078,142.551678,2026-02-16T15:22:18.377299
2026/02/17 01:25:00,PAREPW1,149.14,Iberdrola Australia Energy Markets Pty Limited,Port Augusta Renewable Energy Park,Wind,201.0,74.2,Port Augusta Renewable Energy Park,-32.566944,137.856111,2026-02-16T15:22:18.377299
2026/02/17 01:25:00,RYANCWF1,180.05,Ryan Corner Development Pty Ltd,Ryan Corner Wind Farm,Wind,205.0,87.83,Ryan Corner Wind Farm,-38.271017,142.140647,2026-02-16T15:22:18.377299
2026/02/17 01:25:00,RYEPARK1,84.68,Rye Park Renewable Energy Pty Ltd as trustee for Rye Park Wind Farm Trust,Rye Park Renewable Energy,Wind,384.0,22.05,Rye Park Renewable Energy,-32.138333,148.972778,2026-02-16T15:22:18.377299
2026/02/17 01:25:00,SALTCRK1,0.0,Salt Creek Wind Farm Pty Ltd,Salt Creek Wind Farm,Wind,54.0,0.0,Salt Creek Wind Farm,-37.95,142.63,2026-02-16T15:22:18.377299
2026/02/17 01:25:00,SAPHWF1,260.15,The Trustee For The SWF1 Operations Trust,Sapphire Wind Farm,Wind,270.0,96.35,Sapphire Wind Farm,-29.7,151.41,2026-02-16T15:22:18.377299
2026/02/17 01:25:00,SNOWNTH1,129.1,Snowtown Wind Farm Stage 2 Pty Ltd,Snowtown Wind Farm Stage 2 North,Wind,144.0,89.65,Snowtown Wind Farm Stage 2 North,-33.83,138.118611,2026-02-16T15:22:18.377299
2026/02/17 01:25:00,SNOWSTH1,121.7,Snowtown Wind Farm Stage 2 Pty Ltd,Snowtown South Wind Farm,Wind,126.0,96.59,Snowtown South Wind Farm,-33.83,138.118611,2026-02-16T15:22:18.377299
2026/02/17 01:25:00,SNOWTWN1,88.54,Snowtown Wind Farm Pty Ltd,Snowtown Wind Farm Units 1 And 47,Wind,99.0,89.43,Snowtown Wind Farm Units 1 And 47,-33.83,138.118611,2026-02-16T15:22:18.377299
2026/02/17 01:25:00,STARHLWF,23.79,Starfish Hill Wind Farm Pty Ltd,Starfish Hill Wind Farm,Wind,35.0,67.97,Starfish Hill Wind Farm,-35.58,138.14,2026-02-16T15:22:18.377299
2026/02/17 01:25:00,STOCKYD1,422.6,Stockyard Hill Wind Farm Pty Ltd,Stockyard Hill Wind Farm,Wind,511.0,82.7,Stockyard Hill Wind Farm,-37.535833,143.251389,2026-02-16T15:22:18.377299
2026/02/17 01:25:00,STWF1,47.83,PARF Company 8 Pty Ltd as The Trustee for Silverton Project Trust,Silverton Wind Farm,Wind,198.0,24.16,Silverton Wind Farm,-37.683168,142.551678,2026-02-16T15:22:18.377299
2026/02/17 01:25:00,TARALGA1,24.62,Taralga Wind Farm Nominees No 2 Pty Ltd (ATF Taralga Wind Farm Operating Trust),Taralga Wind Farm,Wind,106.0,23.23,Taralga Wind Farm,-34.42352,149.826267,2026-02-16T15:22:18.377299
2026/02/17 01:25:00,WAMBOWF1,183.47,Stanwell Corporation Limited,Wambo Wind Farm 1,Wind,245.0,74.89,Wambo Wind Farm 1,-35.187301,149.524945,2026-02-16T15:22:18.377299
2026/02/17 01:25:00,WATERLWF,74.3,Waterloo Wind Farm Pty Ltd,Waterloo Wind Farm,Wind,130.0,57.15,Waterloo Wind Farm,-34.00094,138.911567,2026-02-16T15:22:18.377299
2026/02/17 01:25:00,WGWF1,105.6,Willogoleche Power Pty Ltd As The Trustee For The Willogoleche Operating Trust,Willogoleche Wind Farm,Wind,119.0,88.74,Willogoleche Wind Farm,-33.39,138.85,2026-02-16T15:22:18.377299
2026/02/17 01:25:00,WOODLWN1,8.64,Woodlawn Wind Pty Ltd,Woodlawn Wind Farm,Wind,48.0,18.0,Woodlawn Wind Farm,-35.08,149.62,2026-02-16T15:22:18.377299
2026/02/17 01:25:00,WPWF,62.72,AGL SA Generation Pty Limited,Wattle Point Wind Farm,Wind,91.0,68.92,Wattle Point Wind Farm,-35.111624,137.7219,2026-02-16T15:22:18.377299
2026/02/17 01:25:00,WRWF1,151.19,White Rock Wind Farm Pty Ltd,White Rock Wind Farm,Wind,172.0,87.9,White Rock Wind Farm,-29.79,151.54,2026-02-16T15:22:18.377299
2026/02/17 01:25:00,YENDWF1,85.22,Lal Lal Wind Farms Nom Co Pty Ltd,Yendon Wind Farm,Wind,142.0,60.01,Yendon Wind Farm,-37.629987,144.022717,2026-02-16T15:22:18.377299
