SETTLEMENTDATE,DUID,SCADAVALUE,Participant,Station Name,Fuel Source - Primary,MAX_CAP,utilisation_pct,Plant,Latitude,Longitude,timestamp_utc
2026/04/18 03:30:00,CAPTL_WF,18.48,Iberdrola Australia Holdings Pty Limited,Capital Wind Farm,Wind,140.0,13.2,Capital Wind Farm,-35.1,149.31,2026-04-17T17:26:54.421389
2026/04/18 03:30:00,CHALLHWF,5.9,Pacific Hydro Challicum Hills Pty Ltd,Challicum Hills Wind Farm,Wind,52.0,11.35,Challicum Hills Wind Farm,-37.38,143.11,2026-04-17T17:26:54.421389
2026/04/18 03:30:00,CULLRGWF,0.4,Cullerin Range Wind Farm Pty Ltd,Cullerin Range Wind Farm,Wind,30.0,1.33,Cullerin Range Wind Farm,-34.81,149.4,2026-04-17T17:26:54.421389
2026/04/18 03:30:00,DIAPURWF1,2.6,Y.E.S. Energy (SA) Pty Ltd,Diapur Wind Farm,Wind,7.0,37.14,Diapur Wind Farm,-36.3425,141.43,2026-04-17T17:26:54.421389
2026/04/18 03:30:00,MLWF1,0.57,Mortons Lane Windfarm Pty Limited,Mortons Lane Wind Farm,Wind,20.0,2.85,Mortons Lane Wind Farm,-37.84,142.45,2026-04-17T17:26:54.421389
2026/04/18 03:30:00,WAUBRAWF,54.75,Pyrenees Wind Energy Developments Pty Ltd,Waubra Wind Farm,Wind,192.0,28.52,Waubra Wind Farm,-37.394498,143.638982,2026-04-17T17:26:54.421389
2026/04/18 03:30:00,WOOLNTH1,87.97,Hydro-Electric Corporation,Woolnorth Studland Bay / Bluff Point Wind Farm,Wind,140.0,62.84,Woolnorth Studland Bay / Bluff Point Wind Farm,-40.69,144.72,2026-04-17T17:26:54.421389
2026/04/18 03:30:00,YAMBUKWF,1.9,Energy Pacific (Vic) Pty Ltd,Yambuk Wind Farm,Wind,30.0,6.33,Yambuk Wind Farm,-38.299083,142.027577,2026-04-17T17:26:54.421389
2026/04/18 03:30:00,YSWF1,1.9,Pacific Hydro Yaloak South Pty Ltd,Yaloak South Wind Farm,Wind,28.0,6.79,Yaloak South Wind Farm,-37.7163,144.242853,2026-04-17T17:26:54.421389
2026/04/18 03:30:00,ARWF1,28.4,Ararat Wind Farm Pty Ltd,Ararat Wind Farm,Wind,241.0,11.78,Ararat Wind Farm,-37.232778,143.031389,2026-04-17T17:26:54.421389
2026/04/18 03:30:00,BALDHWF1,54.69,Alinta Energy Retail Sales Pty Ltd,Bald Hills Wind Farm,Wind,106.0,51.59,Bald Hills Wind Farm,-38.79,145.93,2026-04-17T17:26:54.421389
2026/04/18 03:30:00,BANGOWF1,5.5,BWF Nominees Pty Ltd as The Trustee for BWF Trust,Bango 973 Wind Farm,Wind,155.0,3.55,Bango 973 Wind Farm,-34.551582,148.732808,2026-04-17T17:26:54.421389
2026/04/18 03:30:00,BANGOWF2,0.0,BWF Nominees Pty Ltd as The Trustee for BWF Trust,Bango 999 Wind Farm,Wind,82.0,0.0,Bango 999 Wind Farm,-34.551582,148.732808,2026-04-17T17:26:54.421389
2026/04/18 03:30:00,BLUFF1,14.2,AGL SA Generation Pty Limited,The Bluff Wind Farm,Wind,53.0,26.79,The Bluff Wind Farm,-33.367778,138.728611,2026-04-17T17:26:54.421389
2026/04/18 03:30:00,BOCORWF1,68.76,Boco Rock Wind Farm Pty Ltd,Boco Rock Wind Farm,Wind,111.0,61.95,Boco Rock Wind Farm,-36.578611,149.103333,2026-04-17T17:26:54.421389
2026/04/18 03:30:00,BRYB1WF1,23.23,Berrybank Development Pty Ltd,Berrybank Wind Farm,Wind,175.9,13.21,Berrybank Wind Farm,-37.94,143.52,2026-04-17T17:26:54.421389
2026/04/18 03:30:00,BRYB2WF2,15.49,Berrybank 2 Asset Pty Ltd as trustee for Berrybank 2 Asset Trust,Berrybank 2 Wind Farm,Wind,105.0,14.75,Berrybank 2 Wind Farm,-37.94,143.52,2026-04-17T17:26:54.421389
2026/04/18 03:30:00,BULGANA1,14.95,Bulgana Wind Farm Pty Ltd,Bulgana Green Power Hub,Wind,204.0,7.33,Bulgana Green Power Hub,-37.0975,142.973611,2026-04-17T17:26:54.421389
2026/04/18 03:30:00,CATHROCK,60.0,Cathedral Rocks Wind Farm Pty Ltd,Cathedral Rocks,Wind,66.0,90.91,Cathedral Rocks,-34.51,135.35,2026-04-17T17:26:54.421389
2026/04/18 03:30:00,CHYTWF1,43.5,Cherry Tree Wind Farm Pty Ltd as trustee for The Cherry Tree Project trust ,Cherry Tree Wind Farm,Wind,57.0,76.32,Cherry Tree Wind Farm,-37.1,145.26,2026-04-17T17:26:54.421389
2026/04/18 03:30:00,CLEMGPWF,30.4,Pacific Hydro Clements Gap Pty Ltd,Clements Gap Wind Farm,Wind,57.0,53.33,Clements Gap Wind Farm,-33.48,138.1,2026-04-17T17:26:54.421389
2026/04/18 03:30:00,CLRKCWF1,0.0,Stanwell Corporation Limited ,Clarke Creek Wind Farm,Wind,338.0,0.0,Clarke Creek Wind Farm,-22.85,149.45,2026-04-17T17:26:54.421389
2026/04/18 03:30:00,CLRKCWF2,0.0,Stanwell Corporation Limited ,Clarke Creek Wind Farm,Wind,101.0,0.0,Clarke Creek Wind Farm,-22.85,149.45,2026-04-17T17:26:54.421389
2026/04/18 03:30:00,CNUNDAWF,0.4,Canunda Power Pty Ltd,Canunda Wind Farm,Wind,46.0,0.87,Canunda Wind Farm,-37.73,140.39,2026-04-17T17:26:54.421389
2026/04/18 03:30:00,COLWF01,11.25,Collector Wind Farm Pty Ltd,Collector Wind Farm 1,Wind,219.0,5.14,Collector Wind Farm 1,-34.8719,149.3967,2026-04-17T17:26:54.421389
2026/04/18 03:30:00,COOPGWF1,43.02,PARF Company 10 Pty Limited as The Trustee for Coopers Gap Project Trust,Coopers Gap Wind Farm,Wind,440.0,9.78,Coopers Gap Wind Farm,-26.74,151.45,2026-04-17T17:26:54.421389
2026/04/18 03:30:00,CROOKWF2,2.95,Crookwell Development Pty Ltd ,Crookwell 2 Wind Farm,Wind,91.0,3.24,Crookwell 2 Wind Farm,-34.52,149.54,2026-04-17T17:26:54.421389
2026/04/18 03:30:00,CROOKWF3,15.26,Crookwell 3 Development Pty Ltd,Crookwell 3 Wind Farm,Wind,56.0,27.25,Crookwell 3 Wind Farm,-34.52,149.54,2026-04-17T17:26:54.421389
2026/04/18 03:30:00,CROWLWF1,13.05,Pacific Hydro Crowlands Pty Ltd ,Crowlands Wind Farm,Wind,79.0,16.52,Crowlands Wind Farm,-37.13,143.16,2026-04-17T17:26:54.421389
2026/04/18 03:30:00,CRURWF1,23.1,CRWF Nominees Pty Ltd As Trustee For The CRWF Trust,Crudine Ridge Wind Farm,Wind,138.0,16.74,Crudine Ridge Wind Farm,-32.97,149.64,2026-04-17T17:26:54.421389
2026/04/18 03:30:00,CTHLWF1,133.46,Wild Cattle Hill Pty Ltd,Cattle Hill Wind Farm,Wind,144.0,92.68,Cattle Hill Wind Farm,-42.15,146.69,2026-04-17T17:26:54.421389
2026/04/18 03:30:00,DULAWF1,53.5,Dulacca Energy Project Co Pty Ltd,Dulacca Wind Farm,Wind,173.0,30.92,Dulacca Wind Farm,-26.63,149.87,2026-04-17T17:26:54.421389
2026/04/18 03:30:00,DUNDWF1,9.16,Dundonnell Wind Farm Pty Ltd,Dundonnell Wind Farm,Wind,168.0,5.45,Dundonnell Wind Farm,-37.52,142.58,2026-04-17T17:26:54.421389
2026/04/18 03:30:00,DUNDWF2,4.54,Dundonnell Wind Farm Pty Ltd,Dundonnell Wind Farm,Wind,46.0,9.87,Dundonnell Wind Farm,-37.52,142.58,2026-04-17T17:26:54.421389
2026/04/18 03:30:00,DUNDWF3,8.07,Dundonnell Wind Farm Pty Ltd,Dundonnell Wind Farm,Wind,122.0,6.61,Dundonnell Wind Farm,-37.52,142.58,2026-04-17T17:26:54.421389
2026/04/18 03:30:00,ELAINWF1,7.89,Lal Lal Wind Farms Nom Co Pty Ltd,Elaine Wind Farm,Wind,82.0,9.62,Elaine Wind Farm,-37.36,144.0,2026-04-17T17:26:54.421389
2026/04/18 03:30:00,FLYCRKWF,0.0,Iberdrola Australia Energy Markets Pty Limited,Flyers Creek Wind Farm,Wind,140.0,0.0,Flyers Creek Wind Farm,-33.365556,148.981944,2026-04-17T17:26:54.421389
2026/04/18 03:30:00,GPWFEST1,23.8,Golden Plains WF1 Pty Ltd as Trustee for the Golden Plains WF1 Unit Trust,Golden Plains Wind Farm East,Wind,240.0,9.92,Golden Plains Wind Farm East,-37.945091,143.752614,2026-04-17T17:26:54.421389
2026/04/18 03:30:00,GPWFEST2,16.12,Golden Plains WF1 Pty Ltd as Trustee for the Golden Plains WF1 Unit Trust,Golden Plains Wind Farm East,Wind,253.0,6.37,Golden Plains Wind Farm East,-37.945091,143.752614,2026-04-17T17:26:54.421389
2026/04/18 03:30:00,GPWFEST3,13.39,Golden Plains WF1 Pty Ltd as Trustee for the Golden Plains WF1 Unit Trust,Golden Plains Wind Farm East,Wind,240.0,5.58,Golden Plains Wind Farm East,-37.945091,143.752614,2026-04-17T17:26:54.421389
2026/04/18 03:30:00,GRANWF1,104.15,Granville Harbour Operations Pty Ltd as The Trustee for Granville Harbour Operations Trust,Granville Harbour Wind Farm,Wind,111.0,93.83,Granville Harbour Wind Farm,-41.8,145.06,2026-04-17T17:26:54.421389
2026/04/18 03:30:00,GSWF1A,120.53,Goyder Wind Farm 1 Pty Ltd as the Trustee for Goyder Wind Farm 1 Trust,Goyder South Wind Farm 1A,Wind,201.0,59.97,Goyder South Wind Farm 1A,-33.679758,138.937597,2026-04-17T17:26:54.421389
2026/04/18 03:30:00,GSWF1B1,51.1,Goyder Wind Farm 1B Pty Ltd as the Trustee for the Goyder Wind Farm 1B Trust,Goyder South Wind Farm 1B,Wind,196.0,26.07,Goyder South Wind Farm 1B,-33.679758,138.937597,2026-04-17T17:26:54.421389
2026/04/18 03:30:00,GULLRWF1,3.85,New Gullen Range Wind Farm Pty Ltd,Gullen Range Wind Farm,Wind,161.0,2.39,Gullen Range Wind Farm,-34.34,149.27,2026-04-17T17:26:54.421389
2026/04/18 03:30:00,GULLRWF2,5.63,New Gullen Range Wind Farm Pty Ltd,Gullen Range Wind Farm,Wind,107.0,5.26,Gullen Range Wind Farm,-34.34,149.27,2026-04-17T17:26:54.421389
2026/04/18 03:30:00,GUNNING1,0.63,Gunning Wind Energy Developments Pty Ltd,Gunning Wind Farm,Wind,47.0,1.34,Gunning Wind Farm,-34.813333,149.4,2026-04-17T17:26:54.421389
2026/04/18 03:30:00,HALLWF1,46.66,AGL SA Generation Pty Limited,Hallett 1 Wind Farm,Wind,95.0,49.12,Hallett 1 Wind Farm,-33.367778,138.728611,2026-04-17T17:26:54.421389
2026/04/18 03:30:00,HALLWF2,44.84,AGL SA Generation Pty Limited,Hallett 2 Wind Farm,Wind,71.0,63.15,Hallett 2 Wind Farm,-33.367778,138.728611,2026-04-17T17:26:54.421389
2026/04/18 03:30:00,HD1WF1,6.36,Hawkesdale Asset Pty Ltd as trustee for Hawkesdale Asset Trust,Hawkesdale Wind Farm,Wind,89.0,7.15,Hawkesdale Wind Farm,-38.147894,142.361381,2026-04-17T17:26:54.421389
2026/04/18 03:30:00,HDWF1,74.9,HWF1 Pty Ltd,Hornsdale Wind Farm,Wind,102.0,73.43,Hornsdale Wind Farm,-33.050556,138.543611,2026-04-17T17:26:54.421389
2026/04/18 03:30:00,HDWF2,81.0,HWF 2 Pty Ltd,Hornsdale Wind Farm 2,Wind,102.0,79.41,Hornsdale Wind Farm 2,-33.06,138.54,2026-04-17T17:26:54.421389
2026/04/18 03:30:00,HDWF3,79.0,HWF3 Pty Ltd,Hornsdale Wind Farm 3,Wind,109.0,72.48,Hornsdale Wind Farm 3,-33.06,138.54,2026-04-17T17:26:54.421389
2026/04/18 03:30:00,KABANWF1,20.48,Kaban Wind Farm Pty Ltd as trustee for Kaban Wind Farm Trust,Kaban Wind Farm,Wind,152.0,13.47,Kaban Wind Farm,-17.56,145.41,2026-04-17T17:26:54.421389
2026/04/18 03:30:00,KEPWF1,18.8,Kennedy Energy Park Pty Ltd,Kennedy Energy Park,Wind,43.0,43.72,Kennedy Energy Park,-20.88,144.42,2026-04-17T17:26:54.421389
2026/04/18 03:30:00,KIATAWF1,6.4,Kiata ProjectCo Pty Ltd Atf Kiata Project Trust,Kiata Wind Farm,Wind,31.0,20.65,Kiata Wind Farm,-36.4,141.75,2026-04-17T17:26:54.421389
2026/04/18 03:30:00,LGAPWF1,11.07,Lincoln Gap Wind Farm (Operations) Pty Ltd,Lincoln Gap Wind Farm,Wind,123.0,9.0,Lincoln Gap Wind Farm,-32.564279,137.557328,2026-04-17T17:26:54.421389
2026/04/18 03:30:00,LGAPWF1,11.07,Lincoln Gap Wind Farm (Operations) Pty Ltd,Lincoln Gap Wind Farm,Wind,123.0,9.0,Lincoln Gap Wind Farm,-32.564279,137.557328,2026-04-17T17:26:54.421389
2026/04/18 03:30:00,LGAPWF2,14.7,Lincoln Gap Wind Farm (Operations) Pty Ltd,Lincoln Gap Wind Farm,Wind,85.0,17.29,Lincoln Gap Wind Farm,-32.564279,137.557328,2026-04-17T17:26:54.421389
2026/04/18 03:30:00,LGAPWF2,14.7,Lincoln Gap Wind Farm (Operations) Pty Ltd,Lincoln Gap Wind Farm,Wind,85.0,17.29,Lincoln Gap Wind Farm,-32.564279,137.557328,2026-04-17T17:26:54.421389
2026/04/18 03:30:00,LKBONNY1,0.0,Lake Bonney Wind Power Pty Ltd,Lake Bonney Wind Farm Stage 1,Wind,81.0,0.0,Lake Bonney Wind Farm Stage 1,-37.76,140.4,2026-04-17T17:26:54.421389
2026/04/18 03:30:00,LKBONNY2,1.01,Lake Bonney Wind Power Pty Ltd,Lake Bonney Stage 2 Windfarm,Wind,159.0,0.64,Lake Bonney Stage 2 Windfarm,-37.76,140.4,2026-04-17T17:26:54.421389
2026/04/18 03:30:00,LKBONNY3,0.17,Lake Bonney Wind Power Pty Ltd,Lake Bonney Stage 3 Wind Farm,Wind,39.0,0.44,Lake Bonney Stage 3 Wind Farm,-37.737781,140.388137,2026-04-17T17:26:54.421389
2026/04/18 03:30:00,MACARTH1,3.1,AGL Hydro Partnership,Macarthur Wind Farm,Wind,420.0,0.74,Macarthur Wind Farm,-38.048957,142.192112,2026-04-17T17:26:54.421389
2026/04/18 03:30:00,MCINTYR1,81.6,MacIntyre UJV Operator Pty Ltd,MacIntyre Wind Farm,Wind,890.0,9.17,MacIntyre Wind Farm,-28.32,151.54,2026-04-17T17:26:54.421389
2026/04/18 03:30:00,MERCER01,15.6,Mt Mercer Windfarm Pty Ltd,Mt Mercer Wind Farm,Wind,131.0,11.91,Mt Mercer Wind Farm,-37.841111,143.871111,2026-04-17T17:26:54.421389
2026/04/18 03:30:00,MEWF1,48.77,Ergon Energy Queensland Pty Ltd ,Mount Emerald Wind Farm,Wind,178.0,27.4,Mount Emerald Wind Farm,-17.133007,145.380644,2026-04-17T17:26:54.421389
2026/04/18 03:30:00,MRTLSWF1,4.32,Mortlake South Wind Farm Pty Ltd,Mortlake South Wind Farm,Wind,153.0,2.82,Mortlake South Wind Farm,-38.127337,142.857801,2026-04-17T17:26:54.421389
2026/04/18 03:30:00,MTGELWF1,15.86,Mt. Gellibrand Wind Farm Pty Ltd,Mt Gellibrand Wind Farm,Wind,132.0,12.02,Mt Gellibrand Wind Farm,-38.23,143.77,2026-04-17T17:26:54.421389
2026/04/18 03:30:00,MTMILLAR,4.8,Mt Millar Wind Farm Pty Ltd,Mt Millar Wind Farm,Wind,70.0,6.86,Mt Millar Wind Farm,-33.624444,136.703611,2026-04-17T17:26:54.421389
2026/04/18 03:30:00,MUSSELR1,69.7,Hydro-Electric Corporation,Musselroe Wind Farm,Wind,168.0,41.49,Musselroe Wind Farm,-40.780225,148.010799,2026-04-17T17:26:54.421389
2026/04/18 03:30:00,MUWAWF1,25.27,Telstra Energy (Generation) Pty Ltd,Murra Warra Wind Farm,Wind,225.7,11.2,Murra Warra Wind Farm,-36.432404,142.317853,2026-04-17T17:26:54.421389
2026/04/18 03:30:00,MUWAWF2,32.5,Murra Warra II Project Co Pty Ltd ATF The Murra Warra II Project Trust,Murra Warra Wind Farm Stage 2,Wind,203.0,16.01,Murra Warra Wind Farm Stage 2,-36.43,142.32,2026-04-17T17:26:54.421389
2026/04/18 03:30:00,NBHWF1,94.4,AGL SA Generation Pty Limited,North Brown Hill Wind Farm,Wind,132.0,71.52,North Brown Hill Wind Farm,-33.367778,138.728611,2026-04-17T17:26:54.421389
2026/04/18 03:30:00,OAKLAND1,0.0,AGL Hydro Partnership,Oaklands Hill Wind Farm,Wind,63.0,0.0,Oaklands Hill Wind Farm,-37.683078,142.551678,2026-04-17T17:26:54.421389
2026/04/18 03:30:00,PAREPW1,45.9,Iberdrola Australia Energy Markets Pty Limited,Port Augusta Renewable Energy Park,Wind,201.0,22.84,Port Augusta Renewable Energy Park,-32.566944,137.856111,2026-04-17T17:26:54.421389
2026/04/18 03:30:00,RYANCWF1,0.0,Ryan Corner Development Pty Ltd,Ryan Corner Wind Farm,Wind,205.0,0.0,Ryan Corner Wind Farm,-38.271017,142.140647,2026-04-17T17:26:54.421389
2026/04/18 03:30:00,RYEPARK1,12.7,Rye Park Renewable Energy Pty Ltd as trustee for Rye Park Wind Farm Trust,Rye Park Renewable Energy,Wind,384.0,3.31,Rye Park Renewable Energy,-32.138333,148.972778,2026-04-17T17:26:54.421389
2026/04/18 03:30:00,SALTCRK1,0.41,Salt Creek Wind Farm Pty Ltd,Salt Creek Wind Farm,Wind,54.0,0.76,Salt Creek Wind Farm,-37.95,142.63,2026-04-17T17:26:54.421389
2026/04/18 03:30:00,SAPHWF1,114.81,The Trustee For The SWF1 Operations Trust,Sapphire Wind Farm,Wind,270.0,42.52,Sapphire Wind Farm,-29.7,151.41,2026-04-17T17:26:54.421389
2026/04/18 03:30:00,SNOWNTH1,51.8,Snowtown Wind Farm Stage 2 Pty Ltd,Snowtown Wind Farm Stage 2 North,Wind,144.0,35.97,Snowtown Wind Farm Stage 2 North,-33.83,138.118611,2026-04-17T17:26:54.421389
2026/04/18 03:30:00,SNOWSTH1,65.5,Snowtown Wind Farm Stage 2 Pty Ltd,Snowtown South Wind Farm,Wind,126.0,51.98,Snowtown South Wind Farm,-33.83,138.118611,2026-04-17T17:26:54.421389
2026/04/18 03:30:00,SNOWTWN1,64.08,Snowtown Wind Farm Pty Ltd,Snowtown Wind Farm Units 1 And 47,Wind,99.0,64.73,Snowtown Wind Farm Units 1 And 47,-33.83,138.118611,2026-04-17T17:26:54.421389
2026/04/18 03:30:00,STARHLWF,14.8,Starfish Hill Wind Farm Pty Ltd,Starfish Hill Wind Farm,Wind,35.0,42.29,Starfish Hill Wind Farm,-35.58,138.14,2026-04-17T17:26:54.421389
2026/04/18 03:30:00,STOCKYD1,99.47,Stockyard Hill Wind Farm Pty Ltd,Stockyard Hill Wind Farm,Wind,511.0,19.47,Stockyard Hill Wind Farm,-37.535833,143.251389,2026-04-17T17:26:54.421389
2026/04/18 03:30:00,STWF1,139.08,PARF Company 8 Pty Ltd as The Trustee for Silverton Project Trust,Silverton Wind Farm,Wind,198.0,70.24,Silverton Wind Farm,-37.683168,142.551678,2026-04-17T17:26:54.421389
2026/04/18 03:30:00,TARALGA1,14.71,Taralga Wind Farm Nominees No 2 Pty Ltd (ATF Taralga Wind Farm Operating Trust),Taralga Wind Farm,Wind,106.0,13.88,Taralga Wind Farm,-34.42352,149.826267,2026-04-17T17:26:54.421389
2026/04/18 03:30:00,WAMBOWF1,20.44,Stanwell Corporation Limited,Wambo Wind Farm 1,Wind,245.0,8.34,Wambo Wind Farm 1,-35.187301,149.524945,2026-04-17T17:26:54.421389
2026/04/18 03:30:00,WATERLWF,73.6,Waterloo Wind Farm Pty Ltd,Waterloo Wind Farm,Wind,130.0,56.62,Waterloo Wind Farm,-34.00094,138.911567,2026-04-17T17:26:54.421389
2026/04/18 03:30:00,WGWF1,72.2,Willogoleche Power Pty Ltd As The Trustee For The Willogoleche Operating Trust,Willogoleche Wind Farm,Wind,119.0,60.67,Willogoleche Wind Farm,-33.39,138.85,2026-04-17T17:26:54.421389
2026/04/18 03:30:00,WOODLWN1,7.24,Woodlawn Wind Pty Ltd,Woodlawn Wind Farm,Wind,48.0,15.08,Woodlawn Wind Farm,-35.08,149.62,2026-04-17T17:26:54.421389
2026/04/18 03:30:00,WPWF,8.25,AGL SA Generation Pty Limited,Wattle Point Wind Farm,Wind,91.0,9.07,Wattle Point Wind Farm,-35.111624,137.7219,2026-04-17T17:26:54.421389
2026/04/18 03:30:00,WRWF1,126.82,White Rock Wind Farm Pty Ltd,White Rock Wind Farm,Wind,172.0,73.73,White Rock Wind Farm,-29.79,151.54,2026-04-17T17:26:54.421389
2026/04/18 03:30:00,YENDWF1,23.34,Lal Lal Wind Farms Nom Co Pty Ltd,Yendon Wind Farm,Wind,142.0,16.44,Yendon Wind Farm,-37.629987,144.022717,2026-04-17T17:26:54.421389
