SETTLEMENTDATE,DUID,SCADAVALUE,Participant,Station Name,Fuel Source - Primary,MAX_CAP,utilisation_pct,Plant,Latitude,Longitude,timestamp_utc
2026/03/02 01:55:00,CAPTL_WF,0.0,Iberdrola Australia Holdings Pty Limited,Capital Wind Farm,Wind,140.0,0.0,Capital Wind Farm,-35.1,149.31,2026-03-01T15:54:48.616178
2026/03/02 01:55:00,CHALLHWF,10.0,Pacific Hydro Challicum Hills Pty Ltd,Challicum Hills Wind Farm,Wind,52.0,19.23,Challicum Hills Wind Farm,-37.38,143.11,2026-03-01T15:54:48.616178
2026/03/02 01:55:00,CULLRGWF,4.75,Cullerin Range Wind Farm Pty Ltd,Cullerin Range Wind Farm,Wind,30.0,15.83,Cullerin Range Wind Farm,-34.81,149.4,2026-03-01T15:54:48.616178
2026/03/02 01:55:00,DIAPURWF1,-0.1,Y.E.S. Energy (SA) Pty Ltd,Diapur Wind Farm,Wind,7.0,-1.43,Diapur Wind Farm,-36.3425,141.43,2026-03-01T15:54:48.616178
2026/03/02 01:55:00,MLWF1,2.26,Mortons Lane Windfarm Pty Limited,Mortons Lane Wind Farm,Wind,20.0,11.3,Mortons Lane Wind Farm,-37.84,142.45,2026-03-01T15:54:48.616178
2026/03/02 01:55:00,WAUBRAWF,170.52,Pyrenees Wind Energy Developments Pty Ltd,Waubra Wind Farm,Wind,192.0,88.81,Waubra Wind Farm,-37.394498,143.638982,2026-03-01T15:54:48.616178
2026/03/02 01:55:00,WOOLNTH1,28.82,Hydro-Electric Corporation,Woolnorth Studland Bay / Bluff Point Wind Farm,Wind,140.0,20.59,Woolnorth Studland Bay / Bluff Point Wind Farm,-40.69,144.72,2026-03-01T15:54:48.616178
2026/03/02 01:55:00,YAMBUKWF,0.4,Energy Pacific (Vic) Pty Ltd,Yambuk Wind Farm,Wind,30.0,1.33,Yambuk Wind Farm,-38.299083,142.027577,2026-03-01T15:54:48.616178
2026/03/02 01:55:00,YSWF1,11.2,Pacific Hydro Yaloak South Pty Ltd,Yaloak South Wind Farm,Wind,28.0,40.0,Yaloak South Wind Farm,-37.7163,144.242853,2026-03-01T15:54:48.616178
2026/03/02 01:55:00,ARWF1,44.7,Ararat Wind Farm Pty Ltd,Ararat Wind Farm,Wind,241.0,18.55,Ararat Wind Farm,-37.232778,143.031389,2026-03-01T15:54:48.616178
2026/03/02 01:55:00,BALDHWF1,0.92,Alinta Energy Retail Sales Pty Ltd,Bald Hills Wind Farm,Wind,106.0,0.87,Bald Hills Wind Farm,-38.79,145.93,2026-03-01T15:54:48.616178
2026/03/02 01:55:00,BANGOWF1,50.8,BWF Nominees Pty Ltd as The Trustee for BWF Trust,Bango 973 Wind Farm,Wind,155.0,32.77,Bango 973 Wind Farm,-34.551582,148.732808,2026-03-01T15:54:48.616178
2026/03/02 01:55:00,BANGOWF2,48.8,BWF Nominees Pty Ltd as The Trustee for BWF Trust,Bango 999 Wind Farm,Wind,82.0,59.51,Bango 999 Wind Farm,-34.551582,148.732808,2026-03-01T15:54:48.616178
2026/03/02 01:55:00,BLUFF1,34.5,AGL SA Generation Pty Limited,The Bluff Wind Farm,Wind,53.0,65.09,The Bluff Wind Farm,-33.367778,138.728611,2026-03-01T15:54:48.616178
2026/03/02 01:55:00,BOCORWF1,74.26,Boco Rock Wind Farm Pty Ltd,Boco Rock Wind Farm,Wind,111.0,66.9,Boco Rock Wind Farm,-36.578611,149.103333,2026-03-01T15:54:48.616178
2026/03/02 01:55:00,BRYB1WF1,66.39,Berrybank Development Pty Ltd,Berrybank Wind Farm,Wind,175.9,37.74,Berrybank Wind Farm,-37.94,143.52,2026-03-01T15:54:48.616178
2026/03/02 01:55:00,BRYB2WF2,27.66,Berrybank 2 Asset Pty Ltd as trustee for Berrybank 2 Asset Trust,Berrybank 2 Wind Farm,Wind,105.0,26.34,Berrybank 2 Wind Farm,-37.94,143.52,2026-03-01T15:54:48.616178
2026/03/02 01:55:00,BULGANA1,58.18,Bulgana Wind Farm Pty Ltd,Bulgana Green Power Hub,Wind,204.0,28.52,Bulgana Green Power Hub,-37.0975,142.973611,2026-03-01T15:54:48.616178
2026/03/02 01:55:00,CATHROCK,41.3,Cathedral Rocks Wind Farm Pty Ltd,Cathedral Rocks,Wind,66.0,62.58,Cathedral Rocks,-34.51,135.35,2026-03-01T15:54:48.616178
2026/03/02 01:55:00,CHYTWF1,55.54,Cherry Tree Wind Farm Pty Ltd as trustee for The Cherry Tree Project trust ,Cherry Tree Wind Farm,Wind,57.0,97.44,Cherry Tree Wind Farm,-37.1,145.26,2026-03-01T15:54:48.616178
2026/03/02 01:55:00,CLEMGPWF,24.2,Pacific Hydro Clements Gap Pty Ltd,Clements Gap Wind Farm,Wind,57.0,42.46,Clements Gap Wind Farm,-33.48,138.1,2026-03-01T15:54:48.616178
2026/03/02 01:55:00,CLRKCWF1,202.48,Stanwell Corporation Limited ,Clarke Creek Wind Farm,Wind,338.0,59.91,Clarke Creek Wind Farm,-22.85,149.45,2026-03-01T15:54:48.616178
2026/03/02 01:55:00,CLRKCWF2,47.13,Stanwell Corporation Limited ,Clarke Creek Wind Farm,Wind,101.0,46.66,Clarke Creek Wind Farm,-22.85,149.45,2026-03-01T15:54:48.616178
2026/03/02 01:55:00,CNUNDAWF,3.2,Canunda Power Pty Ltd,Canunda Wind Farm,Wind,46.0,6.96,Canunda Wind Farm,-37.73,140.39,2026-03-01T15:54:48.616178
2026/03/02 01:55:00,COLWF01,17.35,Collector Wind Farm Pty Ltd,Collector Wind Farm 1,Wind,219.0,7.92,Collector Wind Farm 1,-34.8719,149.3967,2026-03-01T15:54:48.616178
2026/03/02 01:55:00,COOPGWF1,343.33,PARF Company 10 Pty Limited as The Trustee for Coopers Gap Project Trust,Coopers Gap Wind Farm,Wind,440.0,78.03,Coopers Gap Wind Farm,-26.74,151.45,2026-03-01T15:54:48.616178
2026/03/02 01:55:00,CROOKWF2,53.45,Crookwell Development Pty Ltd ,Crookwell 2 Wind Farm,Wind,91.0,58.74,Crookwell 2 Wind Farm,-34.52,149.54,2026-03-01T15:54:48.616178
2026/03/02 01:55:00,CROOKWF3,17.7,Crookwell 3 Development Pty Ltd,Crookwell 3 Wind Farm,Wind,56.0,31.61,Crookwell 3 Wind Farm,-34.52,149.54,2026-03-01T15:54:48.616178
2026/03/02 01:55:00,CROWLWF1,51.67,Pacific Hydro Crowlands Pty Ltd ,Crowlands Wind Farm,Wind,79.0,65.41,Crowlands Wind Farm,-37.13,143.16,2026-03-01T15:54:48.616178
2026/03/02 01:55:00,CRURWF1,40.4,CRWF Nominees Pty Ltd As Trustee For The CRWF Trust,Crudine Ridge Wind Farm,Wind,138.0,29.28,Crudine Ridge Wind Farm,-32.97,149.64,2026-03-01T15:54:48.616178
2026/03/02 01:55:00,CTHLWF1,109.05,Wild Cattle Hill Pty Ltd,Cattle Hill Wind Farm,Wind,144.0,75.73,Cattle Hill Wind Farm,-42.15,146.69,2026-03-01T15:54:48.616178
2026/03/02 01:55:00,DULAWF1,106.3,Dulacca Energy Project Co Pty Ltd,Dulacca Wind Farm,Wind,173.0,61.45,Dulacca Wind Farm,-26.63,149.87,2026-03-01T15:54:48.616178
2026/03/02 01:55:00,DUNDWF1,42.62,Dundonnell Wind Farm Pty Ltd,Dundonnell Wind Farm,Wind,168.0,25.37,Dundonnell Wind Farm,-37.52,142.58,2026-03-01T15:54:48.616178
2026/03/02 01:55:00,DUNDWF2,14.54,Dundonnell Wind Farm Pty Ltd,Dundonnell Wind Farm,Wind,46.0,31.61,Dundonnell Wind Farm,-37.52,142.58,2026-03-01T15:54:48.616178
2026/03/02 01:55:00,DUNDWF3,37.43,Dundonnell Wind Farm Pty Ltd,Dundonnell Wind Farm,Wind,122.0,30.68,Dundonnell Wind Farm,-37.52,142.58,2026-03-01T15:54:48.616178
2026/03/02 01:55:00,ELAINWF1,61.75,Lal Lal Wind Farms Nom Co Pty Ltd,Elaine Wind Farm,Wind,82.0,75.3,Elaine Wind Farm,-37.36,144.0,2026-03-01T15:54:48.616178
2026/03/02 01:55:00,FLYCRKWF,64.53,Iberdrola Australia Energy Markets Pty Limited,Flyers Creek Wind Farm,Wind,140.0,46.09,Flyers Creek Wind Farm,-33.365556,148.981944,2026-03-01T15:54:48.616178
2026/03/02 01:55:00,GPWFEST1,23.07,Golden Plains WF1 Pty Ltd as Trustee for the Golden Plains WF1 Unit Trust,Golden Plains Wind Farm East,Wind,240.0,9.61,Golden Plains Wind Farm East,-37.945091,143.752614,2026-03-01T15:54:48.616178
2026/03/02 01:55:00,GPWFEST2,20.6,Golden Plains WF1 Pty Ltd as Trustee for the Golden Plains WF1 Unit Trust,Golden Plains Wind Farm East,Wind,253.0,8.14,Golden Plains Wind Farm East,-37.945091,143.752614,2026-03-01T15:54:48.616178
2026/03/02 01:55:00,GPWFEST3,16.1,Golden Plains WF1 Pty Ltd as Trustee for the Golden Plains WF1 Unit Trust,Golden Plains Wind Farm East,Wind,240.0,6.71,Golden Plains Wind Farm East,-37.945091,143.752614,2026-03-01T15:54:48.616178
2026/03/02 01:55:00,GRANWF1,54.71,Granville Harbour Operations Pty Ltd as The Trustee for Granville Harbour Operations Trust,Granville Harbour Wind Farm,Wind,111.0,49.29,Granville Harbour Wind Farm,-41.8,145.06,2026-03-01T15:54:48.616178
2026/03/02 01:55:00,GSWF1A,83.58,Goyder Wind Farm 1 Pty Ltd as the Trustee for Goyder Wind Farm 1 Trust,Goyder South Wind Farm 1A,Wind,201.0,41.58,Goyder South Wind Farm 1A,-33.679758,138.937597,2026-03-01T15:54:48.616178
2026/03/02 01:55:00,GSWF1B1,96.72,Goyder Wind Farm 1B Pty Ltd as the Trustee for the Goyder Wind Farm 1B Trust,Goyder South Wind Farm 1B,Wind,196.0,49.35,Goyder South Wind Farm 1B,-33.679758,138.937597,2026-03-01T15:54:48.616178
2026/03/02 01:55:00,GULLRWF1,44.61,New Gullen Range Wind Farm Pty Ltd,Gullen Range Wind Farm,Wind,161.0,27.71,Gullen Range Wind Farm,-34.34,149.27,2026-03-01T15:54:48.616178
2026/03/02 01:55:00,GULLRWF2,72.43,New Gullen Range Wind Farm Pty Ltd,Gullen Range Wind Farm,Wind,107.0,67.69,Gullen Range Wind Farm,-34.34,149.27,2026-03-01T15:54:48.616178
2026/03/02 01:55:00,GUNNING1,18.95,Gunning Wind Energy Developments Pty Ltd,Gunning Wind Farm,Wind,47.0,40.32,Gunning Wind Farm,-34.813333,149.4,2026-03-01T15:54:48.616178
2026/03/02 01:55:00,HALLWF1,35.72,AGL SA Generation Pty Limited,Hallett 1 Wind Farm,Wind,95.0,37.6,Hallett 1 Wind Farm,-33.367778,138.728611,2026-03-01T15:54:48.616178
2026/03/02 01:55:00,HALLWF2,28.1,AGL SA Generation Pty Limited,Hallett 2 Wind Farm,Wind,71.0,39.58,Hallett 2 Wind Farm,-33.367778,138.728611,2026-03-01T15:54:48.616178
2026/03/02 01:55:00,HD1WF1,18.25,Hawkesdale Asset Pty Ltd as trustee for Hawkesdale Asset Trust,Hawkesdale Wind Farm,Wind,89.0,20.51,Hawkesdale Wind Farm,-38.147894,142.361381,2026-03-01T15:54:48.616178
2026/03/02 01:55:00,HDWF1,31.4,HWF1 Pty Ltd,Hornsdale Wind Farm,Wind,102.0,30.78,Hornsdale Wind Farm,-33.050556,138.543611,2026-03-01T15:54:48.616178
2026/03/02 01:55:00,HDWF2,51.8,HWF 2 Pty Ltd,Hornsdale Wind Farm 2,Wind,102.0,50.78,Hornsdale Wind Farm 2,-33.06,138.54,2026-03-01T15:54:48.616178
2026/03/02 01:55:00,HDWF3,55.0,HWF3 Pty Ltd,Hornsdale Wind Farm 3,Wind,109.0,50.46,Hornsdale Wind Farm 3,-33.06,138.54,2026-03-01T15:54:48.616178
2026/03/02 01:55:00,KABANWF1,0.21,Kaban Wind Farm Pty Ltd as trustee for Kaban Wind Farm Trust,Kaban Wind Farm,Wind,152.0,0.14,Kaban Wind Farm,-17.56,145.41,2026-03-01T15:54:48.616178
2026/03/02 01:55:00,KEPWF1,41.6,Kennedy Energy Park Pty Ltd,Kennedy Energy Park,Wind,43.0,96.74,Kennedy Energy Park,-20.88,144.42,2026-03-01T15:54:48.616178
2026/03/02 01:55:00,KIATAWF1,0.0,Kiata ProjectCo Pty Ltd Atf Kiata Project Trust,Kiata Wind Farm,Wind,31.0,0.0,Kiata Wind Farm,-36.4,141.75,2026-03-01T15:54:48.616178
2026/03/02 01:55:00,LGAPWF1,45.53,Lincoln Gap Wind Farm (Operations) Pty Ltd,Lincoln Gap Wind Farm,Wind,123.0,37.02,Lincoln Gap Wind Farm,-32.564279,137.557328,2026-03-01T15:54:48.616178
2026/03/02 01:55:00,LGAPWF1,45.53,Lincoln Gap Wind Farm (Operations) Pty Ltd,Lincoln Gap Wind Farm,Wind,123.0,37.02,Lincoln Gap Wind Farm,-32.564279,137.557328,2026-03-01T15:54:48.616178
2026/03/02 01:55:00,LGAPWF2,76.91,Lincoln Gap Wind Farm (Operations) Pty Ltd,Lincoln Gap Wind Farm,Wind,85.0,90.48,Lincoln Gap Wind Farm,-32.564279,137.557328,2026-03-01T15:54:48.616178
2026/03/02 01:55:00,LGAPWF2,76.91,Lincoln Gap Wind Farm (Operations) Pty Ltd,Lincoln Gap Wind Farm,Wind,85.0,90.48,Lincoln Gap Wind Farm,-32.564279,137.557328,2026-03-01T15:54:48.616178
2026/03/02 01:55:00,LKBONNY1,8.75,Lake Bonney Wind Power Pty Ltd,Lake Bonney Wind Farm Stage 1,Wind,81.0,10.8,Lake Bonney Wind Farm Stage 1,-37.76,140.4,2026-03-01T15:54:48.616178
2026/03/02 01:55:00,LKBONNY2,13.66,Lake Bonney Wind Power Pty Ltd,Lake Bonney Stage 2 Windfarm,Wind,159.0,8.59,Lake Bonney Stage 2 Windfarm,-37.76,140.4,2026-03-01T15:54:48.616178
2026/03/02 01:55:00,LKBONNY3,4.91,Lake Bonney Wind Power Pty Ltd,Lake Bonney Stage 3 Wind Farm,Wind,39.0,12.59,Lake Bonney Stage 3 Wind Farm,-37.737781,140.388137,2026-03-01T15:54:48.616178
2026/03/02 01:55:00,MACARTH1,30.2,AGL Hydro Partnership,Macarthur Wind Farm,Wind,420.0,7.19,Macarthur Wind Farm,-38.048957,142.192112,2026-03-01T15:54:48.616178
2026/03/02 01:55:00,MCINTYR1,393.5,MacIntyre UJV Operator Pty Ltd,MacIntyre Wind Farm,Wind,890.0,44.21,MacIntyre Wind Farm,-28.32,151.54,2026-03-01T15:54:48.616178
2026/03/02 01:55:00,MERCER01,80.2,Mt Mercer Windfarm Pty Ltd,Mt Mercer Wind Farm,Wind,131.0,61.22,Mt Mercer Wind Farm,-37.841111,143.871111,2026-03-01T15:54:48.616178
2026/03/02 01:55:00,MEWF1,1.0,Ergon Energy Queensland Pty Ltd ,Mount Emerald Wind Farm,Wind,178.0,0.56,Mount Emerald Wind Farm,-17.133007,145.380644,2026-03-01T15:54:48.616178
2026/03/02 01:55:00,MRTLSWF1,28.08,Mortlake South Wind Farm Pty Ltd,Mortlake South Wind Farm,Wind,153.0,18.35,Mortlake South Wind Farm,-38.127337,142.857801,2026-03-01T15:54:48.616178
2026/03/02 01:55:00,MTGELWF1,4.65,Mt. Gellibrand Wind Farm Pty Ltd,Mt Gellibrand Wind Farm,Wind,132.0,3.52,Mt Gellibrand Wind Farm,-38.23,143.77,2026-03-01T15:54:48.616178
2026/03/02 01:55:00,MTMILLAR,25.9,Mt Millar Wind Farm Pty Ltd,Mt Millar Wind Farm,Wind,70.0,37.0,Mt Millar Wind Farm,-33.624444,136.703611,2026-03-01T15:54:48.616178
2026/03/02 01:55:00,MUSSELR1,136.6,Hydro-Electric Corporation,Musselroe Wind Farm,Wind,168.0,81.31,Musselroe Wind Farm,-40.780225,148.010799,2026-03-01T15:54:48.616178
2026/03/02 01:55:00,MUWAWF1,20.81,Telstra Energy (Generation) Pty Ltd,Murra Warra Wind Farm,Wind,225.7,9.22,Murra Warra Wind Farm,-36.432404,142.317853,2026-03-01T15:54:48.616178
2026/03/02 01:55:00,MUWAWF2,48.8,Murra Warra II Project Co Pty Ltd ATF The Murra Warra II Project Trust,Murra Warra Wind Farm Stage 2,Wind,203.0,24.04,Murra Warra Wind Farm Stage 2,-36.43,142.32,2026-03-01T15:54:48.616178
2026/03/02 01:55:00,NBHWF1,53.8,AGL SA Generation Pty Limited,North Brown Hill Wind Farm,Wind,132.0,40.76,North Brown Hill Wind Farm,-33.367778,138.728611,2026-03-01T15:54:48.616178
2026/03/02 01:55:00,OAKLAND1,11.1,AGL Hydro Partnership,Oaklands Hill Wind Farm,Wind,63.0,17.62,Oaklands Hill Wind Farm,-37.683078,142.551678,2026-03-01T15:54:48.616178
2026/03/02 01:55:00,PAREPW1,202.97,Iberdrola Australia Energy Markets Pty Limited,Port Augusta Renewable Energy Park,Wind,201.0,100.98,Port Augusta Renewable Energy Park,-32.566944,137.856111,2026-03-01T15:54:48.616178
2026/03/02 01:55:00,RYANCWF1,4.91,Ryan Corner Development Pty Ltd,Ryan Corner Wind Farm,Wind,205.0,2.4,Ryan Corner Wind Farm,-38.271017,142.140647,2026-03-01T15:54:48.616178
2026/03/02 01:55:00,RYEPARK1,237.61,Rye Park Renewable Energy Pty Ltd as trustee for Rye Park Wind Farm Trust,Rye Park Renewable Energy,Wind,384.0,61.88,Rye Park Renewable Energy,-32.138333,148.972778,2026-03-01T15:54:48.616178
2026/03/02 01:55:00,SALTCRK1,16.01,Salt Creek Wind Farm Pty Ltd,Salt Creek Wind Farm,Wind,54.0,29.65,Salt Creek Wind Farm,-37.95,142.63,2026-03-01T15:54:48.616178
2026/03/02 01:55:00,SAPHWF1,259.1,The Trustee For The SWF1 Operations Trust,Sapphire Wind Farm,Wind,270.0,95.96,Sapphire Wind Farm,-29.7,151.41,2026-03-01T15:54:48.616178
2026/03/02 01:55:00,SNOWNTH1,111.3,Snowtown Wind Farm Stage 2 Pty Ltd,Snowtown Wind Farm Stage 2 North,Wind,144.0,77.29,Snowtown Wind Farm Stage 2 North,-33.83,138.118611,2026-03-01T15:54:48.616178
2026/03/02 01:55:00,SNOWSTH1,73.5,Snowtown Wind Farm Stage 2 Pty Ltd,Snowtown South Wind Farm,Wind,126.0,58.33,Snowtown South Wind Farm,-33.83,138.118611,2026-03-01T15:54:48.616178
2026/03/02 01:55:00,SNOWTWN1,54.28,Snowtown Wind Farm Pty Ltd,Snowtown Wind Farm Units 1 And 47,Wind,99.0,54.83,Snowtown Wind Farm Units 1 And 47,-33.83,138.118611,2026-03-01T15:54:48.616178
2026/03/02 01:55:00,STARHLWF,13.3,Starfish Hill Wind Farm Pty Ltd,Starfish Hill Wind Farm,Wind,35.0,38.0,Starfish Hill Wind Farm,-35.58,138.14,2026-03-01T15:54:48.616178
2026/03/02 01:55:00,STOCKYD1,381.91,Stockyard Hill Wind Farm Pty Ltd,Stockyard Hill Wind Farm,Wind,511.0,74.74,Stockyard Hill Wind Farm,-37.535833,143.251389,2026-03-01T15:54:48.616178
2026/03/02 01:55:00,STWF1,125.56,PARF Company 8 Pty Ltd as The Trustee for Silverton Project Trust,Silverton Wind Farm,Wind,198.0,63.41,Silverton Wind Farm,-37.683168,142.551678,2026-03-01T15:54:48.616178
2026/03/02 01:55:00,TARALGA1,46.78,Taralga Wind Farm Nominees No 2 Pty Ltd (ATF Taralga Wind Farm Operating Trust),Taralga Wind Farm,Wind,106.0,44.13,Taralga Wind Farm,-34.42352,149.826267,2026-03-01T15:54:48.616178
2026/03/02 01:55:00,WAMBOWF1,145.6,Stanwell Corporation Limited,Wambo Wind Farm 1,Wind,245.0,59.43,Wambo Wind Farm 1,-35.187301,149.524945,2026-03-01T15:54:48.616178
2026/03/02 01:55:00,WATERLWF,19.8,Waterloo Wind Farm Pty Ltd,Waterloo Wind Farm,Wind,130.0,15.23,Waterloo Wind Farm,-34.00094,138.911567,2026-03-01T15:54:48.616178
2026/03/02 01:55:00,WGWF1,63.8,Willogoleche Power Pty Ltd As The Trustee For The Willogoleche Operating Trust,Willogoleche Wind Farm,Wind,119.0,53.61,Willogoleche Wind Farm,-33.39,138.85,2026-03-01T15:54:48.616178
2026/03/02 01:55:00,WOODLWN1,11.04,Woodlawn Wind Pty Ltd,Woodlawn Wind Farm,Wind,48.0,23.0,Woodlawn Wind Farm,-35.08,149.62,2026-03-01T15:54:48.616178
2026/03/02 01:55:00,WPWF,44.76,AGL SA Generation Pty Limited,Wattle Point Wind Farm,Wind,91.0,49.19,Wattle Point Wind Farm,-35.111624,137.7219,2026-03-01T15:54:48.616178
2026/03/02 01:55:00,WRWF1,132.72,White Rock Wind Farm Pty Ltd,White Rock Wind Farm,Wind,172.0,77.16,White Rock Wind Farm,-29.79,151.54,2026-03-01T15:54:48.616178
2026/03/02 01:55:00,YENDWF1,128.95,Lal Lal Wind Farms Nom Co Pty Ltd,Yendon Wind Farm,Wind,142.0,90.81,Yendon Wind Farm,-37.629987,144.022717,2026-03-01T15:54:48.616178
