SETTLEMENTDATE,DUID,SCADAVALUE,Participant,Station Name,Fuel Source - Primary,MAX_CAP,utilisation_pct,Plant,Latitude,Longitude,timestamp_utc
2026/04/06 21:50:00,CAPTL_WF,39.78,Iberdrola Australia Holdings Pty Limited,Capital Wind Farm,Wind,140.0,28.41,Capital Wind Farm,-35.1,149.31,2026-04-06T11:57:54.361721
2026/04/06 21:50:00,CHALLHWF,7.2,Pacific Hydro Challicum Hills Pty Ltd,Challicum Hills Wind Farm,Wind,52.0,13.85,Challicum Hills Wind Farm,-37.38,143.11,2026-04-06T11:57:54.361721
2026/04/06 21:50:00,CULLRGWF,10.84,Cullerin Range Wind Farm Pty Ltd,Cullerin Range Wind Farm,Wind,30.0,36.13,Cullerin Range Wind Farm,-34.81,149.4,2026-04-06T11:57:54.361721
2026/04/06 21:50:00,DIAPURWF1,7.3,Y.E.S. Energy (SA) Pty Ltd,Diapur Wind Farm,Wind,7.0,104.29,Diapur Wind Farm,-36.3425,141.43,2026-04-06T11:57:54.361721
2026/04/06 21:50:00,MLWF1,5.54,Mortons Lane Windfarm Pty Limited,Mortons Lane Wind Farm,Wind,20.0,27.7,Mortons Lane Wind Farm,-37.84,142.45,2026-04-06T11:57:54.361721
2026/04/06 21:50:00,WAUBRAWF,49.96,Pyrenees Wind Energy Developments Pty Ltd,Waubra Wind Farm,Wind,192.0,26.02,Waubra Wind Farm,-37.394498,143.638982,2026-04-06T11:57:54.361721
2026/04/06 21:50:00,WOOLNTH1,34.78,Hydro-Electric Corporation,Woolnorth Studland Bay / Bluff Point Wind Farm,Wind,140.0,24.84,Woolnorth Studland Bay / Bluff Point Wind Farm,-40.69,144.72,2026-04-06T11:57:54.361721
2026/04/06 21:50:00,YAMBUKWF,2.9,Energy Pacific (Vic) Pty Ltd,Yambuk Wind Farm,Wind,30.0,9.67,Yambuk Wind Farm,-38.299083,142.027577,2026-04-06T11:57:54.361721
2026/04/06 21:50:00,YSWF1,3.6,Pacific Hydro Yaloak South Pty Ltd,Yaloak South Wind Farm,Wind,28.0,12.86,Yaloak South Wind Farm,-37.7163,144.242853,2026-04-06T11:57:54.361721
2026/04/06 21:50:00,ARWF1,49.5,Ararat Wind Farm Pty Ltd,Ararat Wind Farm,Wind,241.0,20.54,Ararat Wind Farm,-37.232778,143.031389,2026-04-06T11:57:54.361721
2026/04/06 21:50:00,BALDHWF1,23.62,Alinta Energy Retail Sales Pty Ltd,Bald Hills Wind Farm,Wind,106.0,22.28,Bald Hills Wind Farm,-38.79,145.93,2026-04-06T11:57:54.361721
2026/04/06 21:50:00,BANGOWF1,5.9,BWF Nominees Pty Ltd as The Trustee for BWF Trust,Bango 973 Wind Farm,Wind,155.0,3.81,Bango 973 Wind Farm,-34.551582,148.732808,2026-04-06T11:57:54.361721
2026/04/06 21:50:00,BANGOWF2,10.7,BWF Nominees Pty Ltd as The Trustee for BWF Trust,Bango 999 Wind Farm,Wind,82.0,13.05,Bango 999 Wind Farm,-34.551582,148.732808,2026-04-06T11:57:54.361721
2026/04/06 21:50:00,BLUFF1,6.5,AGL SA Generation Pty Limited,The Bluff Wind Farm,Wind,53.0,12.26,The Bluff Wind Farm,-33.367778,138.728611,2026-04-06T11:57:54.361721
2026/04/06 21:50:00,BOCORWF1,17.08,Boco Rock Wind Farm Pty Ltd,Boco Rock Wind Farm,Wind,111.0,15.39,Boco Rock Wind Farm,-36.578611,149.103333,2026-04-06T11:57:54.361721
2026/04/06 21:50:00,BRYB1WF1,42.5,Berrybank Development Pty Ltd,Berrybank Wind Farm,Wind,175.9,24.16,Berrybank Wind Farm,-37.94,143.52,2026-04-06T11:57:54.361721
2026/04/06 21:50:00,BRYB2WF2,23.23,Berrybank 2 Asset Pty Ltd as trustee for Berrybank 2 Asset Trust,Berrybank 2 Wind Farm,Wind,105.0,22.12,Berrybank 2 Wind Farm,-37.94,143.52,2026-04-06T11:57:54.361721
2026/04/06 21:50:00,BULGANA1,0.0,Bulgana Wind Farm Pty Ltd,Bulgana Green Power Hub,Wind,204.0,0.0,Bulgana Green Power Hub,-37.0975,142.973611,2026-04-06T11:57:54.361721
2026/04/06 21:50:00,CATHROCK,27.9,Cathedral Rocks Wind Farm Pty Ltd,Cathedral Rocks,Wind,66.0,42.27,Cathedral Rocks,-34.51,135.35,2026-04-06T11:57:54.361721
2026/04/06 21:50:00,CHYTWF1,5.3,Cherry Tree Wind Farm Pty Ltd as trustee for The Cherry Tree Project trust ,Cherry Tree Wind Farm,Wind,57.0,9.3,Cherry Tree Wind Farm,-37.1,145.26,2026-04-06T11:57:54.361721
2026/04/06 21:50:00,CLEMGPWF,18.59,Pacific Hydro Clements Gap Pty Ltd,Clements Gap Wind Farm,Wind,57.0,32.61,Clements Gap Wind Farm,-33.48,138.1,2026-04-06T11:57:54.361721
2026/04/06 21:50:00,CLRKCWF1,241.35,Stanwell Corporation Limited ,Clarke Creek Wind Farm,Wind,338.0,71.41,Clarke Creek Wind Farm,-22.85,149.45,2026-04-06T11:57:54.361721
2026/04/06 21:50:00,CLRKCWF2,82.67,Stanwell Corporation Limited ,Clarke Creek Wind Farm,Wind,101.0,81.85,Clarke Creek Wind Farm,-22.85,149.45,2026-04-06T11:57:54.361721
2026/04/06 21:50:00,CNUNDAWF,22.03,Canunda Power Pty Ltd,Canunda Wind Farm,Wind,46.0,47.89,Canunda Wind Farm,-37.73,140.39,2026-04-06T11:57:54.361721
2026/04/06 21:50:00,COLWF01,38.67,Collector Wind Farm Pty Ltd,Collector Wind Farm 1,Wind,219.0,17.66,Collector Wind Farm 1,-34.8719,149.3967,2026-04-06T11:57:54.361721
2026/04/06 21:50:00,COOPGWF1,127.0,PARF Company 10 Pty Limited as The Trustee for Coopers Gap Project Trust,Coopers Gap Wind Farm,Wind,440.0,28.86,Coopers Gap Wind Farm,-26.74,151.45,2026-04-06T11:57:54.361721
2026/04/06 21:50:00,CROOKWF2,34.05,Crookwell Development Pty Ltd ,Crookwell 2 Wind Farm,Wind,91.0,37.42,Crookwell 2 Wind Farm,-34.52,149.54,2026-04-06T11:57:54.361721
2026/04/06 21:50:00,CROOKWF3,21.58,Crookwell 3 Development Pty Ltd,Crookwell 3 Wind Farm,Wind,56.0,38.54,Crookwell 3 Wind Farm,-34.52,149.54,2026-04-06T11:57:54.361721
2026/04/06 21:50:00,CROWLWF1,29.61,Pacific Hydro Crowlands Pty Ltd ,Crowlands Wind Farm,Wind,79.0,37.48,Crowlands Wind Farm,-37.13,143.16,2026-04-06T11:57:54.361721
2026/04/06 21:50:00,CRURWF1,15.9,CRWF Nominees Pty Ltd As Trustee For The CRWF Trust,Crudine Ridge Wind Farm,Wind,138.0,11.52,Crudine Ridge Wind Farm,-32.97,149.64,2026-04-06T11:57:54.361721
2026/04/06 21:50:00,CTHLWF1,83.68,Wild Cattle Hill Pty Ltd,Cattle Hill Wind Farm,Wind,144.0,58.11,Cattle Hill Wind Farm,-42.15,146.69,2026-04-06T11:57:54.361721
2026/04/06 21:50:00,DULAWF1,0.0,Dulacca Energy Project Co Pty Ltd,Dulacca Wind Farm,Wind,173.0,0.0,Dulacca Wind Farm,-26.63,149.87,2026-04-06T11:57:54.361721
2026/04/06 21:50:00,DUNDWF1,83.74,Dundonnell Wind Farm Pty Ltd,Dundonnell Wind Farm,Wind,168.0,49.85,Dundonnell Wind Farm,-37.52,142.58,2026-04-06T11:57:54.361721
2026/04/06 21:50:00,DUNDWF2,23.03,Dundonnell Wind Farm Pty Ltd,Dundonnell Wind Farm,Wind,46.0,50.07,Dundonnell Wind Farm,-37.52,142.58,2026-04-06T11:57:54.361721
2026/04/06 21:50:00,DUNDWF3,60.81,Dundonnell Wind Farm Pty Ltd,Dundonnell Wind Farm,Wind,122.0,49.84,Dundonnell Wind Farm,-37.52,142.58,2026-04-06T11:57:54.361721
2026/04/06 21:50:00,ELAINWF1,37.92,Lal Lal Wind Farms Nom Co Pty Ltd,Elaine Wind Farm,Wind,82.0,46.24,Elaine Wind Farm,-37.36,144.0,2026-04-06T11:57:54.361721
2026/04/06 21:50:00,FLYCRKWF,0.0,Iberdrola Australia Energy Markets Pty Limited,Flyers Creek Wind Farm,Wind,140.0,0.0,Flyers Creek Wind Farm,-33.365556,148.981944,2026-04-06T11:57:54.361721
2026/04/06 21:50:00,GPWFEST1,42.0,Golden Plains WF1 Pty Ltd as Trustee for the Golden Plains WF1 Unit Trust,Golden Plains Wind Farm East,Wind,240.0,17.5,Golden Plains Wind Farm East,-37.945091,143.752614,2026-04-06T11:57:54.361721
2026/04/06 21:50:00,GPWFEST2,75.37,Golden Plains WF1 Pty Ltd as Trustee for the Golden Plains WF1 Unit Trust,Golden Plains Wind Farm East,Wind,253.0,29.79,Golden Plains Wind Farm East,-37.945091,143.752614,2026-04-06T11:57:54.361721
2026/04/06 21:50:00,GPWFEST3,92.86,Golden Plains WF1 Pty Ltd as Trustee for the Golden Plains WF1 Unit Trust,Golden Plains Wind Farm East,Wind,240.0,38.69,Golden Plains Wind Farm East,-37.945091,143.752614,2026-04-06T11:57:54.361721
2026/04/06 21:50:00,GRANWF1,110.05,Granville Harbour Operations Pty Ltd as The Trustee for Granville Harbour Operations Trust,Granville Harbour Wind Farm,Wind,111.0,99.14,Granville Harbour Wind Farm,-41.8,145.06,2026-04-06T11:57:54.361721
2026/04/06 21:50:00,GSWF1A,107.84,Goyder Wind Farm 1 Pty Ltd as the Trustee for Goyder Wind Farm 1 Trust,Goyder South Wind Farm 1A,Wind,201.0,53.65,Goyder South Wind Farm 1A,-33.679758,138.937597,2026-04-06T11:57:54.361721
2026/04/06 21:50:00,GSWF1B1,140.39,Goyder Wind Farm 1B Pty Ltd as the Trustee for the Goyder Wind Farm 1B Trust,Goyder South Wind Farm 1B,Wind,196.0,71.63,Goyder South Wind Farm 1B,-33.679758,138.937597,2026-04-06T11:57:54.361721
2026/04/06 21:50:00,GULLRWF1,90.99,New Gullen Range Wind Farm Pty Ltd,Gullen Range Wind Farm,Wind,161.0,56.52,Gullen Range Wind Farm,-34.34,149.27,2026-04-06T11:57:54.361721
2026/04/06 21:50:00,GULLRWF2,30.39,New Gullen Range Wind Farm Pty Ltd,Gullen Range Wind Farm,Wind,107.0,28.4,Gullen Range Wind Farm,-34.34,149.27,2026-04-06T11:57:54.361721
2026/04/06 21:50:00,GUNNING1,24.12,Gunning Wind Energy Developments Pty Ltd,Gunning Wind Farm,Wind,47.0,51.32,Gunning Wind Farm,-34.813333,149.4,2026-04-06T11:57:54.361721
2026/04/06 21:50:00,HALLWF1,20.34,AGL SA Generation Pty Limited,Hallett 1 Wind Farm,Wind,95.0,21.41,Hallett 1 Wind Farm,-33.367778,138.728611,2026-04-06T11:57:54.361721
2026/04/06 21:50:00,HALLWF2,20.45,AGL SA Generation Pty Limited,Hallett 2 Wind Farm,Wind,71.0,28.8,Hallett 2 Wind Farm,-33.367778,138.728611,2026-04-06T11:57:54.361721
2026/04/06 21:50:00,HD1WF1,55.99,Hawkesdale Asset Pty Ltd as trustee for Hawkesdale Asset Trust,Hawkesdale Wind Farm,Wind,89.0,62.91,Hawkesdale Wind Farm,-38.147894,142.361381,2026-04-06T11:57:54.361721
2026/04/06 21:50:00,HDWF1,32.3,HWF1 Pty Ltd,Hornsdale Wind Farm,Wind,102.0,31.67,Hornsdale Wind Farm,-33.050556,138.543611,2026-04-06T11:57:54.361721
2026/04/06 21:50:00,HDWF2,32.2,HWF 2 Pty Ltd,Hornsdale Wind Farm 2,Wind,102.0,31.57,Hornsdale Wind Farm 2,-33.06,138.54,2026-04-06T11:57:54.361721
2026/04/06 21:50:00,HDWF3,33.1,HWF3 Pty Ltd,Hornsdale Wind Farm 3,Wind,109.0,30.37,Hornsdale Wind Farm 3,-33.06,138.54,2026-04-06T11:57:54.361721
2026/04/06 21:50:00,KABANWF1,62.29,Kaban Wind Farm Pty Ltd as trustee for Kaban Wind Farm Trust,Kaban Wind Farm,Wind,152.0,40.98,Kaban Wind Farm,-17.56,145.41,2026-04-06T11:57:54.361721
2026/04/06 21:50:00,KEPWF1,27.2,Kennedy Energy Park Pty Ltd,Kennedy Energy Park,Wind,43.0,63.26,Kennedy Energy Park,-20.88,144.42,2026-04-06T11:57:54.361721
2026/04/06 21:50:00,KIATAWF1,20.1,Kiata ProjectCo Pty Ltd Atf Kiata Project Trust,Kiata Wind Farm,Wind,31.0,64.84,Kiata Wind Farm,-36.4,141.75,2026-04-06T11:57:54.361721
2026/04/06 21:50:00,LGAPWF1,27.71,Lincoln Gap Wind Farm (Operations) Pty Ltd,Lincoln Gap Wind Farm,Wind,123.0,22.53,Lincoln Gap Wind Farm,-32.564279,137.557328,2026-04-06T11:57:54.361721
2026/04/06 21:50:00,LGAPWF1,27.71,Lincoln Gap Wind Farm (Operations) Pty Ltd,Lincoln Gap Wind Farm,Wind,123.0,22.53,Lincoln Gap Wind Farm,-32.564279,137.557328,2026-04-06T11:57:54.361721
2026/04/06 21:50:00,LGAPWF2,34.71,Lincoln Gap Wind Farm (Operations) Pty Ltd,Lincoln Gap Wind Farm,Wind,85.0,40.84,Lincoln Gap Wind Farm,-32.564279,137.557328,2026-04-06T11:57:54.361721
2026/04/06 21:50:00,LGAPWF2,34.71,Lincoln Gap Wind Farm (Operations) Pty Ltd,Lincoln Gap Wind Farm,Wind,85.0,40.84,Lincoln Gap Wind Farm,-32.564279,137.557328,2026-04-06T11:57:54.361721
2026/04/06 21:50:00,LKBONNY1,33.94,Lake Bonney Wind Power Pty Ltd,Lake Bonney Wind Farm Stage 1,Wind,81.0,41.9,Lake Bonney Wind Farm Stage 1,-37.76,140.4,2026-04-06T11:57:54.361721
2026/04/06 21:50:00,LKBONNY2,84.67,Lake Bonney Wind Power Pty Ltd,Lake Bonney Stage 2 Windfarm,Wind,159.0,53.25,Lake Bonney Stage 2 Windfarm,-37.76,140.4,2026-04-06T11:57:54.361721
2026/04/06 21:50:00,LKBONNY3,24.12,Lake Bonney Wind Power Pty Ltd,Lake Bonney Stage 3 Wind Farm,Wind,39.0,61.85,Lake Bonney Stage 3 Wind Farm,-37.737781,140.388137,2026-04-06T11:57:54.361721
2026/04/06 21:50:00,MACARTH1,143.3,AGL Hydro Partnership,Macarthur Wind Farm,Wind,420.0,34.12,Macarthur Wind Farm,-38.048957,142.192112,2026-04-06T11:57:54.361721
2026/04/06 21:50:00,MCINTYR1,131.42,MacIntyre UJV Operator Pty Ltd,MacIntyre Wind Farm,Wind,890.0,14.77,MacIntyre Wind Farm,-28.32,151.54,2026-04-06T11:57:54.361721
2026/04/06 21:50:00,MERCER01,59.3,Mt Mercer Windfarm Pty Ltd,Mt Mercer Wind Farm,Wind,131.0,45.27,Mt Mercer Wind Farm,-37.841111,143.871111,2026-04-06T11:57:54.361721
2026/04/06 21:50:00,MEWF1,167.87,Ergon Energy Queensland Pty Ltd ,Mount Emerald Wind Farm,Wind,178.0,94.31,Mount Emerald Wind Farm,-17.133007,145.380644,2026-04-06T11:57:54.361721
2026/04/06 21:50:00,MRTLSWF1,115.5,Mortlake South Wind Farm Pty Ltd,Mortlake South Wind Farm,Wind,153.0,75.49,Mortlake South Wind Farm,-38.127337,142.857801,2026-04-06T11:57:54.361721
2026/04/06 21:50:00,MTGELWF1,60.39,Mt. Gellibrand Wind Farm Pty Ltd,Mt Gellibrand Wind Farm,Wind,132.0,45.75,Mt Gellibrand Wind Farm,-38.23,143.77,2026-04-06T11:57:54.361721
2026/04/06 21:50:00,MTMILLAR,9.1,Mt Millar Wind Farm Pty Ltd,Mt Millar Wind Farm,Wind,70.0,13.0,Mt Millar Wind Farm,-33.624444,136.703611,2026-04-06T11:57:54.361721
2026/04/06 21:50:00,MUSSELR1,35.5,Hydro-Electric Corporation,Musselroe Wind Farm,Wind,168.0,21.13,Musselroe Wind Farm,-40.780225,148.010799,2026-04-06T11:57:54.361721
2026/04/06 21:50:00,MUWAWF1,65.36,Telstra Energy (Generation) Pty Ltd,Murra Warra Wind Farm,Wind,225.7,28.96,Murra Warra Wind Farm,-36.432404,142.317853,2026-04-06T11:57:54.361721
2026/04/06 21:50:00,MUWAWF2,40.4,Murra Warra II Project Co Pty Ltd ATF The Murra Warra II Project Trust,Murra Warra Wind Farm Stage 2,Wind,203.0,19.9,Murra Warra Wind Farm Stage 2,-36.43,142.32,2026-04-06T11:57:54.361721
2026/04/06 21:50:00,NBHWF1,11.0,AGL SA Generation Pty Limited,North Brown Hill Wind Farm,Wind,132.0,8.33,North Brown Hill Wind Farm,-33.367778,138.728611,2026-04-06T11:57:54.361721
2026/04/06 21:50:00,OAKLAND1,21.3,AGL Hydro Partnership,Oaklands Hill Wind Farm,Wind,63.0,33.81,Oaklands Hill Wind Farm,-37.683078,142.551678,2026-04-06T11:57:54.361721
2026/04/06 21:50:00,PAREPW1,142.62,Iberdrola Australia Energy Markets Pty Limited,Port Augusta Renewable Energy Park,Wind,201.0,70.96,Port Augusta Renewable Energy Park,-32.566944,137.856111,2026-04-06T11:57:54.361721
2026/04/06 21:50:00,RYANCWF1,21.28,Ryan Corner Development Pty Ltd,Ryan Corner Wind Farm,Wind,205.0,10.38,Ryan Corner Wind Farm,-38.271017,142.140647,2026-04-06T11:57:54.361721
2026/04/06 21:50:00,RYEPARK1,60.43,Rye Park Renewable Energy Pty Ltd as trustee for Rye Park Wind Farm Trust,Rye Park Renewable Energy,Wind,384.0,15.74,Rye Park Renewable Energy,-32.138333,148.972778,2026-04-06T11:57:54.361721
2026/04/06 21:50:00,SALTCRK1,25.01,Salt Creek Wind Farm Pty Ltd,Salt Creek Wind Farm,Wind,54.0,46.31,Salt Creek Wind Farm,-37.95,142.63,2026-04-06T11:57:54.361721
2026/04/06 21:50:00,SAPHWF1,0.0,The Trustee For The SWF1 Operations Trust,Sapphire Wind Farm,Wind,270.0,0.0,Sapphire Wind Farm,-29.7,151.41,2026-04-06T11:57:54.361721
2026/04/06 21:50:00,SNOWNTH1,27.2,Snowtown Wind Farm Stage 2 Pty Ltd,Snowtown Wind Farm Stage 2 North,Wind,144.0,18.89,Snowtown Wind Farm Stage 2 North,-33.83,138.118611,2026-04-06T11:57:54.361721
2026/04/06 21:50:00,SNOWSTH1,49.0,Snowtown Wind Farm Stage 2 Pty Ltd,Snowtown South Wind Farm,Wind,126.0,38.89,Snowtown South Wind Farm,-33.83,138.118611,2026-04-06T11:57:54.361721
2026/04/06 21:50:00,SNOWTWN1,29.59,Snowtown Wind Farm Pty Ltd,Snowtown Wind Farm Units 1 And 47,Wind,99.0,29.89,Snowtown Wind Farm Units 1 And 47,-33.83,138.118611,2026-04-06T11:57:54.361721
2026/04/06 21:50:00,STARHLWF,10.7,Starfish Hill Wind Farm Pty Ltd,Starfish Hill Wind Farm,Wind,35.0,30.57,Starfish Hill Wind Farm,-35.58,138.14,2026-04-06T11:57:54.361721
2026/04/06 21:50:00,STOCKYD1,57.46,Stockyard Hill Wind Farm Pty Ltd,Stockyard Hill Wind Farm,Wind,511.0,11.24,Stockyard Hill Wind Farm,-37.535833,143.251389,2026-04-06T11:57:54.361721
2026/04/06 21:50:00,STWF1,66.88,PARF Company 8 Pty Ltd as The Trustee for Silverton Project Trust,Silverton Wind Farm,Wind,198.0,33.78,Silverton Wind Farm,-37.683168,142.551678,2026-04-06T11:57:54.361721
2026/04/06 21:50:00,TARALGA1,91.47,Taralga Wind Farm Nominees No 2 Pty Ltd (ATF Taralga Wind Farm Operating Trust),Taralga Wind Farm,Wind,106.0,86.29,Taralga Wind Farm,-34.42352,149.826267,2026-04-06T11:57:54.361721
2026/04/06 21:50:00,WAMBOWF1,105.43,Stanwell Corporation Limited,Wambo Wind Farm 1,Wind,245.0,43.03,Wambo Wind Farm 1,-35.187301,149.524945,2026-04-06T11:57:54.361721
2026/04/06 21:50:00,WATERLWF,54.6,Waterloo Wind Farm Pty Ltd,Waterloo Wind Farm,Wind,130.0,42.0,Waterloo Wind Farm,-34.00094,138.911567,2026-04-06T11:57:54.361721
2026/04/06 21:50:00,WGWF1,28.5,Willogoleche Power Pty Ltd As The Trustee For The Willogoleche Operating Trust,Willogoleche Wind Farm,Wind,119.0,23.95,Willogoleche Wind Farm,-33.39,138.85,2026-04-06T11:57:54.361721
2026/04/06 21:50:00,WOODLWN1,28.53,Woodlawn Wind Pty Ltd,Woodlawn Wind Farm,Wind,48.0,59.44,Woodlawn Wind Farm,-35.08,149.62,2026-04-06T11:57:54.361721
2026/04/06 21:50:00,WPWF,31.02,AGL SA Generation Pty Limited,Wattle Point Wind Farm,Wind,91.0,34.09,Wattle Point Wind Farm,-35.111624,137.7219,2026-04-06T11:57:54.361721
2026/04/06 21:50:00,WRWF1,0.0,White Rock Wind Farm Pty Ltd,White Rock Wind Farm,Wind,172.0,0.0,White Rock Wind Farm,-29.79,151.54,2026-04-06T11:57:54.361721
2026/04/06 21:50:00,YENDWF1,26.95,Lal Lal Wind Farms Nom Co Pty Ltd,Yendon Wind Farm,Wind,142.0,18.98,Yendon Wind Farm,-37.629987,144.022717,2026-04-06T11:57:54.361721
