SETTLEMENTDATE,DUID,SCADAVALUE,Participant,Station Name,Fuel Source - Primary,MAX_CAP,utilisation_pct,Plant,Latitude,Longitude,timestamp_utc
2026/02/01 23:55:00,CAPTL_WF,33.16,Iberdrola Australia Holdings Pty Limited,Capital Wind Farm,Wind,140.0,23.69,Capital Wind Farm,-35.1,149.31,2026-02-01T13:53:13.650139
2026/02/01 23:55:00,CHALLHWF,27.8,Pacific Hydro Challicum Hills Pty Ltd,Challicum Hills Wind Farm,Wind,52.0,53.46,Challicum Hills Wind Farm,-37.38,143.11,2026-02-01T13:53:13.650139
2026/02/01 23:55:00,CULLRGWF,12.88,Cullerin Range Wind Farm Pty Ltd,Cullerin Range Wind Farm,Wind,30.0,42.93,Cullerin Range Wind Farm,-34.81,149.4,2026-02-01T13:53:13.650139
2026/02/01 23:55:00,DIAPURWF1,2.7,Y.E.S. Energy (SA) Pty Ltd,Diapur Wind Farm,Wind,7.0,38.57,Diapur Wind Farm,-36.3425,141.43,2026-02-01T13:53:13.650139
2026/02/01 23:55:00,MLWF1,5.26,Mortons Lane Windfarm Pty Limited,Mortons Lane Wind Farm,Wind,20.0,26.3,Mortons Lane Wind Farm,-37.84,142.45,2026-02-01T13:53:13.650139
2026/02/01 23:55:00,WAUBRAWF,113.9,Pyrenees Wind Energy Developments Pty Ltd,Waubra Wind Farm,Wind,192.0,59.32,Waubra Wind Farm,-37.394498,143.638982,2026-02-01T13:53:13.650139
2026/02/01 23:55:00,WOOLNTH1,50.45,Hydro-Electric Corporation,Woolnorth Studland Bay / Bluff Point Wind Farm,Wind,140.0,36.04,Woolnorth Studland Bay / Bluff Point Wind Farm,-40.69,144.72,2026-02-01T13:53:13.650139
2026/02/01 23:55:00,YAMBUKWF,20.1,Energy Pacific (Vic) Pty Ltd,Yambuk Wind Farm,Wind,30.0,67.0,Yambuk Wind Farm,-38.299083,142.027577,2026-02-01T13:53:13.650139
2026/02/01 23:55:00,YSWF1,6.0,Pacific Hydro Yaloak South Pty Ltd,Yaloak South Wind Farm,Wind,28.0,21.43,Yaloak South Wind Farm,-37.7163,144.242853,2026-02-01T13:53:13.650139
2026/02/01 23:55:00,ARWF1,91.6,Ararat Wind Farm Pty Ltd,Ararat Wind Farm,Wind,241.0,38.01,Ararat Wind Farm,-37.232778,143.031389,2026-02-01T13:53:13.650139
2026/02/01 23:55:00,BALDHWF1,72.58,Alinta Energy Retail Sales Pty Ltd,Bald Hills Wind Farm,Wind,106.0,68.47,Bald Hills Wind Farm,-38.79,145.93,2026-02-01T13:53:13.650139
2026/02/01 23:55:00,BANGOWF1,68.0,BWF Nominees Pty Ltd as The Trustee for BWF Trust,Bango 973 Wind Farm,Wind,155.0,43.87,Bango 973 Wind Farm,-34.551582,148.732808,2026-02-01T13:53:13.650139
2026/02/01 23:55:00,BANGOWF2,40.4,BWF Nominees Pty Ltd as The Trustee for BWF Trust,Bango 999 Wind Farm,Wind,82.0,49.27,Bango 999 Wind Farm,-34.551582,148.732808,2026-02-01T13:53:13.650139
2026/02/01 23:55:00,BLUFF1,26.4,AGL SA Generation Pty Limited,The Bluff Wind Farm,Wind,53.0,49.81,The Bluff Wind Farm,-33.367778,138.728611,2026-02-01T13:53:13.650139
2026/02/01 23:55:00,BOCORWF1,101.81,Boco Rock Wind Farm Pty Ltd,Boco Rock Wind Farm,Wind,111.0,91.72,Boco Rock Wind Farm,-36.578611,149.103333,2026-02-01T13:53:13.650139
2026/02/01 23:55:00,BRYB1WF1,53.18,Berrybank Development Pty Ltd,Berrybank Wind Farm,Wind,175.9,30.23,Berrybank Wind Farm,-37.94,143.52,2026-02-01T13:53:13.650139
2026/02/01 23:55:00,BRYB2WF2,31.32,Berrybank 2 Asset Pty Ltd as trustee for Berrybank 2 Asset Trust,Berrybank 2 Wind Farm,Wind,105.0,29.83,Berrybank 2 Wind Farm,-37.94,143.52,2026-02-01T13:53:13.650139
2026/02/01 23:55:00,BULGANA1,0.0,Bulgana Wind Farm Pty Ltd,Bulgana Green Power Hub,Wind,204.0,0.0,Bulgana Green Power Hub,-37.0975,142.973611,2026-02-01T13:53:13.650139
2026/02/01 23:55:00,CATHROCK,32.1,Cathedral Rocks Wind Farm Pty Ltd,Cathedral Rocks,Wind,66.0,48.64,Cathedral Rocks,-34.51,135.35,2026-02-01T13:53:13.650139
2026/02/01 23:55:00,CHYTWF1,55.67,Cherry Tree Wind Farm Pty Ltd as trustee for The Cherry Tree Project trust ,Cherry Tree Wind Farm,Wind,57.0,97.67,Cherry Tree Wind Farm,-37.1,145.26,2026-02-01T13:53:13.650139
2026/02/01 23:55:00,CLEMGPWF,42.43,Pacific Hydro Clements Gap Pty Ltd,Clements Gap Wind Farm,Wind,57.0,74.44,Clements Gap Wind Farm,-33.48,138.1,2026-02-01T13:53:13.650139
2026/02/01 23:55:00,CLRKCWF1,274.94,Stanwell Corporation Limited ,Clarke Creek Wind Farm,Wind,338.0,81.34,Clarke Creek Wind Farm,-22.85,149.45,2026-02-01T13:53:13.650139
2026/02/01 23:55:00,CLRKCWF2,70.95,Stanwell Corporation Limited ,Clarke Creek Wind Farm,Wind,101.0,70.25,Clarke Creek Wind Farm,-22.85,149.45,2026-02-01T13:53:13.650139
2026/02/01 23:55:00,CNUNDAWF,6.51,Canunda Power Pty Ltd,Canunda Wind Farm,Wind,46.0,14.15,Canunda Wind Farm,-37.73,140.39,2026-02-01T13:53:13.650139
2026/02/01 23:55:00,COLWF01,42.55,Collector Wind Farm Pty Ltd,Collector Wind Farm 1,Wind,219.0,19.43,Collector Wind Farm 1,-34.8719,149.3967,2026-02-01T13:53:13.650139
2026/02/01 23:55:00,COOPGWF1,167.92,PARF Company 10 Pty Limited as The Trustee for Coopers Gap Project Trust,Coopers Gap Wind Farm,Wind,440.0,38.16,Coopers Gap Wind Farm,-26.74,151.45,2026-02-01T13:53:13.650139
2026/02/01 23:55:00,CROOKWF2,9.04,Crookwell Development Pty Ltd ,Crookwell 2 Wind Farm,Wind,91.0,9.93,Crookwell 2 Wind Farm,-34.52,149.54,2026-02-01T13:53:13.650139
2026/02/01 23:55:00,CROOKWF3,8.31,Crookwell 3 Development Pty Ltd,Crookwell 3 Wind Farm,Wind,56.0,14.84,Crookwell 3 Wind Farm,-34.52,149.54,2026-02-01T13:53:13.650139
2026/02/01 23:55:00,CROWLWF1,72.92,Pacific Hydro Crowlands Pty Ltd ,Crowlands Wind Farm,Wind,79.0,92.3,Crowlands Wind Farm,-37.13,143.16,2026-02-01T13:53:13.650139
2026/02/01 23:55:00,CRURWF1,25.0,CRWF Nominees Pty Ltd As Trustee For The CRWF Trust,Crudine Ridge Wind Farm,Wind,138.0,18.12,Crudine Ridge Wind Farm,-32.97,149.64,2026-02-01T13:53:13.650139
2026/02/01 23:55:00,CTHLWF1,115.92,Wild Cattle Hill Pty Ltd,Cattle Hill Wind Farm,Wind,144.0,80.5,Cattle Hill Wind Farm,-42.15,146.69,2026-02-01T13:53:13.650139
2026/02/01 23:55:00,DULAWF1,21.9,Dulacca Energy Project Co Pty Ltd,Dulacca Wind Farm,Wind,173.0,12.66,Dulacca Wind Farm,-26.63,149.87,2026-02-01T13:53:13.650139
2026/02/01 23:55:00,DUNDWF1,96.5,Dundonnell Wind Farm Pty Ltd,Dundonnell Wind Farm,Wind,168.0,57.44,Dundonnell Wind Farm,-37.52,142.58,2026-02-01T13:53:13.650139
2026/02/01 23:55:00,DUNDWF2,26.69,Dundonnell Wind Farm Pty Ltd,Dundonnell Wind Farm,Wind,46.0,58.02,Dundonnell Wind Farm,-37.52,142.58,2026-02-01T13:53:13.650139
2026/02/01 23:55:00,DUNDWF3,60.07,Dundonnell Wind Farm Pty Ltd,Dundonnell Wind Farm,Wind,122.0,49.24,Dundonnell Wind Farm,-37.52,142.58,2026-02-01T13:53:13.650139
2026/02/01 23:55:00,ELAINWF1,57.38,Lal Lal Wind Farms Nom Co Pty Ltd,Elaine Wind Farm,Wind,82.0,69.98,Elaine Wind Farm,-37.36,144.0,2026-02-01T13:53:13.650139
2026/02/01 23:55:00,FLYCRKWF,32.83,Iberdrola Australia Energy Markets Pty Limited,Flyers Creek Wind Farm,Wind,140.0,23.45,Flyers Creek Wind Farm,-33.365556,148.981944,2026-02-01T13:53:13.650139
2026/02/01 23:55:00,GPWFEST1,87.12,Golden Plains WF1 Pty Ltd as Trustee for the Golden Plains WF1 Unit Trust,Golden Plains Wind Farm East,Wind,240.0,36.3,Golden Plains Wind Farm East,-37.945091,143.752614,2026-02-01T13:53:13.650139
2026/02/01 23:55:00,GPWFEST2,65.04,Golden Plains WF1 Pty Ltd as Trustee for the Golden Plains WF1 Unit Trust,Golden Plains Wind Farm East,Wind,253.0,25.71,Golden Plains Wind Farm East,-37.945091,143.752614,2026-02-01T13:53:13.650139
2026/02/01 23:55:00,GPWFEST3,71.04,Golden Plains WF1 Pty Ltd as Trustee for the Golden Plains WF1 Unit Trust,Golden Plains Wind Farm East,Wind,240.0,29.6,Golden Plains Wind Farm East,-37.945091,143.752614,2026-02-01T13:53:13.650139
2026/02/01 23:55:00,GRANWF1,53.71,Granville Harbour Operations Pty Ltd as The Trustee for Granville Harbour Operations Trust,Granville Harbour Wind Farm,Wind,111.0,48.39,Granville Harbour Wind Farm,-41.8,145.06,2026-02-01T13:53:13.650139
2026/02/01 23:55:00,GSWF1A,141.12,Goyder Wind Farm 1 Pty Ltd as the Trustee for Goyder Wind Farm 1 Trust,Goyder South Wind Farm 1A,Wind,201.0,70.21,Goyder South Wind Farm 1A,-33.679758,138.937597,2026-02-01T13:53:13.650139
2026/02/01 23:55:00,GSWF1B1,166.75,Goyder Wind Farm 1B Pty Ltd as the Trustee for the Goyder Wind Farm 1B Trust,Goyder South Wind Farm 1B,Wind,196.0,85.08,Goyder South Wind Farm 1B,-33.679758,138.937597,2026-02-01T13:53:13.650139
2026/02/01 23:55:00,GULLRWF1,16.41,New Gullen Range Wind Farm Pty Ltd,Gullen Range Wind Farm,Wind,161.0,10.19,Gullen Range Wind Farm,-34.34,149.27,2026-02-01T13:53:13.650139
2026/02/01 23:55:00,GULLRWF2,5.75,New Gullen Range Wind Farm Pty Ltd,Gullen Range Wind Farm,Wind,107.0,5.37,Gullen Range Wind Farm,-34.34,149.27,2026-02-01T13:53:13.650139
2026/02/01 23:55:00,GUNNING1,10.77,Gunning Wind Energy Developments Pty Ltd,Gunning Wind Farm,Wind,47.0,22.91,Gunning Wind Farm,-34.813333,149.4,2026-02-01T13:53:13.650139
2026/02/01 23:55:00,HALLWF1,74.05,AGL SA Generation Pty Limited,Hallett 1 Wind Farm,Wind,95.0,77.95,Hallett 1 Wind Farm,-33.367778,138.728611,2026-02-01T13:53:13.650139
2026/02/01 23:55:00,HALLWF2,61.85,AGL SA Generation Pty Limited,Hallett 2 Wind Farm,Wind,71.0,87.11,Hallett 2 Wind Farm,-33.367778,138.728611,2026-02-01T13:53:13.650139
2026/02/01 23:55:00,HD1WF1,38.06,Hawkesdale Asset Pty Ltd as trustee for Hawkesdale Asset Trust,Hawkesdale Wind Farm,Wind,89.0,42.76,Hawkesdale Wind Farm,-38.147894,142.361381,2026-02-01T13:53:13.650139
2026/02/01 23:55:00,HDWF1,62.0,HWF1 Pty Ltd,Hornsdale Wind Farm,Wind,102.0,60.78,Hornsdale Wind Farm,-33.050556,138.543611,2026-02-01T13:53:13.650139
2026/02/01 23:55:00,HDWF2,69.8,HWF 2 Pty Ltd,Hornsdale Wind Farm 2,Wind,102.0,68.43,Hornsdale Wind Farm 2,-33.06,138.54,2026-02-01T13:53:13.650139
2026/02/01 23:55:00,HDWF3,44.7,HWF3 Pty Ltd,Hornsdale Wind Farm 3,Wind,109.0,41.01,Hornsdale Wind Farm 3,-33.06,138.54,2026-02-01T13:53:13.650139
2026/02/01 23:55:00,KABANWF1,4.64,Kaban Wind Farm Pty Ltd as trustee for Kaban Wind Farm Trust,Kaban Wind Farm,Wind,152.0,3.05,Kaban Wind Farm,-17.56,145.41,2026-02-01T13:53:13.650139
2026/02/01 23:55:00,KEPWF1,0.0,Kennedy Energy Park Pty Ltd,Kennedy Energy Park,Wind,43.0,0.0,Kennedy Energy Park,-20.88,144.42,2026-02-01T13:53:13.650139
2026/02/01 23:55:00,KIATAWF1,23.7,Kiata ProjectCo Pty Ltd Atf Kiata Project Trust,Kiata Wind Farm,Wind,31.0,76.45,Kiata Wind Farm,-36.4,141.75,2026-02-01T13:53:13.650139
2026/02/01 23:55:00,LGAPWF1,55.57,Lincoln Gap Wind Farm (Operations) Pty Ltd,Lincoln Gap Wind Farm,Wind,123.0,45.18,Lincoln Gap Wind Farm,-32.564279,137.557328,2026-02-01T13:53:13.650139
2026/02/01 23:55:00,LGAPWF1,55.57,Lincoln Gap Wind Farm (Operations) Pty Ltd,Lincoln Gap Wind Farm,Wind,123.0,45.18,Lincoln Gap Wind Farm,-32.564279,137.557328,2026-02-01T13:53:13.650139
2026/02/01 23:55:00,LGAPWF2,78.11,Lincoln Gap Wind Farm (Operations) Pty Ltd,Lincoln Gap Wind Farm,Wind,85.0,91.89,Lincoln Gap Wind Farm,-32.564279,137.557328,2026-02-01T13:53:13.650139
2026/02/01 23:55:00,LGAPWF2,78.11,Lincoln Gap Wind Farm (Operations) Pty Ltd,Lincoln Gap Wind Farm,Wind,85.0,91.89,Lincoln Gap Wind Farm,-32.564279,137.557328,2026-02-01T13:53:13.650139
2026/02/01 23:55:00,LKBONNY1,6.16,Lake Bonney Wind Power Pty Ltd,Lake Bonney Wind Farm Stage 1,Wind,81.0,7.6,Lake Bonney Wind Farm Stage 1,-37.76,140.4,2026-02-01T13:53:13.650139
2026/02/01 23:55:00,LKBONNY2,26.01,Lake Bonney Wind Power Pty Ltd,Lake Bonney Stage 2 Windfarm,Wind,159.0,16.36,Lake Bonney Stage 2 Windfarm,-37.76,140.4,2026-02-01T13:53:13.650139
2026/02/01 23:55:00,LKBONNY3,8.6,Lake Bonney Wind Power Pty Ltd,Lake Bonney Stage 3 Wind Farm,Wind,39.0,22.05,Lake Bonney Stage 3 Wind Farm,-37.737781,140.388137,2026-02-01T13:53:13.650139
2026/02/01 23:55:00,MACARTH1,90.0,AGL Hydro Partnership,Macarthur Wind Farm,Wind,420.0,21.43,Macarthur Wind Farm,-38.048957,142.192112,2026-02-01T13:53:13.650139
2026/02/01 23:55:00,MCINTYR1,92.49,MacIntyre UJV Operator Pty Ltd,MacIntyre Wind Farm,Wind,890.0,10.39,MacIntyre Wind Farm,-28.32,151.54,2026-02-01T13:53:13.650139
2026/02/01 23:55:00,MERCER01,31.3,Mt Mercer Windfarm Pty Ltd,Mt Mercer Wind Farm,Wind,131.0,23.89,Mt Mercer Wind Farm,-37.841111,143.871111,2026-02-01T13:53:13.650139
2026/02/01 23:55:00,MEWF1,0.0,Ergon Energy Queensland Pty Ltd ,Mount Emerald Wind Farm,Wind,178.0,0.0,Mount Emerald Wind Farm,-17.133007,145.380644,2026-02-01T13:53:13.650139
2026/02/01 23:55:00,MRTLSWF1,28.57,Mortlake South Wind Farm Pty Ltd,Mortlake South Wind Farm,Wind,153.0,18.67,Mortlake South Wind Farm,-38.127337,142.857801,2026-02-01T13:53:13.650139
2026/02/01 23:55:00,MTGELWF1,16.45,Mt. Gellibrand Wind Farm Pty Ltd,Mt Gellibrand Wind Farm,Wind,132.0,12.46,Mt Gellibrand Wind Farm,-38.23,143.77,2026-02-01T13:53:13.650139
2026/02/01 23:55:00,MTMILLAR,55.2,Mt Millar Wind Farm Pty Ltd,Mt Millar Wind Farm,Wind,70.0,78.86,Mt Millar Wind Farm,-33.624444,136.703611,2026-02-01T13:53:13.650139
2026/02/01 23:55:00,MUSSELR1,4.4,Hydro-Electric Corporation,Musselroe Wind Farm,Wind,168.0,2.62,Musselroe Wind Farm,-40.780225,148.010799,2026-02-01T13:53:13.650139
2026/02/01 23:55:00,MUWAWF1,52.41,Telstra Energy (Generation) Pty Ltd,Murra Warra Wind Farm,Wind,225.7,23.22,Murra Warra Wind Farm,-36.432404,142.317853,2026-02-01T13:53:13.650139
2026/02/01 23:55:00,MUWAWF2,47.1,Murra Warra II Project Co Pty Ltd ATF The Murra Warra II Project Trust,Murra Warra Wind Farm Stage 2,Wind,203.0,23.2,Murra Warra Wind Farm Stage 2,-36.43,142.32,2026-02-01T13:53:13.650139
2026/02/01 23:55:00,NBHWF1,110.0,AGL SA Generation Pty Limited,North Brown Hill Wind Farm,Wind,132.0,83.33,North Brown Hill Wind Farm,-33.367778,138.728611,2026-02-01T13:53:13.650139
2026/02/01 23:55:00,OAKLAND1,29.6,AGL Hydro Partnership,Oaklands Hill Wind Farm,Wind,63.0,46.98,Oaklands Hill Wind Farm,-37.683078,142.551678,2026-02-01T13:53:13.650139
2026/02/01 23:55:00,PAREPW1,123.94,Iberdrola Australia Energy Markets Pty Limited,Port Augusta Renewable Energy Park,Wind,201.0,61.66,Port Augusta Renewable Energy Park,-32.566944,137.856111,2026-02-01T13:53:13.650139
2026/02/01 23:55:00,RYANCWF1,77.96,Ryan Corner Development Pty Ltd,Ryan Corner Wind Farm,Wind,205.0,38.03,Ryan Corner Wind Farm,-38.271017,142.140647,2026-02-01T13:53:13.650139
2026/02/01 23:55:00,RYEPARK1,88.67,Rye Park Renewable Energy Pty Ltd as trustee for Rye Park Wind Farm Trust,Rye Park Renewable Energy,Wind,384.0,23.09,Rye Park Renewable Energy,-32.138333,148.972778,2026-02-01T13:53:13.650139
2026/02/01 23:55:00,SALTCRK1,19.52,Salt Creek Wind Farm Pty Ltd,Salt Creek Wind Farm,Wind,54.0,36.15,Salt Creek Wind Farm,-37.95,142.63,2026-02-01T13:53:13.650139
2026/02/01 23:55:00,SAPHWF1,84.88,The Trustee For The SWF1 Operations Trust,Sapphire Wind Farm,Wind,270.0,31.44,Sapphire Wind Farm,-29.7,151.41,2026-02-01T13:53:13.650139
2026/02/01 23:55:00,SNOWNTH1,140.8,Snowtown Wind Farm Stage 2 Pty Ltd,Snowtown Wind Farm Stage 2 North,Wind,144.0,97.78,Snowtown Wind Farm Stage 2 North,-33.83,138.118611,2026-02-01T13:53:13.650139
2026/02/01 23:55:00,SNOWSTH1,123.3,Snowtown Wind Farm Stage 2 Pty Ltd,Snowtown South Wind Farm,Wind,126.0,97.86,Snowtown South Wind Farm,-33.83,138.118611,2026-02-01T13:53:13.650139
2026/02/01 23:55:00,SNOWTWN1,90.94,Snowtown Wind Farm Pty Ltd,Snowtown Wind Farm Units 1 And 47,Wind,99.0,91.86,Snowtown Wind Farm Units 1 And 47,-33.83,138.118611,2026-02-01T13:53:13.650139
2026/02/01 23:55:00,STARHLWF,23.69,Starfish Hill Wind Farm Pty Ltd,Starfish Hill Wind Farm,Wind,35.0,67.69,Starfish Hill Wind Farm,-35.58,138.14,2026-02-01T13:53:13.650139
2026/02/01 23:55:00,STOCKYD1,401.07,Stockyard Hill Wind Farm Pty Ltd,Stockyard Hill Wind Farm,Wind,511.0,78.49,Stockyard Hill Wind Farm,-37.535833,143.251389,2026-02-01T13:53:13.650139
2026/02/01 23:55:00,STWF1,0.0,PARF Company 8 Pty Ltd as The Trustee for Silverton Project Trust,Silverton Wind Farm,Wind,198.0,0.0,Silverton Wind Farm,-37.683168,142.551678,2026-02-01T13:53:13.650139
2026/02/01 23:55:00,TARALGA1,7.75,Taralga Wind Farm Nominees No 2 Pty Ltd (ATF Taralga Wind Farm Operating Trust),Taralga Wind Farm,Wind,106.0,7.31,Taralga Wind Farm,-34.42352,149.826267,2026-02-01T13:53:13.650139
2026/02/01 23:55:00,WAMBOWF1,73.32,Stanwell Corporation Limited,Wambo Wind Farm 1,Wind,245.0,29.93,Wambo Wind Farm 1,-35.187301,149.524945,2026-02-01T13:53:13.650139
2026/02/01 23:55:00,WATERLWF,108.4,Waterloo Wind Farm Pty Ltd,Waterloo Wind Farm,Wind,130.0,83.38,Waterloo Wind Farm,-34.00094,138.911567,2026-02-01T13:53:13.650139
2026/02/01 23:55:00,WGWF1,109.9,Willogoleche Power Pty Ltd As The Trustee For The Willogoleche Operating Trust,Willogoleche Wind Farm,Wind,119.0,92.35,Willogoleche Wind Farm,-33.39,138.85,2026-02-01T13:53:13.650139
2026/02/01 23:55:00,WOODLWN1,10.1,Woodlawn Wind Pty Ltd,Woodlawn Wind Farm,Wind,48.0,21.04,Woodlawn Wind Farm,-35.08,149.62,2026-02-01T13:53:13.650139
2026/02/01 23:55:00,WPWF,62.16,AGL SA Generation Pty Limited,Wattle Point Wind Farm,Wind,91.0,68.31,Wattle Point Wind Farm,-35.111624,137.7219,2026-02-01T13:53:13.650139
2026/02/01 23:55:00,WRWF1,41.37,White Rock Wind Farm Pty Ltd,White Rock Wind Farm,Wind,172.0,24.05,White Rock Wind Farm,-29.79,151.54,2026-02-01T13:53:13.650139
2026/02/01 23:55:00,YENDWF1,51.81,Lal Lal Wind Farms Nom Co Pty Ltd,Yendon Wind Farm,Wind,142.0,36.49,Yendon Wind Farm,-37.629987,144.022717,2026-02-01T13:53:13.650139
