SETTLEMENTDATE,DUID,SCADAVALUE,Participant,Station Name,Fuel Source - Primary,MAX_CAP,utilisation_pct,Plant,Latitude,Longitude,timestamp_utc
2026/02/27 00:40:00,CAPTL_WF,72.81,Iberdrola Australia Holdings Pty Limited,Capital Wind Farm,Wind,140.0,52.01,Capital Wind Farm,-35.1,149.31,2026-02-26T14:39:22.503149
2026/02/27 00:40:00,CHALLHWF,9.9,Pacific Hydro Challicum Hills Pty Ltd,Challicum Hills Wind Farm,Wind,52.0,19.04,Challicum Hills Wind Farm,-37.38,143.11,2026-02-26T14:39:22.503149
2026/02/27 00:40:00,CULLRGWF,29.06,Cullerin Range Wind Farm Pty Ltd,Cullerin Range Wind Farm,Wind,30.0,96.87,Cullerin Range Wind Farm,-34.81,149.4,2026-02-26T14:39:22.503149
2026/02/27 00:40:00,DIAPURWF1,8.3,Y.E.S. Energy (SA) Pty Ltd,Diapur Wind Farm,Wind,7.0,118.57,Diapur Wind Farm,-36.3425,141.43,2026-02-26T14:39:22.503149
2026/02/27 00:40:00,MLWF1,3.22,Mortons Lane Windfarm Pty Limited,Mortons Lane Wind Farm,Wind,20.0,16.1,Mortons Lane Wind Farm,-37.84,142.45,2026-02-26T14:39:22.503149
2026/02/27 00:40:00,WAUBRAWF,12.46,Pyrenees Wind Energy Developments Pty Ltd,Waubra Wind Farm,Wind,192.0,6.49,Waubra Wind Farm,-37.394498,143.638982,2026-02-26T14:39:22.503149
2026/02/27 00:40:00,WOOLNTH1,47.91,Hydro-Electric Corporation,Woolnorth Studland Bay / Bluff Point Wind Farm,Wind,140.0,34.22,Woolnorth Studland Bay / Bluff Point Wind Farm,-40.69,144.72,2026-02-26T14:39:22.503149
2026/02/27 00:40:00,YAMBUKWF,12.0,Energy Pacific (Vic) Pty Ltd,Yambuk Wind Farm,Wind,30.0,40.0,Yambuk Wind Farm,-38.299083,142.027577,2026-02-26T14:39:22.503149
2026/02/27 00:40:00,YSWF1,0.0,Pacific Hydro Yaloak South Pty Ltd,Yaloak South Wind Farm,Wind,28.0,0.0,Yaloak South Wind Farm,-37.7163,144.242853,2026-02-26T14:39:22.503149
2026/02/27 00:40:00,ARWF1,0.0,Ararat Wind Farm Pty Ltd,Ararat Wind Farm,Wind,241.0,0.0,Ararat Wind Farm,-37.232778,143.031389,2026-02-26T14:39:22.503149
2026/02/27 00:40:00,BALDHWF1,104.51,Alinta Energy Retail Sales Pty Ltd,Bald Hills Wind Farm,Wind,106.0,98.59,Bald Hills Wind Farm,-38.79,145.93,2026-02-26T14:39:22.503149
2026/02/27 00:40:00,BANGOWF1,148.1,BWF Nominees Pty Ltd as The Trustee for BWF Trust,Bango 973 Wind Farm,Wind,155.0,95.55,Bango 973 Wind Farm,-34.551582,148.732808,2026-02-26T14:39:22.503149
2026/02/27 00:40:00,BANGOWF2,80.1,BWF Nominees Pty Ltd as The Trustee for BWF Trust,Bango 999 Wind Farm,Wind,82.0,97.68,Bango 999 Wind Farm,-34.551582,148.732808,2026-02-26T14:39:22.503149
2026/02/27 00:40:00,BLUFF1,0.0,AGL SA Generation Pty Limited,The Bluff Wind Farm,Wind,53.0,0.0,The Bluff Wind Farm,-33.367778,138.728611,2026-02-26T14:39:22.503149
2026/02/27 00:40:00,BOCORWF1,28.77,Boco Rock Wind Farm Pty Ltd,Boco Rock Wind Farm,Wind,111.0,25.92,Boco Rock Wind Farm,-36.578611,149.103333,2026-02-26T14:39:22.503149
2026/02/27 00:40:00,BRYB1WF1,86.98,Berrybank Development Pty Ltd,Berrybank Wind Farm,Wind,175.9,49.45,Berrybank Wind Farm,-37.94,143.52,2026-02-26T14:39:22.503149
2026/02/27 00:40:00,BRYB2WF2,71.56,Berrybank 2 Asset Pty Ltd as trustee for Berrybank 2 Asset Trust,Berrybank 2 Wind Farm,Wind,105.0,68.15,Berrybank 2 Wind Farm,-37.94,143.52,2026-02-26T14:39:22.503149
2026/02/27 00:40:00,BULGANA1,15.33,Bulgana Wind Farm Pty Ltd,Bulgana Green Power Hub,Wind,204.0,7.51,Bulgana Green Power Hub,-37.0975,142.973611,2026-02-26T14:39:22.503149
2026/02/27 00:40:00,CATHROCK,23.2,Cathedral Rocks Wind Farm Pty Ltd,Cathedral Rocks,Wind,66.0,35.15,Cathedral Rocks,-34.51,135.35,2026-02-26T14:39:22.503149
2026/02/27 00:40:00,CHYTWF1,10.47,Cherry Tree Wind Farm Pty Ltd as trustee for The Cherry Tree Project trust ,Cherry Tree Wind Farm,Wind,57.0,18.37,Cherry Tree Wind Farm,-37.1,145.26,2026-02-26T14:39:22.503149
2026/02/27 00:40:00,CLEMGPWF,4.03,Pacific Hydro Clements Gap Pty Ltd,Clements Gap Wind Farm,Wind,57.0,7.07,Clements Gap Wind Farm,-33.48,138.1,2026-02-26T14:39:22.503149
2026/02/27 00:40:00,CLRKCWF1,0.0,Stanwell Corporation Limited ,Clarke Creek Wind Farm,Wind,338.0,0.0,Clarke Creek Wind Farm,-22.85,149.45,2026-02-26T14:39:22.503149
2026/02/27 00:40:00,CLRKCWF2,0.0,Stanwell Corporation Limited ,Clarke Creek Wind Farm,Wind,101.0,0.0,Clarke Creek Wind Farm,-22.85,149.45,2026-02-26T14:39:22.503149
2026/02/27 00:40:00,CNUNDAWF,21.93,Canunda Power Pty Ltd,Canunda Wind Farm,Wind,46.0,47.67,Canunda Wind Farm,-37.73,140.39,2026-02-26T14:39:22.503149
2026/02/27 00:40:00,COLWF01,125.7,Collector Wind Farm Pty Ltd,Collector Wind Farm 1,Wind,219.0,57.4,Collector Wind Farm 1,-34.8719,149.3967,2026-02-26T14:39:22.503149
2026/02/27 00:40:00,COOPGWF1,182.7,PARF Company 10 Pty Limited as The Trustee for Coopers Gap Project Trust,Coopers Gap Wind Farm,Wind,440.0,41.52,Coopers Gap Wind Farm,-26.74,151.45,2026-02-26T14:39:22.503149
2026/02/27 00:40:00,CROOKWF2,60.54,Crookwell Development Pty Ltd ,Crookwell 2 Wind Farm,Wind,91.0,66.53,Crookwell 2 Wind Farm,-34.52,149.54,2026-02-26T14:39:22.503149
2026/02/27 00:40:00,CROOKWF3,33.2,Crookwell 3 Development Pty Ltd,Crookwell 3 Wind Farm,Wind,56.0,59.29,Crookwell 3 Wind Farm,-34.52,149.54,2026-02-26T14:39:22.503149
2026/02/27 00:40:00,CROWLWF1,11.08,Pacific Hydro Crowlands Pty Ltd ,Crowlands Wind Farm,Wind,79.0,14.03,Crowlands Wind Farm,-37.13,143.16,2026-02-26T14:39:22.503149
2026/02/27 00:40:00,CRURWF1,96.2,CRWF Nominees Pty Ltd As Trustee For The CRWF Trust,Crudine Ridge Wind Farm,Wind,138.0,69.71,Crudine Ridge Wind Farm,-32.97,149.64,2026-02-26T14:39:22.503149
2026/02/27 00:40:00,CTHLWF1,12.89,Wild Cattle Hill Pty Ltd,Cattle Hill Wind Farm,Wind,144.0,8.95,Cattle Hill Wind Farm,-42.15,146.69,2026-02-26T14:39:22.503149
2026/02/27 00:40:00,DULAWF1,162.3,Dulacca Energy Project Co Pty Ltd,Dulacca Wind Farm,Wind,173.0,93.82,Dulacca Wind Farm,-26.63,149.87,2026-02-26T14:39:22.503149
2026/02/27 00:40:00,DUNDWF1,69.44,Dundonnell Wind Farm Pty Ltd,Dundonnell Wind Farm,Wind,168.0,41.33,Dundonnell Wind Farm,-37.52,142.58,2026-02-26T14:39:22.503149
2026/02/27 00:40:00,DUNDWF2,20.48,Dundonnell Wind Farm Pty Ltd,Dundonnell Wind Farm,Wind,46.0,44.52,Dundonnell Wind Farm,-37.52,142.58,2026-02-26T14:39:22.503149
2026/02/27 00:40:00,DUNDWF3,66.47,Dundonnell Wind Farm Pty Ltd,Dundonnell Wind Farm,Wind,122.0,54.48,Dundonnell Wind Farm,-37.52,142.58,2026-02-26T14:39:22.503149
2026/02/27 00:40:00,ELAINWF1,9.72,Lal Lal Wind Farms Nom Co Pty Ltd,Elaine Wind Farm,Wind,82.0,11.85,Elaine Wind Farm,-37.36,144.0,2026-02-26T14:39:22.503149
2026/02/27 00:40:00,FLYCRKWF,73.27,Iberdrola Australia Energy Markets Pty Limited,Flyers Creek Wind Farm,Wind,140.0,52.34,Flyers Creek Wind Farm,-33.365556,148.981944,2026-02-26T14:39:22.503149
2026/02/27 00:40:00,GPWFEST1,100.64,Golden Plains WF1 Pty Ltd as Trustee for the Golden Plains WF1 Unit Trust,Golden Plains Wind Farm East,Wind,240.0,41.93,Golden Plains Wind Farm East,-37.945091,143.752614,2026-02-26T14:39:22.503149
2026/02/27 00:40:00,GPWFEST2,75.88,Golden Plains WF1 Pty Ltd as Trustee for the Golden Plains WF1 Unit Trust,Golden Plains Wind Farm East,Wind,253.0,29.99,Golden Plains Wind Farm East,-37.945091,143.752614,2026-02-26T14:39:22.503149
2026/02/27 00:40:00,GPWFEST3,105.39,Golden Plains WF1 Pty Ltd as Trustee for the Golden Plains WF1 Unit Trust,Golden Plains Wind Farm East,Wind,240.0,43.91,Golden Plains Wind Farm East,-37.945091,143.752614,2026-02-26T14:39:22.503149
2026/02/27 00:40:00,GRANWF1,0.0,Granville Harbour Operations Pty Ltd as The Trustee for Granville Harbour Operations Trust,Granville Harbour Wind Farm,Wind,111.0,0.0,Granville Harbour Wind Farm,-41.8,145.06,2026-02-26T14:39:22.503149
2026/02/27 00:40:00,GSWF1A,29.71,Goyder Wind Farm 1 Pty Ltd as the Trustee for Goyder Wind Farm 1 Trust,Goyder South Wind Farm 1A,Wind,201.0,14.78,Goyder South Wind Farm 1A,-33.679758,138.937597,2026-02-26T14:39:22.503149
2026/02/27 00:40:00,GSWF1B1,6.26,Goyder Wind Farm 1B Pty Ltd as the Trustee for the Goyder Wind Farm 1B Trust,Goyder South Wind Farm 1B,Wind,196.0,3.19,Goyder South Wind Farm 1B,-33.679758,138.937597,2026-02-26T14:39:22.503149
2026/02/27 00:40:00,GULLRWF1,130.12,New Gullen Range Wind Farm Pty Ltd,Gullen Range Wind Farm,Wind,161.0,80.82,Gullen Range Wind Farm,-34.34,149.27,2026-02-26T14:39:22.503149
2026/02/27 00:40:00,GULLRWF2,106.39,New Gullen Range Wind Farm Pty Ltd,Gullen Range Wind Farm,Wind,107.0,99.43,Gullen Range Wind Farm,-34.34,149.27,2026-02-26T14:39:22.503149
2026/02/27 00:40:00,GUNNING1,44.14,Gunning Wind Energy Developments Pty Ltd,Gunning Wind Farm,Wind,47.0,93.91,Gunning Wind Farm,-34.813333,149.4,2026-02-26T14:39:22.503149
2026/02/27 00:40:00,HALLWF1,16.36,AGL SA Generation Pty Limited,Hallett 1 Wind Farm,Wind,95.0,17.22,Hallett 1 Wind Farm,-33.367778,138.728611,2026-02-26T14:39:22.503149
2026/02/27 00:40:00,HALLWF2,9.96,AGL SA Generation Pty Limited,Hallett 2 Wind Farm,Wind,71.0,14.03,Hallett 2 Wind Farm,-33.367778,138.728611,2026-02-26T14:39:22.503149
2026/02/27 00:40:00,HD1WF1,39.53,Hawkesdale Asset Pty Ltd as trustee for Hawkesdale Asset Trust,Hawkesdale Wind Farm,Wind,89.0,44.42,Hawkesdale Wind Farm,-38.147894,142.361381,2026-02-26T14:39:22.503149
2026/02/27 00:40:00,HDWF1,36.3,HWF1 Pty Ltd,Hornsdale Wind Farm,Wind,102.0,35.59,Hornsdale Wind Farm,-33.050556,138.543611,2026-02-26T14:39:22.503149
2026/02/27 00:40:00,HDWF2,19.5,HWF 2 Pty Ltd,Hornsdale Wind Farm 2,Wind,102.0,19.12,Hornsdale Wind Farm 2,-33.06,138.54,2026-02-26T14:39:22.503149
2026/02/27 00:40:00,HDWF3,24.0,HWF3 Pty Ltd,Hornsdale Wind Farm 3,Wind,109.0,22.02,Hornsdale Wind Farm 3,-33.06,138.54,2026-02-26T14:39:22.503149
2026/02/27 00:40:00,KABANWF1,58.44,Kaban Wind Farm Pty Ltd as trustee for Kaban Wind Farm Trust,Kaban Wind Farm,Wind,152.0,38.45,Kaban Wind Farm,-17.56,145.41,2026-02-26T14:39:22.503149
2026/02/27 00:40:00,KEPWF1,41.3,Kennedy Energy Park Pty Ltd,Kennedy Energy Park,Wind,43.0,96.05,Kennedy Energy Park,-20.88,144.42,2026-02-26T14:39:22.503149
2026/02/27 00:40:00,KIATAWF1,21.5,Kiata ProjectCo Pty Ltd Atf Kiata Project Trust,Kiata Wind Farm,Wind,31.0,69.35,Kiata Wind Farm,-36.4,141.75,2026-02-26T14:39:22.503149
2026/02/27 00:40:00,LGAPWF1,0.0,Lincoln Gap Wind Farm (Operations) Pty Ltd,Lincoln Gap Wind Farm,Wind,123.0,0.0,Lincoln Gap Wind Farm,-32.564279,137.557328,2026-02-26T14:39:22.503149
2026/02/27 00:40:00,LGAPWF1,0.0,Lincoln Gap Wind Farm (Operations) Pty Ltd,Lincoln Gap Wind Farm,Wind,123.0,0.0,Lincoln Gap Wind Farm,-32.564279,137.557328,2026-02-26T14:39:22.503149
2026/02/27 00:40:00,LGAPWF2,0.14,Lincoln Gap Wind Farm (Operations) Pty Ltd,Lincoln Gap Wind Farm,Wind,85.0,0.16,Lincoln Gap Wind Farm,-32.564279,137.557328,2026-02-26T14:39:22.503149
2026/02/27 00:40:00,LGAPWF2,0.14,Lincoln Gap Wind Farm (Operations) Pty Ltd,Lincoln Gap Wind Farm,Wind,85.0,0.16,Lincoln Gap Wind Farm,-32.564279,137.557328,2026-02-26T14:39:22.503149
2026/02/27 00:40:00,LKBONNY1,31.17,Lake Bonney Wind Power Pty Ltd,Lake Bonney Wind Farm Stage 1,Wind,81.0,38.48,Lake Bonney Wind Farm Stage 1,-37.76,140.4,2026-02-26T14:39:22.503149
2026/02/27 00:40:00,LKBONNY2,86.57,Lake Bonney Wind Power Pty Ltd,Lake Bonney Stage 2 Windfarm,Wind,159.0,54.45,Lake Bonney Stage 2 Windfarm,-37.76,140.4,2026-02-26T14:39:22.503149
2026/02/27 00:40:00,LKBONNY3,21.77,Lake Bonney Wind Power Pty Ltd,Lake Bonney Stage 3 Wind Farm,Wind,39.0,55.82,Lake Bonney Stage 3 Wind Farm,-37.737781,140.388137,2026-02-26T14:39:22.503149
2026/02/27 00:40:00,MACARTH1,61.9,AGL Hydro Partnership,Macarthur Wind Farm,Wind,420.0,14.74,Macarthur Wind Farm,-38.048957,142.192112,2026-02-26T14:39:22.503149
2026/02/27 00:40:00,MCINTYR1,380.85,MacIntyre UJV Operator Pty Ltd,MacIntyre Wind Farm,Wind,890.0,42.79,MacIntyre Wind Farm,-28.32,151.54,2026-02-26T14:39:22.503149
2026/02/27 00:40:00,MERCER01,31.6,Mt Mercer Windfarm Pty Ltd,Mt Mercer Wind Farm,Wind,131.0,24.12,Mt Mercer Wind Farm,-37.841111,143.871111,2026-02-26T14:39:22.503149
2026/02/27 00:40:00,MEWF1,71.05,Ergon Energy Queensland Pty Ltd ,Mount Emerald Wind Farm,Wind,178.0,39.92,Mount Emerald Wind Farm,-17.133007,145.380644,2026-02-26T14:39:22.503149
2026/02/27 00:40:00,MRTLSWF1,65.98,Mortlake South Wind Farm Pty Ltd,Mortlake South Wind Farm,Wind,153.0,43.12,Mortlake South Wind Farm,-38.127337,142.857801,2026-02-26T14:39:22.503149
2026/02/27 00:40:00,MTGELWF1,75.87,Mt. Gellibrand Wind Farm Pty Ltd,Mt Gellibrand Wind Farm,Wind,132.0,57.48,Mt Gellibrand Wind Farm,-38.23,143.77,2026-02-26T14:39:22.503149
2026/02/27 00:40:00,MTMILLAR,6.7,Mt Millar Wind Farm Pty Ltd,Mt Millar Wind Farm,Wind,70.0,9.57,Mt Millar Wind Farm,-33.624444,136.703611,2026-02-26T14:39:22.503149
2026/02/27 00:40:00,MUSSELR1,44.8,Hydro-Electric Corporation,Musselroe Wind Farm,Wind,168.0,26.67,Musselroe Wind Farm,-40.780225,148.010799,2026-02-26T14:39:22.503149
2026/02/27 00:40:00,MUWAWF1,118.77,Telstra Energy (Generation) Pty Ltd,Murra Warra Wind Farm,Wind,225.7,52.62,Murra Warra Wind Farm,-36.432404,142.317853,2026-02-26T14:39:22.503149
2026/02/27 00:40:00,MUWAWF2,102.2,Murra Warra II Project Co Pty Ltd ATF The Murra Warra II Project Trust,Murra Warra Wind Farm Stage 2,Wind,203.0,50.34,Murra Warra Wind Farm Stage 2,-36.43,142.32,2026-02-26T14:39:22.503149
2026/02/27 00:40:00,NBHWF1,41.2,AGL SA Generation Pty Limited,North Brown Hill Wind Farm,Wind,132.0,31.21,North Brown Hill Wind Farm,-33.367778,138.728611,2026-02-26T14:39:22.503149
2026/02/27 00:40:00,OAKLAND1,11.3,AGL Hydro Partnership,Oaklands Hill Wind Farm,Wind,63.0,17.94,Oaklands Hill Wind Farm,-37.683078,142.551678,2026-02-26T14:39:22.503149
2026/02/27 00:40:00,PAREPW1,1.61,Iberdrola Australia Energy Markets Pty Limited,Port Augusta Renewable Energy Park,Wind,201.0,0.8,Port Augusta Renewable Energy Park,-32.566944,137.856111,2026-02-26T14:39:22.503149
2026/02/27 00:40:00,RYANCWF1,78.24,Ryan Corner Development Pty Ltd,Ryan Corner Wind Farm,Wind,205.0,38.17,Ryan Corner Wind Farm,-38.271017,142.140647,2026-02-26T14:39:22.503149
2026/02/27 00:40:00,RYEPARK1,350.4,Rye Park Renewable Energy Pty Ltd as trustee for Rye Park Wind Farm Trust,Rye Park Renewable Energy,Wind,384.0,91.25,Rye Park Renewable Energy,-32.138333,148.972778,2026-02-26T14:39:22.503149
2026/02/27 00:40:00,SALTCRK1,20.23,Salt Creek Wind Farm Pty Ltd,Salt Creek Wind Farm,Wind,54.0,37.46,Salt Creek Wind Farm,-37.95,142.63,2026-02-26T14:39:22.503149
2026/02/27 00:40:00,SAPHWF1,250.19,The Trustee For The SWF1 Operations Trust,Sapphire Wind Farm,Wind,270.0,92.66,Sapphire Wind Farm,-29.7,151.41,2026-02-26T14:39:22.503149
2026/02/27 00:40:00,SNOWNTH1,5.8,Snowtown Wind Farm Stage 2 Pty Ltd,Snowtown Wind Farm Stage 2 North,Wind,144.0,4.03,Snowtown Wind Farm Stage 2 North,-33.83,138.118611,2026-02-26T14:39:22.503149
2026/02/27 00:40:00,SNOWSTH1,24.4,Snowtown Wind Farm Stage 2 Pty Ltd,Snowtown South Wind Farm,Wind,126.0,19.37,Snowtown South Wind Farm,-33.83,138.118611,2026-02-26T14:39:22.503149
2026/02/27 00:40:00,SNOWTWN1,7.8,Snowtown Wind Farm Pty Ltd,Snowtown Wind Farm Units 1 And 47,Wind,99.0,7.88,Snowtown Wind Farm Units 1 And 47,-33.83,138.118611,2026-02-26T14:39:22.503149
2026/02/27 00:40:00,STARHLWF,23.29,Starfish Hill Wind Farm Pty Ltd,Starfish Hill Wind Farm,Wind,35.0,66.54,Starfish Hill Wind Farm,-35.58,138.14,2026-02-26T14:39:22.503149
2026/02/27 00:40:00,STOCKYD1,86.58,Stockyard Hill Wind Farm Pty Ltd,Stockyard Hill Wind Farm,Wind,511.0,16.94,Stockyard Hill Wind Farm,-37.535833,143.251389,2026-02-26T14:39:22.503149
2026/02/27 00:40:00,STWF1,18.02,PARF Company 8 Pty Ltd as The Trustee for Silverton Project Trust,Silverton Wind Farm,Wind,198.0,9.1,Silverton Wind Farm,-37.683168,142.551678,2026-02-26T14:39:22.503149
2026/02/27 00:40:00,TARALGA1,47.42,Taralga Wind Farm Nominees No 2 Pty Ltd (ATF Taralga Wind Farm Operating Trust),Taralga Wind Farm,Wind,106.0,44.74,Taralga Wind Farm,-34.42352,149.826267,2026-02-26T14:39:22.503149
2026/02/27 00:40:00,WAMBOWF1,44.19,Stanwell Corporation Limited,Wambo Wind Farm 1,Wind,245.0,18.04,Wambo Wind Farm 1,-35.187301,149.524945,2026-02-26T14:39:22.503149
2026/02/27 00:40:00,WATERLWF,44.2,Waterloo Wind Farm Pty Ltd,Waterloo Wind Farm,Wind,130.0,34.0,Waterloo Wind Farm,-34.00094,138.911567,2026-02-26T14:39:22.503149
2026/02/27 00:40:00,WGWF1,1.2,Willogoleche Power Pty Ltd As The Trustee For The Willogoleche Operating Trust,Willogoleche Wind Farm,Wind,119.0,1.01,Willogoleche Wind Farm,-33.39,138.85,2026-02-26T14:39:22.503149
2026/02/27 00:40:00,WOODLWN1,32.86,Woodlawn Wind Pty Ltd,Woodlawn Wind Farm,Wind,48.0,68.46,Woodlawn Wind Farm,-35.08,149.62,2026-02-26T14:39:22.503149
2026/02/27 00:40:00,WPWF,56.7,AGL SA Generation Pty Limited,Wattle Point Wind Farm,Wind,91.0,62.31,Wattle Point Wind Farm,-35.111624,137.7219,2026-02-26T14:39:22.503149
2026/02/27 00:40:00,WRWF1,160.43,White Rock Wind Farm Pty Ltd,White Rock Wind Farm,Wind,172.0,93.27,White Rock Wind Farm,-29.79,151.54,2026-02-26T14:39:22.503149
2026/02/27 00:40:00,YENDWF1,7.7,Lal Lal Wind Farms Nom Co Pty Ltd,Yendon Wind Farm,Wind,142.0,5.42,Yendon Wind Farm,-37.629987,144.022717,2026-02-26T14:39:22.503149
