SETTLEMENTDATE,DUID,SCADAVALUE,Participant,Station Name,Fuel Source - Primary,MAX_CAP,utilisation_pct,Plant,Latitude,Longitude,timestamp_utc
2026/03/27 19:40:00,CAPTL_WF,104.07,Iberdrola Australia Holdings Pty Limited,Capital Wind Farm,Wind,140.0,74.34,Capital Wind Farm,-35.1,149.31,2026-03-27T09:38:13.912863
2026/03/27 19:40:00,CHALLHWF,23.6,Pacific Hydro Challicum Hills Pty Ltd,Challicum Hills Wind Farm,Wind,52.0,45.38,Challicum Hills Wind Farm,-37.38,143.11,2026-03-27T09:38:13.912863
2026/03/27 19:40:00,CULLRGWF,22.2,Cullerin Range Wind Farm Pty Ltd,Cullerin Range Wind Farm,Wind,30.0,74.0,Cullerin Range Wind Farm,-34.81,149.4,2026-03-27T09:38:13.912863
2026/03/27 19:40:00,DIAPURWF1,8.3,Y.E.S. Energy (SA) Pty Ltd,Diapur Wind Farm,Wind,7.0,118.57,Diapur Wind Farm,-36.3425,141.43,2026-03-27T09:38:13.912863
2026/03/27 19:40:00,MLWF1,6.03,Mortons Lane Windfarm Pty Limited,Mortons Lane Wind Farm,Wind,20.0,30.15,Mortons Lane Wind Farm,-37.84,142.45,2026-03-27T09:38:13.912863
2026/03/27 19:40:00,WAUBRAWF,164.74,Pyrenees Wind Energy Developments Pty Ltd,Waubra Wind Farm,Wind,192.0,85.8,Waubra Wind Farm,-37.394498,143.638982,2026-03-27T09:38:13.912863
2026/03/27 19:40:00,WOOLNTH1,38.32,Hydro-Electric Corporation,Woolnorth Studland Bay / Bluff Point Wind Farm,Wind,140.0,27.37,Woolnorth Studland Bay / Bluff Point Wind Farm,-40.69,144.72,2026-03-27T09:38:13.912863
2026/03/27 19:40:00,YAMBUKWF,16.4,Energy Pacific (Vic) Pty Ltd,Yambuk Wind Farm,Wind,30.0,54.67,Yambuk Wind Farm,-38.299083,142.027577,2026-03-27T09:38:13.912863
2026/03/27 19:40:00,YSWF1,4.4,Pacific Hydro Yaloak South Pty Ltd,Yaloak South Wind Farm,Wind,28.0,15.71,Yaloak South Wind Farm,-37.7163,144.242853,2026-03-27T09:38:13.912863
2026/03/27 19:40:00,ARWF1,145.5,Ararat Wind Farm Pty Ltd,Ararat Wind Farm,Wind,241.0,60.37,Ararat Wind Farm,-37.232778,143.031389,2026-03-27T09:38:13.912863
2026/03/27 19:40:00,BALDHWF1,62.78,Alinta Energy Retail Sales Pty Ltd,Bald Hills Wind Farm,Wind,106.0,59.23,Bald Hills Wind Farm,-38.79,145.93,2026-03-27T09:38:13.912863
2026/03/27 19:40:00,BANGOWF1,115.9,BWF Nominees Pty Ltd as The Trustee for BWF Trust,Bango 973 Wind Farm,Wind,155.0,74.77,Bango 973 Wind Farm,-34.551582,148.732808,2026-03-27T09:38:13.912863
2026/03/27 19:40:00,BANGOWF2,49.1,BWF Nominees Pty Ltd as The Trustee for BWF Trust,Bango 999 Wind Farm,Wind,82.0,59.88,Bango 999 Wind Farm,-34.551582,148.732808,2026-03-27T09:38:13.912863
2026/03/27 19:40:00,BLUFF1,34.0,AGL SA Generation Pty Limited,The Bluff Wind Farm,Wind,53.0,64.15,The Bluff Wind Farm,-33.367778,138.728611,2026-03-27T09:38:13.912863
2026/03/27 19:40:00,BOCORWF1,97.83,Boco Rock Wind Farm Pty Ltd,Boco Rock Wind Farm,Wind,111.0,88.14,Boco Rock Wind Farm,-36.578611,149.103333,2026-03-27T09:38:13.912863
2026/03/27 19:40:00,BRYB1WF1,65.54,Berrybank Development Pty Ltd,Berrybank Wind Farm,Wind,175.9,37.26,Berrybank Wind Farm,-37.94,143.52,2026-03-27T09:38:13.912863
2026/03/27 19:40:00,BRYB2WF2,45.78,Berrybank 2 Asset Pty Ltd as trustee for Berrybank 2 Asset Trust,Berrybank 2 Wind Farm,Wind,105.0,43.6,Berrybank 2 Wind Farm,-37.94,143.52,2026-03-27T09:38:13.912863
2026/03/27 19:40:00,BULGANA1,125.7,Bulgana Wind Farm Pty Ltd,Bulgana Green Power Hub,Wind,204.0,61.62,Bulgana Green Power Hub,-37.0975,142.973611,2026-03-27T09:38:13.912863
2026/03/27 19:40:00,CATHROCK,10.3,Cathedral Rocks Wind Farm Pty Ltd,Cathedral Rocks,Wind,66.0,15.61,Cathedral Rocks,-34.51,135.35,2026-03-27T09:38:13.912863
2026/03/27 19:40:00,CHYTWF1,51.41,Cherry Tree Wind Farm Pty Ltd as trustee for The Cherry Tree Project trust ,Cherry Tree Wind Farm,Wind,57.0,90.19,Cherry Tree Wind Farm,-37.1,145.26,2026-03-27T09:38:13.912863
2026/03/27 19:40:00,CLEMGPWF,40.63,Pacific Hydro Clements Gap Pty Ltd,Clements Gap Wind Farm,Wind,57.0,71.28,Clements Gap Wind Farm,-33.48,138.1,2026-03-27T09:38:13.912863
2026/03/27 19:40:00,CLRKCWF1,24.04,Stanwell Corporation Limited ,Clarke Creek Wind Farm,Wind,338.0,7.11,Clarke Creek Wind Farm,-22.85,149.45,2026-03-27T09:38:13.912863
2026/03/27 19:40:00,CLRKCWF2,12.1,Stanwell Corporation Limited ,Clarke Creek Wind Farm,Wind,101.0,11.98,Clarke Creek Wind Farm,-22.85,149.45,2026-03-27T09:38:13.912863
2026/03/27 19:40:00,CNUNDAWF,0.2,Canunda Power Pty Ltd,Canunda Wind Farm,Wind,46.0,0.43,Canunda Wind Farm,-37.73,140.39,2026-03-27T09:38:13.912863
2026/03/27 19:40:00,COLWF01,115.69,Collector Wind Farm Pty Ltd,Collector Wind Farm 1,Wind,219.0,52.83,Collector Wind Farm 1,-34.8719,149.3967,2026-03-27T09:38:13.912863
2026/03/27 19:40:00,COOPGWF1,317.17,PARF Company 10 Pty Limited as The Trustee for Coopers Gap Project Trust,Coopers Gap Wind Farm,Wind,440.0,72.08,Coopers Gap Wind Farm,-26.74,151.45,2026-03-27T09:38:13.912863
2026/03/27 19:40:00,CROOKWF2,84.49,Crookwell Development Pty Ltd ,Crookwell 2 Wind Farm,Wind,91.0,92.85,Crookwell 2 Wind Farm,-34.52,149.54,2026-03-27T09:38:13.912863
2026/03/27 19:40:00,CROOKWF3,52.59,Crookwell 3 Development Pty Ltd,Crookwell 3 Wind Farm,Wind,56.0,93.91,Crookwell 3 Wind Farm,-34.52,149.54,2026-03-27T09:38:13.912863
2026/03/27 19:40:00,CROWLWF1,55.54,Pacific Hydro Crowlands Pty Ltd ,Crowlands Wind Farm,Wind,79.0,70.3,Crowlands Wind Farm,-37.13,143.16,2026-03-27T09:38:13.912863
2026/03/27 19:40:00,CRURWF1,130.5,CRWF Nominees Pty Ltd As Trustee For The CRWF Trust,Crudine Ridge Wind Farm,Wind,138.0,94.57,Crudine Ridge Wind Farm,-32.97,149.64,2026-03-27T09:38:13.912863
2026/03/27 19:40:00,CTHLWF1,41.1,Wild Cattle Hill Pty Ltd,Cattle Hill Wind Farm,Wind,144.0,28.54,Cattle Hill Wind Farm,-42.15,146.69,2026-03-27T09:38:13.912863
2026/03/27 19:40:00,DULAWF1,57.0,Dulacca Energy Project Co Pty Ltd,Dulacca Wind Farm,Wind,173.0,32.95,Dulacca Wind Farm,-26.63,149.87,2026-03-27T09:38:13.912863
2026/03/27 19:40:00,DUNDWF1,84.07,Dundonnell Wind Farm Pty Ltd,Dundonnell Wind Farm,Wind,168.0,50.04,Dundonnell Wind Farm,-37.52,142.58,2026-03-27T09:38:13.912863
2026/03/27 19:40:00,DUNDWF2,23.11,Dundonnell Wind Farm Pty Ltd,Dundonnell Wind Farm,Wind,46.0,50.24,Dundonnell Wind Farm,-37.52,142.58,2026-03-27T09:38:13.912863
2026/03/27 19:40:00,DUNDWF3,60.84,Dundonnell Wind Farm Pty Ltd,Dundonnell Wind Farm,Wind,122.0,49.87,Dundonnell Wind Farm,-37.52,142.58,2026-03-27T09:38:13.912863
2026/03/27 19:40:00,ELAINWF1,20.16,Lal Lal Wind Farms Nom Co Pty Ltd,Elaine Wind Farm,Wind,82.0,24.59,Elaine Wind Farm,-37.36,144.0,2026-03-27T09:38:13.912863
2026/03/27 19:40:00,FLYCRKWF,91.72,Iberdrola Australia Energy Markets Pty Limited,Flyers Creek Wind Farm,Wind,140.0,65.51,Flyers Creek Wind Farm,-33.365556,148.981944,2026-03-27T09:38:13.912863
2026/03/27 19:40:00,GPWFEST1,164.98,Golden Plains WF1 Pty Ltd as Trustee for the Golden Plains WF1 Unit Trust,Golden Plains Wind Farm East,Wind,240.0,68.74,Golden Plains Wind Farm East,-37.945091,143.752614,2026-03-27T09:38:13.912863
2026/03/27 19:40:00,GPWFEST2,115.84,Golden Plains WF1 Pty Ltd as Trustee for the Golden Plains WF1 Unit Trust,Golden Plains Wind Farm East,Wind,253.0,45.79,Golden Plains Wind Farm East,-37.945091,143.752614,2026-03-27T09:38:13.912863
2026/03/27 19:40:00,GPWFEST3,130.07,Golden Plains WF1 Pty Ltd as Trustee for the Golden Plains WF1 Unit Trust,Golden Plains Wind Farm East,Wind,240.0,54.2,Golden Plains Wind Farm East,-37.945091,143.752614,2026-03-27T09:38:13.912863
2026/03/27 19:40:00,GRANWF1,6.72,Granville Harbour Operations Pty Ltd as The Trustee for Granville Harbour Operations Trust,Granville Harbour Wind Farm,Wind,111.0,6.05,Granville Harbour Wind Farm,-41.8,145.06,2026-03-27T09:38:13.912863
2026/03/27 19:40:00,GSWF1A,84.41,Goyder Wind Farm 1 Pty Ltd as the Trustee for Goyder Wind Farm 1 Trust,Goyder South Wind Farm 1A,Wind,201.0,42.0,Goyder South Wind Farm 1A,-33.679758,138.937597,2026-03-27T09:38:13.912863
2026/03/27 19:40:00,GSWF1B1,96.42,Goyder Wind Farm 1B Pty Ltd as the Trustee for the Goyder Wind Farm 1B Trust,Goyder South Wind Farm 1B,Wind,196.0,49.19,Goyder South Wind Farm 1B,-33.679758,138.937597,2026-03-27T09:38:13.912863
2026/03/27 19:40:00,GULLRWF1,76.67,New Gullen Range Wind Farm Pty Ltd,Gullen Range Wind Farm,Wind,161.0,47.62,Gullen Range Wind Farm,-34.34,149.27,2026-03-27T09:38:13.912863
2026/03/27 19:40:00,GULLRWF2,25.5,New Gullen Range Wind Farm Pty Ltd,Gullen Range Wind Farm,Wind,107.0,23.83,Gullen Range Wind Farm,-34.34,149.27,2026-03-27T09:38:13.912863
2026/03/27 19:40:00,GUNNING1,14.35,Gunning Wind Energy Developments Pty Ltd,Gunning Wind Farm,Wind,47.0,30.53,Gunning Wind Farm,-34.813333,149.4,2026-03-27T09:38:13.912863
2026/03/27 19:40:00,HALLWF1,39.95,AGL SA Generation Pty Limited,Hallett 1 Wind Farm,Wind,95.0,42.05,Hallett 1 Wind Farm,-33.367778,138.728611,2026-03-27T09:38:13.912863
2026/03/27 19:40:00,HALLWF2,15.25,AGL SA Generation Pty Limited,Hallett 2 Wind Farm,Wind,71.0,21.48,Hallett 2 Wind Farm,-33.367778,138.728611,2026-03-27T09:38:13.912863
2026/03/27 19:40:00,HD1WF1,15.35,Hawkesdale Asset Pty Ltd as trustee for Hawkesdale Asset Trust,Hawkesdale Wind Farm,Wind,89.0,17.25,Hawkesdale Wind Farm,-38.147894,142.361381,2026-03-27T09:38:13.912863
2026/03/27 19:40:00,HDWF1,54.7,HWF1 Pty Ltd,Hornsdale Wind Farm,Wind,102.0,53.63,Hornsdale Wind Farm,-33.050556,138.543611,2026-03-27T09:38:13.912863
2026/03/27 19:40:00,HDWF2,55.2,HWF 2 Pty Ltd,Hornsdale Wind Farm 2,Wind,102.0,54.12,Hornsdale Wind Farm 2,-33.06,138.54,2026-03-27T09:38:13.912863
2026/03/27 19:40:00,HDWF3,58.5,HWF3 Pty Ltd,Hornsdale Wind Farm 3,Wind,109.0,53.67,Hornsdale Wind Farm 3,-33.06,138.54,2026-03-27T09:38:13.912863
2026/03/27 19:40:00,KABANWF1,20.62,Kaban Wind Farm Pty Ltd as trustee for Kaban Wind Farm Trust,Kaban Wind Farm,Wind,152.0,13.57,Kaban Wind Farm,-17.56,145.41,2026-03-27T09:38:13.912863
2026/03/27 19:40:00,KEPWF1,27.2,Kennedy Energy Park Pty Ltd,Kennedy Energy Park,Wind,43.0,63.26,Kennedy Energy Park,-20.88,144.42,2026-03-27T09:38:13.912863
2026/03/27 19:40:00,KIATAWF1,27.9,Kiata ProjectCo Pty Ltd Atf Kiata Project Trust,Kiata Wind Farm,Wind,31.0,90.0,Kiata Wind Farm,-36.4,141.75,2026-03-27T09:38:13.912863
2026/03/27 19:40:00,LGAPWF1,38.26,Lincoln Gap Wind Farm (Operations) Pty Ltd,Lincoln Gap Wind Farm,Wind,123.0,31.11,Lincoln Gap Wind Farm,-32.564279,137.557328,2026-03-27T09:38:13.912863
2026/03/27 19:40:00,LGAPWF1,38.26,Lincoln Gap Wind Farm (Operations) Pty Ltd,Lincoln Gap Wind Farm,Wind,123.0,31.11,Lincoln Gap Wind Farm,-32.564279,137.557328,2026-03-27T09:38:13.912863
2026/03/27 19:40:00,LGAPWF2,58.11,Lincoln Gap Wind Farm (Operations) Pty Ltd,Lincoln Gap Wind Farm,Wind,85.0,68.36,Lincoln Gap Wind Farm,-32.564279,137.557328,2026-03-27T09:38:13.912863
2026/03/27 19:40:00,LGAPWF2,58.11,Lincoln Gap Wind Farm (Operations) Pty Ltd,Lincoln Gap Wind Farm,Wind,85.0,68.36,Lincoln Gap Wind Farm,-32.564279,137.557328,2026-03-27T09:38:13.912863
2026/03/27 19:40:00,LKBONNY1,0.63,Lake Bonney Wind Power Pty Ltd,Lake Bonney Wind Farm Stage 1,Wind,81.0,0.78,Lake Bonney Wind Farm Stage 1,-37.76,140.4,2026-03-27T09:38:13.912863
2026/03/27 19:40:00,LKBONNY2,3.48,Lake Bonney Wind Power Pty Ltd,Lake Bonney Stage 2 Windfarm,Wind,159.0,2.19,Lake Bonney Stage 2 Windfarm,-37.76,140.4,2026-03-27T09:38:13.912863
2026/03/27 19:40:00,LKBONNY3,1.45,Lake Bonney Wind Power Pty Ltd,Lake Bonney Stage 3 Wind Farm,Wind,39.0,3.72,Lake Bonney Stage 3 Wind Farm,-37.737781,140.388137,2026-03-27T09:38:13.912863
2026/03/27 19:40:00,MACARTH1,38.1,AGL Hydro Partnership,Macarthur Wind Farm,Wind,420.0,9.07,Macarthur Wind Farm,-38.048957,142.192112,2026-03-27T09:38:13.912863
2026/03/27 19:40:00,MCINTYR1,314.97,MacIntyre UJV Operator Pty Ltd,MacIntyre Wind Farm,Wind,890.0,35.39,MacIntyre Wind Farm,-28.32,151.54,2026-03-27T09:38:13.912863
2026/03/27 19:40:00,MERCER01,38.4,Mt Mercer Windfarm Pty Ltd,Mt Mercer Wind Farm,Wind,131.0,29.31,Mt Mercer Wind Farm,-37.841111,143.871111,2026-03-27T09:38:13.912863
2026/03/27 19:40:00,MEWF1,13.65,Ergon Energy Queensland Pty Ltd ,Mount Emerald Wind Farm,Wind,178.0,7.67,Mount Emerald Wind Farm,-17.133007,145.380644,2026-03-27T09:38:13.912863
2026/03/27 19:40:00,MRTLSWF1,79.25,Mortlake South Wind Farm Pty Ltd,Mortlake South Wind Farm,Wind,153.0,51.8,Mortlake South Wind Farm,-38.127337,142.857801,2026-03-27T09:38:13.912863
2026/03/27 19:40:00,MTGELWF1,22.83,Mt. Gellibrand Wind Farm Pty Ltd,Mt Gellibrand Wind Farm,Wind,132.0,17.3,Mt Gellibrand Wind Farm,-38.23,143.77,2026-03-27T09:38:13.912863
2026/03/27 19:40:00,MTMILLAR,26.4,Mt Millar Wind Farm Pty Ltd,Mt Millar Wind Farm,Wind,70.0,37.71,Mt Millar Wind Farm,-33.624444,136.703611,2026-03-27T09:38:13.912863
2026/03/27 19:40:00,MUSSELR1,43.2,Hydro-Electric Corporation,Musselroe Wind Farm,Wind,168.0,25.71,Musselroe Wind Farm,-40.780225,148.010799,2026-03-27T09:38:13.912863
2026/03/27 19:40:00,MUWAWF1,156.06,Telstra Energy (Generation) Pty Ltd,Murra Warra Wind Farm,Wind,225.7,69.14,Murra Warra Wind Farm,-36.432404,142.317853,2026-03-27T09:38:13.912863
2026/03/27 19:40:00,MUWAWF2,94.1,Murra Warra II Project Co Pty Ltd ATF The Murra Warra II Project Trust,Murra Warra Wind Farm Stage 2,Wind,203.0,46.35,Murra Warra Wind Farm Stage 2,-36.43,142.32,2026-03-27T09:38:13.912863
2026/03/27 19:40:00,NBHWF1,73.8,AGL SA Generation Pty Limited,North Brown Hill Wind Farm,Wind,132.0,55.91,North Brown Hill Wind Farm,-33.367778,138.728611,2026-03-27T09:38:13.912863
2026/03/27 19:40:00,OAKLAND1,32.4,AGL Hydro Partnership,Oaklands Hill Wind Farm,Wind,63.0,51.43,Oaklands Hill Wind Farm,-37.683078,142.551678,2026-03-27T09:38:13.912863
2026/03/27 19:40:00,PAREPW1,184.31,Iberdrola Australia Energy Markets Pty Limited,Port Augusta Renewable Energy Park,Wind,201.0,91.7,Port Augusta Renewable Energy Park,-32.566944,137.856111,2026-03-27T09:38:13.912863
2026/03/27 19:40:00,RYANCWF1,74.92,Ryan Corner Development Pty Ltd,Ryan Corner Wind Farm,Wind,205.0,36.55,Ryan Corner Wind Farm,-38.271017,142.140647,2026-03-27T09:38:13.912863
2026/03/27 19:40:00,RYEPARK1,199.69,Rye Park Renewable Energy Pty Ltd as trustee for Rye Park Wind Farm Trust,Rye Park Renewable Energy,Wind,384.0,52.0,Rye Park Renewable Energy,-32.138333,148.972778,2026-03-27T09:38:13.912863
2026/03/27 19:40:00,SALTCRK1,13.39,Salt Creek Wind Farm Pty Ltd,Salt Creek Wind Farm,Wind,54.0,24.8,Salt Creek Wind Farm,-37.95,142.63,2026-03-27T09:38:13.912863
2026/03/27 19:40:00,SAPHWF1,216.03,The Trustee For The SWF1 Operations Trust,Sapphire Wind Farm,Wind,270.0,80.01,Sapphire Wind Farm,-29.7,151.41,2026-03-27T09:38:13.912863
2026/03/27 19:40:00,SNOWNTH1,83.9,Snowtown Wind Farm Stage 2 Pty Ltd,Snowtown Wind Farm Stage 2 North,Wind,144.0,58.26,Snowtown Wind Farm Stage 2 North,-33.83,138.118611,2026-03-27T09:38:13.912863
2026/03/27 19:40:00,SNOWSTH1,65.7,Snowtown Wind Farm Stage 2 Pty Ltd,Snowtown South Wind Farm,Wind,126.0,52.14,Snowtown South Wind Farm,-33.83,138.118611,2026-03-27T09:38:13.912863
2026/03/27 19:40:00,SNOWTWN1,43.22,Snowtown Wind Farm Pty Ltd,Snowtown Wind Farm Units 1 And 47,Wind,99.0,43.66,Snowtown Wind Farm Units 1 And 47,-33.83,138.118611,2026-03-27T09:38:13.912863
2026/03/27 19:40:00,STARHLWF,5.7,Starfish Hill Wind Farm Pty Ltd,Starfish Hill Wind Farm,Wind,35.0,16.29,Starfish Hill Wind Farm,-35.58,138.14,2026-03-27T09:38:13.912863
2026/03/27 19:40:00,STOCKYD1,343.33,Stockyard Hill Wind Farm Pty Ltd,Stockyard Hill Wind Farm,Wind,511.0,67.19,Stockyard Hill Wind Farm,-37.535833,143.251389,2026-03-27T09:38:13.912863
2026/03/27 19:40:00,STWF1,67.09,PARF Company 8 Pty Ltd as The Trustee for Silverton Project Trust,Silverton Wind Farm,Wind,198.0,33.88,Silverton Wind Farm,-37.683168,142.551678,2026-03-27T09:38:13.912863
2026/03/27 19:40:00,TARALGA1,88.94,Taralga Wind Farm Nominees No 2 Pty Ltd (ATF Taralga Wind Farm Operating Trust),Taralga Wind Farm,Wind,106.0,83.91,Taralga Wind Farm,-34.42352,149.826267,2026-03-27T09:38:13.912863
2026/03/27 19:40:00,WAMBOWF1,229.57,Stanwell Corporation Limited,Wambo Wind Farm 1,Wind,245.0,93.7,Wambo Wind Farm 1,-35.187301,149.524945,2026-03-27T09:38:13.912863
2026/03/27 19:40:00,WATERLWF,14.0,Waterloo Wind Farm Pty Ltd,Waterloo Wind Farm,Wind,130.0,10.77,Waterloo Wind Farm,-34.00094,138.911567,2026-03-27T09:38:13.912863
2026/03/27 19:40:00,WGWF1,9.5,Willogoleche Power Pty Ltd As The Trustee For The Willogoleche Operating Trust,Willogoleche Wind Farm,Wind,119.0,7.98,Willogoleche Wind Farm,-33.39,138.85,2026-03-27T09:38:13.912863
2026/03/27 19:40:00,WOODLWN1,40.3,Woodlawn Wind Pty Ltd,Woodlawn Wind Farm,Wind,48.0,83.96,Woodlawn Wind Farm,-35.08,149.62,2026-03-27T09:38:13.912863
2026/03/27 19:40:00,WPWF,48.56,AGL SA Generation Pty Limited,Wattle Point Wind Farm,Wind,91.0,53.36,Wattle Point Wind Farm,-35.111624,137.7219,2026-03-27T09:38:13.912863
2026/03/27 19:40:00,WRWF1,157.9,White Rock Wind Farm Pty Ltd,White Rock Wind Farm,Wind,172.0,91.8,White Rock Wind Farm,-29.79,151.54,2026-03-27T09:38:13.912863
2026/03/27 19:40:00,YENDWF1,41.25,Lal Lal Wind Farms Nom Co Pty Ltd,Yendon Wind Farm,Wind,142.0,29.05,Yendon Wind Farm,-37.629987,144.022717,2026-03-27T09:38:13.912863
