SETTLEMENTDATE,DUID,SCADAVALUE,Participant,Station Name,Fuel Source - Primary,MAX_CAP,utilisation_pct,Plant,Latitude,Longitude,timestamp_utc
2026/02/17 20:05:00,CAPTL_WF,31.85,Iberdrola Australia Holdings Pty Limited,Capital Wind Farm,Wind,140.0,22.75,Capital Wind Farm,-35.1,149.31,2026-02-17T10:03:10.801095
2026/02/17 20:05:00,CHALLHWF,9.4,Pacific Hydro Challicum Hills Pty Ltd,Challicum Hills Wind Farm,Wind,52.0,18.08,Challicum Hills Wind Farm,-37.38,143.11,2026-02-17T10:03:10.801095
2026/02/17 20:05:00,CULLRGWF,11.49,Cullerin Range Wind Farm Pty Ltd,Cullerin Range Wind Farm,Wind,30.0,38.3,Cullerin Range Wind Farm,-34.81,149.4,2026-02-17T10:03:10.801095
2026/02/17 20:05:00,DIAPURWF1,8.3,Y.E.S. Energy (SA) Pty Ltd,Diapur Wind Farm,Wind,7.0,118.57,Diapur Wind Farm,-36.3425,141.43,2026-02-17T10:03:10.801095
2026/02/17 20:05:00,MLWF1,5.04,Mortons Lane Windfarm Pty Limited,Mortons Lane Wind Farm,Wind,20.0,25.2,Mortons Lane Wind Farm,-37.84,142.45,2026-02-17T10:03:10.801095
2026/02/17 20:05:00,WAUBRAWF,118.69,Pyrenees Wind Energy Developments Pty Ltd,Waubra Wind Farm,Wind,192.0,61.82,Waubra Wind Farm,-37.394498,143.638982,2026-02-17T10:03:10.801095
2026/02/17 20:05:00,WOOLNTH1,86.23,Hydro-Electric Corporation,Woolnorth Studland Bay / Bluff Point Wind Farm,Wind,140.0,61.59,Woolnorth Studland Bay / Bluff Point Wind Farm,-40.69,144.72,2026-02-17T10:03:10.801095
2026/02/17 20:05:00,YAMBUKWF,22.6,Energy Pacific (Vic) Pty Ltd,Yambuk Wind Farm,Wind,30.0,75.33,Yambuk Wind Farm,-38.299083,142.027577,2026-02-17T10:03:10.801095
2026/02/17 20:05:00,YSWF1,17.9,Pacific Hydro Yaloak South Pty Ltd,Yaloak South Wind Farm,Wind,28.0,63.93,Yaloak South Wind Farm,-37.7163,144.242853,2026-02-17T10:03:10.801095
2026/02/17 20:05:00,ARWF1,110.4,Ararat Wind Farm Pty Ltd,Ararat Wind Farm,Wind,241.0,45.81,Ararat Wind Farm,-37.232778,143.031389,2026-02-17T10:03:10.801095
2026/02/17 20:05:00,BALDHWF1,60.81,Alinta Energy Retail Sales Pty Ltd,Bald Hills Wind Farm,Wind,106.0,57.37,Bald Hills Wind Farm,-38.79,145.93,2026-02-17T10:03:10.801095
2026/02/17 20:05:00,BANGOWF1,65.4,BWF Nominees Pty Ltd as The Trustee for BWF Trust,Bango 973 Wind Farm,Wind,155.0,42.19,Bango 973 Wind Farm,-34.551582,148.732808,2026-02-17T10:03:10.801095
2026/02/17 20:05:00,BANGOWF2,27.7,BWF Nominees Pty Ltd as The Trustee for BWF Trust,Bango 999 Wind Farm,Wind,82.0,33.78,Bango 999 Wind Farm,-34.551582,148.732808,2026-02-17T10:03:10.801095
2026/02/17 20:05:00,BLUFF1,18.8,AGL SA Generation Pty Limited,The Bluff Wind Farm,Wind,53.0,35.47,The Bluff Wind Farm,-33.367778,138.728611,2026-02-17T10:03:10.801095
2026/02/17 20:05:00,BOCORWF1,75.49,Boco Rock Wind Farm Pty Ltd,Boco Rock Wind Farm,Wind,111.0,68.01,Boco Rock Wind Farm,-36.578611,149.103333,2026-02-17T10:03:10.801095
2026/02/17 20:05:00,BRYB1WF1,57.93,Berrybank Development Pty Ltd,Berrybank Wind Farm,Wind,175.9,32.93,Berrybank Wind Farm,-37.94,143.52,2026-02-17T10:03:10.801095
2026/02/17 20:05:00,BRYB2WF2,41.76,Berrybank 2 Asset Pty Ltd as trustee for Berrybank 2 Asset Trust,Berrybank 2 Wind Farm,Wind,105.0,39.77,Berrybank 2 Wind Farm,-37.94,143.52,2026-02-17T10:03:10.801095
2026/02/17 20:05:00,BULGANA1,71.29,Bulgana Wind Farm Pty Ltd,Bulgana Green Power Hub,Wind,204.0,34.95,Bulgana Green Power Hub,-37.0975,142.973611,2026-02-17T10:03:10.801095
2026/02/17 20:05:00,CATHROCK,23.2,Cathedral Rocks Wind Farm Pty Ltd,Cathedral Rocks,Wind,66.0,35.15,Cathedral Rocks,-34.51,135.35,2026-02-17T10:03:10.801095
2026/02/17 20:05:00,CHYTWF1,14.76,Cherry Tree Wind Farm Pty Ltd as trustee for The Cherry Tree Project trust ,Cherry Tree Wind Farm,Wind,57.0,25.89,Cherry Tree Wind Farm,-37.1,145.26,2026-02-17T10:03:10.801095
2026/02/17 20:05:00,CLEMGPWF,46.1,Pacific Hydro Clements Gap Pty Ltd,Clements Gap Wind Farm,Wind,57.0,80.88,Clements Gap Wind Farm,-33.48,138.1,2026-02-17T10:03:10.801095
2026/02/17 20:05:00,CLRKCWF1,295.52,Stanwell Corporation Limited ,Clarke Creek Wind Farm,Wind,338.0,87.43,Clarke Creek Wind Farm,-22.85,149.45,2026-02-17T10:03:10.801095
2026/02/17 20:05:00,CLRKCWF2,91.84,Stanwell Corporation Limited ,Clarke Creek Wind Farm,Wind,101.0,90.93,Clarke Creek Wind Farm,-22.85,149.45,2026-02-17T10:03:10.801095
2026/02/17 20:05:00,CNUNDAWF,12.01,Canunda Power Pty Ltd,Canunda Wind Farm,Wind,46.0,26.11,Canunda Wind Farm,-37.73,140.39,2026-02-17T10:03:10.801095
2026/02/17 20:05:00,COLWF01,45.98,Collector Wind Farm Pty Ltd,Collector Wind Farm 1,Wind,219.0,21.0,Collector Wind Farm 1,-34.8719,149.3967,2026-02-17T10:03:10.801095
2026/02/17 20:05:00,COOPGWF1,300.78,PARF Company 10 Pty Limited as The Trustee for Coopers Gap Project Trust,Coopers Gap Wind Farm,Wind,440.0,68.36,Coopers Gap Wind Farm,-26.74,151.45,2026-02-17T10:03:10.801095
2026/02/17 20:05:00,CROOKWF2,29.31,Crookwell Development Pty Ltd ,Crookwell 2 Wind Farm,Wind,91.0,32.21,Crookwell 2 Wind Farm,-34.52,149.54,2026-02-17T10:03:10.801095
2026/02/17 20:05:00,CROOKWF3,18.45,Crookwell 3 Development Pty Ltd,Crookwell 3 Wind Farm,Wind,56.0,32.95,Crookwell 3 Wind Farm,-34.52,149.54,2026-02-17T10:03:10.801095
2026/02/17 20:05:00,CROWLWF1,54.33,Pacific Hydro Crowlands Pty Ltd ,Crowlands Wind Farm,Wind,79.0,68.77,Crowlands Wind Farm,-37.13,143.16,2026-02-17T10:03:10.801095
2026/02/17 20:05:00,CRURWF1,23.1,CRWF Nominees Pty Ltd As Trustee For The CRWF Trust,Crudine Ridge Wind Farm,Wind,138.0,16.74,Crudine Ridge Wind Farm,-32.97,149.64,2026-02-17T10:03:10.801095
2026/02/17 20:05:00,CTHLWF1,137.65,Wild Cattle Hill Pty Ltd,Cattle Hill Wind Farm,Wind,144.0,95.59,Cattle Hill Wind Farm,-42.15,146.69,2026-02-17T10:03:10.801095
2026/02/17 20:05:00,DULAWF1,33.9,Dulacca Energy Project Co Pty Ltd,Dulacca Wind Farm,Wind,173.0,19.6,Dulacca Wind Farm,-26.63,149.87,2026-02-17T10:03:10.801095
2026/02/17 20:05:00,DUNDWF1,39.1,Dundonnell Wind Farm Pty Ltd,Dundonnell Wind Farm,Wind,168.0,23.27,Dundonnell Wind Farm,-37.52,142.58,2026-02-17T10:03:10.801095
2026/02/17 20:05:00,DUNDWF2,10.83,Dundonnell Wind Farm Pty Ltd,Dundonnell Wind Farm,Wind,46.0,23.54,Dundonnell Wind Farm,-37.52,142.58,2026-02-17T10:03:10.801095
2026/02/17 20:05:00,DUNDWF3,20.87,Dundonnell Wind Farm Pty Ltd,Dundonnell Wind Farm,Wind,122.0,17.11,Dundonnell Wind Farm,-37.52,142.58,2026-02-17T10:03:10.801095
2026/02/17 20:05:00,ELAINWF1,24.94,Lal Lal Wind Farms Nom Co Pty Ltd,Elaine Wind Farm,Wind,82.0,30.41,Elaine Wind Farm,-37.36,144.0,2026-02-17T10:03:10.801095
2026/02/17 20:05:00,FLYCRKWF,5.34,Iberdrola Australia Energy Markets Pty Limited,Flyers Creek Wind Farm,Wind,140.0,3.81,Flyers Creek Wind Farm,-33.365556,148.981944,2026-02-17T10:03:10.801095
2026/02/17 20:05:00,GPWFEST1,58.19,Golden Plains WF1 Pty Ltd as Trustee for the Golden Plains WF1 Unit Trust,Golden Plains Wind Farm East,Wind,240.0,24.25,Golden Plains Wind Farm East,-37.945091,143.752614,2026-02-17T10:03:10.801095
2026/02/17 20:05:00,GPWFEST2,51.3,Golden Plains WF1 Pty Ltd as Trustee for the Golden Plains WF1 Unit Trust,Golden Plains Wind Farm East,Wind,253.0,20.28,Golden Plains Wind Farm East,-37.945091,143.752614,2026-02-17T10:03:10.801095
2026/02/17 20:05:00,GPWFEST3,54.35,Golden Plains WF1 Pty Ltd as Trustee for the Golden Plains WF1 Unit Trust,Golden Plains Wind Farm East,Wind,240.0,22.65,Golden Plains Wind Farm East,-37.945091,143.752614,2026-02-17T10:03:10.801095
2026/02/17 20:05:00,GRANWF1,0.0,Granville Harbour Operations Pty Ltd as The Trustee for Granville Harbour Operations Trust,Granville Harbour Wind Farm,Wind,111.0,0.0,Granville Harbour Wind Farm,-41.8,145.06,2026-02-17T10:03:10.801095
2026/02/17 20:05:00,GSWF1A,123.21,Goyder Wind Farm 1 Pty Ltd as the Trustee for Goyder Wind Farm 1 Trust,Goyder South Wind Farm 1A,Wind,201.0,61.3,Goyder South Wind Farm 1A,-33.679758,138.937597,2026-02-17T10:03:10.801095
2026/02/17 20:05:00,GSWF1B1,114.34,Goyder Wind Farm 1B Pty Ltd as the Trustee for the Goyder Wind Farm 1B Trust,Goyder South Wind Farm 1B,Wind,196.0,58.34,Goyder South Wind Farm 1B,-33.679758,138.937597,2026-02-17T10:03:10.801095
2026/02/17 20:05:00,GULLRWF1,38.77,New Gullen Range Wind Farm Pty Ltd,Gullen Range Wind Farm,Wind,161.0,24.08,Gullen Range Wind Farm,-34.34,149.27,2026-02-17T10:03:10.801095
2026/02/17 20:05:00,GULLRWF2,30.86,New Gullen Range Wind Farm Pty Ltd,Gullen Range Wind Farm,Wind,107.0,28.84,Gullen Range Wind Farm,-34.34,149.27,2026-02-17T10:03:10.801095
2026/02/17 20:05:00,GUNNING1,22.55,Gunning Wind Energy Developments Pty Ltd,Gunning Wind Farm,Wind,47.0,47.98,Gunning Wind Farm,-34.813333,149.4,2026-02-17T10:03:10.801095
2026/02/17 20:05:00,HALLWF1,70.05,AGL SA Generation Pty Limited,Hallett 1 Wind Farm,Wind,95.0,73.74,Hallett 1 Wind Farm,-33.367778,138.728611,2026-02-17T10:03:10.801095
2026/02/17 20:05:00,HALLWF2,49.16,AGL SA Generation Pty Limited,Hallett 2 Wind Farm,Wind,71.0,69.24,Hallett 2 Wind Farm,-33.367778,138.728611,2026-02-17T10:03:10.801095
2026/02/17 20:05:00,HD1WF1,56.55,Hawkesdale Asset Pty Ltd as trustee for Hawkesdale Asset Trust,Hawkesdale Wind Farm,Wind,89.0,63.54,Hawkesdale Wind Farm,-38.147894,142.361381,2026-02-17T10:03:10.801095
2026/02/17 20:05:00,HDWF1,74.3,HWF1 Pty Ltd,Hornsdale Wind Farm,Wind,102.0,72.84,Hornsdale Wind Farm,-33.050556,138.543611,2026-02-17T10:03:10.801095
2026/02/17 20:05:00,HDWF2,71.0,HWF 2 Pty Ltd,Hornsdale Wind Farm 2,Wind,102.0,69.61,Hornsdale Wind Farm 2,-33.06,138.54,2026-02-17T10:03:10.801095
2026/02/17 20:05:00,HDWF3,82.2,HWF3 Pty Ltd,Hornsdale Wind Farm 3,Wind,109.0,75.41,Hornsdale Wind Farm 3,-33.06,138.54,2026-02-17T10:03:10.801095
2026/02/17 20:05:00,KABANWF1,35.74,Kaban Wind Farm Pty Ltd as trustee for Kaban Wind Farm Trust,Kaban Wind Farm,Wind,152.0,23.51,Kaban Wind Farm,-17.56,145.41,2026-02-17T10:03:10.801095
2026/02/17 20:05:00,KEPWF1,0.0,Kennedy Energy Park Pty Ltd,Kennedy Energy Park,Wind,43.0,0.0,Kennedy Energy Park,-20.88,144.42,2026-02-17T10:03:10.801095
2026/02/17 20:05:00,KIATAWF1,17.8,Kiata ProjectCo Pty Ltd Atf Kiata Project Trust,Kiata Wind Farm,Wind,31.0,57.42,Kiata Wind Farm,-36.4,141.75,2026-02-17T10:03:10.801095
2026/02/17 20:05:00,LGAPWF1,73.73,Lincoln Gap Wind Farm (Operations) Pty Ltd,Lincoln Gap Wind Farm,Wind,123.0,59.94,Lincoln Gap Wind Farm,-32.564279,137.557328,2026-02-17T10:03:10.801095
2026/02/17 20:05:00,LGAPWF1,73.73,Lincoln Gap Wind Farm (Operations) Pty Ltd,Lincoln Gap Wind Farm,Wind,123.0,59.94,Lincoln Gap Wind Farm,-32.564279,137.557328,2026-02-17T10:03:10.801095
2026/02/17 20:05:00,LGAPWF2,81.77,Lincoln Gap Wind Farm (Operations) Pty Ltd,Lincoln Gap Wind Farm,Wind,85.0,96.2,Lincoln Gap Wind Farm,-32.564279,137.557328,2026-02-17T10:03:10.801095
2026/02/17 20:05:00,LGAPWF2,81.77,Lincoln Gap Wind Farm (Operations) Pty Ltd,Lincoln Gap Wind Farm,Wind,85.0,96.2,Lincoln Gap Wind Farm,-32.564279,137.557328,2026-02-17T10:03:10.801095
2026/02/17 20:05:00,LKBONNY1,18.13,Lake Bonney Wind Power Pty Ltd,Lake Bonney Wind Farm Stage 1,Wind,81.0,22.38,Lake Bonney Wind Farm Stage 1,-37.76,140.4,2026-02-17T10:03:10.801095
2026/02/17 20:05:00,LKBONNY2,49.59,Lake Bonney Wind Power Pty Ltd,Lake Bonney Stage 2 Windfarm,Wind,159.0,31.19,Lake Bonney Stage 2 Windfarm,-37.76,140.4,2026-02-17T10:03:10.801095
2026/02/17 20:05:00,LKBONNY3,14.9,Lake Bonney Wind Power Pty Ltd,Lake Bonney Stage 3 Wind Farm,Wind,39.0,38.21,Lake Bonney Stage 3 Wind Farm,-37.737781,140.388137,2026-02-17T10:03:10.801095
2026/02/17 20:05:00,MACARTH1,98.3,AGL Hydro Partnership,Macarthur Wind Farm,Wind,420.0,23.4,Macarthur Wind Farm,-38.048957,142.192112,2026-02-17T10:03:10.801095
2026/02/17 20:05:00,MCINTYR1,158.2,MacIntyre UJV Operator Pty Ltd,MacIntyre Wind Farm,Wind,890.0,17.78,MacIntyre Wind Farm,-28.32,151.54,2026-02-17T10:03:10.801095
2026/02/17 20:05:00,MERCER01,70.5,Mt Mercer Windfarm Pty Ltd,Mt Mercer Wind Farm,Wind,131.0,53.82,Mt Mercer Wind Farm,-37.841111,143.871111,2026-02-17T10:03:10.801095
2026/02/17 20:05:00,MEWF1,34.97,Ergon Energy Queensland Pty Ltd ,Mount Emerald Wind Farm,Wind,178.0,19.65,Mount Emerald Wind Farm,-17.133007,145.380644,2026-02-17T10:03:10.801095
2026/02/17 20:05:00,MRTLSWF1,94.11,Mortlake South Wind Farm Pty Ltd,Mortlake South Wind Farm,Wind,153.0,61.51,Mortlake South Wind Farm,-38.127337,142.857801,2026-02-17T10:03:10.801095
2026/02/17 20:05:00,MTGELWF1,58.78,Mt. Gellibrand Wind Farm Pty Ltd,Mt Gellibrand Wind Farm,Wind,132.0,44.53,Mt Gellibrand Wind Farm,-38.23,143.77,2026-02-17T10:03:10.801095
2026/02/17 20:05:00,MTMILLAR,25.4,Mt Millar Wind Farm Pty Ltd,Mt Millar Wind Farm,Wind,70.0,36.29,Mt Millar Wind Farm,-33.624444,136.703611,2026-02-17T10:03:10.801095
2026/02/17 20:05:00,MUSSELR1,9.2,Hydro-Electric Corporation,Musselroe Wind Farm,Wind,168.0,5.48,Musselroe Wind Farm,-40.780225,148.010799,2026-02-17T10:03:10.801095
2026/02/17 20:05:00,MUWAWF1,145.02,Telstra Energy (Generation) Pty Ltd,Murra Warra Wind Farm,Wind,225.7,64.25,Murra Warra Wind Farm,-36.432404,142.317853,2026-02-17T10:03:10.801095
2026/02/17 20:05:00,MUWAWF2,141.6,Murra Warra II Project Co Pty Ltd ATF The Murra Warra II Project Trust,Murra Warra Wind Farm Stage 2,Wind,203.0,69.75,Murra Warra Wind Farm Stage 2,-36.43,142.32,2026-02-17T10:03:10.801095
2026/02/17 20:05:00,NBHWF1,103.6,AGL SA Generation Pty Limited,North Brown Hill Wind Farm,Wind,132.0,78.48,North Brown Hill Wind Farm,-33.367778,138.728611,2026-02-17T10:03:10.801095
2026/02/17 20:05:00,OAKLAND1,15.5,AGL Hydro Partnership,Oaklands Hill Wind Farm,Wind,63.0,24.6,Oaklands Hill Wind Farm,-37.683078,142.551678,2026-02-17T10:03:10.801095
2026/02/17 20:05:00,PAREPW1,192.89,Iberdrola Australia Energy Markets Pty Limited,Port Augusta Renewable Energy Park,Wind,201.0,95.97,Port Augusta Renewable Energy Park,-32.566944,137.856111,2026-02-17T10:03:10.801095
2026/02/17 20:05:00,RYANCWF1,74.75,Ryan Corner Development Pty Ltd,Ryan Corner Wind Farm,Wind,205.0,36.46,Ryan Corner Wind Farm,-38.271017,142.140647,2026-02-17T10:03:10.801095
2026/02/17 20:05:00,RYEPARK1,153.19,Rye Park Renewable Energy Pty Ltd as trustee for Rye Park Wind Farm Trust,Rye Park Renewable Energy,Wind,384.0,39.89,Rye Park Renewable Energy,-32.138333,148.972778,2026-02-17T10:03:10.801095
2026/02/17 20:05:00,SALTCRK1,17.82,Salt Creek Wind Farm Pty Ltd,Salt Creek Wind Farm,Wind,54.0,33.0,Salt Creek Wind Farm,-37.95,142.63,2026-02-17T10:03:10.801095
2026/02/17 20:05:00,SAPHWF1,108.73,The Trustee For The SWF1 Operations Trust,Sapphire Wind Farm,Wind,270.0,40.27,Sapphire Wind Farm,-29.7,151.41,2026-02-17T10:03:10.801095
2026/02/17 20:05:00,SNOWNTH1,52.2,Snowtown Wind Farm Stage 2 Pty Ltd,Snowtown Wind Farm Stage 2 North,Wind,144.0,36.25,Snowtown Wind Farm Stage 2 North,-33.83,138.118611,2026-02-17T10:03:10.801095
2026/02/17 20:05:00,SNOWSTH1,51.7,Snowtown Wind Farm Stage 2 Pty Ltd,Snowtown South Wind Farm,Wind,126.0,41.03,Snowtown South Wind Farm,-33.83,138.118611,2026-02-17T10:03:10.801095
2026/02/17 20:05:00,SNOWTWN1,32.75,Snowtown Wind Farm Pty Ltd,Snowtown Wind Farm Units 1 And 47,Wind,99.0,33.08,Snowtown Wind Farm Units 1 And 47,-33.83,138.118611,2026-02-17T10:03:10.801095
2026/02/17 20:05:00,STARHLWF,10.0,Starfish Hill Wind Farm Pty Ltd,Starfish Hill Wind Farm,Wind,35.0,28.57,Starfish Hill Wind Farm,-35.58,138.14,2026-02-17T10:03:10.801095
2026/02/17 20:05:00,STOCKYD1,179.54,Stockyard Hill Wind Farm Pty Ltd,Stockyard Hill Wind Farm,Wind,511.0,35.14,Stockyard Hill Wind Farm,-37.535833,143.251389,2026-02-17T10:03:10.801095
2026/02/17 20:05:00,STWF1,1.72,PARF Company 8 Pty Ltd as The Trustee for Silverton Project Trust,Silverton Wind Farm,Wind,198.0,0.87,Silverton Wind Farm,-37.683168,142.551678,2026-02-17T10:03:10.801095
2026/02/17 20:05:00,TARALGA1,0.0,Taralga Wind Farm Nominees No 2 Pty Ltd (ATF Taralga Wind Farm Operating Trust),Taralga Wind Farm,Wind,106.0,0.0,Taralga Wind Farm,-34.42352,149.826267,2026-02-17T10:03:10.801095
2026/02/17 20:05:00,WAMBOWF1,122.37,Stanwell Corporation Limited,Wambo Wind Farm 1,Wind,245.0,49.95,Wambo Wind Farm 1,-35.187301,149.524945,2026-02-17T10:03:10.801095
2026/02/17 20:05:00,WATERLWF,45.6,Waterloo Wind Farm Pty Ltd,Waterloo Wind Farm,Wind,130.0,35.08,Waterloo Wind Farm,-34.00094,138.911567,2026-02-17T10:03:10.801095
2026/02/17 20:05:00,WGWF1,0.0,Willogoleche Power Pty Ltd As The Trustee For The Willogoleche Operating Trust,Willogoleche Wind Farm,Wind,119.0,0.0,Willogoleche Wind Farm,-33.39,138.85,2026-02-17T10:03:10.801095
2026/02/17 20:05:00,WOODLWN1,12.76,Woodlawn Wind Pty Ltd,Woodlawn Wind Farm,Wind,48.0,26.58,Woodlawn Wind Farm,-35.08,149.62,2026-02-17T10:03:10.801095
2026/02/17 20:05:00,WPWF,39.82,AGL SA Generation Pty Limited,Wattle Point Wind Farm,Wind,91.0,43.76,Wattle Point Wind Farm,-35.111624,137.7219,2026-02-17T10:03:10.801095
2026/02/17 20:05:00,WRWF1,50.23,White Rock Wind Farm Pty Ltd,White Rock Wind Farm,Wind,172.0,29.2,White Rock Wind Farm,-29.79,151.54,2026-02-17T10:03:10.801095
2026/02/17 20:05:00,YENDWF1,29.56,Lal Lal Wind Farms Nom Co Pty Ltd,Yendon Wind Farm,Wind,142.0,20.82,Yendon Wind Farm,-37.629987,144.022717,2026-02-17T10:03:10.801095
