SETTLEMENTDATE,DUID,SCADAVALUE,Participant,Station Name,Fuel Source - Primary,MAX_CAP,utilisation_pct,Plant,Latitude,Longitude,timestamp_utc
2026/03/08 18:45:00,CAPTL_WF,106.89,Iberdrola Australia Holdings Pty Limited,Capital Wind Farm,Wind,140.0,76.35,Capital Wind Farm,-35.1,149.31,2026-03-08T08:43:22.220497
2026/03/08 18:45:00,CHALLHWF,8.5,Pacific Hydro Challicum Hills Pty Ltd,Challicum Hills Wind Farm,Wind,52.0,16.35,Challicum Hills Wind Farm,-37.38,143.11,2026-03-08T08:43:22.220497
2026/03/08 18:45:00,CULLRGWF,24.28,Cullerin Range Wind Farm Pty Ltd,Cullerin Range Wind Farm,Wind,30.0,80.93,Cullerin Range Wind Farm,-34.81,149.4,2026-03-08T08:43:22.220497
2026/03/08 18:45:00,DIAPURWF1,0.2,Y.E.S. Energy (SA) Pty Ltd,Diapur Wind Farm,Wind,7.0,2.86,Diapur Wind Farm,-36.3425,141.43,2026-03-08T08:43:22.220497
2026/03/08 18:45:00,MLWF1,6.46,Mortons Lane Windfarm Pty Limited,Mortons Lane Wind Farm,Wind,20.0,32.3,Mortons Lane Wind Farm,-37.84,142.45,2026-03-08T08:43:22.220497
2026/03/08 18:45:00,WAUBRAWF,56.65,Pyrenees Wind Energy Developments Pty Ltd,Waubra Wind Farm,Wind,192.0,29.51,Waubra Wind Farm,-37.394498,143.638982,2026-03-08T08:43:22.220497
2026/03/08 18:45:00,WOOLNTH1,9.63,Hydro-Electric Corporation,Woolnorth Studland Bay / Bluff Point Wind Farm,Wind,140.0,6.88,Woolnorth Studland Bay / Bluff Point Wind Farm,-40.69,144.72,2026-03-08T08:43:22.220497
2026/03/08 18:45:00,YAMBUKWF,14.4,Energy Pacific (Vic) Pty Ltd,Yambuk Wind Farm,Wind,30.0,48.0,Yambuk Wind Farm,-38.299083,142.027577,2026-03-08T08:43:22.220497
2026/03/08 18:45:00,YSWF1,11.6,Pacific Hydro Yaloak South Pty Ltd,Yaloak South Wind Farm,Wind,28.0,41.43,Yaloak South Wind Farm,-37.7163,144.242853,2026-03-08T08:43:22.220497
2026/03/08 18:45:00,ARWF1,39.3,Ararat Wind Farm Pty Ltd,Ararat Wind Farm,Wind,241.0,16.31,Ararat Wind Farm,-37.232778,143.031389,2026-03-08T08:43:22.220497
2026/03/08 18:45:00,BALDHWF1,94.73,Alinta Energy Retail Sales Pty Ltd,Bald Hills Wind Farm,Wind,106.0,89.37,Bald Hills Wind Farm,-38.79,145.93,2026-03-08T08:43:22.220497
2026/03/08 18:45:00,BANGOWF1,119.5,BWF Nominees Pty Ltd as The Trustee for BWF Trust,Bango 973 Wind Farm,Wind,155.0,77.1,Bango 973 Wind Farm,-34.551582,148.732808,2026-03-08T08:43:22.220497
2026/03/08 18:45:00,BANGOWF2,51.5,BWF Nominees Pty Ltd as The Trustee for BWF Trust,Bango 999 Wind Farm,Wind,82.0,62.8,Bango 999 Wind Farm,-34.551582,148.732808,2026-03-08T08:43:22.220497
2026/03/08 18:45:00,BLUFF1,10.3,AGL SA Generation Pty Limited,The Bluff Wind Farm,Wind,53.0,19.43,The Bluff Wind Farm,-33.367778,138.728611,2026-03-08T08:43:22.220497
2026/03/08 18:45:00,BOCORWF1,59.84,Boco Rock Wind Farm Pty Ltd,Boco Rock Wind Farm,Wind,111.0,53.91,Boco Rock Wind Farm,-36.578611,149.103333,2026-03-08T08:43:22.220497
2026/03/08 18:45:00,BRYB1WF1,82.1,Berrybank Development Pty Ltd,Berrybank Wind Farm,Wind,175.9,46.67,Berrybank Wind Farm,-37.94,143.52,2026-03-08T08:43:22.220497
2026/03/08 18:45:00,BRYB2WF2,63.95,Berrybank 2 Asset Pty Ltd as trustee for Berrybank 2 Asset Trust,Berrybank 2 Wind Farm,Wind,105.0,60.9,Berrybank 2 Wind Farm,-37.94,143.52,2026-03-08T08:43:22.220497
2026/03/08 18:45:00,BULGANA1,72.2,Bulgana Wind Farm Pty Ltd,Bulgana Green Power Hub,Wind,204.0,35.39,Bulgana Green Power Hub,-37.0975,142.973611,2026-03-08T08:43:22.220497
2026/03/08 18:45:00,CATHROCK,11.5,Cathedral Rocks Wind Farm Pty Ltd,Cathedral Rocks,Wind,66.0,17.42,Cathedral Rocks,-34.51,135.35,2026-03-08T08:43:22.220497
2026/03/08 18:45:00,CHYTWF1,14.45,Cherry Tree Wind Farm Pty Ltd as trustee for The Cherry Tree Project trust ,Cherry Tree Wind Farm,Wind,57.0,25.35,Cherry Tree Wind Farm,-37.1,145.26,2026-03-08T08:43:22.220497
2026/03/08 18:45:00,CLEMGPWF,23.77,Pacific Hydro Clements Gap Pty Ltd,Clements Gap Wind Farm,Wind,57.0,41.7,Clements Gap Wind Farm,-33.48,138.1,2026-03-08T08:43:22.220497
2026/03/08 18:45:00,CLRKCWF1,194.09,Stanwell Corporation Limited ,Clarke Creek Wind Farm,Wind,338.0,57.42,Clarke Creek Wind Farm,-22.85,149.45,2026-03-08T08:43:22.220497
2026/03/08 18:45:00,CLRKCWF2,35.07,Stanwell Corporation Limited ,Clarke Creek Wind Farm,Wind,101.0,34.72,Clarke Creek Wind Farm,-22.85,149.45,2026-03-08T08:43:22.220497
2026/03/08 18:45:00,CNUNDAWF,21.73,Canunda Power Pty Ltd,Canunda Wind Farm,Wind,46.0,47.24,Canunda Wind Farm,-37.73,140.39,2026-03-08T08:43:22.220497
2026/03/08 18:45:00,COLWF01,148.45,Collector Wind Farm Pty Ltd,Collector Wind Farm 1,Wind,219.0,67.79,Collector Wind Farm 1,-34.8719,149.3967,2026-03-08T08:43:22.220497
2026/03/08 18:45:00,COOPGWF1,195.82,PARF Company 10 Pty Limited as The Trustee for Coopers Gap Project Trust,Coopers Gap Wind Farm,Wind,440.0,44.5,Coopers Gap Wind Farm,-26.74,151.45,2026-03-08T08:43:22.220497
2026/03/08 18:45:00,CROOKWF2,47.89,Crookwell Development Pty Ltd ,Crookwell 2 Wind Farm,Wind,91.0,52.63,Crookwell 2 Wind Farm,-34.52,149.54,2026-03-08T08:43:22.220497
2026/03/08 18:45:00,CROOKWF3,35.09,Crookwell 3 Development Pty Ltd,Crookwell 3 Wind Farm,Wind,56.0,62.66,Crookwell 3 Wind Farm,-34.52,149.54,2026-03-08T08:43:22.220497
2026/03/08 18:45:00,CROWLWF1,25.03,Pacific Hydro Crowlands Pty Ltd ,Crowlands Wind Farm,Wind,79.0,31.68,Crowlands Wind Farm,-37.13,143.16,2026-03-08T08:43:22.220497
2026/03/08 18:45:00,CRURWF1,60.9,CRWF Nominees Pty Ltd As Trustee For The CRWF Trust,Crudine Ridge Wind Farm,Wind,138.0,44.13,Crudine Ridge Wind Farm,-32.97,149.64,2026-03-08T08:43:22.220497
2026/03/08 18:45:00,CTHLWF1,0.0,Wild Cattle Hill Pty Ltd,Cattle Hill Wind Farm,Wind,144.0,0.0,Cattle Hill Wind Farm,-42.15,146.69,2026-03-08T08:43:22.220497
2026/03/08 18:45:00,DULAWF1,149.2,Dulacca Energy Project Co Pty Ltd,Dulacca Wind Farm,Wind,173.0,86.24,Dulacca Wind Farm,-26.63,149.87,2026-03-08T08:43:22.220497
2026/03/08 18:45:00,DUNDWF1,89.19,Dundonnell Wind Farm Pty Ltd,Dundonnell Wind Farm,Wind,168.0,53.09,Dundonnell Wind Farm,-37.52,142.58,2026-03-08T08:43:22.220497
2026/03/08 18:45:00,DUNDWF2,28.66,Dundonnell Wind Farm Pty Ltd,Dundonnell Wind Farm,Wind,46.0,62.3,Dundonnell Wind Farm,-37.52,142.58,2026-03-08T08:43:22.220497
2026/03/08 18:45:00,DUNDWF3,48.29,Dundonnell Wind Farm Pty Ltd,Dundonnell Wind Farm,Wind,122.0,39.58,Dundonnell Wind Farm,-37.52,142.58,2026-03-08T08:43:22.220497
2026/03/08 18:45:00,ELAINWF1,12.96,Lal Lal Wind Farms Nom Co Pty Ltd,Elaine Wind Farm,Wind,82.0,15.8,Elaine Wind Farm,-37.36,144.0,2026-03-08T08:43:22.220497
2026/03/08 18:45:00,FLYCRKWF,76.25,Iberdrola Australia Energy Markets Pty Limited,Flyers Creek Wind Farm,Wind,140.0,54.46,Flyers Creek Wind Farm,-33.365556,148.981944,2026-03-08T08:43:22.220497
2026/03/08 18:45:00,GPWFEST1,120.65,Golden Plains WF1 Pty Ltd as Trustee for the Golden Plains WF1 Unit Trust,Golden Plains Wind Farm East,Wind,240.0,50.27,Golden Plains Wind Farm East,-37.945091,143.752614,2026-03-08T08:43:22.220497
2026/03/08 18:45:00,GPWFEST2,75.93,Golden Plains WF1 Pty Ltd as Trustee for the Golden Plains WF1 Unit Trust,Golden Plains Wind Farm East,Wind,253.0,30.01,Golden Plains Wind Farm East,-37.945091,143.752614,2026-03-08T08:43:22.220497
2026/03/08 18:45:00,GPWFEST3,59.89,Golden Plains WF1 Pty Ltd as Trustee for the Golden Plains WF1 Unit Trust,Golden Plains Wind Farm East,Wind,240.0,24.95,Golden Plains Wind Farm East,-37.945091,143.752614,2026-03-08T08:43:22.220497
2026/03/08 18:45:00,GRANWF1,2.61,Granville Harbour Operations Pty Ltd as The Trustee for Granville Harbour Operations Trust,Granville Harbour Wind Farm,Wind,111.0,2.35,Granville Harbour Wind Farm,-41.8,145.06,2026-03-08T08:43:22.220497
2026/03/08 18:45:00,GSWF1A,43.7,Goyder Wind Farm 1 Pty Ltd as the Trustee for Goyder Wind Farm 1 Trust,Goyder South Wind Farm 1A,Wind,201.0,21.74,Goyder South Wind Farm 1A,-33.679758,138.937597,2026-03-08T08:43:22.220497
2026/03/08 18:45:00,GSWF1B1,10.35,Goyder Wind Farm 1B Pty Ltd as the Trustee for the Goyder Wind Farm 1B Trust,Goyder South Wind Farm 1B,Wind,196.0,5.28,Goyder South Wind Farm 1B,-33.679758,138.937597,2026-03-08T08:43:22.220497
2026/03/08 18:45:00,GULLRWF1,85.49,New Gullen Range Wind Farm Pty Ltd,Gullen Range Wind Farm,Wind,161.0,53.1,Gullen Range Wind Farm,-34.34,149.27,2026-03-08T08:43:22.220497
2026/03/08 18:45:00,GULLRWF2,102.54,New Gullen Range Wind Farm Pty Ltd,Gullen Range Wind Farm,Wind,107.0,95.83,Gullen Range Wind Farm,-34.34,149.27,2026-03-08T08:43:22.220497
2026/03/08 18:45:00,GUNNING1,36.46,Gunning Wind Energy Developments Pty Ltd,Gunning Wind Farm,Wind,47.0,77.57,Gunning Wind Farm,-34.813333,149.4,2026-03-08T08:43:22.220497
2026/03/08 18:45:00,HALLWF1,12.49,AGL SA Generation Pty Limited,Hallett 1 Wind Farm,Wind,95.0,13.15,Hallett 1 Wind Farm,-33.367778,138.728611,2026-03-08T08:43:22.220497
2026/03/08 18:45:00,HALLWF2,9.25,AGL SA Generation Pty Limited,Hallett 2 Wind Farm,Wind,71.0,13.03,Hallett 2 Wind Farm,-33.367778,138.728611,2026-03-08T08:43:22.220497
2026/03/08 18:45:00,HD1WF1,41.04,Hawkesdale Asset Pty Ltd as trustee for Hawkesdale Asset Trust,Hawkesdale Wind Farm,Wind,89.0,46.11,Hawkesdale Wind Farm,-38.147894,142.361381,2026-03-08T08:43:22.220497
2026/03/08 18:45:00,HDWF1,13.1,HWF1 Pty Ltd,Hornsdale Wind Farm,Wind,102.0,12.84,Hornsdale Wind Farm,-33.050556,138.543611,2026-03-08T08:43:22.220497
2026/03/08 18:45:00,HDWF2,15.9,HWF 2 Pty Ltd,Hornsdale Wind Farm 2,Wind,102.0,15.59,Hornsdale Wind Farm 2,-33.06,138.54,2026-03-08T08:43:22.220497
2026/03/08 18:45:00,HDWF3,15.4,HWF3 Pty Ltd,Hornsdale Wind Farm 3,Wind,109.0,14.13,Hornsdale Wind Farm 3,-33.06,138.54,2026-03-08T08:43:22.220497
2026/03/08 18:45:00,KABANWF1,34.92,Kaban Wind Farm Pty Ltd as trustee for Kaban Wind Farm Trust,Kaban Wind Farm,Wind,152.0,22.97,Kaban Wind Farm,-17.56,145.41,2026-03-08T08:43:22.220497
2026/03/08 18:45:00,KEPWF1,26.2,Kennedy Energy Park Pty Ltd,Kennedy Energy Park,Wind,43.0,60.93,Kennedy Energy Park,-20.88,144.42,2026-03-08T08:43:22.220497
2026/03/08 18:45:00,KIATAWF1,3.2,Kiata ProjectCo Pty Ltd Atf Kiata Project Trust,Kiata Wind Farm,Wind,31.0,10.32,Kiata Wind Farm,-36.4,141.75,2026-03-08T08:43:22.220497
2026/03/08 18:45:00,LGAPWF1,20.89,Lincoln Gap Wind Farm (Operations) Pty Ltd,Lincoln Gap Wind Farm,Wind,123.0,16.98,Lincoln Gap Wind Farm,-32.564279,137.557328,2026-03-08T08:43:22.220497
2026/03/08 18:45:00,LGAPWF1,20.89,Lincoln Gap Wind Farm (Operations) Pty Ltd,Lincoln Gap Wind Farm,Wind,123.0,16.98,Lincoln Gap Wind Farm,-32.564279,137.557328,2026-03-08T08:43:22.220497
2026/03/08 18:45:00,LGAPWF2,25.93,Lincoln Gap Wind Farm (Operations) Pty Ltd,Lincoln Gap Wind Farm,Wind,85.0,30.51,Lincoln Gap Wind Farm,-32.564279,137.557328,2026-03-08T08:43:22.220497
2026/03/08 18:45:00,LGAPWF2,25.93,Lincoln Gap Wind Farm (Operations) Pty Ltd,Lincoln Gap Wind Farm,Wind,85.0,30.51,Lincoln Gap Wind Farm,-32.564279,137.557328,2026-03-08T08:43:22.220497
2026/03/08 18:45:00,LKBONNY1,27.42,Lake Bonney Wind Power Pty Ltd,Lake Bonney Wind Farm Stage 1,Wind,81.0,33.85,Lake Bonney Wind Farm Stage 1,-37.76,140.4,2026-03-08T08:43:22.220497
2026/03/08 18:45:00,LKBONNY2,60.95,Lake Bonney Wind Power Pty Ltd,Lake Bonney Stage 2 Windfarm,Wind,159.0,38.33,Lake Bonney Stage 2 Windfarm,-37.76,140.4,2026-03-08T08:43:22.220497
2026/03/08 18:45:00,LKBONNY3,10.22,Lake Bonney Wind Power Pty Ltd,Lake Bonney Stage 3 Wind Farm,Wind,39.0,26.21,Lake Bonney Stage 3 Wind Farm,-37.737781,140.388137,2026-03-08T08:43:22.220497
2026/03/08 18:45:00,MACARTH1,120.2,AGL Hydro Partnership,Macarthur Wind Farm,Wind,420.0,28.62,Macarthur Wind Farm,-38.048957,142.192112,2026-03-08T08:43:22.220497
2026/03/08 18:45:00,MCINTYR1,288.41,MacIntyre UJV Operator Pty Ltd,MacIntyre Wind Farm,Wind,890.0,32.41,MacIntyre Wind Farm,-28.32,151.54,2026-03-08T08:43:22.220497
2026/03/08 18:45:00,MERCER01,15.8,Mt Mercer Windfarm Pty Ltd,Mt Mercer Wind Farm,Wind,131.0,12.06,Mt Mercer Wind Farm,-37.841111,143.871111,2026-03-08T08:43:22.220497
2026/03/08 18:45:00,MEWF1,2.66,Ergon Energy Queensland Pty Ltd ,Mount Emerald Wind Farm,Wind,178.0,1.49,Mount Emerald Wind Farm,-17.133007,145.380644,2026-03-08T08:43:22.220497
2026/03/08 18:45:00,MRTLSWF1,31.98,Mortlake South Wind Farm Pty Ltd,Mortlake South Wind Farm,Wind,153.0,20.9,Mortlake South Wind Farm,-38.127337,142.857801,2026-03-08T08:43:22.220497
2026/03/08 18:45:00,MTGELWF1,99.31,Mt. Gellibrand Wind Farm Pty Ltd,Mt Gellibrand Wind Farm,Wind,132.0,75.23,Mt Gellibrand Wind Farm,-38.23,143.77,2026-03-08T08:43:22.220497
2026/03/08 18:45:00,MTMILLAR,15.3,Mt Millar Wind Farm Pty Ltd,Mt Millar Wind Farm,Wind,70.0,21.86,Mt Millar Wind Farm,-33.624444,136.703611,2026-03-08T08:43:22.220497
2026/03/08 18:45:00,MUSSELR1,41.9,Hydro-Electric Corporation,Musselroe Wind Farm,Wind,168.0,24.94,Musselroe Wind Farm,-40.780225,148.010799,2026-03-08T08:43:22.220497
2026/03/08 18:45:00,MUWAWF1,126.6,Telstra Energy (Generation) Pty Ltd,Murra Warra Wind Farm,Wind,225.7,56.09,Murra Warra Wind Farm,-36.432404,142.317853,2026-03-08T08:43:22.220497
2026/03/08 18:45:00,MUWAWF2,68.3,Murra Warra II Project Co Pty Ltd ATF The Murra Warra II Project Trust,Murra Warra Wind Farm Stage 2,Wind,203.0,33.65,Murra Warra Wind Farm Stage 2,-36.43,142.32,2026-03-08T08:43:22.220497
2026/03/08 18:45:00,NBHWF1,10.6,AGL SA Generation Pty Limited,North Brown Hill Wind Farm,Wind,132.0,8.03,North Brown Hill Wind Farm,-33.367778,138.728611,2026-03-08T08:43:22.220497
2026/03/08 18:45:00,OAKLAND1,10.5,AGL Hydro Partnership,Oaklands Hill Wind Farm,Wind,63.0,16.67,Oaklands Hill Wind Farm,-37.683078,142.551678,2026-03-08T08:43:22.220497
2026/03/08 18:45:00,PAREPW1,177.99,Iberdrola Australia Energy Markets Pty Limited,Port Augusta Renewable Energy Park,Wind,201.0,88.55,Port Augusta Renewable Energy Park,-32.566944,137.856111,2026-03-08T08:43:22.220497
2026/03/08 18:45:00,RYANCWF1,174.25,Ryan Corner Development Pty Ltd,Ryan Corner Wind Farm,Wind,205.0,85.0,Ryan Corner Wind Farm,-38.271017,142.140647,2026-03-08T08:43:22.220497
2026/03/08 18:45:00,RYEPARK1,340.38,Rye Park Renewable Energy Pty Ltd as trustee for Rye Park Wind Farm Trust,Rye Park Renewable Energy,Wind,384.0,88.64,Rye Park Renewable Energy,-32.138333,148.972778,2026-03-08T08:43:22.220497
2026/03/08 18:45:00,SALTCRK1,22.66,Salt Creek Wind Farm Pty Ltd,Salt Creek Wind Farm,Wind,54.0,41.96,Salt Creek Wind Farm,-37.95,142.63,2026-03-08T08:43:22.220497
2026/03/08 18:45:00,SAPHWF1,201.64,The Trustee For The SWF1 Operations Trust,Sapphire Wind Farm,Wind,270.0,74.68,Sapphire Wind Farm,-29.7,151.41,2026-03-08T08:43:22.220497
2026/03/08 18:45:00,SNOWNTH1,120.3,Snowtown Wind Farm Stage 2 Pty Ltd,Snowtown Wind Farm Stage 2 North,Wind,144.0,83.54,Snowtown Wind Farm Stage 2 North,-33.83,138.118611,2026-03-08T08:43:22.220497
2026/03/08 18:45:00,SNOWSTH1,55.9,Snowtown Wind Farm Stage 2 Pty Ltd,Snowtown South Wind Farm,Wind,126.0,44.37,Snowtown South Wind Farm,-33.83,138.118611,2026-03-08T08:43:22.220497
2026/03/08 18:45:00,SNOWTWN1,67.53,Snowtown Wind Farm Pty Ltd,Snowtown Wind Farm Units 1 And 47,Wind,99.0,68.21,Snowtown Wind Farm Units 1 And 47,-33.83,138.118611,2026-03-08T08:43:22.220497
2026/03/08 18:45:00,STARHLWF,13.9,Starfish Hill Wind Farm Pty Ltd,Starfish Hill Wind Farm,Wind,35.0,39.71,Starfish Hill Wind Farm,-35.58,138.14,2026-03-08T08:43:22.220497
2026/03/08 18:45:00,STOCKYD1,127.31,Stockyard Hill Wind Farm Pty Ltd,Stockyard Hill Wind Farm,Wind,511.0,24.91,Stockyard Hill Wind Farm,-37.535833,143.251389,2026-03-08T08:43:22.220497
2026/03/08 18:45:00,STWF1,46.97,PARF Company 8 Pty Ltd as The Trustee for Silverton Project Trust,Silverton Wind Farm,Wind,198.0,23.72,Silverton Wind Farm,-37.683168,142.551678,2026-03-08T08:43:22.220497
2026/03/08 18:45:00,TARALGA1,27.63,Taralga Wind Farm Nominees No 2 Pty Ltd (ATF Taralga Wind Farm Operating Trust),Taralga Wind Farm,Wind,106.0,26.07,Taralga Wind Farm,-34.42352,149.826267,2026-03-08T08:43:22.220497
2026/03/08 18:45:00,WAMBOWF1,133.38,Stanwell Corporation Limited,Wambo Wind Farm 1,Wind,245.0,54.44,Wambo Wind Farm 1,-35.187301,149.524945,2026-03-08T08:43:22.220497
2026/03/08 18:45:00,WATERLWF,17.0,Waterloo Wind Farm Pty Ltd,Waterloo Wind Farm,Wind,130.0,13.08,Waterloo Wind Farm,-34.00094,138.911567,2026-03-08T08:43:22.220497
2026/03/08 18:45:00,WGWF1,25.7,Willogoleche Power Pty Ltd As The Trustee For The Willogoleche Operating Trust,Willogoleche Wind Farm,Wind,119.0,21.6,Willogoleche Wind Farm,-33.39,138.85,2026-03-08T08:43:22.220497
2026/03/08 18:45:00,WOODLWN1,28.32,Woodlawn Wind Pty Ltd,Woodlawn Wind Farm,Wind,48.0,59.0,Woodlawn Wind Farm,-35.08,149.62,2026-03-08T08:43:22.220497
2026/03/08 18:45:00,WPWF,69.76,AGL SA Generation Pty Limited,Wattle Point Wind Farm,Wind,91.0,76.66,Wattle Point Wind Farm,-35.111624,137.7219,2026-03-08T08:43:22.220497
2026/03/08 18:45:00,WRWF1,167.3,White Rock Wind Farm Pty Ltd,White Rock Wind Farm,Wind,172.0,97.27,White Rock Wind Farm,-29.79,151.54,2026-03-08T08:43:22.220497
2026/03/08 18:45:00,YENDWF1,16.29,Lal Lal Wind Farms Nom Co Pty Ltd,Yendon Wind Farm,Wind,142.0,11.47,Yendon Wind Farm,-37.629987,144.022717,2026-03-08T08:43:22.220497
