SETTLEMENTDATE,DUID,SCADAVALUE,Participant,Station Name,Fuel Source - Primary,MAX_CAP,utilisation_pct,Plant,Latitude,Longitude,timestamp_utc
2026/03/09 02:00:00,CAPTL_WF,63.24,Iberdrola Australia Holdings Pty Limited,Capital Wind Farm,Wind,140.0,45.17,Capital Wind Farm,-35.1,149.31,2026-03-08T15:57:44.764130
2026/03/09 02:00:00,CHALLHWF,4.2,Pacific Hydro Challicum Hills Pty Ltd,Challicum Hills Wind Farm,Wind,52.0,8.08,Challicum Hills Wind Farm,-37.38,143.11,2026-03-08T15:57:44.764130
2026/03/09 02:00:00,CULLRGWF,27.19,Cullerin Range Wind Farm Pty Ltd,Cullerin Range Wind Farm,Wind,30.0,90.63,Cullerin Range Wind Farm,-34.81,149.4,2026-03-08T15:57:44.764130
2026/03/09 02:00:00,DIAPURWF1,3.0,Y.E.S. Energy (SA) Pty Ltd,Diapur Wind Farm,Wind,7.0,42.86,Diapur Wind Farm,-36.3425,141.43,2026-03-08T15:57:44.764130
2026/03/09 02:00:00,MLWF1,0.52,Mortons Lane Windfarm Pty Limited,Mortons Lane Wind Farm,Wind,20.0,2.6,Mortons Lane Wind Farm,-37.84,142.45,2026-03-08T15:57:44.764130
2026/03/09 02:00:00,WAUBRAWF,0.0,Pyrenees Wind Energy Developments Pty Ltd,Waubra Wind Farm,Wind,192.0,0.0,Waubra Wind Farm,-37.394498,143.638982,2026-03-08T15:57:44.764130
2026/03/09 02:00:00,WOOLNTH1,41.96,Hydro-Electric Corporation,Woolnorth Studland Bay / Bluff Point Wind Farm,Wind,140.0,29.97,Woolnorth Studland Bay / Bluff Point Wind Farm,-40.69,144.72,2026-03-08T15:57:44.764130
2026/03/09 02:00:00,YAMBUKWF,2.0,Energy Pacific (Vic) Pty Ltd,Yambuk Wind Farm,Wind,30.0,6.67,Yambuk Wind Farm,-38.299083,142.027577,2026-03-08T15:57:44.764130
2026/03/09 02:00:00,YSWF1,0.0,Pacific Hydro Yaloak South Pty Ltd,Yaloak South Wind Farm,Wind,28.0,0.0,Yaloak South Wind Farm,-37.7163,144.242853,2026-03-08T15:57:44.764130
2026/03/09 02:00:00,ARWF1,1.9,Ararat Wind Farm Pty Ltd,Ararat Wind Farm,Wind,241.0,0.79,Ararat Wind Farm,-37.232778,143.031389,2026-03-08T15:57:44.764130
2026/03/09 02:00:00,BALDHWF1,93.35,Alinta Energy Retail Sales Pty Ltd,Bald Hills Wind Farm,Wind,106.0,88.07,Bald Hills Wind Farm,-38.79,145.93,2026-03-08T15:57:44.764130
2026/03/09 02:00:00,BANGOWF1,120.9,BWF Nominees Pty Ltd as The Trustee for BWF Trust,Bango 973 Wind Farm,Wind,155.0,78.0,Bango 973 Wind Farm,-34.551582,148.732808,2026-03-08T15:57:44.764130
2026/03/09 02:00:00,BANGOWF2,81.1,BWF Nominees Pty Ltd as The Trustee for BWF Trust,Bango 999 Wind Farm,Wind,82.0,98.9,Bango 999 Wind Farm,-34.551582,148.732808,2026-03-08T15:57:44.764130
2026/03/09 02:00:00,BLUFF1,0.0,AGL SA Generation Pty Limited,The Bluff Wind Farm,Wind,53.0,0.0,The Bluff Wind Farm,-33.367778,138.728611,2026-03-08T15:57:44.764130
2026/03/09 02:00:00,BOCORWF1,4.15,Boco Rock Wind Farm Pty Ltd,Boco Rock Wind Farm,Wind,111.0,3.74,Boco Rock Wind Farm,-36.578611,149.103333,2026-03-08T15:57:44.764130
2026/03/09 02:00:00,BRYB1WF1,20.19,Berrybank Development Pty Ltd,Berrybank Wind Farm,Wind,175.9,11.48,Berrybank Wind Farm,-37.94,143.52,2026-03-08T15:57:44.764130
2026/03/09 02:00:00,BRYB2WF2,14.75,Berrybank 2 Asset Pty Ltd as trustee for Berrybank 2 Asset Trust,Berrybank 2 Wind Farm,Wind,105.0,14.05,Berrybank 2 Wind Farm,-37.94,143.52,2026-03-08T15:57:44.764130
2026/03/09 02:00:00,BULGANA1,19.47,Bulgana Wind Farm Pty Ltd,Bulgana Green Power Hub,Wind,204.0,9.54,Bulgana Green Power Hub,-37.0975,142.973611,2026-03-08T15:57:44.764130
2026/03/09 02:00:00,CATHROCK,12.0,Cathedral Rocks Wind Farm Pty Ltd,Cathedral Rocks,Wind,66.0,18.18,Cathedral Rocks,-34.51,135.35,2026-03-08T15:57:44.764130
2026/03/09 02:00:00,CHYTWF1,8.26,Cherry Tree Wind Farm Pty Ltd as trustee for The Cherry Tree Project trust ,Cherry Tree Wind Farm,Wind,57.0,14.49,Cherry Tree Wind Farm,-37.1,145.26,2026-03-08T15:57:44.764130
2026/03/09 02:00:00,CLEMGPWF,27.59,Pacific Hydro Clements Gap Pty Ltd,Clements Gap Wind Farm,Wind,57.0,48.4,Clements Gap Wind Farm,-33.48,138.1,2026-03-08T15:57:44.764130
2026/03/09 02:00:00,CLRKCWF1,184.01,Stanwell Corporation Limited ,Clarke Creek Wind Farm,Wind,338.0,54.44,Clarke Creek Wind Farm,-22.85,149.45,2026-03-08T15:57:44.764130
2026/03/09 02:00:00,CLRKCWF2,26.24,Stanwell Corporation Limited ,Clarke Creek Wind Farm,Wind,101.0,25.98,Clarke Creek Wind Farm,-22.85,149.45,2026-03-08T15:57:44.764130
2026/03/09 02:00:00,CNUNDAWF,4.91,Canunda Power Pty Ltd,Canunda Wind Farm,Wind,46.0,10.67,Canunda Wind Farm,-37.73,140.39,2026-03-08T15:57:44.764130
2026/03/09 02:00:00,COLWF01,148.49,Collector Wind Farm Pty Ltd,Collector Wind Farm 1,Wind,219.0,67.8,Collector Wind Farm 1,-34.8719,149.3967,2026-03-08T15:57:44.764130
2026/03/09 02:00:00,COOPGWF1,307.02,PARF Company 10 Pty Limited as The Trustee for Coopers Gap Project Trust,Coopers Gap Wind Farm,Wind,440.0,69.78,Coopers Gap Wind Farm,-26.74,151.45,2026-03-08T15:57:44.764130
2026/03/09 02:00:00,CROOKWF2,24.18,Crookwell Development Pty Ltd ,Crookwell 2 Wind Farm,Wind,91.0,26.57,Crookwell 2 Wind Farm,-34.52,149.54,2026-03-08T15:57:44.764130
2026/03/09 02:00:00,CROOKWF3,14.51,Crookwell 3 Development Pty Ltd,Crookwell 3 Wind Farm,Wind,56.0,25.91,Crookwell 3 Wind Farm,-34.52,149.54,2026-03-08T15:57:44.764130
2026/03/09 02:00:00,CROWLWF1,6.64,Pacific Hydro Crowlands Pty Ltd ,Crowlands Wind Farm,Wind,79.0,8.41,Crowlands Wind Farm,-37.13,143.16,2026-03-08T15:57:44.764130
2026/03/09 02:00:00,CRURWF1,116.5,CRWF Nominees Pty Ltd As Trustee For The CRWF Trust,Crudine Ridge Wind Farm,Wind,138.0,84.42,Crudine Ridge Wind Farm,-32.97,149.64,2026-03-08T15:57:44.764130
2026/03/09 02:00:00,CTHLWF1,49.22,Wild Cattle Hill Pty Ltd,Cattle Hill Wind Farm,Wind,144.0,34.18,Cattle Hill Wind Farm,-42.15,146.69,2026-03-08T15:57:44.764130
2026/03/09 02:00:00,DULAWF1,149.4,Dulacca Energy Project Co Pty Ltd,Dulacca Wind Farm,Wind,173.0,86.36,Dulacca Wind Farm,-26.63,149.87,2026-03-08T15:57:44.764130
2026/03/09 02:00:00,DUNDWF1,12.39,Dundonnell Wind Farm Pty Ltd,Dundonnell Wind Farm,Wind,168.0,7.38,Dundonnell Wind Farm,-37.52,142.58,2026-03-08T15:57:44.764130
2026/03/09 02:00:00,DUNDWF2,5.01,Dundonnell Wind Farm Pty Ltd,Dundonnell Wind Farm,Wind,46.0,10.89,Dundonnell Wind Farm,-37.52,142.58,2026-03-08T15:57:44.764130
2026/03/09 02:00:00,DUNDWF3,11.08,Dundonnell Wind Farm Pty Ltd,Dundonnell Wind Farm,Wind,122.0,9.08,Dundonnell Wind Farm,-37.52,142.58,2026-03-08T15:57:44.764130
2026/03/09 02:00:00,ELAINWF1,0.0,Lal Lal Wind Farms Nom Co Pty Ltd,Elaine Wind Farm,Wind,82.0,0.0,Elaine Wind Farm,-37.36,144.0,2026-03-08T15:57:44.764130
2026/03/09 02:00:00,FLYCRKWF,78.88,Iberdrola Australia Energy Markets Pty Limited,Flyers Creek Wind Farm,Wind,140.0,56.34,Flyers Creek Wind Farm,-33.365556,148.981944,2026-03-08T15:57:44.764130
2026/03/09 02:00:00,GPWFEST1,22.48,Golden Plains WF1 Pty Ltd as Trustee for the Golden Plains WF1 Unit Trust,Golden Plains Wind Farm East,Wind,240.0,9.37,Golden Plains Wind Farm East,-37.945091,143.752614,2026-03-08T15:57:44.764130
2026/03/09 02:00:00,GPWFEST2,39.77,Golden Plains WF1 Pty Ltd as Trustee for the Golden Plains WF1 Unit Trust,Golden Plains Wind Farm East,Wind,253.0,15.72,Golden Plains Wind Farm East,-37.945091,143.752614,2026-03-08T15:57:44.764130
2026/03/09 02:00:00,GPWFEST3,36.28,Golden Plains WF1 Pty Ltd as Trustee for the Golden Plains WF1 Unit Trust,Golden Plains Wind Farm East,Wind,240.0,15.12,Golden Plains Wind Farm East,-37.945091,143.752614,2026-03-08T15:57:44.764130
2026/03/09 02:00:00,GRANWF1,57.02,Granville Harbour Operations Pty Ltd as The Trustee for Granville Harbour Operations Trust,Granville Harbour Wind Farm,Wind,111.0,51.37,Granville Harbour Wind Farm,-41.8,145.06,2026-03-08T15:57:44.764130
2026/03/09 02:00:00,GSWF1A,20.31,Goyder Wind Farm 1 Pty Ltd as the Trustee for Goyder Wind Farm 1 Trust,Goyder South Wind Farm 1A,Wind,201.0,10.1,Goyder South Wind Farm 1A,-33.679758,138.937597,2026-03-08T15:57:44.764130
2026/03/09 02:00:00,GSWF1B1,16.97,Goyder Wind Farm 1B Pty Ltd as the Trustee for the Goyder Wind Farm 1B Trust,Goyder South Wind Farm 1B,Wind,196.0,8.66,Goyder South Wind Farm 1B,-33.679758,138.937597,2026-03-08T15:57:44.764130
2026/03/09 02:00:00,GULLRWF1,84.57,New Gullen Range Wind Farm Pty Ltd,Gullen Range Wind Farm,Wind,161.0,52.53,Gullen Range Wind Farm,-34.34,149.27,2026-03-08T15:57:44.764130
2026/03/09 02:00:00,GULLRWF2,102.42,New Gullen Range Wind Farm Pty Ltd,Gullen Range Wind Farm,Wind,107.0,95.72,Gullen Range Wind Farm,-34.34,149.27,2026-03-08T15:57:44.764130
2026/03/09 02:00:00,GUNNING1,44.58,Gunning Wind Energy Developments Pty Ltd,Gunning Wind Farm,Wind,47.0,94.85,Gunning Wind Farm,-34.813333,149.4,2026-03-08T15:57:44.764130
2026/03/09 02:00:00,HALLWF1,6.53,AGL SA Generation Pty Limited,Hallett 1 Wind Farm,Wind,95.0,6.87,Hallett 1 Wind Farm,-33.367778,138.728611,2026-03-08T15:57:44.764130
2026/03/09 02:00:00,HALLWF2,13.29,AGL SA Generation Pty Limited,Hallett 2 Wind Farm,Wind,71.0,18.72,Hallett 2 Wind Farm,-33.367778,138.728611,2026-03-08T15:57:44.764130
2026/03/09 02:00:00,HD1WF1,6.75,Hawkesdale Asset Pty Ltd as trustee for Hawkesdale Asset Trust,Hawkesdale Wind Farm,Wind,89.0,7.58,Hawkesdale Wind Farm,-38.147894,142.361381,2026-03-08T15:57:44.764130
2026/03/09 02:00:00,HDWF1,30.8,HWF1 Pty Ltd,Hornsdale Wind Farm,Wind,102.0,30.2,Hornsdale Wind Farm,-33.050556,138.543611,2026-03-08T15:57:44.764130
2026/03/09 02:00:00,HDWF2,10.5,HWF 2 Pty Ltd,Hornsdale Wind Farm 2,Wind,102.0,10.29,Hornsdale Wind Farm 2,-33.06,138.54,2026-03-08T15:57:44.764130
2026/03/09 02:00:00,HDWF3,17.1,HWF3 Pty Ltd,Hornsdale Wind Farm 3,Wind,109.0,15.69,Hornsdale Wind Farm 3,-33.06,138.54,2026-03-08T15:57:44.764130
2026/03/09 02:00:00,KABANWF1,119.29,Kaban Wind Farm Pty Ltd as trustee for Kaban Wind Farm Trust,Kaban Wind Farm,Wind,152.0,78.48,Kaban Wind Farm,-17.56,145.41,2026-03-08T15:57:44.764130
2026/03/09 02:00:00,KEPWF1,27.0,Kennedy Energy Park Pty Ltd,Kennedy Energy Park,Wind,43.0,62.79,Kennedy Energy Park,-20.88,144.42,2026-03-08T15:57:44.764130
2026/03/09 02:00:00,KIATAWF1,6.5,Kiata ProjectCo Pty Ltd Atf Kiata Project Trust,Kiata Wind Farm,Wind,31.0,20.97,Kiata Wind Farm,-36.4,141.75,2026-03-08T15:57:44.764130
2026/03/09 02:00:00,LGAPWF1,17.65,Lincoln Gap Wind Farm (Operations) Pty Ltd,Lincoln Gap Wind Farm,Wind,123.0,14.35,Lincoln Gap Wind Farm,-32.564279,137.557328,2026-03-08T15:57:44.764130
2026/03/09 02:00:00,LGAPWF1,17.65,Lincoln Gap Wind Farm (Operations) Pty Ltd,Lincoln Gap Wind Farm,Wind,123.0,14.35,Lincoln Gap Wind Farm,-32.564279,137.557328,2026-03-08T15:57:44.764130
2026/03/09 02:00:00,LGAPWF2,17.56,Lincoln Gap Wind Farm (Operations) Pty Ltd,Lincoln Gap Wind Farm,Wind,85.0,20.66,Lincoln Gap Wind Farm,-32.564279,137.557328,2026-03-08T15:57:44.764130
2026/03/09 02:00:00,LGAPWF2,17.56,Lincoln Gap Wind Farm (Operations) Pty Ltd,Lincoln Gap Wind Farm,Wind,85.0,20.66,Lincoln Gap Wind Farm,-32.564279,137.557328,2026-03-08T15:57:44.764130
2026/03/09 02:00:00,LKBONNY1,3.04,Lake Bonney Wind Power Pty Ltd,Lake Bonney Wind Farm Stage 1,Wind,81.0,3.75,Lake Bonney Wind Farm Stage 1,-37.76,140.4,2026-03-08T15:57:44.764130
2026/03/09 02:00:00,LKBONNY2,15.51,Lake Bonney Wind Power Pty Ltd,Lake Bonney Stage 2 Windfarm,Wind,159.0,9.75,Lake Bonney Stage 2 Windfarm,-37.76,140.4,2026-03-08T15:57:44.764130
2026/03/09 02:00:00,LKBONNY3,4.69,Lake Bonney Wind Power Pty Ltd,Lake Bonney Stage 3 Wind Farm,Wind,39.0,12.03,Lake Bonney Stage 3 Wind Farm,-37.737781,140.388137,2026-03-08T15:57:44.764130
2026/03/09 02:00:00,MACARTH1,7.7,AGL Hydro Partnership,Macarthur Wind Farm,Wind,420.0,1.83,Macarthur Wind Farm,-38.048957,142.192112,2026-03-08T15:57:44.764130
2026/03/09 02:00:00,MCINTYR1,302.79,MacIntyre UJV Operator Pty Ltd,MacIntyre Wind Farm,Wind,890.0,34.02,MacIntyre Wind Farm,-28.32,151.54,2026-03-08T15:57:44.764130
2026/03/09 02:00:00,MERCER01,1.9,Mt Mercer Windfarm Pty Ltd,Mt Mercer Wind Farm,Wind,131.0,1.45,Mt Mercer Wind Farm,-37.841111,143.871111,2026-03-08T15:57:44.764130
2026/03/09 02:00:00,MEWF1,102.38,Ergon Energy Queensland Pty Ltd ,Mount Emerald Wind Farm,Wind,178.0,57.52,Mount Emerald Wind Farm,-17.133007,145.380644,2026-03-08T15:57:44.764130
2026/03/09 02:00:00,MRTLSWF1,13.48,Mortlake South Wind Farm Pty Ltd,Mortlake South Wind Farm,Wind,153.0,8.81,Mortlake South Wind Farm,-38.127337,142.857801,2026-03-08T15:57:44.764130
2026/03/09 02:00:00,MTGELWF1,21.41,Mt. Gellibrand Wind Farm Pty Ltd,Mt Gellibrand Wind Farm,Wind,132.0,16.22,Mt Gellibrand Wind Farm,-38.23,143.77,2026-03-08T15:57:44.764130
2026/03/09 02:00:00,MTMILLAR,13.9,Mt Millar Wind Farm Pty Ltd,Mt Millar Wind Farm,Wind,70.0,19.86,Mt Millar Wind Farm,-33.624444,136.703611,2026-03-08T15:57:44.764130
2026/03/09 02:00:00,MUSSELR1,58.7,Hydro-Electric Corporation,Musselroe Wind Farm,Wind,168.0,34.94,Musselroe Wind Farm,-40.780225,148.010799,2026-03-08T15:57:44.764130
2026/03/09 02:00:00,MUWAWF1,67.27,Telstra Energy (Generation) Pty Ltd,Murra Warra Wind Farm,Wind,225.7,29.81,Murra Warra Wind Farm,-36.432404,142.317853,2026-03-08T15:57:44.764130
2026/03/09 02:00:00,MUWAWF2,87.8,Murra Warra II Project Co Pty Ltd ATF The Murra Warra II Project Trust,Murra Warra Wind Farm Stage 2,Wind,203.0,43.25,Murra Warra Wind Farm Stage 2,-36.43,142.32,2026-03-08T15:57:44.764130
2026/03/09 02:00:00,NBHWF1,4.9,AGL SA Generation Pty Limited,North Brown Hill Wind Farm,Wind,132.0,3.71,North Brown Hill Wind Farm,-33.367778,138.728611,2026-03-08T15:57:44.764130
2026/03/09 02:00:00,OAKLAND1,0.0,AGL Hydro Partnership,Oaklands Hill Wind Farm,Wind,63.0,0.0,Oaklands Hill Wind Farm,-37.683078,142.551678,2026-03-08T15:57:44.764130
2026/03/09 02:00:00,PAREPW1,41.76,Iberdrola Australia Energy Markets Pty Limited,Port Augusta Renewable Energy Park,Wind,201.0,20.78,Port Augusta Renewable Energy Park,-32.566944,137.856111,2026-03-08T15:57:44.764130
2026/03/09 02:00:00,RYANCWF1,1.59,Ryan Corner Development Pty Ltd,Ryan Corner Wind Farm,Wind,205.0,0.78,Ryan Corner Wind Farm,-38.271017,142.140647,2026-03-08T15:57:44.764130
2026/03/09 02:00:00,RYEPARK1,369.25,Rye Park Renewable Energy Pty Ltd as trustee for Rye Park Wind Farm Trust,Rye Park Renewable Energy,Wind,384.0,96.16,Rye Park Renewable Energy,-32.138333,148.972778,2026-03-08T15:57:44.764130
2026/03/09 02:00:00,SALTCRK1,6.14,Salt Creek Wind Farm Pty Ltd,Salt Creek Wind Farm,Wind,54.0,11.37,Salt Creek Wind Farm,-37.95,142.63,2026-03-08T15:57:44.764130
2026/03/09 02:00:00,SAPHWF1,149.51,The Trustee For The SWF1 Operations Trust,Sapphire Wind Farm,Wind,270.0,55.37,Sapphire Wind Farm,-29.7,151.41,2026-03-08T15:57:44.764130
2026/03/09 02:00:00,SNOWNTH1,17.9,Snowtown Wind Farm Stage 2 Pty Ltd,Snowtown Wind Farm Stage 2 North,Wind,144.0,12.43,Snowtown Wind Farm Stage 2 North,-33.83,138.118611,2026-03-08T15:57:44.764130
2026/03/09 02:00:00,SNOWSTH1,25.4,Snowtown Wind Farm Stage 2 Pty Ltd,Snowtown South Wind Farm,Wind,126.0,20.16,Snowtown South Wind Farm,-33.83,138.118611,2026-03-08T15:57:44.764130
2026/03/09 02:00:00,SNOWTWN1,21.77,Snowtown Wind Farm Pty Ltd,Snowtown Wind Farm Units 1 And 47,Wind,99.0,21.99,Snowtown Wind Farm Units 1 And 47,-33.83,138.118611,2026-03-08T15:57:44.764130
2026/03/09 02:00:00,STARHLWF,14.3,Starfish Hill Wind Farm Pty Ltd,Starfish Hill Wind Farm,Wind,35.0,40.86,Starfish Hill Wind Farm,-35.58,138.14,2026-03-08T15:57:44.764130
2026/03/09 02:00:00,STOCKYD1,4.21,Stockyard Hill Wind Farm Pty Ltd,Stockyard Hill Wind Farm,Wind,511.0,0.82,Stockyard Hill Wind Farm,-37.535833,143.251389,2026-03-08T15:57:44.764130
2026/03/09 02:00:00,STWF1,116.48,PARF Company 8 Pty Ltd as The Trustee for Silverton Project Trust,Silverton Wind Farm,Wind,198.0,58.83,Silverton Wind Farm,-37.683168,142.551678,2026-03-08T15:57:44.764130
2026/03/09 02:00:00,TARALGA1,35.58,Taralga Wind Farm Nominees No 2 Pty Ltd (ATF Taralga Wind Farm Operating Trust),Taralga Wind Farm,Wind,106.0,33.57,Taralga Wind Farm,-34.42352,149.826267,2026-03-08T15:57:44.764130
2026/03/09 02:00:00,WAMBOWF1,184.34,Stanwell Corporation Limited,Wambo Wind Farm 1,Wind,245.0,75.24,Wambo Wind Farm 1,-35.187301,149.524945,2026-03-08T15:57:44.764130
2026/03/09 02:00:00,WATERLWF,8.8,Waterloo Wind Farm Pty Ltd,Waterloo Wind Farm,Wind,130.0,6.77,Waterloo Wind Farm,-34.00094,138.911567,2026-03-08T15:57:44.764130
2026/03/09 02:00:00,WGWF1,17.8,Willogoleche Power Pty Ltd As The Trustee For The Willogoleche Operating Trust,Willogoleche Wind Farm,Wind,119.0,14.96,Willogoleche Wind Farm,-33.39,138.85,2026-03-08T15:57:44.764130
2026/03/09 02:00:00,WOODLWN1,29.39,Woodlawn Wind Pty Ltd,Woodlawn Wind Farm,Wind,48.0,61.23,Woodlawn Wind Farm,-35.08,149.62,2026-03-08T15:57:44.764130
2026/03/09 02:00:00,WPWF,12.19,AGL SA Generation Pty Limited,Wattle Point Wind Farm,Wind,91.0,13.4,Wattle Point Wind Farm,-35.111624,137.7219,2026-03-08T15:57:44.764130
2026/03/09 02:00:00,WRWF1,162.92,White Rock Wind Farm Pty Ltd,White Rock Wind Farm,Wind,172.0,94.72,White Rock Wind Farm,-29.79,151.54,2026-03-08T15:57:44.764130
2026/03/09 02:00:00,YENDWF1,0.0,Lal Lal Wind Farms Nom Co Pty Ltd,Yendon Wind Farm,Wind,142.0,0.0,Yendon Wind Farm,-37.629987,144.022717,2026-03-08T15:57:44.764130
